Frame 1: 198 bytes on wire (1584 bits), 198 bytes captured (1584 bits)
Ethernet II, Src: Send_00 (20:53:45:4e:44:00), Dst: Receive_00 (20:52:45:43:56:00)
Internet Protocol Version 6, Src: fe80::1, Dst: fe80::
Transmission Control Protocol, Src Port: 7114, Dst Port: 0, Seq: 1, Ack: 1, Len: 124
Zilla Frame
    Frame Type ID: 0x40000003
    Frame Type: SIGNAL
    Protocol Type ID: 0x00000000
    Protocol Type: 
    Worker: 0
    Offset: 0x00000000
    Origin ID: 0x0000000000000000
    Routed ID: 0x0000000000000000
    Stream ID: 0x0000000000000000
    Direction: 
    Sequence: 0
    Acknowledge: 0
    Maximum: 0
    Timestamp: 0x0000000000000000
    Trace ID: 0x0000000000000001
    Authorization: 0x0000000000000000
    Cancel ID: 0xffffffffffffffff
    Signal ID: 0x00000001
    Context ID: 0x00000000
    Payload
        Length: -1

Frame 2: 202 bytes on wire (1616 bits), 202 bytes captured (1616 bits)
Ethernet II, Src: Send_00 (20:53:45:4e:44:00), Dst: Receive_00 (20:52:45:43:56:00)
Internet Protocol Version 6, Src: fe80::1:3f00:0:0:3, Dst: fe80::1:3f00:0:0:2
Transmission Control Protocol, Src Port: 7114, Dst Port: 0, Seq: 1, Ack: 1, Len: 128
Zilla Frame
    Frame Type ID: 0x00000001
    Frame Type: BEGIN
    Protocol Type ID: 0x112dc182
    Protocol Type: amqp
    Worker: 1
    Offset: 0x00000000
    Origin ID: 0x0000000100000010
    Origin Namespace: test
    Origin Binding: net0
    Routed ID: 0x0000000100000010
    Routed Namespace: test
    Routed Binding: net0
    Stream ID: 0x3f00000000000002
    Initial ID: 0x3f00000000000003
    Reply ID: 0x3f00000000000002
    Direction: REP
    Sequence: 0
    Acknowledge: 0
    Maximum: 0
    Timestamp: 0x0000000000000000
    Trace ID: 0x8000000000000001
    Authorization: 0x0000000000000000
    Affinity: 0x0000000000000000

Frame 3: 202 bytes on wire (1616 bits), 202 bytes captured (1616 bits)
Ethernet II, Src: Send_00 (20:53:45:4e:44:00), Dst: Receive_00 (20:52:45:43:56:00)
Internet Protocol Version 6, Src: fe80::3f00:0:0:2, Dst: fe80::3f00:0:0:3
Transmission Control Protocol, Src Port: 0, Dst Port: 7114, Seq: 0, Ack: 1, Len: 128
Zilla Frame
    Frame Type ID: 0x00000001
    Frame Type: BEGIN
    Protocol Type ID: 0x112dc182
    Protocol Type: amqp
    Worker: 0
    Offset: 0x00000060
    Origin ID: 0x0000000100000010
    Origin Namespace: test
    Origin Binding: net0
    Routed ID: 0x0000000100000010
    Routed Namespace: test
    Routed Binding: net0
    Stream ID: 0x3f00000000000003
    Initial ID: 0x3f00000000000003
    Reply ID: 0x3f00000000000002
    Direction: INI
    Sequence: 0
    Acknowledge: 0
    Maximum: 0
    Timestamp: 0x0000000000000000
    Trace ID: 0x8000000000000001
    Authorization: 0x0000000000000000
    Affinity: 0x0000000000000000

Frame 4: 211 bytes on wire (1688 bits), 211 bytes captured (1688 bits)
Ethernet II, Src: Send_00 (20:53:45:4e:44:00), Dst: Receive_00 (20:52:45:43:56:00)
Internet Protocol Version 6, Src: fe80::1:3f00:0:0:2, Dst: fe80::1:3f00:0:0:3
Transmission Control Protocol, Src Port: 0, Dst Port: 7114, Seq: 1, Ack: 129, Len: 137
Zilla Frame
    Frame Type ID: 0x40000002
    Frame Type: WINDOW
    Protocol Type ID: 0x112dc182
    Protocol Type: amqp
    Worker: 1
    Offset: 0x00000058
    Origin ID: 0x0000000100000010
    Origin Namespace: test
    Origin Binding: net0
    Routed ID: 0x0000000100000010
    Routed Namespace: test
    Routed Binding: net0
    Stream ID: 0x3f00000000000003
    Initial ID: 0x3f00000000000003
    Reply ID: 0x3f00000000000002
    Direction: INI
    Sequence: 0
    Acknowledge: 0
    Maximum: 65536
    Timestamp: 0x0000000000000000
    Trace ID: 0x8000000000000001
    Authorization: 0x0000000000000000
    Budget ID: 0x0000000000000000
    Padding: 0
    Minimum: 0
    Capabilities: 0x00
    Progress: 0
    Progress/Maximum: 0/65536

Frame 5: 211 bytes on wire (1688 bits), 211 bytes captured (1688 bits)
Ethernet II, Src: Send_00 (20:53:45:4e:44:00), Dst: Receive_00 (20:52:45:43:56:00)
Internet Protocol Version 6, Src: fe80::3f00:0:0:3, Dst: fe80::3f00:0:0:2
Transmission Control Protocol, Src Port: 7114, Dst Port: 0, Seq: 1, Ack: 128, Len: 137
Zilla Frame
    Frame Type ID: 0x40000002
    Frame Type: WINDOW
    Protocol Type ID: 0x112dc182
    Protocol Type: amqp
    Worker: 0
    Offset: 0x000000b8
    Origin ID: 0x0000000100000010
    Origin Namespace: test
    Origin Binding: net0
    Routed ID: 0x0000000100000010
    Routed Namespace: test
    Routed Binding: net0
    Stream ID: 0x3f00000000000002
    Initial ID: 0x3f00000000000003
    Reply ID: 0x3f00000000000002
    Direction: REP
    Sequence: 0
    Acknowledge: 0
    Maximum: 8192
    Timestamp: 0x0000000000000000
    Trace ID: 0x8000000000000002
    Authorization: 0x0000000000000000
    Budget ID: 0x0000000000000000
    Padding: 0
    Minimum: 0
    Capabilities: 0x00
    Progress: 0
    Progress/Maximum: 0/8192

Frame 6: 219 bytes on wire (1752 bits), 219 bytes captured (1752 bits)
Ethernet II, Src: Send_00 (20:53:45:4e:44:00), Dst: Receive_00 (20:52:45:43:56:00)
Internet Protocol Version 6, Src: fe80::1:3f00:0:0:3, Dst: fe80::1:3f00:0:0:2
Transmission Control Protocol, Src Port: 7114, Dst Port: 0, Seq: 129, Ack: 138, Len: 145
Zilla Frame
    Frame Type ID: 0x00000002
    Frame Type: DATA
    Protocol Type ID: 0x112dc182
    Protocol Type: amqp
    Worker: 1
    Offset: 0x000000b8
    Origin ID: 0x0000000100000010
    Origin Namespace: test
    Origin Binding: net0
    Routed ID: 0x0000000100000010
    Routed Namespace: test
    Routed Binding: net0
    Stream ID: 0x3f00000000000002
    Initial ID: 0x3f00000000000003
    Reply ID: 0x3f00000000000002
    Direction: REP
    Sequence: 0
    Acknowledge: 0
    Maximum: 8192
    Timestamp: 0x0000000000000000
    Trace ID: 0x8000000000000003
    Authorization: 0x0000000000000000
    Flags: 0x03
        .... ...1 = FIN: Set (1)
        .... ..1. = INIT: Set (1)
        .... .0.. = INCOMPLETE: Not set (0)
        .... 0... = SKIP: Not set (0)
    Budget ID: 0x0000000000000000
    Reserved: 8
    Progress: 8
    Progress/Maximum: 8/8192
    Payload
        Length: 8
        Payload
Advanced Message Queuing Protocol

Frame 7: 219 bytes on wire (1752 bits), 219 bytes captured (1752 bits)
Ethernet II, Src: Send_00 (20:53:45:4e:44:00), Dst: Receive_00 (20:52:45:43:56:00)
Internet Protocol Version 6, Src: fe80::3f00:0:0:2, Dst: fe80::3f00:0:0:3
Transmission Control Protocol, Src Port: 0, Dst Port: 7114, Seq: 128, Ack: 138, Len: 145
Zilla Frame
    Frame Type ID: 0x00000002
    Frame Type: DATA
    Protocol Type ID: 0x112dc182
    Protocol Type: amqp
    Worker: 0
    Offset: 0x00000118
    Origin ID: 0x0000000100000010
    Origin Namespace: test
    Origin Binding: net0
    Routed ID: 0x0000000100000010
    Routed Namespace: test
    Routed Binding: net0
    Stream ID: 0x3f00000000000003
    Initial ID: 0x3f00000000000003
    Reply ID: 0x3f00000000000002
    Direction: INI
    Sequence: 0
    Acknowledge: 0
    Maximum: 65536
    Timestamp: 0x0000000000000000
    Trace ID: 0x8000000000000003
    Authorization: 0x0000000000000000
    Flags: 0x03
        .... ...1 = FIN: Set (1)
        .... ..1. = INIT: Set (1)
        .... .0.. = INCOMPLETE: Not set (0)
        .... 0... = SKIP: Not set (0)
    Budget ID: 0x0000000000000000
    Reserved: 8
    Progress: 8
    Progress/Maximum: 8/65536
    Payload
        Length: 8
        Payload
Advanced Message Queuing Protocol

Frame 8: 233 bytes on wire (1864 bits), 233 bytes captured (1864 bits)
Ethernet II, Src: Send_00 (20:53:45:4e:44:00), Dst: Receive_00 (20:52:45:43:56:00)
Internet Protocol Version 6, Src: fe80::1:3f00:0:0:3, Dst: fe80::1:3f00:0:0:2
Transmission Control Protocol, Src Port: 7114, Dst Port: 0, Seq: 274, Ack: 138, Len: 159
Zilla Frame
    Frame Type ID: 0x00000002
    Frame Type: DATA
    Protocol Type ID: 0x112dc182
    Protocol Type: amqp
    Worker: 1
    Offset: 0x00000120
    Origin ID: 0x0000000100000010
    Origin Namespace: test
    Origin Binding: net0
    Routed ID: 0x0000000100000010
    Routed Namespace: test
    Routed Binding: net0
    Stream ID: 0x3f00000000000002
    Initial ID: 0x3f00000000000003
    Reply ID: 0x3f00000000000002
    Direction: REP
    Sequence: 8
    Acknowledge: 0
    Maximum: 8192
    Timestamp: 0x0000000000000000
    Trace ID: 0x8000000000000003
    Authorization: 0x0000000000000000
    Flags: 0x03
        .... ...1 = FIN: Set (1)
        .... ..1. = INIT: Set (1)
        .... .0.. = INCOMPLETE: Not set (0)
        .... 0... = SKIP: Not set (0)
    Budget ID: 0x0000000000000000
    Reserved: 22
    Progress: 30
    Progress/Maximum: 30/8192
    Payload
        Length: 22
        Payload
Advanced Message Queuing Protocol

Frame 9: 211 bytes on wire (1688 bits), 211 bytes captured (1688 bits)
Ethernet II, Src: Send_00 (20:53:45:4e:44:00), Dst: Receive_00 (20:52:45:43:56:00)
Internet Protocol Version 6, Src: fe80::3f00:0:0:3, Dst: fe80::3f00:0:0:2
Transmission Control Protocol, Src Port: 7114, Dst Port: 0, Seq: 138, Ack: 273, Len: 137
Zilla Frame
    Frame Type ID: 0x40000002
    Frame Type: WINDOW
    Protocol Type ID: 0x112dc182
    Protocol Type: amqp
    Worker: 0
    Offset: 0x00000180
    Origin ID: 0x0000000100000010
    Origin Namespace: test
    Origin Binding: net0
    Routed ID: 0x0000000100000010
    Routed Namespace: test
    Routed Binding: net0
    Stream ID: 0x3f00000000000002
    Initial ID: 0x3f00000000000003
    Reply ID: 0x3f00000000000002
    Direction: REP
    Sequence: 8
    Acknowledge: 8
    Maximum: 8192
    Timestamp: 0x0000000000000000
    Trace ID: 0x8000000000000004
    Authorization: 0x0000000000000000
    Budget ID: 0x0000000000000000
    Padding: 0
    Minimum: 0
    Capabilities: 0x00
    Progress: 0
    Progress/Maximum: 0/8192

Frame 10: 240 bytes on wire (1920 bits), 240 bytes captured (1920 bits)
Ethernet II, Src: Send_00 (20:53:45:4e:44:00), Dst: Receive_00 (20:52:45:43:56:00)
Internet Protocol Version 6, Src: fe80::1:3f00:0:0:3, Dst: fe80::1:3f00:0:0:2
Transmission Control Protocol, Src Port: 7114, Dst Port: 0, Seq: 433, Ack: 138, Len: 166
Zilla Frame
    Frame Type ID: 0x00000002
    Frame Type: DATA
    Protocol Type ID: 0x112dc182
    Protocol Type: amqp
    Worker: 1
    Offset: 0x00000198
    Origin ID: 0x0000000100000010
    Origin Namespace: test
    Origin Binding: net0
    Routed ID: 0x0000000100000010
    Routed Namespace: test
    Routed Binding: net0
    Stream ID: 0x3f00000000000002
    Initial ID: 0x3f00000000000003
    Reply ID: 0x3f00000000000002
    Direction: REP
    Sequence: 30
    Acknowledge: 30
    Maximum: 8192
    Timestamp: 0x0000000000000000
    Trace ID: 0x8000000000000007
    Authorization: 0x0000000000000000
    Flags: 0x03
        .... ...1 = FIN: Set (1)
        .... ..1. = INIT: Set (1)
        .... .0.. = INCOMPLETE: Not set (0)
        .... 0... = SKIP: Not set (0)
    Budget ID: 0x0000000000000000
    Reserved: 29
    Progress: 29
    Progress/Maximum: 29/8192
    Payload
        Length: 29
        Payload
Advanced Message Queuing Protocol

Frame 11: 211 bytes on wire (1688 bits), 211 bytes captured (1688 bits)
Ethernet II, Src: Send_00 (20:53:45:4e:44:00), Dst: Receive_00 (20:52:45:43:56:00)
Internet Protocol Version 6, Src: fe80::3f00:0:0:3, Dst: fe80::3f00:0:0:2
Transmission Control Protocol, Src Port: 7114, Dst Port: 0, Seq: 275, Ack: 273, Len: 137
Zilla Frame
    Frame Type ID: 0x40000002
    Frame Type: WINDOW
    Protocol Type ID: 0x112dc182
    Protocol Type: amqp
    Worker: 0
    Offset: 0x000001e0
    Origin ID: 0x0000000100000010
    Origin Namespace: test
    Origin Binding: net0
    Routed ID: 0x0000000100000010
    Routed Namespace: test
    Routed Binding: net0
    Stream ID: 0x3f00000000000002
    Initial ID: 0x3f00000000000003
    Reply ID: 0x3f00000000000002
    Direction: REP
    Sequence: 30
    Acknowledge: 30
    Maximum: 8192
    Timestamp: 0x0000000000000000
    Trace ID: 0x8000000000000005
    Authorization: 0x0000000000000000
    Budget ID: 0x0000000000000000
    Padding: 0
    Minimum: 0
    Capabilities: 0x00
    Progress: 0
    Progress/Maximum: 0/8192

Frame 12: 217 bytes on wire (1736 bits), 217 bytes captured (1736 bits)
Ethernet II, Src: Send_00 (20:53:45:4e:44:00), Dst: Receive_00 (20:52:45:43:56:00)
Internet Protocol Version 6, Src: fe80::1:3f:0:0:2, Dst: fe80::1:3f:0:0:3
Transmission Control Protocol, Src Port: 0, Dst Port: 7114, Seq: 0, Ack: 1, Len: 143
Zilla Frame
    Frame Type ID: 0x00000001
    Frame Type: BEGIN
    Protocol Type ID: 0x00000000
    Protocol Type: 
    Worker: 1
    Offset: 0x00000218
    Origin ID: 0x0000000100000010
    Origin Namespace: test
    Origin Binding: net0
    Routed ID: 0x0000000100000002
    Routed Namespace: test
    Routed Binding: app0
    Stream ID: 0x003f000000000003
    Initial ID: 0x003f000000000003
    Reply ID: 0x003f000000000002
    Direction: INI
    Sequence: 99
    Acknowledge: 99
    Maximum: 0
    Timestamp: 0x0000000000000000
    Trace ID: 0x8000000000000009
    Authorization: 0x0000000000000000
    Affinity: 0x0000000000000000
    Extension: amqp
        Stream Type ID: 0x82c12d11
        Stream Type: amqp
        Address: clients
            Length: 7
            Name: clients
        Capabilities: RECEIVE_ONLY (2)
        Sender Settle Mode: SETTLED (1)
        Receiver Settle Mode: FIRST (0)
