Frame 1: 202 bytes on wire (1616 bits), 202 bytes captured (1616 bits)
Ethernet II, Src: Send_00 (20:53:45:4e:44:00), Dst: Receive_00 (20:52:45:43:56:00)
Internet Protocol Version 6, Src: fe80::3f3f:0:0:2, Dst: fe80::3f3f:0:0:3
Transmission Control Protocol, Src Port: 0, Dst Port: 7114, Seq: 0, Ack: 1, Len: 128
Zilla Frame
    Frame Type ID: 0x00000001
    Frame Type: BEGIN
    Protocol Type ID: 0x112dc182
    Protocol Type: amqp
    Worker: 0
    Offset: 0x00000000
    Origin ID: 0x0000000100000002
    Origin Namespace: test
    Origin Binding: net0
    Routed ID: 0x0000000100000002
    Routed Namespace: test
    Routed Binding: net0
    Stream ID: 0x3f3f000000000003
    Initial ID: 0x3f3f000000000003
    Reply ID: 0x3f3f000000000002
    Direction: INI
    Sequence: 0
    Acknowledge: 0
    Maximum: 0
    Timestamp: 0x0000000000000000
    Trace ID: 0x8000000000000001
    Authorization: 0x0000000000000000
    Affinity: 0x0000000000000000

Frame 2: 202 bytes on wire (1616 bits), 202 bytes captured (1616 bits)
Ethernet II, Src: Send_00 (20:53:45:4e:44:00), Dst: Receive_00 (20:52:45:43:56:00)
Internet Protocol Version 6, Src: fe80::3f3f:0:0:3, Dst: fe80::3f3f:0:0:2
Transmission Control Protocol, Src Port: 7114, Dst Port: 0, Seq: 1, Ack: 128, Len: 128
Zilla Frame
    Frame Type ID: 0x00000001
    Frame Type: BEGIN
    Protocol Type ID: 0x112dc182
    Protocol Type: amqp
    Worker: 0
    Offset: 0x00000058
    Origin ID: 0x0000000100000002
    Origin Namespace: test
    Origin Binding: net0
    Routed ID: 0x0000000100000002
    Routed Namespace: test
    Routed Binding: net0
    Stream ID: 0x3f3f000000000002
    Initial ID: 0x3f3f000000000003
    Reply ID: 0x3f3f000000000002
    Direction: REP
    Sequence: 0
    Acknowledge: 0
    Maximum: 0
    Timestamp: 0x0000000000000000
    Trace ID: 0x8000000000000002
    Authorization: 0x0000000000000000
    Affinity: 0x0000000000000000

Frame 3: 211 bytes on wire (1688 bits), 211 bytes captured (1688 bits)
Ethernet II, Src: Send_00 (20:53:45:4e:44:00), Dst: Receive_00 (20:52:45:43:56:00)
Internet Protocol Version 6, Src: fe80::3f3f:0:0:2, Dst: fe80::3f3f:0:0:3
Transmission Control Protocol, Src Port: 0, Dst Port: 7114, Seq: 128, Ack: 129, Len: 137
Zilla Frame
    Frame Type ID: 0x40000002
    Frame Type: WINDOW
    Protocol Type ID: 0x112dc182
    Protocol Type: amqp
    Worker: 0
    Offset: 0x000000b0
    Origin ID: 0x0000000100000002
    Origin Namespace: test
    Origin Binding: net0
    Routed ID: 0x0000000100000002
    Routed Namespace: test
    Routed Binding: net0
    Stream ID: 0x3f3f000000000003
    Initial ID: 0x3f3f000000000003
    Reply ID: 0x3f3f000000000002
    Direction: INI
    Sequence: 0
    Acknowledge: 0
    Maximum: 8192
    Timestamp: 0x0000000000000000
    Trace ID: 0x8000000000000003
    Authorization: 0x0000000000000000
    Budget ID: 0x0000000000000000
    Padding: 0
    Minimum: 0
    Capabilities: 0x00
    Progress: 0
    Progress/Maximum: 0/8192

Frame 4: 211 bytes on wire (1688 bits), 211 bytes captured (1688 bits)
Ethernet II, Src: Send_00 (20:53:45:4e:44:00), Dst: Receive_00 (20:52:45:43:56:00)
Internet Protocol Version 6, Src: fe80::3f3f:0:0:3, Dst: fe80::3f3f:0:0:2
Transmission Control Protocol, Src Port: 7114, Dst Port: 0, Seq: 129, Ack: 265, Len: 137
Zilla Frame
    Frame Type ID: 0x40000002
    Frame Type: WINDOW
    Protocol Type ID: 0x112dc182
    Protocol Type: amqp
    Worker: 0
    Offset: 0x00000110
    Origin ID: 0x0000000100000002
    Origin Namespace: test
    Origin Binding: net0
    Routed ID: 0x0000000100000002
    Routed Namespace: test
    Routed Binding: net0
    Stream ID: 0x3f3f000000000002
    Initial ID: 0x3f3f000000000003
    Reply ID: 0x3f3f000000000002
    Direction: REP
    Sequence: 0
    Acknowledge: 0
    Maximum: 8192
    Timestamp: 0x0000000000000000
    Trace ID: 0x8000000000000004
    Authorization: 0x0000000000000000
    Budget ID: 0x0000000000000000
    Padding: 0
    Minimum: 0
    Capabilities: 0x00
    Progress: 0
    Progress/Maximum: 0/8192

Frame 5: 219 bytes on wire (1752 bits), 219 bytes captured (1752 bits)
Ethernet II, Src: Send_00 (20:53:45:4e:44:00), Dst: Receive_00 (20:52:45:43:56:00)
Internet Protocol Version 6, Src: fe80::3f3f:0:0:2, Dst: fe80::3f3f:0:0:3
Transmission Control Protocol, Src Port: 0, Dst Port: 7114, Seq: 265, Ack: 266, Len: 145
Zilla Frame
    Frame Type ID: 0x00000002
    Frame Type: DATA
    Protocol Type ID: 0x112dc182
    Protocol Type: amqp
    Worker: 0
    Offset: 0x00000170
    Origin ID: 0x0000000100000002
    Origin Namespace: test
    Origin Binding: net0
    Routed ID: 0x0000000100000002
    Routed Namespace: test
    Routed Binding: net0
    Stream ID: 0x3f3f000000000003
    Initial ID: 0x3f3f000000000003
    Reply ID: 0x3f3f000000000002
    Direction: INI
    Sequence: 0
    Acknowledge: 0
    Maximum: 8192
    Timestamp: 0x0000000000000000
    Trace ID: 0x8000000000000005
    Authorization: 0x0000000000000000
    Flags: 0x03
        .... ...1 = FIN: Set (1)
        .... ..1. = INIT: Set (1)
        .... .0.. = INCOMPLETE: Not set (0)
        .... 0... = SKIP: Not set (0)
    Budget ID: 0x0000000000000000
    Reserved: 8
    Progress: 8
    Progress/Maximum: 8/8192
    Payload
        Length: 8
        Payload
Advanced Message Queuing Protocol

Frame 6: 211 bytes on wire (1688 bits), 211 bytes captured (1688 bits)
Ethernet II, Src: Send_00 (20:53:45:4e:44:00), Dst: Receive_00 (20:52:45:43:56:00)
Internet Protocol Version 6, Src: fe80::3f3f:0:0:2, Dst: fe80::3f3f:0:0:3
Transmission Control Protocol, Src Port: 0, Dst Port: 7114, Seq: 410, Ack: 266, Len: 137
Zilla Frame
    Frame Type ID: 0x40000002
    Frame Type: WINDOW
    Protocol Type ID: 0x112dc182
    Protocol Type: amqp
    Worker: 0
    Offset: 0x000001d8
    Origin ID: 0x0000000100000002
    Origin Namespace: test
    Origin Binding: net0
    Routed ID: 0x0000000100000002
    Routed Namespace: test
    Routed Binding: net0
    Stream ID: 0x3f3f000000000003
    Initial ID: 0x3f3f000000000003
    Reply ID: 0x3f3f000000000002
    Direction: INI
    Sequence: 8
    Acknowledge: 8
    Maximum: 8192
    Timestamp: 0x0000000000000000
    Trace ID: 0x8000000000000006
    Authorization: 0x0000000000000000
    Budget ID: 0x0000000000000000
    Padding: 0
    Minimum: 0
    Capabilities: 0x00
    Progress: 0
    Progress/Maximum: 0/8192

Frame 7: 219 bytes on wire (1752 bits), 219 bytes captured (1752 bits)
Ethernet II, Src: Send_00 (20:53:45:4e:44:00), Dst: Receive_00 (20:52:45:43:56:00)
Internet Protocol Version 6, Src: fe80::3f3f:0:0:3, Dst: fe80::3f3f:0:0:2
Transmission Control Protocol, Src Port: 7114, Dst Port: 0, Seq: 266, Ack: 547, Len: 145
Zilla Frame
    Frame Type ID: 0x00000002
    Frame Type: DATA
    Protocol Type ID: 0x112dc182
    Protocol Type: amqp
    Worker: 0
    Offset: 0x00000238
    Origin ID: 0x0000000100000002
    Origin Namespace: test
    Origin Binding: net0
    Routed ID: 0x0000000100000002
    Routed Namespace: test
    Routed Binding: net0
    Stream ID: 0x3f3f000000000002
    Initial ID: 0x3f3f000000000003
    Reply ID: 0x3f3f000000000002
    Direction: REP
    Sequence: 0
    Acknowledge: 0
    Maximum: 8192
    Timestamp: 0x0000000000000000
    Trace ID: 0x8000000000000007
    Authorization: 0x0000000000000000
    Flags: 0x03
        .... ...1 = FIN: Set (1)
        .... ..1. = INIT: Set (1)
        .... .0.. = INCOMPLETE: Not set (0)
        .... 0... = SKIP: Not set (0)
    Budget ID: 0x0000000000000000
    Reserved: 8
    Progress: 8
    Progress/Maximum: 8/8192
    Payload
        Length: 8
        Payload
Advanced Message Queuing Protocol

Frame 8: 211 bytes on wire (1688 bits), 211 bytes captured (1688 bits)
Ethernet II, Src: Send_00 (20:53:45:4e:44:00), Dst: Receive_00 (20:52:45:43:56:00)
Internet Protocol Version 6, Src: fe80::3f3f:0:0:3, Dst: fe80::3f3f:0:0:2
Transmission Control Protocol, Src Port: 7114, Dst Port: 0, Seq: 411, Ack: 547, Len: 137
Zilla Frame
    Frame Type ID: 0x40000002
    Frame Type: WINDOW
    Protocol Type ID: 0x112dc182
    Protocol Type: amqp
    Worker: 0
    Offset: 0x000002a0
    Origin ID: 0x0000000100000002
    Origin Namespace: test
    Origin Binding: net0
    Routed ID: 0x0000000100000002
    Routed Namespace: test
    Routed Binding: net0
    Stream ID: 0x3f3f000000000002
    Initial ID: 0x3f3f000000000003
    Reply ID: 0x3f3f000000000002
    Direction: REP
    Sequence: 8
    Acknowledge: 8
    Maximum: 8192
    Timestamp: 0x0000000000000000
    Trace ID: 0x8000000000000008
    Authorization: 0x0000000000000000
    Budget ID: 0x0000000000000000
    Padding: 0
    Minimum: 0
    Capabilities: 0x00
    Progress: 0
    Progress/Maximum: 0/8192

Frame 9: 233 bytes on wire (1864 bits), 233 bytes captured (1864 bits)
Ethernet II, Src: Send_00 (20:53:45:4e:44:00), Dst: Receive_00 (20:52:45:43:56:00)
Internet Protocol Version 6, Src: fe80::3f3f:0:0:2, Dst: fe80::3f3f:0:0:3
Transmission Control Protocol, Src Port: 0, Dst Port: 7114, Seq: 547, Ack: 548, Len: 159
Zilla Frame
    Frame Type ID: 0x00000002
    Frame Type: DATA
    Protocol Type ID: 0x112dc182
    Protocol Type: amqp
    Worker: 0
    Offset: 0x00000300
    Origin ID: 0x0000000100000002
    Origin Namespace: test
    Origin Binding: net0
    Routed ID: 0x0000000100000002
    Routed Namespace: test
    Routed Binding: net0
    Stream ID: 0x3f3f000000000003
    Initial ID: 0x3f3f000000000003
    Reply ID: 0x3f3f000000000002
    Direction: INI
    Sequence: 8
    Acknowledge: 8
    Maximum: 8192
    Timestamp: 0x0000000000000000
    Trace ID: 0x8000000000000009
    Authorization: 0x0000000000000000
    Flags: 0x03
        .... ...1 = FIN: Set (1)
        .... ..1. = INIT: Set (1)
        .... .0.. = INCOMPLETE: Not set (0)
        .... 0... = SKIP: Not set (0)
    Budget ID: 0x0000000000000000
    Reserved: 22
    Progress: 22
    Progress/Maximum: 22/8192
    Payload
        Length: 22
        Payload
Advanced Message Queuing Protocol

Frame 10: 211 bytes on wire (1688 bits), 211 bytes captured (1688 bits)
Ethernet II, Src: Send_00 (20:53:45:4e:44:00), Dst: Receive_00 (20:52:45:43:56:00)
Internet Protocol Version 6, Src: fe80::3f3f:0:0:2, Dst: fe80::3f3f:0:0:3
Transmission Control Protocol, Src Port: 0, Dst Port: 7114, Seq: 706, Ack: 548, Len: 137
Zilla Frame
    Frame Type ID: 0x40000002
    Frame Type: WINDOW
    Protocol Type ID: 0x112dc182
    Protocol Type: amqp
    Worker: 0
    Offset: 0x00000378
    Origin ID: 0x0000000100000002
    Origin Namespace: test
    Origin Binding: net0
    Routed ID: 0x0000000100000002
    Routed Namespace: test
    Routed Binding: net0
    Stream ID: 0x3f3f000000000003
    Initial ID: 0x3f3f000000000003
    Reply ID: 0x3f3f000000000002
    Direction: INI
    Sequence: 30
    Acknowledge: 30
    Maximum: 8192
    Timestamp: 0x0000000000000000
    Trace ID: 0x800000000000000a
    Authorization: 0x0000000000000000
    Budget ID: 0x0000000000000000
    Padding: 0
    Minimum: 0
    Capabilities: 0x00
    Progress: 0
    Progress/Maximum: 0/8192

Frame 11: 233 bytes on wire (1864 bits), 233 bytes captured (1864 bits)
Ethernet II, Src: Send_00 (20:53:45:4e:44:00), Dst: Receive_00 (20:52:45:43:56:00)
Internet Protocol Version 6, Src: fe80::3f3f:0:0:3, Dst: fe80::3f3f:0:0:2
Transmission Control Protocol, Src Port: 7114, Dst Port: 0, Seq: 548, Ack: 843, Len: 159
Zilla Frame
    Frame Type ID: 0x00000002
    Frame Type: DATA
    Protocol Type ID: 0x112dc182
    Protocol Type: amqp
    Worker: 0
    Offset: 0x000003d8
    Origin ID: 0x0000000100000002
    Origin Namespace: test
    Origin Binding: net0
    Routed ID: 0x0000000100000002
    Routed Namespace: test
    Routed Binding: net0
    Stream ID: 0x3f3f000000000002
    Initial ID: 0x3f3f000000000003
    Reply ID: 0x3f3f000000000002
    Direction: REP
    Sequence: 8
    Acknowledge: 8
    Maximum: 8192
    Timestamp: 0x0000000000000000
    Trace ID: 0x800000000000000b
    Authorization: 0x0000000000000000
    Flags: 0x03
        .... ...1 = FIN: Set (1)
        .... ..1. = INIT: Set (1)
        .... .0.. = INCOMPLETE: Not set (0)
        .... 0... = SKIP: Not set (0)
    Budget ID: 0x0000000000000000
    Reserved: 22
    Progress: 22
    Progress/Maximum: 22/8192
    Payload
        Length: 22
        Payload
Advanced Message Queuing Protocol

Frame 12: 211 bytes on wire (1688 bits), 211 bytes captured (1688 bits)
Ethernet II, Src: Send_00 (20:53:45:4e:44:00), Dst: Receive_00 (20:52:45:43:56:00)
Internet Protocol Version 6, Src: fe80::3f3f:0:0:3, Dst: fe80::3f3f:0:0:2
Transmission Control Protocol, Src Port: 7114, Dst Port: 0, Seq: 707, Ack: 843, Len: 137
Zilla Frame
    Frame Type ID: 0x40000002
    Frame Type: WINDOW
    Protocol Type ID: 0x112dc182
    Protocol Type: amqp
    Worker: 0
    Offset: 0x00000450
    Origin ID: 0x0000000100000002
    Origin Namespace: test
    Origin Binding: net0
    Routed ID: 0x0000000100000002
    Routed Namespace: test
    Routed Binding: net0
    Stream ID: 0x3f3f000000000002
    Initial ID: 0x3f3f000000000003
    Reply ID: 0x3f3f000000000002
    Direction: REP
    Sequence: 30
    Acknowledge: 30
    Maximum: 8192
    Timestamp: 0x0000000000000000
    Trace ID: 0x800000000000000c
    Authorization: 0x0000000000000000
    Budget ID: 0x0000000000000000
    Padding: 0
    Minimum: 0
    Capabilities: 0x00
    Progress: 0
    Progress/Maximum: 0/8192

Frame 13: 238 bytes on wire (1904 bits), 238 bytes captured (1904 bits)
Ethernet II, Src: Send_00 (20:53:45:4e:44:00), Dst: Receive_00 (20:52:45:43:56:00)
Internet Protocol Version 6, Src: fe80::3f3f:0:0:2, Dst: fe80::3f3f:0:0:3
Transmission Control Protocol, Src Port: 0, Dst Port: 7114, Seq: 843, Ack: 844, Len: 164
Zilla Frame
    Frame Type ID: 0x00000002
    Frame Type: DATA
    Protocol Type ID: 0x112dc182
    Protocol Type: amqp
    Worker: 0
    Offset: 0x000004b0
    Origin ID: 0x0000000100000002
    Origin Namespace: test
    Origin Binding: net0
    Routed ID: 0x0000000100000002
    Routed Namespace: test
    Routed Binding: net0
    Stream ID: 0x3f3f000000000003
    Initial ID: 0x3f3f000000000003
    Reply ID: 0x3f3f000000000002
    Direction: INI
    Sequence: 30
    Acknowledge: 30
    Maximum: 8192
    Timestamp: 0x0000000000000000
    Trace ID: 0x800000000000000d
    Authorization: 0x0000000000000000
    Flags: 0x03
        .... ...1 = FIN: Set (1)
        .... ..1. = INIT: Set (1)
        .... .0.. = INCOMPLETE: Not set (0)
        .... 0... = SKIP: Not set (0)
    Budget ID: 0x0000000000000000
    Reserved: 27
    Progress: 27
    Progress/Maximum: 27/8192
    Payload
        Length: 27
        Payload
Advanced Message Queuing Protocol

Frame 14: 211 bytes on wire (1688 bits), 211 bytes captured (1688 bits)
Ethernet II, Src: Send_00 (20:53:45:4e:44:00), Dst: Receive_00 (20:52:45:43:56:00)
Internet Protocol Version 6, Src: fe80::3f3f:0:0:2, Dst: fe80::3f3f:0:0:3
Transmission Control Protocol, Src Port: 0, Dst Port: 7114, Seq: 1007, Ack: 844, Len: 137
Zilla Frame
    Frame Type ID: 0x40000002
    Frame Type: WINDOW
    Protocol Type ID: 0x112dc182
    Protocol Type: amqp
    Worker: 0
    Offset: 0x00000528
    Origin ID: 0x0000000100000002
    Origin Namespace: test
    Origin Binding: net0
    Routed ID: 0x0000000100000002
    Routed Namespace: test
    Routed Binding: net0
    Stream ID: 0x3f3f000000000003
    Initial ID: 0x3f3f000000000003
    Reply ID: 0x3f3f000000000002
    Direction: INI
    Sequence: 57
    Acknowledge: 57
    Maximum: 8192
    Timestamp: 0x0000000000000000
    Trace ID: 0x800000000000000e
    Authorization: 0x0000000000000000
    Budget ID: 0x0000000000000000
    Padding: 0
    Minimum: 0
    Capabilities: 0x00
    Progress: 0
    Progress/Maximum: 0/8192

Frame 15: 240 bytes on wire (1920 bits), 240 bytes captured (1920 bits)
Ethernet II, Src: Send_00 (20:53:45:4e:44:00), Dst: Receive_00 (20:52:45:43:56:00)
Internet Protocol Version 6, Src: fe80::3f3f:0:0:3, Dst: fe80::3f3f:0:0:2
Transmission Control Protocol, Src Port: 7114, Dst Port: 0, Seq: 844, Ack: 1144, Len: 166
Zilla Frame
    Frame Type ID: 0x00000002
    Frame Type: DATA
    Protocol Type ID: 0x112dc182
    Protocol Type: amqp
    Worker: 0
    Offset: 0x00000588
    Origin ID: 0x0000000100000002
    Origin Namespace: test
    Origin Binding: net0
    Routed ID: 0x0000000100000002
    Routed Namespace: test
    Routed Binding: net0
    Stream ID: 0x3f3f000000000002
    Initial ID: 0x3f3f000000000003
    Reply ID: 0x3f3f000000000002
    Direction: REP
    Sequence: 30
    Acknowledge: 30
    Maximum: 8192
    Timestamp: 0x0000000000000000
    Trace ID: 0x800000000000000f
    Authorization: 0x0000000000000000
    Flags: 0x03
        .... ...1 = FIN: Set (1)
        .... ..1. = INIT: Set (1)
        .... .0.. = INCOMPLETE: Not set (0)
        .... 0... = SKIP: Not set (0)
    Budget ID: 0x0000000000000000
    Reserved: 29
    Progress: 29
    Progress/Maximum: 29/8192
    Payload
        Length: 29
        Payload
Advanced Message Queuing Protocol

Frame 16: 211 bytes on wire (1688 bits), 211 bytes captured (1688 bits)
Ethernet II, Src: Send_00 (20:53:45:4e:44:00), Dst: Receive_00 (20:52:45:43:56:00)
Internet Protocol Version 6, Src: fe80::3f3f:0:0:3, Dst: fe80::3f3f:0:0:2
Transmission Control Protocol, Src Port: 7114, Dst Port: 0, Seq: 1010, Ack: 1144, Len: 137
Zilla Frame
    Frame Type ID: 0x40000002
    Frame Type: WINDOW
    Protocol Type ID: 0x112dc182
    Protocol Type: amqp
    Worker: 0
    Offset: 0x00000608
    Origin ID: 0x0000000100000002
    Origin Namespace: test
    Origin Binding: net0
    Routed ID: 0x0000000100000002
    Routed Namespace: test
    Routed Binding: net0
    Stream ID: 0x3f3f000000000002
    Initial ID: 0x3f3f000000000003
    Reply ID: 0x3f3f000000000002
    Direction: REP
    Sequence: 59
    Acknowledge: 59
    Maximum: 8192
    Timestamp: 0x0000000000000000
    Trace ID: 0x8000000000000010
    Authorization: 0x0000000000000000
    Budget ID: 0x0000000000000000
    Padding: 0
    Minimum: 0
    Capabilities: 0x00
    Progress: 0
    Progress/Maximum: 0/8192

Frame 17: 253 bytes on wire (2024 bits), 253 bytes captured (2024 bits)
Ethernet II, Src: Send_00 (20:53:45:4e:44:00), Dst: Receive_00 (20:52:45:43:56:00)
Internet Protocol Version 6, Src: fe80::3f3f:0:0:2, Dst: fe80::3f3f:0:0:3
Transmission Control Protocol, Src Port: 0, Dst Port: 7114, Seq: 1144, Ack: 1147, Len: 179
Zilla Frame
    Frame Type ID: 0x00000002
    Frame Type: DATA
    Protocol Type ID: 0x112dc182
    Protocol Type: amqp
    Worker: 0
    Offset: 0x00000668
    Origin ID: 0x0000000100000002
    Origin Namespace: test
    Origin Binding: net0
    Routed ID: 0x0000000100000002
    Routed Namespace: test
    Routed Binding: net0
    Stream ID: 0x3f3f000000000003
    Initial ID: 0x3f3f000000000003
    Reply ID: 0x3f3f000000000002
    Direction: INI
    Sequence: 57
    Acknowledge: 57
    Maximum: 8192
    Timestamp: 0x0000000000000000
    Trace ID: 0x8000000000000011
    Authorization: 0x0000000000000000
    Flags: 0x03
        .... ...1 = FIN: Set (1)
        .... ..1. = INIT: Set (1)
        .... .0.. = INCOMPLETE: Not set (0)
        .... 0... = SKIP: Not set (0)
    Budget ID: 0x0000000000000000
    Reserved: 42
    Progress: 42
    Progress/Maximum: 42/8192
    Payload
        Length: 42
        Payload
Advanced Message Queuing Protocol

Frame 18: 211 bytes on wire (1688 bits), 211 bytes captured (1688 bits)
Ethernet II, Src: Send_00 (20:53:45:4e:44:00), Dst: Receive_00 (20:52:45:43:56:00)
Internet Protocol Version 6, Src: fe80::3f3f:0:0:2, Dst: fe80::3f3f:0:0:3
Transmission Control Protocol, Src Port: 0, Dst Port: 7114, Seq: 1323, Ack: 1147, Len: 137
Zilla Frame
    Frame Type ID: 0x40000002
    Frame Type: WINDOW
    Protocol Type ID: 0x112dc182
    Protocol Type: amqp
    Worker: 0
    Offset: 0x000006f0
    Origin ID: 0x0000000100000002
    Origin Namespace: test
    Origin Binding: net0
    Routed ID: 0x0000000100000002
    Routed Namespace: test
    Routed Binding: net0
    Stream ID: 0x3f3f000000000003
    Initial ID: 0x3f3f000000000003
    Reply ID: 0x3f3f000000000002
    Direction: INI
    Sequence: 99
    Acknowledge: 99
    Maximum: 8192
    Timestamp: 0x0000000000000000
    Trace ID: 0x8000000000000012
    Authorization: 0x0000000000000000
    Budget ID: 0x0000000000000000
    Padding: 0
    Minimum: 0
    Capabilities: 0x00
    Progress: 0
    Progress/Maximum: 0/8192

Frame 19: 260 bytes on wire (2080 bits), 260 bytes captured (2080 bits)
Ethernet II, Src: Send_00 (20:53:45:4e:44:00), Dst: Receive_00 (20:52:45:43:56:00)
Internet Protocol Version 6, Src: fe80::3f3f:0:0:3, Dst: fe80::3f3f:0:0:2
Transmission Control Protocol, Src Port: 7114, Dst Port: 0, Seq: 1147, Ack: 1460, Len: 186
Zilla Frame
    Frame Type ID: 0x00000002
    Frame Type: DATA
    Protocol Type ID: 0x112dc182
    Protocol Type: amqp
    Worker: 0
    Offset: 0x00000750
    Origin ID: 0x0000000100000002
    Origin Namespace: test
    Origin Binding: net0
    Routed ID: 0x0000000100000002
    Routed Namespace: test
    Routed Binding: net0
    Stream ID: 0x3f3f000000000002
    Initial ID: 0x3f3f000000000003
    Reply ID: 0x3f3f000000000002
    Direction: REP
    Sequence: 59
    Acknowledge: 59
    Maximum: 8192
    Timestamp: 0x0000000000000000
    Trace ID: 0x8000000000000013
    Authorization: 0x0000000000000000
    Flags: 0x03
        .... ...1 = FIN: Set (1)
        .... ..1. = INIT: Set (1)
        .... .0.. = INCOMPLETE: Not set (0)
        .... 0... = SKIP: Not set (0)
    Budget ID: 0x0000000000000000
    Reserved: 49
    Progress: 49
    Progress/Maximum: 49/8192
    Payload
        Length: 49
        Payload
Advanced Message Queuing Protocol

Frame 20: 211 bytes on wire (1688 bits), 211 bytes captured (1688 bits)
Ethernet II, Src: Send_00 (20:53:45:4e:44:00), Dst: Receive_00 (20:52:45:43:56:00)
Internet Protocol Version 6, Src: fe80::3f3f:0:0:3, Dst: fe80::3f3f:0:0:2
Transmission Control Protocol, Src Port: 7114, Dst Port: 0, Seq: 1333, Ack: 1460, Len: 137
Zilla Frame
    Frame Type ID: 0x40000002
    Frame Type: WINDOW
    Protocol Type ID: 0x112dc182
    Protocol Type: amqp
    Worker: 0
    Offset: 0x000007e0
    Origin ID: 0x0000000100000002
    Origin Namespace: test
    Origin Binding: net0
    Routed ID: 0x0000000100000002
    Routed Namespace: test
    Routed Binding: net0
    Stream ID: 0x3f3f000000000002
    Initial ID: 0x3f3f000000000003
    Reply ID: 0x3f3f000000000002
    Direction: REP
    Sequence: 108
    Acknowledge: 108
    Maximum: 8192
    Timestamp: 0x0000000000000000
    Trace ID: 0x8000000000000014
    Authorization: 0x0000000000000000
    Budget ID: 0x0000000000000000
    Padding: 0
    Minimum: 0
    Capabilities: 0x00
    Progress: 0
    Progress/Maximum: 0/8192

Frame 21: 239 bytes on wire (1912 bits), 239 bytes captured (1912 bits)
Ethernet II, Src: Send_00 (20:53:45:4e:44:00), Dst: Receive_00 (20:52:45:43:56:00)
Internet Protocol Version 6, Src: fe80::3f3f:0:0:2, Dst: fe80::3f3f:0:0:3
Transmission Control Protocol, Src Port: 0, Dst Port: 7114, Seq: 1460, Ack: 1470, Len: 165
Zilla Frame
    Frame Type ID: 0x00000002
    Frame Type: DATA
    Protocol Type ID: 0x112dc182
    Protocol Type: amqp
    Worker: 0
    Offset: 0x00000840
    Origin ID: 0x0000000100000002
    Origin Namespace: test
    Origin Binding: net0
    Routed ID: 0x0000000100000002
    Routed Namespace: test
    Routed Binding: net0
    Stream ID: 0x3f3f000000000003
    Initial ID: 0x3f3f000000000003
    Reply ID: 0x3f3f000000000002
    Direction: INI
    Sequence: 99
    Acknowledge: 99
    Maximum: 8192
    Timestamp: 0x0000000000000000
    Trace ID: 0x8000000000000015
    Authorization: 0x0000000000000000
    Flags: 0x03
        .... ...1 = FIN: Set (1)
        .... ..1. = INIT: Set (1)
        .... .0.. = INCOMPLETE: Not set (0)
        .... 0... = SKIP: Not set (0)
    Budget ID: 0x0000000000000000
    Reserved: 28
    Progress: 28
    Progress/Maximum: 28/8192
    Payload
        Length: 28
        Payload
Advanced Message Queuing Protocol

Frame 22: 211 bytes on wire (1688 bits), 211 bytes captured (1688 bits)
Ethernet II, Src: Send_00 (20:53:45:4e:44:00), Dst: Receive_00 (20:52:45:43:56:00)
Internet Protocol Version 6, Src: fe80::3f3f:0:0:2, Dst: fe80::3f3f:0:0:3
Transmission Control Protocol, Src Port: 0, Dst Port: 7114, Seq: 1625, Ack: 1470, Len: 137
Zilla Frame
    Frame Type ID: 0x40000002
    Frame Type: WINDOW
    Protocol Type ID: 0x112dc182
    Protocol Type: amqp
    Worker: 0
    Offset: 0x000008c0
    Origin ID: 0x0000000100000002
    Origin Namespace: test
    Origin Binding: net0
    Routed ID: 0x0000000100000002
    Routed Namespace: test
    Routed Binding: net0
    Stream ID: 0x3f3f000000000003
    Initial ID: 0x3f3f000000000003
    Reply ID: 0x3f3f000000000002
    Direction: INI
    Sequence: 127
    Acknowledge: 127
    Maximum: 8192
    Timestamp: 0x0000000000000000
    Trace ID: 0x8000000000000016
    Authorization: 0x0000000000000000
    Budget ID: 0x0000000000000000
    Padding: 0
    Minimum: 0
    Capabilities: 0x00
    Progress: 0
    Progress/Maximum: 0/8192
