Frame 1: 198 bytes on wire (1584 bits), 198 bytes captured (1584 bits)
Ethernet II, Src: Send_00 (20:53:45:4e:44:00), Dst: Receive_00 (20:52:45:43:56:00)
Internet Protocol Version 6, Src: fe80::1, Dst: fe80::
Transmission Control Protocol, Src Port: 7114, Dst Port: 0, Seq: 1, Ack: 1, Len: 124
Zilla Frame
    Frame Type ID: 0x40000003
    Frame Type: SIGNAL
    Protocol Type ID: 0x00000000
    Protocol Type: 
    Worker: 0
    Offset: 0x00000000
    Origin ID: 0x0000000000000000
    Routed ID: 0x0000000000000000
    Stream ID: 0x0000000000000000
    Direction: 
    Sequence: 0
    Acknowledge: 0
    Maximum: 0
    Timestamp: 0x0000000000000001
    Trace ID: 0x0000000000000000
    Authorization: 0x0000000000000000
    Cancel ID: 0x0000000000007701
    Signal ID: 30466
    Context ID: 30467
    Payload
        Length: -1

Frame 2: 210 bytes on wire (1680 bits), 210 bytes captured (1680 bits)
Ethernet II, Src: Send_00 (20:53:45:4e:44:00), Dst: Receive_00 (20:52:45:43:56:00)
Internet Protocol Version 6, Src: fe80::1, Dst: fe80::
Transmission Control Protocol, Src Port: 7114, Dst Port: 0, Seq: 125, Ack: 1, Len: 136
Zilla Frame
    Frame Type ID: 0x40000003
    Frame Type: SIGNAL
    Protocol Type ID: 0x00000000
    Protocol Type: 
    Worker: 0
    Offset: 0x00000060
    Origin ID: 0x0000000000000000
    Routed ID: 0x0000000000000000
    Stream ID: 0x0000000000000000
    Direction: 
    Sequence: 0
    Acknowledge: 0
    Maximum: 0
    Timestamp: 0x0000000000000002
    Trace ID: 0x0000000000000000
    Authorization: 0x0000000000000000
    Cancel ID: 0x0000000000007801
    Signal ID: 30722
    Context ID: 30723
    Payload
        Length: 12
        Payload

Frame 3: 233 bytes on wire (1864 bits), 233 bytes captured (1864 bits)
Ethernet II, Src: Send_00 (20:53:45:4e:44:00), Dst: Receive_00 (20:52:45:43:56:00)
Internet Protocol Version 6, Src: fe80::4, Dst: fe80::5
Transmission Control Protocol, Src Port: 0, Dst Port: 7114, Seq: 0, Ack: 1, Len: 159
Zilla Frame
    Frame Type ID: 0x00000001
    Frame Type: BEGIN
    Protocol Type ID: 0x8ab62046
    Protocol Type: http
    Worker: 0
    Offset: 0x000000d0
    Origin ID: 0x000000090000000b
    Origin Namespace: example
    Origin Binding: north_tcp_server
    Routed ID: 0x000000090000000d
    Routed Namespace: example
    Routed Binding: north_http_server
    Stream ID: 0x0000000000000005
    Initial ID: 0x0000000000000005
    Reply ID: 0x0000000000000004
    Direction: INI
    Sequence: 0
    Acknowledge: 0
    Maximum: 0
    Timestamp: 0x0000000000000002
    Trace ID: 0x0000000000000003
    Authorization: 0x0000000000000000
    Affinity: 0x0000000000000005

Frame 4: 242 bytes on wire (1936 bits), 242 bytes captured (1936 bits)
Ethernet II, Src: Send_00 (20:53:45:4e:44:00), Dst: Receive_00 (20:52:45:43:56:00)
Internet Protocol Version 6, Src: fe80::4, Dst: fe80::5
Transmission Control Protocol, Src Port: 0, Dst Port: 7114, Seq: 159, Ack: 1, Len: 168
Zilla Frame
    Frame Type ID: 0x40000002
    Frame Type: WINDOW
    Protocol Type ID: 0x8ab62046
    Protocol Type: http
    Worker: 0
    Offset: 0x00000128
    Origin ID: 0x000000090000000b
    Origin Namespace: example
    Origin Binding: north_tcp_server
    Routed ID: 0x000000090000000d
    Routed Namespace: example
    Routed Binding: north_http_server
    Stream ID: 0x0000000000000005
    Initial ID: 0x0000000000000005
    Reply ID: 0x0000000000000004
    Direction: INI
    Sequence: 0
    Acknowledge: 0
    Maximum: 65536
    Timestamp: 0x0000000000000003
    Trace ID: 0x0000000000000003
    Authorization: 0x0000000000000000
    Budget ID: 0x0000000000000000
    Padding: 0
    Minimum: 0
    Capabilities: 0x00
    Progress: 0
    Progress/Maximum: 0/65536

Frame 5: 233 bytes on wire (1864 bits), 233 bytes captured (1864 bits)
Ethernet II, Src: Send_00 (20:53:45:4e:44:00), Dst: Receive_00 (20:52:45:43:56:00)
Internet Protocol Version 6, Src: fe80::5, Dst: fe80::4
Transmission Control Protocol, Src Port: 7114, Dst Port: 0, Seq: 1, Ack: 327, Len: 159
Zilla Frame
    Frame Type ID: 0x00000001
    Frame Type: BEGIN
    Protocol Type ID: 0x8ab62046
    Protocol Type: http
    Worker: 0
    Offset: 0x00000188
    Origin ID: 0x000000090000000b
    Origin Namespace: example
    Origin Binding: north_tcp_server
    Routed ID: 0x000000090000000d
    Routed Namespace: example
    Routed Binding: north_http_server
    Stream ID: 0x0000000000000004
    Initial ID: 0x0000000000000005
    Reply ID: 0x0000000000000004
    Direction: REP
    Sequence: 1
    Acknowledge: 0
    Maximum: 0
    Timestamp: 0x0000000000000004
    Trace ID: 0x0000000000000003
    Authorization: 0x0000000000000000
    Affinity: 0x0000000000000000

Frame 6: 242 bytes on wire (1936 bits), 242 bytes captured (1936 bits)
Ethernet II, Src: Send_00 (20:53:45:4e:44:00), Dst: Receive_00 (20:52:45:43:56:00)
Internet Protocol Version 6, Src: fe80::5, Dst: fe80::4
Transmission Control Protocol, Src Port: 7114, Dst Port: 0, Seq: 160, Ack: 327, Len: 168
Zilla Frame
    Frame Type ID: 0x40000002
    Frame Type: WINDOW
    Protocol Type ID: 0x8ab62046
    Protocol Type: http
    Worker: 0
    Offset: 0x000001e0
    Origin ID: 0x000000090000000b
    Origin Namespace: example
    Origin Binding: north_tcp_server
    Routed ID: 0x000000090000000d
    Routed Namespace: example
    Routed Binding: north_http_server
    Stream ID: 0x0000000000000004
    Initial ID: 0x0000000000000005
    Reply ID: 0x0000000000000004
    Direction: REP
    Sequence: 0
    Acknowledge: 0
    Maximum: 65536
    Timestamp: 0x0000000000000005
    Trace ID: 0x0000000000000003
    Authorization: 0x0000000000000000
    Budget ID: 0x0000000000000000
    Padding: 0
    Minimum: 0
    Capabilities: 0x00
    Progress: 0
    Progress/Maximum: 0/65536

Frame 7: 232 bytes on wire (1856 bits), 232 bytes captured (1856 bits)
Ethernet II, Src: Send_00 (20:53:45:4e:44:00), Dst: Receive_00 (20:52:45:43:56:00)
Internet Protocol Version 6, Src: fe80::76, Dst: fe80::77
Transmission Control Protocol, Src Port: 0, Dst Port: 7114, Seq: 0, Ack: 1, Len: 158
Zilla Frame
    Frame Type ID: 0x00000001
    Frame Type: BEGIN
    Protocol Type ID: 0x99f321bc
    Protocol Type: tls
    Worker: 0
    Offset: 0x00000240
    Origin ID: 0x000000090000000b
    Origin Namespace: example
    Origin Binding: north_tcp_server
    Routed ID: 0x000000090000000c
    Routed Namespace: example
    Routed Binding: north_tls_server
    Stream ID: 0x0000000000000077
    Initial ID: 0x0000000000000077
    Reply ID: 0x0000000000000076
    Direction: INI
    Sequence: 71
    Acknowledge: 72
    Maximum: 73
    Timestamp: 0x0000000000004201
    Trace ID: 0x0000000000004202
    Authorization: 0x0000000000004203
    Affinity: 0x0000000000004204

Frame 8: 372 bytes on wire (2976 bits), 372 bytes captured (2976 bits)
Ethernet II, Src: Send_00 (20:53:45:4e:44:00), Dst: Receive_00 (20:52:45:43:56:00)
Internet Protocol Version 6, Src: fe80::4, Dst: fe80::5
Transmission Control Protocol, Src Port: 0, Dst Port: 7114, Seq: 327, Ack: 328, Len: 298
Zilla Frame
    Frame Type ID: 0x00000002
    Frame Type: DATA
    Protocol Type ID: 0x8ab62046
    Protocol Type: http
    Worker: 0
    Offset: 0x00000298
    Origin ID: 0x000000090000000b
    Origin Namespace: example
    Origin Binding: north_tcp_server
    Routed ID: 0x000000090000000d
    Routed Namespace: example
    Routed Binding: north_http_server
    Stream ID: 0x0000000000000005
    Initial ID: 0x0000000000000005
    Reply ID: 0x0000000000000004
    Direction: INI
    Sequence: 123
    Acknowledge: 456
    Maximum: 777
    Timestamp: 0x0000000000000006
    Trace ID: 0x0000000000000003
    Authorization: 0x0000000000000000
    Flags: 0x03
        .... ...1 = FIN: Set (1)
        .... ..1. = INIT: Set (1)
        .... .0.. = INCOMPLETE: Not set (0)
        .... 0... = SKIP: Not set (0)
    Budget ID: 0x0000000000004205
    Reserved: 16902
    Progress: 16569
    Progress/Maximum: 16569/777
    Payload
        Length: 130
        Payload
Hypertext Transfer Protocol
    POST / HTTP/1.1\n
        [Expert Info (Chat/Sequence): POST / HTTP/1.1\n]
            [POST / HTTP/1.1\n]
            [Severity level: Chat]
            [Group: Sequence]
        Request Method: POST
        Request URI: /
        Request Version: HTTP/1.1
    Host: localhost:8080\n
    User-Agent: curl/7.85.0\n
    Accept: */*\n
    Content-Type: text/plain\n
    Content-Length: 12\n
        [Content length: 12]
    \n
    [Full request URI: http://localhost:8080/]
    [HTTP request 1/1]
    File Data: 12 bytes
Line-based text data: text/plain (1 lines)

Frame 9: 316 bytes on wire (2528 bits), 316 bytes captured (2528 bits)
Ethernet II, Src: Send_00 (20:53:45:4e:44:00), Dst: Receive_00 (20:52:45:43:56:00)
Internet Protocol Version 6, Src: fe80::5, Dst: fe80::4
Transmission Control Protocol, Src Port: 7114, Dst Port: 0, Seq: 328, Ack: 625, Len: 242
Zilla Frame
    Frame Type ID: 0x00000002
    Frame Type: DATA
    Protocol Type ID: 0x8ab62046
    Protocol Type: http
    Worker: 0
    Offset: 0x00000378
    Origin ID: 0x000000090000000b
    Origin Namespace: example
    Origin Binding: north_tcp_server
    Routed ID: 0x000000090000000d
    Routed Namespace: example
    Routed Binding: north_http_server
    Stream ID: 0x0000000000000004
    Initial ID: 0x0000000000000005
    Reply ID: 0x0000000000000004
    Direction: REP
    Sequence: 123
    Acknowledge: 456
    Maximum: 777
    Timestamp: 0x0000000000000007
    Trace ID: 0x0000000000000003
    Authorization: 0x0000000000000000
    Flags: 0x03
        .... ...1 = FIN: Set (1)
        .... ..1. = INIT: Set (1)
        .... .0.. = INCOMPLETE: Not set (0)
        .... 0... = SKIP: Not set (0)
    Budget ID: 0x0000000000004205
    Reserved: 16902
    Progress: 16569
    Progress/Maximum: 16569/777
    Payload
        Length: 74
        Payload
Hypertext Transfer Protocol
    HTTP/1.1 200 OK\n
        [Expert Info (Chat/Sequence): HTTP/1.1 200 OK\n]
            [HTTP/1.1 200 OK\n]
            [Severity level: Chat]
            [Group: Sequence]
        Response Version: HTTP/1.1
        Status Code: 200
        [Status Code Description: OK]
        Response Phrase: OK
    Content-Type: text/plain\n
    Content-Length: 13\n
        [Content length: 13]
    \n
    [HTTP response 1/1]
    [Time since request: 0.000000000 seconds]
    [Request in frame: 8]
    [Request URI: http://localhost:8080/]
    File Data: 13 bytes
Line-based text data: text/plain (1 lines)

Frame 10: 225 bytes on wire (1800 bits), 225 bytes captured (1800 bits)
Ethernet II, Src: Send_00 (20:53:45:4e:44:00), Dst: Receive_00 (20:52:45:43:56:00)
Internet Protocol Version 6, Src: fe80::4, Dst: fe80::5
Transmission Control Protocol, Src Port: 0, Dst Port: 7114, Seq: 625, Ack: 570, Len: 151
Zilla Frame
    Frame Type ID: 0x00000003
    Frame Type: END
    Protocol Type ID: 0x8ab62046
    Protocol Type: http
    Worker: 0
    Offset: 0x00000420
    Origin ID: 0x000000090000000b
    Origin Namespace: example
    Origin Binding: north_tcp_server
    Routed ID: 0x000000090000000d
    Routed Namespace: example
    Routed Binding: north_http_server
    Stream ID: 0x0000000000000005
    Initial ID: 0x0000000000000005
    Reply ID: 0x0000000000000004
    Direction: INI
    Sequence: 701
    Acknowledge: 702
    Maximum: 7777
    Timestamp: 0x0000000000000008
    Trace ID: 0x0000000000000003
    Authorization: 0x0000000000000000

Frame 11: 225 bytes on wire (1800 bits), 225 bytes captured (1800 bits)
Ethernet II, Src: Send_00 (20:53:45:4e:44:00), Dst: Receive_00 (20:52:45:43:56:00)
Internet Protocol Version 6, Src: fe80::5, Dst: fe80::4
Transmission Control Protocol, Src Port: 7114, Dst Port: 0, Seq: 570, Ack: 776, Len: 151
Zilla Frame
    Frame Type ID: 0x00000003
    Frame Type: END
    Protocol Type ID: 0x8ab62046
    Protocol Type: http
    Worker: 0
    Offset: 0x00000470
    Origin ID: 0x000000090000000b
    Origin Namespace: example
    Origin Binding: north_tcp_server
    Routed ID: 0x000000090000000d
    Routed Namespace: example
    Routed Binding: north_http_server
    Stream ID: 0x0000000000000004
    Initial ID: 0x0000000000000005
    Reply ID: 0x0000000000000004
    Direction: REP
    Sequence: 703
    Acknowledge: 704
    Maximum: 4444
    Timestamp: 0x0000000000000009
    Trace ID: 0x0000000000000003
    Authorization: 0x0000000000000000

