Frame 1: 186 bytes on wire (1488 bits), 186 bytes captured (1488 bits)
Ethernet II, Src: Send_00 (20:53:45:4e:44:00), Dst: Receive_00 (20:52:45:43:56:00)
Internet Protocol Version 6, Src: fe80::1, Dst: fe80::
Transmission Control Protocol, Src Port: 7114, Dst Port: 0, Seq: 1, Ack: 1, Len: 112
Zilla Frame
    Frame Type ID: 0x00000001
    Frame Type: BEGIN
    Protocol Type ID: 0x00000000
    Protocol Type: 
    Worker: 0
    Offset: 0x00000000
    Origin ID: 0x0000000000000000
    Routed ID: 0x0000000000000000
    Stream ID: 0x0000000000000000
    Direction: 
    Sequence: 0
    Acknowledge: 0
    Maximum: 0
    Timestamp: 0x0000000000000000
    Trace ID: 0x0000000000000000
    Authorization: 0x0000000000000000
    Affinity: 0x0000000000000000

Frame 2: 190 bytes on wire (1520 bits), 190 bytes captured (1520 bits)
Ethernet II, Src: Send_00 (20:53:45:4e:44:00), Dst: Receive_00 (20:52:45:43:56:00)
Internet Protocol Version 6, Src: fe80::, Dst: fe80::1
Transmission Control Protocol, Src Port: 0, Dst Port: 7114, Seq: 0, Ack: 113, Len: 116
Zilla Frame
    Frame Type ID: 0x00000001
    Frame Type: BEGIN
    Protocol Type ID: 0x00000000
    Protocol Type: 
    Worker: 0
    Offset: 0x00000058
    Origin ID: 0x0000000000000000
    Routed ID: 0x0000000000000001
    Routed Binding: test
    Stream ID: 0x0000000000000001
    Initial ID: 0x0000000000000001
    Reply ID: 0x0000000000000000
    Direction: INI
    Sequence: 1
    Acknowledge: 0
    Maximum: 0
    Timestamp: 0x0000000000000000
    Trace ID: 0x0000000000000000
    Authorization: 0x0000000000000000
    Affinity: 0x0000000000000000

Frame 3: 196 bytes on wire (1568 bits), 196 bytes captured (1568 bits)
Ethernet II, Src: Send_00 (20:53:45:4e:44:00), Dst: Receive_00 (20:52:45:43:56:00)
Internet Protocol Version 6, Src: fe80::5, Dst: fe80::4
Transmission Control Protocol, Src Port: 7114, Dst Port: 0, Seq: 1, Ack: 1, Len: 122
Zilla Frame
    Frame Type ID: 0x00000001
    Frame Type: BEGIN
    Protocol Type ID: 0x00000000
    Protocol Type: 
    Worker: 0
    Offset: 0x000000b0
    Origin ID: 0x0000000000000000
    Routed ID: 0x0000000100000002
    Routed Namespace: test
    Routed Binding: kafka0
    Stream ID: 0x0000000000000004
    Initial ID: 0x0000000000000005
    Reply ID: 0x0000000000000004
    Direction: REP
    Sequence: 4
    Acknowledge: 0
    Maximum: 0
    Timestamp: 0x0000000000000000
    Trace ID: 0x0000000000000000
    Authorization: 0x0000000000000000
    Affinity: 0x0000000000000000

Frame 4: 195 bytes on wire (1560 bits), 195 bytes captured (1560 bits)
Ethernet II, Src: Send_00 (20:53:45:4e:44:00), Dst: Receive_00 (20:52:45:43:56:00)
Internet Protocol Version 6, Src: fe80::1, Dst: fe80::
Transmission Control Protocol, Src Port: 7114, Dst Port: 0, Seq: 113, Ack: 116, Len: 121
Zilla Frame
    Frame Type ID: 0x40000002
    Frame Type: WINDOW
    Protocol Type ID: 0x00000000
    Protocol Type: 
    Worker: 0
    Offset: 0x00000108
    Origin ID: 0x0000000000000000
    Routed ID: 0x0000000000000000
    Stream ID: 0x0000000000000000
    Direction: 
    Sequence: 0
    Acknowledge: 0
    Maximum: 0
    Timestamp: 0x0000000000000000
    Trace ID: 0x0000000000000000
    Authorization: 0x0000000000000000
    Budget ID: 0x0000000000000000
    Padding: 0
    Minimum: 0
    Capabilities: 0x00
    Progress: 0
    Progress/Maximum: 0/0

Frame 5: 199 bytes on wire (1592 bits), 199 bytes captured (1592 bits)
Ethernet II, Src: Send_00 (20:53:45:4e:44:00), Dst: Receive_00 (20:52:45:43:56:00)
Internet Protocol Version 6, Src: fe80::, Dst: fe80::1
Transmission Control Protocol, Src Port: 0, Dst Port: 7114, Seq: 116, Ack: 234, Len: 125
Zilla Frame
    Frame Type ID: 0x40000002
    Frame Type: WINDOW
    Protocol Type ID: 0x00000000
    Protocol Type: 
    Worker: 0
    Offset: 0x00000168
    Origin ID: 0x0000000000000000
    Routed ID: 0x0000000000000001
    Routed Binding: test
    Stream ID: 0x0000000000000001
    Initial ID: 0x0000000000000001
    Reply ID: 0x0000000000000000
    Direction: INI
    Sequence: 1
    Acknowledge: 0
    Maximum: 0
    Timestamp: 0x0000000000000000
    Trace ID: 0x0000000000000000
    Authorization: 0x0000000000000000
    Budget ID: 0x0000000000000000
    Padding: 0
    Minimum: 0
    Capabilities: 0x00
    Progress: 1
    Progress/Maximum: 1/0

Frame 6: 325 bytes on wire (2600 bits), 325 bytes captured (2600 bits)
Ethernet II, Src: Send_00 (20:53:45:4e:44:00), Dst: Receive_00 (20:52:45:43:56:00)
Internet Protocol Version 6, Src: fe80::1, Dst: fe80::
Transmission Control Protocol, Src Port: 7114, Dst Port: 0, Seq: 234, Ack: 241, Len: 251
Zilla Frame
    Frame Type ID: 0x00000002
    Frame Type: DATA
    Protocol Type ID: 0x00000000
    Protocol Type: 
    Worker: 0
    Offset: 0x000001c8
    Origin ID: 0x0000000000000000
    Routed ID: 0x0000000000000000
    Stream ID: 0x0000000000000000
    Direction: 
    Sequence: 0
    Acknowledge: 0
    Maximum: 0
    Timestamp: 0x0000000000000000
    Trace ID: 0x0000000000000000
    Authorization: 0x0000000000000000
    Flags: 0x03
        .... ...1 = FIN: Set (1)
        .... ..1. = INIT: Set (1)
        .... .0.. = INCOMPLETE: Not set (0)
        .... 0... = SKIP: Not set (0)
    Budget ID: 0x0000000000000000
    Reserved: 0
    Progress: 0
    Progress/Maximum: 0/0
    Payload
        Length: 130
        Payload

Frame 7: 329 bytes on wire (2632 bits), 329 bytes captured (2632 bits)
Ethernet II, Src: Send_00 (20:53:45:4e:44:00), Dst: Receive_00 (20:52:45:43:56:00)
Internet Protocol Version 6, Src: fe80::, Dst: fe80::1
Transmission Control Protocol, Src Port: 0, Dst Port: 7114, Seq: 241, Ack: 485, Len: 255
Zilla Frame
    Frame Type ID: 0x00000002
    Frame Type: DATA
    Protocol Type ID: 0x00000000
    Protocol Type: 
    Worker: 0
    Offset: 0x000002a8
    Origin ID: 0x0000000000000000
    Routed ID: 0x0000000000000001
    Routed Binding: test
    Stream ID: 0x0000000000000001
    Initial ID: 0x0000000000000001
    Reply ID: 0x0000000000000000
    Direction: INI
    Sequence: 1
    Acknowledge: 0
    Maximum: 0
    Timestamp: 0x0000000000000000
    Trace ID: 0x0000000000000000
    Authorization: 0x0000000000000000
    Flags: 0x03
        .... ...1 = FIN: Set (1)
        .... ..1. = INIT: Set (1)
        .... .0.. = INCOMPLETE: Not set (0)
        .... 0... = SKIP: Not set (0)
    Budget ID: 0x0000000000000000
    Reserved: 0
    Progress: 1
    Progress/Maximum: 1/0
    Payload
        Length: 130
        Payload

Frame 8: 178 bytes on wire (1424 bits), 178 bytes captured (1424 bits)
Ethernet II, Src: Send_00 (20:53:45:4e:44:00), Dst: Receive_00 (20:52:45:43:56:00)
Internet Protocol Version 6, Src: fe80::1, Dst: fe80::
Transmission Control Protocol, Src Port: 7114, Dst Port: 0, Seq: 485, Ack: 496, Len: 104
Zilla Frame
    Frame Type ID: 0x00000003
    Frame Type: END
    Protocol Type ID: 0x00000000
    Protocol Type: 
    Worker: 0
    Offset: 0x00000388
    Origin ID: 0x0000000000000000
    Routed ID: 0x0000000000000000
    Stream ID: 0x0000000000000000
    Direction: 
    Sequence: 0
    Acknowledge: 0
    Maximum: 0
    Timestamp: 0x0000000000000000
    Trace ID: 0x0000000000000000
    Authorization: 0x0000000000000000

Frame 9: 182 bytes on wire (1456 bits), 182 bytes captured (1456 bits)
Ethernet II, Src: Send_00 (20:53:45:4e:44:00), Dst: Receive_00 (20:52:45:43:56:00)
Internet Protocol Version 6, Src: fe80::, Dst: fe80::1
Transmission Control Protocol, Src Port: 0, Dst Port: 7114, Seq: 496, Ack: 589, Len: 108
Zilla Frame
    Frame Type ID: 0x00000003
    Frame Type: END
    Protocol Type ID: 0x00000000
    Protocol Type: 
    Worker: 0
    Offset: 0x000003d8
    Origin ID: 0x0000000000000000
    Routed ID: 0x0000000000000001
    Routed Binding: test
    Stream ID: 0x0000000000000001
    Initial ID: 0x0000000000000001
    Reply ID: 0x0000000000000000
    Direction: INI
    Sequence: 1
    Acknowledge: 0
    Maximum: 0
    Timestamp: 0x0000000000000000
    Trace ID: 0x0000000000000000
    Authorization: 0x0000000000000000

