Frame 1: 250 bytes on wire (2000 bits), 250 bytes captured (2000 bits)
Ethernet II, Src: Send_00 (20:53:45:4e:44:00), Dst: Receive_00 (20:52:45:43:56:00)
Internet Protocol Version 6, Src: fe80::3f3f:0:0:2, Dst: fe80::3f3f:0:0:3
Transmission Control Protocol, Src Port: 0, Dst Port: 7114, Seq: 0, Ack: 1, Len: 176
Zilla Frame
    Frame Type ID: 0x00000001
    Frame Type: BEGIN
    Protocol Type ID: 0x00000000
    Protocol Type: 
    Worker: 0
    Offset: 0x00000000
    Origin ID: 0x0000000100000002
    Origin Namespace: test
    Origin Binding: app0
    Routed ID: 0x0000000100000002
    Routed Namespace: test
    Routed Binding: app0
    Stream ID: 0x3f3f000000000003
    Initial ID: 0x3f3f000000000003
    Reply ID: 0x3f3f000000000002
    Direction: INI
    Sequence: 0
    Acknowledge: 0
    Maximum: 0
    Timestamp: 0x0000000000000000
    Trace ID: 0x8000000000000001
    Authorization: 0x0000000000000000
    Affinity: 0x0000000000000000
    Extension: filesystem
        Stream Type ID: 0x9eaae6e4
        Stream Type: filesystem
        Capabilities: 0x00000002
            .... .... .... .... .... .... .... ...0 = READ_PAYLOAD: Not set (0)
            .... .... .... .... .... .... .... ..1. = READ_EXTENSION: Set (1)
            .... .... .... .... .... .... .... .0.. = READ_CHANGES: Not set (0)
        Path: index.html
            Length: 10
            Path: index.html
        Type: 
            Length: -1
            Type: 
        Payload Size: 0
        Tag: 
            Length: -1
            Tag: 
        Timeout: 0

Frame 2: 211 bytes on wire (1688 bits), 211 bytes captured (1688 bits)
Ethernet II, Src: Send_00 (20:53:45:4e:44:00), Dst: Receive_00 (20:52:45:43:56:00)
Internet Protocol Version 6, Src: fe80::3f3f:0:0:2, Dst: fe80::3f3f:0:0:3
Transmission Control Protocol, Src Port: 0, Dst Port: 7114, Seq: 176, Ack: 1, Len: 137
Zilla Frame
    Frame Type ID: 0x40000002
    Frame Type: WINDOW
    Protocol Type ID: 0x00000000
    Protocol Type: 
    Worker: 0
    Offset: 0x00000088
    Origin ID: 0x0000000100000002
    Origin Namespace: test
    Origin Binding: app0
    Routed ID: 0x0000000100000002
    Routed Namespace: test
    Routed Binding: app0
    Stream ID: 0x3f3f000000000003
    Initial ID: 0x3f3f000000000003
    Reply ID: 0x3f3f000000000002
    Direction: INI
    Sequence: 0
    Acknowledge: 0
    Maximum: 8192
    Timestamp: 0x0000000000000000
    Trace ID: 0x8000000000000002
    Authorization: 0x0000000000000000
    Budget ID: 0x0000000000000000
    Padding: 0
    Minimum: 0
    Capabilities: 0x00
    Progress: 0
    Progress/Maximum: 0/8192

Frame 3: 194 bytes on wire (1552 bits), 194 bytes captured (1552 bits)
Ethernet II, Src: Send_00 (20:53:45:4e:44:00), Dst: Receive_00 (20:52:45:43:56:00)
Internet Protocol Version 6, Src: fe80::3f3f:0:0:2, Dst: fe80::3f3f:0:0:3
Transmission Control Protocol, Src Port: 0, Dst Port: 7114, Seq: 313, Ack: 1, Len: 120
Zilla Frame
    Frame Type ID: 0x00000003
    Frame Type: END
    Protocol Type ID: 0x00000000
    Protocol Type: 
    Worker: 0
    Offset: 0x000000e8
    Origin ID: 0x0000000100000002
    Origin Namespace: test
    Origin Binding: app0
    Routed ID: 0x0000000100000002
    Routed Namespace: test
    Routed Binding: app0
    Stream ID: 0x3f3f000000000003
    Initial ID: 0x3f3f000000000003
    Reply ID: 0x3f3f000000000002
    Direction: INI
    Sequence: 0
    Acknowledge: 0
    Maximum: 8192
    Timestamp: 0x0000000000000000
    Trace ID: 0x8000000000000003
    Authorization: 0x0000000000000000

Frame 4: 259 bytes on wire (2072 bits), 259 bytes captured (2072 bits)
Ethernet II, Src: Send_00 (20:53:45:4e:44:00), Dst: Receive_00 (20:52:45:43:56:00)
Internet Protocol Version 6, Src: fe80::3f3f:0:0:3, Dst: fe80::3f3f:0:0:2
Transmission Control Protocol, Src Port: 7114, Dst Port: 0, Seq: 1, Ack: 433, Len: 185
Zilla Frame
    Frame Type ID: 0x00000001
    Frame Type: BEGIN
    Protocol Type ID: 0x00000000
    Protocol Type: 
    Worker: 0
    Offset: 0x00000138
    Origin ID: 0x0000000100000002
    Origin Namespace: test
    Origin Binding: app0
    Routed ID: 0x0000000100000002
    Routed Namespace: test
    Routed Binding: app0
    Stream ID: 0x3f3f000000000002
    Initial ID: 0x3f3f000000000003
    Reply ID: 0x3f3f000000000002
    Direction: REP
    Sequence: 0
    Acknowledge: 0
    Maximum: 0
    Timestamp: 0x0000000000000000
    Trace ID: 0x8000000000000004
    Authorization: 0x0000000000000000
    Affinity: 0x0000000000000000
    Extension: filesystem
        Stream Type ID: 0x9eaae6e4
        Stream Type: filesystem
        Capabilities: 0x00000002
            .... .... .... .... .... .... .... ...0 = READ_PAYLOAD: Not set (0)
            .... .... .... .... .... .... .... ..1. = READ_EXTENSION: Set (1)
            .... .... .... .... .... .... .... .0.. = READ_CHANGES: Not set (0)
        Path: index.html
            Length: 10
            Path: index.html
        Type: text/html
            Length: 9
            Type: text/html
        Payload Size: 77
        Tag: 
            Length: -1
            Tag: 
        Timeout: 0

Frame 5: 194 bytes on wire (1552 bits), 194 bytes captured (1552 bits)
Ethernet II, Src: Send_00 (20:53:45:4e:44:00), Dst: Receive_00 (20:52:45:43:56:00)
Internet Protocol Version 6, Src: fe80::3f3f:0:0:3, Dst: fe80::3f3f:0:0:2
Transmission Control Protocol, Src Port: 7114, Dst Port: 0, Seq: 186, Ack: 433, Len: 120
Zilla Frame
    Frame Type ID: 0x00000003
    Frame Type: END
    Protocol Type ID: 0x00000000
    Protocol Type: 
    Worker: 0
    Offset: 0x000001c8
    Origin ID: 0x0000000100000002
    Origin Namespace: test
    Origin Binding: app0
    Routed ID: 0x0000000100000002
    Routed Namespace: test
    Routed Binding: app0
    Stream ID: 0x3f3f000000000002
    Initial ID: 0x3f3f000000000003
    Reply ID: 0x3f3f000000000002
    Direction: REP
    Sequence: 0
    Acknowledge: 0
    Maximum: 0
    Timestamp: 0x0000000000000000
    Trace ID: 0x8000000000000005
    Authorization: 0x0000000000000000

Frame 6: 211 bytes on wire (1688 bits), 211 bytes captured (1688 bits)
Ethernet II, Src: Send_00 (20:53:45:4e:44:00), Dst: Receive_00 (20:52:45:43:56:00)
Internet Protocol Version 6, Src: fe80::3f3f:0:0:3, Dst: fe80::3f3f:0:0:2
Transmission Control Protocol, Src Port: 7114, Dst Port: 0, Seq: 306, Ack: 433, Len: 137
Zilla Frame
    Frame Type ID: 0x40000002
    Frame Type: WINDOW
    Protocol Type ID: 0x00000000
    Protocol Type: 
    Worker: 0
    Offset: 0x00000218
    Origin ID: 0x0000000100000002
    Origin Namespace: test
    Origin Binding: app0
    Routed ID: 0x0000000100000002
    Routed Namespace: test
    Routed Binding: app0
    Stream ID: 0x3f3f000000000002
    Initial ID: 0x3f3f000000000003
    Reply ID: 0x3f3f000000000002
    Direction: REP
    Sequence: 0
    Acknowledge: 0
    Maximum: 8192
    Timestamp: 0x0000000000000000
    Trace ID: 0x8000000000000006
    Authorization: 0x0000000000000000
    Budget ID: 0x0000000000000000
    Padding: 0
    Minimum: 0
    Capabilities: 0x00
    Progress: 0
    Progress/Maximum: 0/8192

