Frame 1: 198 bytes on wire (1584 bits), 198 bytes captured (1584 bits)
Ethernet II, Src: Send_00 (20:53:45:4e:44:00), Dst: Receive_00 (20:52:45:43:56:00)
Internet Protocol Version 6, Src: fe80::1, Dst: fe80::
Transmission Control Protocol, Src Port: 7114, Dst Port: 0, Seq: 1, Ack: 1, Len: 124
Zilla Frame
    Frame Type ID: 0x40000003
    Frame Type: SIGNAL
    Protocol Type ID: 0x00000000
    Protocol Type: 
    Worker: 0
    Offset: 0x00000000
    Origin ID: 0x0000000000000000
    Routed ID: 0x0000000000000000
    Stream ID: 0x0000000000000000
    Direction: 
    Sequence: 0
    Acknowledge: 0
    Maximum: 0
    Timestamp: 0x0000000000000000
    Trace ID: 0x0000000000000001
    Authorization: 0x0000000000000000
    Cancel ID: 0xffffffffffffffff
    Signal ID: 0x00000001
    Context ID: 0x00000000
    Payload
        Length: -1

Frame 2: 211 bytes on wire (1688 bits), 211 bytes captured (1688 bits)
Ethernet II, Src: Send_00 (20:53:45:4e:44:00), Dst: Receive_00 (20:52:45:43:56:00)
Internet Protocol Version 6, Src: fe80::1:3f00:0:0:2, Dst: fe80::1:3f00:0:0:3
Transmission Control Protocol, Src Port: 0, Dst Port: 7114, Seq: 1, Ack: 1, Len: 137
Zilla Frame
    Frame Type ID: 0x40000002
    Frame Type: WINDOW
    Protocol Type ID: 0x8ab62046
    Protocol Type: http
    Worker: 1
    Offset: 0x00000000
    Origin ID: 0x0000000100000009
    Origin Namespace: test
    Origin Binding: net0
    Routed ID: 0x0000000100000009
    Routed Namespace: test
    Routed Binding: net0
    Stream ID: 0x3f00000000000003
    Initial ID: 0x3f00000000000003
    Reply ID: 0x3f00000000000002
    Direction: INI
    Sequence: 0
    Acknowledge: 0
    Maximum: 65536
    Timestamp: 0x0000000000000000
    Trace ID: 0x8000000000000001
    Authorization: 0x0000000000000000
    Budget ID: 0x0000000000000000
    Padding: 0
    Minimum: 0
    Capabilities: 0x00
    Progress: 0
    Progress/Maximum: 0/65536

Frame 3: 225 bytes on wire (1800 bits), 225 bytes captured (1800 bits)
Ethernet II, Src: Send_00 (20:53:45:4e:44:00), Dst: Receive_00 (20:52:45:43:56:00)
Internet Protocol Version 6, Src: fe80::3f00:0:0:2, Dst: fe80::3f00:0:0:3
Transmission Control Protocol, Src Port: 0, Dst Port: 7114, Seq: 0, Ack: 1, Len: 151
Zilla Frame
    Frame Type ID: 0x00000001
    Frame Type: BEGIN
    Protocol Type ID: 0x8ab62046
    Protocol Type: http
    Worker: 0
    Offset: 0x00000060
    Origin ID: 0x0000000100000009
    Origin Namespace: test
    Origin Binding: net0
    Routed ID: 0x0000000100000009
    Routed Namespace: test
    Routed Binding: net0
    Stream ID: 0x3f00000000000003
    Initial ID: 0x3f00000000000003
    Reply ID: 0x3f00000000000002
    Direction: INI
    Sequence: 0
    Acknowledge: 0
    Maximum: 0
    Timestamp: 0x0000000000000000
    Trace ID: 0x8000000000000001
    Authorization: 0x0000000000000000
    Affinity: 0x0000000000000000
    Extension: proxy
        Stream Type ID: 0x50a8ce8d
        Stream Type: proxy
        Address: NONE
            Family: NONE (4)
        Info (1 items)
            Length: 14
            Size: 1
        Info: SECURE: VERSION: TLSv1.3
            Type: SECURE (0x20)
            Secure Type: VERSION (0x21)
            Length: 7
            Value: TLSv1.3

Frame 4: 202 bytes on wire (1616 bits), 202 bytes captured (1616 bits)
Ethernet II, Src: Send_00 (20:53:45:4e:44:00), Dst: Receive_00 (20:52:45:43:56:00)
Internet Protocol Version 6, Src: fe80::1:3f00:0:0:3, Dst: fe80::1:3f00:0:0:2
Transmission Control Protocol, Src Port: 7114, Dst Port: 0, Seq: 1, Ack: 138, Len: 128
Zilla Frame
    Frame Type ID: 0x00000001
    Frame Type: BEGIN
    Protocol Type ID: 0x8ab62046
    Protocol Type: http
    Worker: 1
    Offset: 0x00000060
    Origin ID: 0x0000000100000009
    Origin Namespace: test
    Origin Binding: net0
    Routed ID: 0x0000000100000009
    Routed Namespace: test
    Routed Binding: net0
    Stream ID: 0x3f00000000000002
    Initial ID: 0x3f00000000000003
    Reply ID: 0x3f00000000000002
    Direction: REP
    Sequence: 0
    Acknowledge: 0
    Maximum: 0
    Timestamp: 0x0000000000000000
    Trace ID: 0x8000000000000001
    Authorization: 0x0000000000000000
    Affinity: 0x0000000000000000

Frame 5: 211 bytes on wire (1688 bits), 211 bytes captured (1688 bits)
Ethernet II, Src: Send_00 (20:53:45:4e:44:00), Dst: Receive_00 (20:52:45:43:56:00)
Internet Protocol Version 6, Src: fe80::3f00:0:0:3, Dst: fe80::3f00:0:0:2
Transmission Control Protocol, Src Port: 7114, Dst Port: 0, Seq: 1, Ack: 151, Len: 137
Zilla Frame
    Frame Type ID: 0x40000002
    Frame Type: WINDOW
    Protocol Type ID: 0x8ab62046
    Protocol Type: http
    Worker: 0
    Offset: 0x000000d0
    Origin ID: 0x0000000100000009
    Origin Namespace: test
    Origin Binding: net0
    Routed ID: 0x0000000100000009
    Routed Namespace: test
    Routed Binding: net0
    Stream ID: 0x3f00000000000002
    Initial ID: 0x3f00000000000003
    Reply ID: 0x3f00000000000002
    Direction: REP
    Sequence: 0
    Acknowledge: 0
    Maximum: 8192
    Timestamp: 0x0000000000000000
    Trace ID: 0x8000000000000002
    Authorization: 0x0000000000000000
    Budget ID: 0x0000000000000000
    Padding: 0
    Minimum: 0
    Capabilities: 0x00
    Progress: 0
    Progress/Maximum: 0/8192

Frame 6: 308 bytes on wire (2464 bits), 308 bytes captured (2464 bits)
Ethernet II, Src: Send_00 (20:53:45:4e:44:00), Dst: Receive_00 (20:52:45:43:56:00)
Internet Protocol Version 6, Src: fe80::1:3f:0:0:2, Dst: fe80::1:3f:0:0:3
Transmission Control Protocol, Src Port: 0, Dst Port: 7114, Seq: 0, Ack: 1, Len: 234
Zilla Frame
    Frame Type ID: 0x00000001
    Frame Type: BEGIN
    Protocol Type ID: 0x00000000
    Protocol Type: 
    Worker: 1
    Offset: 0x000000b8
    Origin ID: 0x0000000100000009
    Origin Namespace: test
    Origin Binding: net0
    Routed ID: 0x0000000100000002
    Routed Namespace: test
    Routed Binding: app0
    Stream ID: 0x003f000000000003
    Initial ID: 0x003f000000000003
    Reply ID: 0x003f000000000002
    Direction: INI
    Sequence: 71
    Acknowledge: 71
    Maximum: 0
    Timestamp: 0x0000000000000000
    Trace ID: 0x8000000000000003
    Authorization: 0x0000000000000001
    Affinity: 0x0000000000000000
    Extension: http
        Stream Type ID: 0x4620b68a
        Stream Type: http
        Headers (5 items)
            Length: 98
            Size: 5
        Header: :scheme: https
            Length: 7
            Name: :scheme
            Length: 5
            Value: https
        Header: :method: GET
            Length: 7
            Name: :method
            Length: 3
            Value: GET
        Header: :path: /
            Length: 5
            Name: :path
            Length: 1
            Value: /
        Header: :authority: example.com:9090
            Length: 10
            Name: :authority
            Length: 16
            Value: example.com:9090
        Header: authorization: Bearer TOKEN
            Length: 13
            Name: authorization
            Length: 12
            Value: Bearer TOKEN

Frame 7: 282 bytes on wire (2256 bits), 282 bytes captured (2256 bits)
Ethernet II, Src: Send_00 (20:53:45:4e:44:00), Dst: Receive_00 (20:52:45:43:56:00)
Internet Protocol Version 6, Src: fe80::3f00:0:0:2, Dst: fe80::3f00:0:0:3
Transmission Control Protocol, Src Port: 0, Dst Port: 7114, Seq: 151, Ack: 138, Len: 208
Zilla Frame
    Frame Type ID: 0x00000002
    Frame Type: DATA
    Protocol Type ID: 0x8ab62046
    Protocol Type: http
    Worker: 0
    Offset: 0x00000130
    Origin ID: 0x0000000100000009
    Origin Namespace: test
    Origin Binding: net0
    Routed ID: 0x0000000100000009
    Routed Namespace: test
    Routed Binding: net0
    Stream ID: 0x3f00000000000003
    Initial ID: 0x3f00000000000003
    Reply ID: 0x3f00000000000002
    Direction: INI
    Sequence: 0
    Acknowledge: 0
    Maximum: 65536
    Timestamp: 0x0000000000000000
    Trace ID: 0x8000000000000003
    Authorization: 0x0000000000000000
    Flags: 0x03
        .... ...1 = FIN: Set (1)
        .... ..1. = INIT: Set (1)
        .... .0.. = INCOMPLETE: Not set (0)
        .... 0... = SKIP: Not set (0)
    Budget ID: 0x0000000000000000
    Reserved: 71
    Progress: 71
    Progress/Maximum: 71/65536
    Payload
        Length: 71
        Payload
Hypertext Transfer Protocol

Frame 8: 211 bytes on wire (1688 bits), 211 bytes captured (1688 bits)
Ethernet II, Src: Send_00 (20:53:45:4e:44:00), Dst: Receive_00 (20:52:45:43:56:00)
Internet Protocol Version 6, Src: fe80::1:3f:0:0:3, Dst: fe80::1:3f:0:0:2
Transmission Control Protocol, Src Port: 7114, Dst Port: 0, Seq: 1, Ack: 234, Len: 137
Zilla Frame
    Frame Type ID: 0x40000002
    Frame Type: WINDOW
    Protocol Type ID: 0x00000000
    Protocol Type: 
    Worker: 1
    Offset: 0x00000178
    Origin ID: 0x0000000100000009
    Origin Namespace: test
    Origin Binding: net0
    Routed ID: 0x0000000100000002
    Routed Namespace: test
    Routed Binding: app0
    Stream ID: 0x003f000000000002
    Initial ID: 0x003f000000000003
    Reply ID: 0x003f000000000002
    Direction: REP
    Sequence: 0
    Acknowledge: 0
    Maximum: 8192
    Timestamp: 0x0000000000000000
    Trace ID: 0x8000000000000003
    Authorization: 0x0000000000000001
    Budget ID: 0x0000000000000000
    Padding: 10
    Minimum: 0
    Capabilities: 0x00
    Progress: 0
    Progress/Maximum: 0/8192

Frame 9: 194 bytes on wire (1552 bits), 194 bytes captured (1552 bits)
Ethernet II, Src: Send_00 (20:53:45:4e:44:00), Dst: Receive_00 (20:52:45:43:56:00)
Internet Protocol Version 6, Src: fe80::3f00:0:0:2, Dst: fe80::3f00:0:0:3
Transmission Control Protocol, Src Port: 0, Dst Port: 7114, Seq: 359, Ack: 138, Len: 120
Zilla Frame
    Frame Type ID: 0x00000003
    Frame Type: END
    Protocol Type ID: 0x8ab62046
    Protocol Type: http
    Worker: 0
    Offset: 0x000001d8
    Origin ID: 0x0000000100000009
    Origin Namespace: test
    Origin Binding: net0
    Routed ID: 0x0000000100000009
    Routed Namespace: test
    Routed Binding: net0
    Stream ID: 0x3f00000000000003
    Initial ID: 0x3f00000000000003
    Reply ID: 0x3f00000000000002
    Direction: INI
    Sequence: 71
    Acknowledge: 0
    Maximum: 65536
    Timestamp: 0x0000000000000000
    Trace ID: 0x8000000000000004
    Authorization: 0x0000000000000000

Frame 10: 194 bytes on wire (1552 bits), 194 bytes captured (1552 bits)
Ethernet II, Src: Send_00 (20:53:45:4e:44:00), Dst: Receive_00 (20:52:45:43:56:00)
Internet Protocol Version 6, Src: fe80::1:3f:0:0:2, Dst: fe80::1:3f:0:0:3
Transmission Control Protocol, Src Port: 0, Dst Port: 7114, Seq: 234, Ack: 138, Len: 120
Zilla Frame
    Frame Type ID: 0x00000003
    Frame Type: END
    Protocol Type ID: 0x00000000
    Protocol Type: 
    Worker: 1
    Offset: 0x000001d8
    Origin ID: 0x0000000100000009
    Origin Namespace: test
    Origin Binding: net0
    Routed ID: 0x0000000100000002
    Routed Namespace: test
    Routed Binding: app0
    Stream ID: 0x003f000000000003
    Initial ID: 0x003f000000000003
    Reply ID: 0x003f000000000002
    Direction: INI
    Sequence: 71
    Acknowledge: 71
    Maximum: 8192
    Timestamp: 0x0000000000000000
    Trace ID: 0x8000000000000005
    Authorization: 0x0000000000000000

Frame 11: 211 bytes on wire (1688 bits), 211 bytes captured (1688 bits)
Ethernet II, Src: Send_00 (20:53:45:4e:44:00), Dst: Receive_00 (20:52:45:43:56:00)
Internet Protocol Version 6, Src: fe80::3f:0:0:2, Dst: fe80::3f:0:0:3
Transmission Control Protocol, Src Port: 0, Dst Port: 7114, Seq: 1, Ack: 1, Len: 137
Zilla Frame
    Frame Type ID: 0x40000002
    Frame Type: WINDOW
    Protocol Type ID: 0x00000000
    Protocol Type: 
    Worker: 0
    Offset: 0x00000228
    Origin ID: 0x0000000100000009
    Origin Namespace: test
    Origin Binding: net0
    Routed ID: 0x0000000100000002
    Routed Namespace: test
    Routed Binding: app0
    Stream ID: 0x003f000000000003
    Initial ID: 0x003f000000000003
    Reply ID: 0x003f000000000002
    Direction: INI
    Sequence: 71
    Acknowledge: 71
    Maximum: 8192
    Timestamp: 0x0000000000000000
    Trace ID: 0x8000000000000005
    Authorization: 0x0000000000000000
    Budget ID: 0x0000000000000000
    Padding: 0
    Minimum: 0
    Capabilities: 0x01
    Progress: 0
    Progress/Maximum: 0/8192

Frame 12: 334 bytes on wire (2672 bits), 334 bytes captured (2672 bits)
Ethernet II, Src: Send_00 (20:53:45:4e:44:00), Dst: Receive_00 (20:52:45:43:56:00)
Internet Protocol Version 6, Src: fe80::1:3f00:0:0:3, Dst: fe80::1:3f00:0:0:2
Transmission Control Protocol, Src Port: 7114, Dst Port: 0, Seq: 129, Ack: 138, Len: 260
Zilla Frame
    Frame Type ID: 0x00000002
    Frame Type: DATA
    Protocol Type ID: 0x8ab62046
    Protocol Type: http
    Worker: 1
    Offset: 0x00000228
    Origin ID: 0x0000000100000009
    Origin Namespace: test
    Origin Binding: net0
    Routed ID: 0x0000000100000009
    Routed Namespace: test
    Routed Binding: net0
    Stream ID: 0x3f00000000000002
    Initial ID: 0x3f00000000000003
    Reply ID: 0x3f00000000000002
    Direction: REP
    Sequence: 0
    Acknowledge: 0
    Maximum: 8192
    Timestamp: 0x0000000000000000
    Trace ID: 0x8000000000000006
    Authorization: 0x0000000000000001
    Flags: 0x03
        .... ...1 = FIN: Set (1)
        .... ..1. = INIT: Set (1)
        .... .0.. = INCOMPLETE: Not set (0)
        .... 0... = SKIP: Not set (0)
    Budget ID: 0x0000000000000000
    Reserved: 123
    Progress: 123
    Progress/Maximum: 123/8192
    Payload
        Length: 123
        Payload
Hypertext Transfer Protocol

Frame 13: 194 bytes on wire (1552 bits), 194 bytes captured (1552 bits)
Ethernet II, Src: Send_00 (20:53:45:4e:44:00), Dst: Receive_00 (20:52:45:43:56:00)
Internet Protocol Version 6, Src: fe80::3f:0:0:2, Dst: fe80::3f:0:0:3
Transmission Control Protocol, Src Port: 0, Dst Port: 7114, Seq: 138, Ack: 1, Len: 120
Zilla Frame
    Frame Type ID: 0x40000001
    Frame Type: RESET
    Protocol Type ID: 0x00000000
    Protocol Type: 
    Worker: 0
    Offset: 0x00000288
    Origin ID: 0x0000000100000009
    Origin Namespace: test
    Origin Binding: net0
    Routed ID: 0x0000000100000002
    Routed Namespace: test
    Routed Binding: app0
    Stream ID: 0x003f000000000003
    Initial ID: 0x003f000000000003
    Reply ID: 0x003f000000000002
    Direction: INI
    Sequence: 71
    Acknowledge: 71
    Maximum: 8192
    Timestamp: 0x0000000000000000
    Trace ID: 0x8000000000000005
    Authorization: 0x0000000000000000

Frame 14: 230 bytes on wire (1840 bits), 230 bytes captured (1840 bits)
Ethernet II, Src: Send_00 (20:53:45:4e:44:00), Dst: Receive_00 (20:52:45:43:56:00)
Internet Protocol Version 6, Src: fe80::1:3f00:0:0:3, Dst: fe80::1:3f00:0:0:2
Transmission Control Protocol, Src Port: 7114, Dst Port: 0, Seq: 389, Ack: 138, Len: 156
Zilla Frame
    Frame Type ID: 0x00000002
    Frame Type: DATA
    Protocol Type ID: 0x8ab62046
    Protocol Type: http
    Worker: 1
    Offset: 0x00000300
    Origin ID: 0x0000000100000009
    Origin Namespace: test
    Origin Binding: net0
    Routed ID: 0x0000000100000009
    Routed Namespace: test
    Routed Binding: net0
    Stream ID: 0x3f00000000000002
    Initial ID: 0x3f00000000000003
    Reply ID: 0x3f00000000000002
    Direction: REP
    Sequence: 123
    Acknowledge: 0
    Maximum: 8192
    Timestamp: 0x0000000000000000
    Trace ID: 0x8000000000000007
    Authorization: 0x0000000000000000
    Flags: 0x03
        .... ...1 = FIN: Set (1)
        .... ..1. = INIT: Set (1)
        .... .0.. = INCOMPLETE: Not set (0)
        .... 0... = SKIP: Not set (0)
    Budget ID: 0x0000000000000000
    Reserved: 19
    Progress: 142
    Progress/Maximum: 142/8192
    Payload
        Length: 19
        Payload

Frame 15: 327 bytes on wire (2616 bits), 327 bytes captured (2616 bits)
Ethernet II, Src: Send_00 (20:53:45:4e:44:00), Dst: Receive_00 (20:52:45:43:56:00)
Internet Protocol Version 6, Src: fe80::3f:0:0:3, Dst: fe80::3f:0:0:2
Transmission Control Protocol, Src Port: 7114, Dst Port: 0, Seq: 1, Ack: 258, Len: 253
Zilla Frame
    Frame Type ID: 0x00000001
    Frame Type: BEGIN
    Protocol Type ID: 0x00000000
    Protocol Type: 
    Worker: 0
    Offset: 0x000002d8
    Origin ID: 0x0000000100000009
    Origin Namespace: test
    Origin Binding: net0
    Routed ID: 0x0000000100000002
    Routed Namespace: test
    Routed Binding: app0
    Stream ID: 0x003f000000000002
    Initial ID: 0x003f000000000003
    Reply ID: 0x003f000000000002
    Direction: REP
    Sequence: 0
    Acknowledge: 0
    Maximum: 8192
    Timestamp: 0x0000000000000000
    Trace ID: 0x8000000000000006
    Authorization: 0x0000000000000000
    Affinity: 0x0000000000000000
    Extension: http
        Stream Type ID: 0x4620b68a
        Stream Type: http
        Headers (5 items)
            Length: 117
            Size: 5
        Header: :status: 200
            Length: 7
            Name: :status
            Length: 3
            Value: 200
        Header: server: Zilla
            Length: 6
            Name: server
            Length: 5
            Value: Zilla
        Header: date: Tue, 02 Feb 2022 22:22:22 GMT
            Length: 4
            Name: date
            Length: 29
            Value: Tue, 02 Feb 2022 22:22:22 GMT
        Header: content-type: text/event-stream
            Length: 12
            Name: content-type
            Length: 17
            Value: text/event-stream
        Header: connection: close
            Length: 10
            Name: connection
            Length: 5
            Value: close

Frame 16: 211 bytes on wire (1688 bits), 211 bytes captured (1688 bits)
Ethernet II, Src: Send_00 (20:53:45:4e:44:00), Dst: Receive_00 (20:52:45:43:56:00)
Internet Protocol Version 6, Src: fe80::1:3f:0:0:3, Dst: fe80::1:3f:0:0:2
Transmission Control Protocol, Src Port: 7114, Dst Port: 0, Seq: 138, Ack: 354, Len: 137
Zilla Frame
    Frame Type ID: 0x40000002
    Frame Type: WINDOW
    Protocol Type ID: 0x00000000
    Protocol Type: 
    Worker: 1
    Offset: 0x00000370
    Origin ID: 0x0000000100000009
    Origin Namespace: test
    Origin Binding: net0
    Routed ID: 0x0000000100000002
    Routed Namespace: test
    Routed Binding: app0
    Stream ID: 0x003f000000000002
    Initial ID: 0x003f000000000003
    Reply ID: 0x003f000000000002
    Direction: REP
    Sequence: 29
    Acknowledge: 10
    Maximum: 8192
    Timestamp: 0x0000000000000000
    Trace ID: 0x8000000000000008
    Authorization: 0x0000000000000001
    Budget ID: 0x0000000000000000
    Padding: 0
    Minimum: 0
    Capabilities: 0x00
    Progress: 19
    Progress/Maximum: 19/8192

Frame 17: 230 bytes on wire (1840 bits), 230 bytes captured (1840 bits)
Ethernet II, Src: Send_00 (20:53:45:4e:44:00), Dst: Receive_00 (20:52:45:43:56:00)
Internet Protocol Version 6, Src: fe80::3f:0:0:3, Dst: fe80::3f:0:0:2
Transmission Control Protocol, Src Port: 7114, Dst Port: 0, Seq: 254, Ack: 258, Len: 156
Zilla Frame
    Frame Type ID: 0x00000002
    Frame Type: DATA
    Protocol Type ID: 0x00000000
    Protocol Type: 
    Worker: 0
    Offset: 0x000003b0
    Origin ID: 0x0000000100000009
    Origin Namespace: test
    Origin Binding: net0
    Routed ID: 0x0000000100000002
    Routed Namespace: test
    Routed Binding: app0
    Stream ID: 0x003f000000000002
    Initial ID: 0x003f000000000003
    Reply ID: 0x003f000000000002
    Direction: REP
    Sequence: 0
    Acknowledge: 0
    Maximum: 8192
    Timestamp: 0x0000000000000000
    Trace ID: 0x8000000000000007
    Authorization: 0x0000000000000000
    Flags: 0x03
        .... ...1 = FIN: Set (1)
        .... ..1. = INIT: Set (1)
        .... .0.. = INCOMPLETE: Not set (0)
        .... 0... = SKIP: Not set (0)
    Budget ID: 0x0000000000000000
    Reserved: 29
    Progress: 29
    Progress/Maximum: 29/8192
    Payload
        Length: 19
        Payload

Frame 18: 211 bytes on wire (1688 bits), 211 bytes captured (1688 bits)
Ethernet II, Src: Send_00 (20:53:45:4e:44:00), Dst: Receive_00 (20:52:45:43:56:00)
Internet Protocol Version 6, Src: fe80::1:3f:0:0:3, Dst: fe80::1:3f:0:0:2
Transmission Control Protocol, Src Port: 7114, Dst Port: 0, Seq: 275, Ack: 354, Len: 137
Zilla Frame
    Frame Type ID: 0x40000002
    Frame Type: WINDOW
    Protocol Type ID: 0x00000000
    Protocol Type: 
    Worker: 1
    Offset: 0x000003d0
    Origin ID: 0x0000000100000009
    Origin Namespace: test
    Origin Binding: net0
    Routed ID: 0x0000000100000002
    Routed Namespace: test
    Routed Binding: app0
    Stream ID: 0x003f000000000002
    Initial ID: 0x003f000000000003
    Reply ID: 0x003f000000000002
    Direction: REP
    Sequence: 29
    Acknowledge: 29
    Maximum: 8192
    Timestamp: 0x0000000000000000
    Trace ID: 0x8000000000000009
    Authorization: 0x0000000000000001
    Budget ID: 0x0000000000000000
    Padding: 0
    Minimum: 0
    Capabilities: 0x00
    Progress: 0
    Progress/Maximum: 0/8192

Frame 19: 211 bytes on wire (1688 bits), 211 bytes captured (1688 bits)
Ethernet II, Src: Send_00 (20:53:45:4e:44:00), Dst: Receive_00 (20:52:45:43:56:00)
Internet Protocol Version 6, Src: fe80::3f00:0:0:3, Dst: fe80::3f00:0:0:2
Transmission Control Protocol, Src Port: 7114, Dst Port: 0, Seq: 138, Ack: 479, Len: 137
Zilla Frame
    Frame Type ID: 0x40000002
    Frame Type: WINDOW
    Protocol Type ID: 0x8ab62046
    Protocol Type: http
    Worker: 0
    Offset: 0x00000420
    Origin ID: 0x0000000100000009
    Origin Namespace: test
    Origin Binding: net0
    Routed ID: 0x0000000100000009
    Routed Namespace: test
    Routed Binding: net0
    Stream ID: 0x3f00000000000002
    Initial ID: 0x3f00000000000003
    Reply ID: 0x3f00000000000002
    Direction: REP
    Sequence: 123
    Acknowledge: 123
    Maximum: 8192
    Timestamp: 0x0000000000000000
    Trace ID: 0x8000000000000008
    Authorization: 0x0000000000000000
    Budget ID: 0x0000000000000000
    Padding: 0
    Minimum: 0
    Capabilities: 0x00
    Progress: 0
    Progress/Maximum: 0/8192

Frame 20: 267 bytes on wire (2136 bits), 267 bytes captured (2136 bits)
Ethernet II, Src: Send_00 (20:53:45:4e:44:00), Dst: Receive_00 (20:52:45:43:56:00)
Internet Protocol Version 6, Src: fe80::1:3f:0:0:3, Dst: fe80::1:3f:0:0:2
Transmission Control Protocol, Src Port: 7114, Dst Port: 0, Seq: 412, Ack: 354, Len: 193
Zilla Frame
    Frame Type ID: 0x40000004
    Frame Type: CHALLENGE
    Protocol Type ID: 0x00000000
    Protocol Type: 
    Worker: 1
    Offset: 0x00000430
    Origin ID: 0x0000000100000009
    Origin Namespace: test
    Origin Binding: net0
    Routed ID: 0x0000000100000002
    Routed Namespace: test
    Routed Binding: app0
    Stream ID: 0x003f000000000002
    Initial ID: 0x003f000000000003
    Reply ID: 0x003f000000000002
    Direction: REP
    Sequence: 29
    Acknowledge: 29
    Maximum: 8192
    Timestamp: 0x0000000000000000
    Trace ID: 0x8000000000000003
    Authorization: 0x0000000000000001
    Extension: http
        Stream Type ID: 0x4620b68a
        Stream Type: http
        Headers (2 items)
            Length: 65
            Size: 2
        Header: :method: POST
            Length: 7
            Name: :method
            Length: 4
            Value: POST
        Header: content-type: application/x-challenge-response
            Length: 12
            Name: content-type
            Length: 32
            Value: application/x-challenge-response

Frame 21: 211 bytes on wire (1688 bits), 211 bytes captured (1688 bits)
Ethernet II, Src: Send_00 (20:53:45:4e:44:00), Dst: Receive_00 (20:52:45:43:56:00)
Internet Protocol Version 6, Src: fe80::3f00:0:0:3, Dst: fe80::3f00:0:0:2
Transmission Control Protocol, Src Port: 7114, Dst Port: 0, Seq: 275, Ack: 479, Len: 137
Zilla Frame
    Frame Type ID: 0x40000002
    Frame Type: WINDOW
    Protocol Type ID: 0x8ab62046
    Protocol Type: http
    Worker: 0
    Offset: 0x00000480
    Origin ID: 0x0000000100000009
    Origin Namespace: test
    Origin Binding: net0
    Routed ID: 0x0000000100000009
    Routed Namespace: test
    Routed Binding: net0
    Stream ID: 0x3f00000000000002
    Initial ID: 0x3f00000000000003
    Reply ID: 0x3f00000000000002
    Direction: REP
    Sequence: 142
    Acknowledge: 142
    Maximum: 8192
    Timestamp: 0x0000000000000000
    Trace ID: 0x8000000000000009
    Authorization: 0x0000000000000000
    Budget ID: 0x0000000000000000
    Padding: 0
    Minimum: 0
    Capabilities: 0x00
    Progress: 0
    Progress/Maximum: 0/8192

Frame 22: 312 bytes on wire (2496 bits), 312 bytes captured (2496 bits)
Ethernet II, Src: Send_00 (20:53:45:4e:44:00), Dst: Receive_00 (20:52:45:43:56:00)
Internet Protocol Version 6, Src: fe80::1:3f00:0:0:3, Dst: fe80::1:3f00:0:0:2
Transmission Control Protocol, Src Port: 7114, Dst Port: 0, Seq: 545, Ack: 138, Len: 238
Zilla Frame
    Frame Type ID: 0x00000002
    Frame Type: DATA
    Protocol Type ID: 0x8ab62046
    Protocol Type: http
    Worker: 1
    Offset: 0x000004c8
    Origin ID: 0x0000000100000009
    Origin Namespace: test
    Origin Binding: net0
    Routed ID: 0x0000000100000009
    Routed Namespace: test
    Routed Binding: net0
    Stream ID: 0x3f00000000000002
    Initial ID: 0x3f00000000000003
    Reply ID: 0x3f00000000000002
    Direction: REP
    Sequence: 142
    Acknowledge: 142
    Maximum: 8192
    Timestamp: 0x0000000000000000
    Trace ID: 0x800000000000000a
    Authorization: 0x0000000000000000
    Flags: 0x03
        .... ...1 = FIN: Set (1)
        .... ..1. = INIT: Set (1)
        .... .0.. = INCOMPLETE: Not set (0)
        .... 0... = SKIP: Not set (0)
    Budget ID: 0x0000000000000000
    Reserved: 101
    Progress: 101
    Progress/Maximum: 101/8192
    Payload
        Length: 101
        Payload

Frame 23: 214 bytes on wire (1712 bits), 214 bytes captured (1712 bits)
Ethernet II, Src: Send_00 (20:53:45:4e:44:00), Dst: Receive_00 (20:52:45:43:56:00)
Internet Protocol Version 6, Src: fe80::3f00:0:0:3, Dst: fe80::3f00:0:0:2
Transmission Control Protocol, Src Port: 7114, Dst Port: 0, Seq: 412, Ack: 479, Len: 140
Zilla Frame
    Frame Type ID: 0x40000003
    Frame Type: SIGNAL
    Protocol Type ID: 0x00000000
    Protocol Type: 
    Worker: 0
    Offset: 0x000004e0
    Origin ID: 0x0000000100000009
    Origin Namespace: test
    Origin Binding: net0
    Routed ID: 0x0000000100000002
    Routed Namespace: test
    Routed Binding: app0
    Stream ID: 0x3f00000000000002
    Initial ID: 0x3f00000000000003
    Reply ID: 0x3f00000000000002
    Direction: REP
    Sequence: 0
    Acknowledge: 0
    Maximum: 0
    Timestamp: 0x0000000000000000
    Trace ID: 0x8000000000000003
    Authorization: 0x0000000000000000
    Cancel ID: 0xffffffffffffffff
    Signal ID: 0x00000002
    Context ID: 0x00000000
    Payload
        Length: -1

Frame 24: 194 bytes on wire (1552 bits), 194 bytes captured (1552 bits)
Ethernet II, Src: Send_00 (20:53:45:4e:44:00), Dst: Receive_00 (20:52:45:43:56:00)
Internet Protocol Version 6, Src: fe80::1:3f00:0:0:3, Dst: fe80::1:3f00:0:0:2
Transmission Control Protocol, Src Port: 7114, Dst Port: 0, Seq: 783, Ack: 138, Len: 120
Zilla Frame
    Frame Type ID: 0x00000004
    Frame Type: ABORT
    Protocol Type ID: 0x8ab62046
    Protocol Type: http
    Worker: 1
    Offset: 0x00000590
    Origin ID: 0x0000000100000009
    Origin Namespace: test
    Origin Binding: net0
    Routed ID: 0x0000000100000009
    Routed Namespace: test
    Routed Binding: net0
    Stream ID: 0x3f00000000000002
    Initial ID: 0x3f00000000000003
    Reply ID: 0x3f00000000000002
    Direction: REP
    Sequence: 243
    Acknowledge: 142
    Maximum: 8192
    Timestamp: 0x0000000000000000
    Trace ID: 0x800000000000000b
    Authorization: 0x0000000000000000

Frame 25: 312 bytes on wire (2496 bits), 312 bytes captured (2496 bits)
Ethernet II, Src: Send_00 (20:53:45:4e:44:00), Dst: Receive_00 (20:52:45:43:56:00)
Internet Protocol Version 6, Src: fe80::3f:0:0:3, Dst: fe80::3f:0:0:2
Transmission Control Protocol, Src Port: 7114, Dst Port: 0, Seq: 410, Ack: 258, Len: 238
Zilla Frame
    Frame Type ID: 0x00000002
    Frame Type: DATA
    Protocol Type ID: 0x00000000
    Protocol Type: 
    Worker: 0
    Offset: 0x00000540
    Origin ID: 0x0000000100000009
    Origin Namespace: test
    Origin Binding: net0
    Routed ID: 0x0000000100000002
    Routed Namespace: test
    Routed Binding: app0
    Stream ID: 0x003f000000000002
    Initial ID: 0x003f000000000003
    Reply ID: 0x003f000000000002
    Direction: REP
    Sequence: 29
    Acknowledge: 29
    Maximum: 8192
    Timestamp: 0x0000000000000000
    Trace ID: 0x800000000000000a
    Authorization: 0x0000000000000000
    Flags: 0x03
        .... ...1 = FIN: Set (1)
        .... ..1. = INIT: Set (1)
        .... .0.. = INCOMPLETE: Not set (0)
        .... 0... = SKIP: Not set (0)
    Budget ID: 0x0000000000000000
    Reserved: 101
    Progress: 101
    Progress/Maximum: 101/8192
    Payload
        Length: 101
        Payload

Frame 26: 194 bytes on wire (1552 bits), 194 bytes captured (1552 bits)
Ethernet II, Src: Send_00 (20:53:45:4e:44:00), Dst: Receive_00 (20:52:45:43:56:00)
Internet Protocol Version 6, Src: fe80::3f:0:0:3, Dst: fe80::3f:0:0:2
Transmission Control Protocol, Src Port: 7114, Dst Port: 0, Seq: 648, Ack: 258, Len: 120
Zilla Frame
    Frame Type ID: 0x00000004
    Frame Type: ABORT
    Protocol Type ID: 0x00000000
    Protocol Type: 
    Worker: 0
    Offset: 0x00000608
    Origin ID: 0x0000000100000009
    Origin Namespace: test
    Origin Binding: net0
    Routed ID: 0x0000000100000002
    Routed Namespace: test
    Routed Binding: app0
    Stream ID: 0x003f000000000002
    Initial ID: 0x003f000000000003
    Reply ID: 0x003f000000000002
    Direction: REP
    Sequence: 130
    Acknowledge: 29
    Maximum: 8192
    Timestamp: 0x0000000000000000
    Trace ID: 0x800000000000000b
    Authorization: 0x0000000000000000

Frame 27: 211 bytes on wire (1688 bits), 211 bytes captured (1688 bits)
Ethernet II, Src: Send_00 (20:53:45:4e:44:00), Dst: Receive_00 (20:52:45:43:56:00)
Internet Protocol Version 6, Src: fe80::3f00:0:0:3, Dst: fe80::3f00:0:0:2
Transmission Control Protocol, Src Port: 7114, Dst Port: 0, Seq: 552, Ack: 479, Len: 137
Zilla Frame
    Frame Type ID: 0x40000002
    Frame Type: WINDOW
    Protocol Type ID: 0x8ab62046
    Protocol Type: http
    Worker: 0
    Offset: 0x00000658
    Origin ID: 0x0000000100000009
    Origin Namespace: test
    Origin Binding: net0
    Routed ID: 0x0000000100000009
    Routed Namespace: test
    Routed Binding: net0
    Stream ID: 0x3f00000000000002
    Initial ID: 0x3f00000000000003
    Reply ID: 0x3f00000000000002
    Direction: REP
    Sequence: 243
    Acknowledge: 243
    Maximum: 8192
    Timestamp: 0x0000000000000000
    Trace ID: 0x800000000000000c
    Authorization: 0x0000000000000000
    Budget ID: 0x0000000000000000
    Padding: 0
    Minimum: 0
    Capabilities: 0x00
    Progress: 0
    Progress/Maximum: 0/8192

