Frame 1: 202 bytes on wire (1616 bits), 202 bytes captured (1616 bits)
Ethernet II, Src: Send_00 (20:53:45:4e:44:00), Dst: Receive_00 (20:52:45:43:56:00)
Internet Protocol Version 6, Src: fe80::3f3f:0:0:2, Dst: fe80::3f3f:0:0:3
Transmission Control Protocol, Src Port: 0, Dst Port: 7114, Seq: 0, Ack: 1, Len: 128
Zilla Frame
    Frame Type ID: 0x00000001
    Frame Type: BEGIN
    Protocol Type ID: 0x8ab62046
    Protocol Type: http
    Worker: 0
    Offset: 0x00000000
    Origin ID: 0x0000000100000002
    Origin Namespace: test
    Origin Binding: net0
    Routed ID: 0x0000000100000002
    Routed Namespace: test
    Routed Binding: net0
    Stream ID: 0x3f3f000000000003
    Initial ID: 0x3f3f000000000003
    Reply ID: 0x3f3f000000000002
    Direction: INI
    Sequence: 0
    Acknowledge: 0
    Maximum: 0
    Timestamp: 0x0000000000000000
    Trace ID: 0x8000000000000001
    Authorization: 0x0000000000000000
    Affinity: 0x0000000000000000

Frame 2: 202 bytes on wire (1616 bits), 202 bytes captured (1616 bits)
Ethernet II, Src: Send_00 (20:53:45:4e:44:00), Dst: Receive_00 (20:52:45:43:56:00)
Internet Protocol Version 6, Src: fe80::3f3f:0:0:3, Dst: fe80::3f3f:0:0:2
Transmission Control Protocol, Src Port: 7114, Dst Port: 0, Seq: 1, Ack: 128, Len: 128
Zilla Frame
    Frame Type ID: 0x00000001
    Frame Type: BEGIN
    Protocol Type ID: 0x8ab62046
    Protocol Type: http
    Worker: 0
    Offset: 0x00000058
    Origin ID: 0x0000000100000002
    Origin Namespace: test
    Origin Binding: net0
    Routed ID: 0x0000000100000002
    Routed Namespace: test
    Routed Binding: net0
    Stream ID: 0x3f3f000000000002
    Initial ID: 0x3f3f000000000003
    Reply ID: 0x3f3f000000000002
    Direction: REP
    Sequence: 0
    Acknowledge: 0
    Maximum: 0
    Timestamp: 0x0000000000000000
    Trace ID: 0x8000000000000002
    Authorization: 0x0000000000000000
    Affinity: 0x0000000000000000

Frame 3: 211 bytes on wire (1688 bits), 211 bytes captured (1688 bits)
Ethernet II, Src: Send_00 (20:53:45:4e:44:00), Dst: Receive_00 (20:52:45:43:56:00)
Internet Protocol Version 6, Src: fe80::3f3f:0:0:2, Dst: fe80::3f3f:0:0:3
Transmission Control Protocol, Src Port: 0, Dst Port: 7114, Seq: 128, Ack: 129, Len: 137
Zilla Frame
    Frame Type ID: 0x40000002
    Frame Type: WINDOW
    Protocol Type ID: 0x8ab62046
    Protocol Type: http
    Worker: 0
    Offset: 0x000000b0
    Origin ID: 0x0000000100000002
    Origin Namespace: test
    Origin Binding: net0
    Routed ID: 0x0000000100000002
    Routed Namespace: test
    Routed Binding: net0
    Stream ID: 0x3f3f000000000003
    Initial ID: 0x3f3f000000000003
    Reply ID: 0x3f3f000000000002
    Direction: INI
    Sequence: 0
    Acknowledge: 0
    Maximum: 40000
    Timestamp: 0x0000000000000000
    Trace ID: 0x8000000000000003
    Authorization: 0x0000000000000000
    Budget ID: 0x0000000000000000
    Padding: 0
    Minimum: 0
    Capabilities: 0x00
    Progress: 0
    Progress/Maximum: 0/40000

Frame 4: 211 bytes on wire (1688 bits), 211 bytes captured (1688 bits)
Ethernet II, Src: Send_00 (20:53:45:4e:44:00), Dst: Receive_00 (20:52:45:43:56:00)
Internet Protocol Version 6, Src: fe80::3f3f:0:0:3, Dst: fe80::3f3f:0:0:2
Transmission Control Protocol, Src Port: 7114, Dst Port: 0, Seq: 129, Ack: 265, Len: 137
Zilla Frame
    Frame Type ID: 0x40000002
    Frame Type: WINDOW
    Protocol Type ID: 0x8ab62046
    Protocol Type: http
    Worker: 0
    Offset: 0x00000110
    Origin ID: 0x0000000100000002
    Origin Namespace: test
    Origin Binding: net0
    Routed ID: 0x0000000100000002
    Routed Namespace: test
    Routed Binding: net0
    Stream ID: 0x3f3f000000000002
    Initial ID: 0x3f3f000000000003
    Reply ID: 0x3f3f000000000002
    Direction: REP
    Sequence: 0
    Acknowledge: 0
    Maximum: 40000
    Timestamp: 0x0000000000000000
    Trace ID: 0x8000000000000004
    Authorization: 0x0000000000000000
    Budget ID: 0x0000000000000000
    Padding: 0
    Minimum: 0
    Capabilities: 0x00
    Progress: 0
    Progress/Maximum: 0/40000

Frame 5: 235 bytes on wire (1880 bits), 235 bytes captured (1880 bits)
Ethernet II, Src: Send_00 (20:53:45:4e:44:00), Dst: Receive_00 (20:52:45:43:56:00)
Internet Protocol Version 6, Src: fe80::3f3f:0:0:2, Dst: fe80::3f3f:0:0:3
Transmission Control Protocol, Src Port: 0, Dst Port: 7114, Seq: 265, Ack: 266, Len: 161
Zilla Frame
    Frame Type ID: 0x00000002
    Frame Type: DATA
    Protocol Type ID: 0x8ab62046
    Protocol Type: http
    Worker: 0
    Offset: 0x00000170
    Origin ID: 0x0000000100000002
    Origin Namespace: test
    Origin Binding: net0
    Routed ID: 0x0000000100000002
    Routed Namespace: test
    Routed Binding: net0
    Stream ID: 0x3f3f000000000003
    Initial ID: 0x3f3f000000000003
    Reply ID: 0x3f3f000000000002
    Direction: INI
    Sequence: 0
    Acknowledge: 0
    Maximum: 40000
    Timestamp: 0x0000000000000000
    Trace ID: 0x8000000000000005
    Authorization: 0x0000000000000000
    Flags: 0x03
        .... ...1 = FIN: Set (1)
        .... ..1. = INIT: Set (1)
        .... .0.. = INCOMPLETE: Not set (0)
        .... 0... = SKIP: Not set (0)
    Budget ID: 0x0000000000000000
    Reserved: 24
    Progress: 24
    Progress/Maximum: 24/40000
    Payload
        Length: 24
        Payload
HyperText Transfer Protocol 2

Frame 6: 211 bytes on wire (1688 bits), 211 bytes captured (1688 bits)
Ethernet II, Src: Send_00 (20:53:45:4e:44:00), Dst: Receive_00 (20:52:45:43:56:00)
Internet Protocol Version 6, Src: fe80::3f3f:0:0:2, Dst: fe80::3f3f:0:0:3
Transmission Control Protocol, Src Port: 0, Dst Port: 7114, Seq: 426, Ack: 266, Len: 137
Zilla Frame
    Frame Type ID: 0x40000002
    Frame Type: WINDOW
    Protocol Type ID: 0x8ab62046
    Protocol Type: http
    Worker: 0
    Offset: 0x000001e8
    Origin ID: 0x0000000100000002
    Origin Namespace: test
    Origin Binding: net0
    Routed ID: 0x0000000100000002
    Routed Namespace: test
    Routed Binding: net0
    Stream ID: 0x3f3f000000000003
    Initial ID: 0x3f3f000000000003
    Reply ID: 0x3f3f000000000002
    Direction: INI
    Sequence: 24
    Acknowledge: 24
    Maximum: 40000
    Timestamp: 0x0000000000000000
    Trace ID: 0x8000000000000006
    Authorization: 0x0000000000000000
    Budget ID: 0x0000000000000000
    Padding: 0
    Minimum: 0
    Capabilities: 0x00
    Progress: 0
    Progress/Maximum: 0/40000

Frame 7: 238 bytes on wire (1904 bits), 238 bytes captured (1904 bits)
Ethernet II, Src: Send_00 (20:53:45:4e:44:00), Dst: Receive_00 (20:52:45:43:56:00)
Internet Protocol Version 6, Src: fe80::3f3f:0:0:3, Dst: fe80::3f3f:0:0:2
Transmission Control Protocol, Src Port: 7114, Dst Port: 0, Seq: 266, Ack: 563, Len: 164
Zilla Frame
    Frame Type ID: 0x00000002
    Frame Type: DATA
    Protocol Type ID: 0x8ab62046
    Protocol Type: http
    Worker: 0
    Offset: 0x00000248
    Origin ID: 0x0000000100000002
    Origin Namespace: test
    Origin Binding: net0
    Routed ID: 0x0000000100000002
    Routed Namespace: test
    Routed Binding: net0
    Stream ID: 0x3f3f000000000002
    Initial ID: 0x3f3f000000000003
    Reply ID: 0x3f3f000000000002
    Direction: REP
    Sequence: 0
    Acknowledge: 0
    Maximum: 40000
    Timestamp: 0x0000000000000000
    Trace ID: 0x8000000000000007
    Authorization: 0x0000000000000000
    Flags: 0x03
        .... ...1 = FIN: Set (1)
        .... ..1. = INIT: Set (1)
        .... .0.. = INCOMPLETE: Not set (0)
        .... 0... = SKIP: Not set (0)
    Budget ID: 0x0000000000000000
    Reserved: 27
    Progress: 27
    Progress/Maximum: 27/40000
    Payload
        Length: 27
        Payload
HyperText Transfer Protocol 2

Frame 8: 211 bytes on wire (1688 bits), 211 bytes captured (1688 bits)
Ethernet II, Src: Send_00 (20:53:45:4e:44:00), Dst: Receive_00 (20:52:45:43:56:00)
Internet Protocol Version 6, Src: fe80::3f3f:0:0:3, Dst: fe80::3f3f:0:0:2
Transmission Control Protocol, Src Port: 7114, Dst Port: 0, Seq: 430, Ack: 563, Len: 137
Zilla Frame
    Frame Type ID: 0x40000002
    Frame Type: WINDOW
    Protocol Type ID: 0x8ab62046
    Protocol Type: http
    Worker: 0
    Offset: 0x000002c0
    Origin ID: 0x0000000100000002
    Origin Namespace: test
    Origin Binding: net0
    Routed ID: 0x0000000100000002
    Routed Namespace: test
    Routed Binding: net0
    Stream ID: 0x3f3f000000000002
    Initial ID: 0x3f3f000000000003
    Reply ID: 0x3f3f000000000002
    Direction: REP
    Sequence: 27
    Acknowledge: 27
    Maximum: 40000
    Timestamp: 0x0000000000000000
    Trace ID: 0x8000000000000008
    Authorization: 0x0000000000000000
    Budget ID: 0x0000000000000000
    Padding: 0
    Minimum: 0
    Capabilities: 0x00
    Progress: 0
    Progress/Maximum: 0/40000

Frame 9: 232 bytes on wire (1856 bits), 232 bytes captured (1856 bits)
Ethernet II, Src: Send_00 (20:53:45:4e:44:00), Dst: Receive_00 (20:52:45:43:56:00)
Internet Protocol Version 6, Src: fe80::3f3f:0:0:2, Dst: fe80::3f3f:0:0:3
Transmission Control Protocol, Src Port: 0, Dst Port: 7114, Seq: 563, Ack: 567, Len: 158
Zilla Frame
    Frame Type ID: 0x00000002
    Frame Type: DATA
    Protocol Type ID: 0x8ab62046
    Protocol Type: http
    Worker: 0
    Offset: 0x00000320
    Origin ID: 0x0000000100000002
    Origin Namespace: test
    Origin Binding: net0
    Routed ID: 0x0000000100000002
    Routed Namespace: test
    Routed Binding: net0
    Stream ID: 0x3f3f000000000003
    Initial ID: 0x3f3f000000000003
    Reply ID: 0x3f3f000000000002
    Direction: INI
    Sequence: 24
    Acknowledge: 24
    Maximum: 40000
    Timestamp: 0x0000000000000000
    Trace ID: 0x8000000000000009
    Authorization: 0x0000000000000000
    Flags: 0x03
        .... ...1 = FIN: Set (1)
        .... ..1. = INIT: Set (1)
        .... .0.. = INCOMPLETE: Not set (0)
        .... 0... = SKIP: Not set (0)
    Budget ID: 0x0000000000000000
    Reserved: 21
    Progress: 21
    Progress/Maximum: 21/40000
    Payload
        Length: 21
        Payload
HyperText Transfer Protocol 2

Frame 10: 211 bytes on wire (1688 bits), 211 bytes captured (1688 bits)
Ethernet II, Src: Send_00 (20:53:45:4e:44:00), Dst: Receive_00 (20:52:45:43:56:00)
Internet Protocol Version 6, Src: fe80::3f3f:0:0:2, Dst: fe80::3f3f:0:0:3
Transmission Control Protocol, Src Port: 0, Dst Port: 7114, Seq: 721, Ack: 567, Len: 137
Zilla Frame
    Frame Type ID: 0x40000002
    Frame Type: WINDOW
    Protocol Type ID: 0x8ab62046
    Protocol Type: http
    Worker: 0
    Offset: 0x00000398
    Origin ID: 0x0000000100000002
    Origin Namespace: test
    Origin Binding: net0
    Routed ID: 0x0000000100000002
    Routed Namespace: test
    Routed Binding: net0
    Stream ID: 0x3f3f000000000003
    Initial ID: 0x3f3f000000000003
    Reply ID: 0x3f3f000000000002
    Direction: INI
    Sequence: 45
    Acknowledge: 45
    Maximum: 40000
    Timestamp: 0x0000000000000000
    Trace ID: 0x800000000000000a
    Authorization: 0x0000000000000000
    Budget ID: 0x0000000000000000
    Padding: 0
    Minimum: 0
    Capabilities: 0x00
    Progress: 0
    Progress/Maximum: 0/40000

Frame 11: 220 bytes on wire (1760 bits), 220 bytes captured (1760 bits)
Ethernet II, Src: Send_00 (20:53:45:4e:44:00), Dst: Receive_00 (20:52:45:43:56:00)
Internet Protocol Version 6, Src: fe80::3f3f:0:0:3, Dst: fe80::3f3f:0:0:2
Transmission Control Protocol, Src Port: 7114, Dst Port: 0, Seq: 567, Ack: 858, Len: 146
Zilla Frame
    Frame Type ID: 0x00000002
    Frame Type: DATA
    Protocol Type ID: 0x8ab62046
    Protocol Type: http
    Worker: 0
    Offset: 0x000003f8
    Origin ID: 0x0000000100000002
    Origin Namespace: test
    Origin Binding: net0
    Routed ID: 0x0000000100000002
    Routed Namespace: test
    Routed Binding: net0
    Stream ID: 0x3f3f000000000002
    Initial ID: 0x3f3f000000000003
    Reply ID: 0x3f3f000000000002
    Direction: REP
    Sequence: 27
    Acknowledge: 27
    Maximum: 40000
    Timestamp: 0x0000000000000000
    Trace ID: 0x800000000000000b
    Authorization: 0x0000000000000000
    Flags: 0x03
        .... ...1 = FIN: Set (1)
        .... ..1. = INIT: Set (1)
        .... .0.. = INCOMPLETE: Not set (0)
        .... 0... = SKIP: Not set (0)
    Budget ID: 0x0000000000000000
    Reserved: 9
    Progress: 9
    Progress/Maximum: 9/40000
    Payload
        Length: 9
        Payload
HyperText Transfer Protocol 2

Frame 12: 211 bytes on wire (1688 bits), 211 bytes captured (1688 bits)
Ethernet II, Src: Send_00 (20:53:45:4e:44:00), Dst: Receive_00 (20:52:45:43:56:00)
Internet Protocol Version 6, Src: fe80::3f3f:0:0:3, Dst: fe80::3f3f:0:0:2
Transmission Control Protocol, Src Port: 7114, Dst Port: 0, Seq: 713, Ack: 858, Len: 137
Zilla Frame
    Frame Type ID: 0x40000002
    Frame Type: WINDOW
    Protocol Type ID: 0x8ab62046
    Protocol Type: http
    Worker: 0
    Offset: 0x00000460
    Origin ID: 0x0000000100000002
    Origin Namespace: test
    Origin Binding: net0
    Routed ID: 0x0000000100000002
    Routed Namespace: test
    Routed Binding: net0
    Stream ID: 0x3f3f000000000002
    Initial ID: 0x3f3f000000000003
    Reply ID: 0x3f3f000000000002
    Direction: REP
    Sequence: 36
    Acknowledge: 36
    Maximum: 40000
    Timestamp: 0x0000000000000000
    Trace ID: 0x800000000000000c
    Authorization: 0x0000000000000000
    Budget ID: 0x0000000000000000
    Padding: 0
    Minimum: 0
    Capabilities: 0x00
    Progress: 0
    Progress/Maximum: 0/40000

Frame 13: 220 bytes on wire (1760 bits), 220 bytes captured (1760 bits)
Ethernet II, Src: Send_00 (20:53:45:4e:44:00), Dst: Receive_00 (20:52:45:43:56:00)
Internet Protocol Version 6, Src: fe80::3f3f:0:0:2, Dst: fe80::3f3f:0:0:3
Transmission Control Protocol, Src Port: 0, Dst Port: 7114, Seq: 858, Ack: 850, Len: 146
Zilla Frame
    Frame Type ID: 0x00000002
    Frame Type: DATA
    Protocol Type ID: 0x8ab62046
    Protocol Type: http
    Worker: 0
    Offset: 0x000004c0
    Origin ID: 0x0000000100000002
    Origin Namespace: test
    Origin Binding: net0
    Routed ID: 0x0000000100000002
    Routed Namespace: test
    Routed Binding: net0
    Stream ID: 0x3f3f000000000003
    Initial ID: 0x3f3f000000000003
    Reply ID: 0x3f3f000000000002
    Direction: INI
    Sequence: 45
    Acknowledge: 45
    Maximum: 40000
    Timestamp: 0x0000000000000000
    Trace ID: 0x800000000000000d
    Authorization: 0x0000000000000000
    Flags: 0x03
        .... ...1 = FIN: Set (1)
        .... ..1. = INIT: Set (1)
        .... .0.. = INCOMPLETE: Not set (0)
        .... 0... = SKIP: Not set (0)
    Budget ID: 0x0000000000000000
    Reserved: 9
    Progress: 9
    Progress/Maximum: 9/40000
    Payload
        Length: 9
        Payload
HyperText Transfer Protocol 2

Frame 14: 269 bytes on wire (2152 bits), 269 bytes captured (2152 bits)
Ethernet II, Src: Send_00 (20:53:45:4e:44:00), Dst: Receive_00 (20:52:45:43:56:00)
Internet Protocol Version 6, Src: fe80::3f3f:0:0:2, Dst: fe80::3f3f:0:0:3
Transmission Control Protocol, Src Port: 0, Dst Port: 7114, Seq: 1004, Ack: 850, Len: 195
Zilla Frame
    Frame Type ID: 0x00000002
    Frame Type: DATA
    Protocol Type ID: 0x8ab62046
    Protocol Type: http
    Worker: 0
    Offset: 0x00000528
    Origin ID: 0x0000000100000002
    Origin Namespace: test
    Origin Binding: net0
    Routed ID: 0x0000000100000002
    Routed Namespace: test
    Routed Binding: net0
    Stream ID: 0x3f3f000000000003
    Initial ID: 0x3f3f000000000003
    Reply ID: 0x3f3f000000000002
    Direction: INI
    Sequence: 54
    Acknowledge: 45
    Maximum: 40000
    Timestamp: 0x0000000000000000
    Trace ID: 0x800000000000000e
    Authorization: 0x0000000000000000
    Flags: 0x03
        .... ...1 = FIN: Set (1)
        .... ..1. = INIT: Set (1)
        .... .0.. = INCOMPLETE: Not set (0)
        .... 0... = SKIP: Not set (0)
    Budget ID: 0x0000000000000000
    Reserved: 58
    Progress: 67
    Progress/Maximum: 67/40000
    Payload
        Length: 58
        Payload
HyperText Transfer Protocol 2

Frame 15: 211 bytes on wire (1688 bits), 211 bytes captured (1688 bits)
Ethernet II, Src: Send_00 (20:53:45:4e:44:00), Dst: Receive_00 (20:52:45:43:56:00)
Internet Protocol Version 6, Src: fe80::3f3f:0:0:2, Dst: fe80::3f3f:0:0:3
Transmission Control Protocol, Src Port: 0, Dst Port: 7114, Seq: 1199, Ack: 850, Len: 137
Zilla Frame
    Frame Type ID: 0x40000002
    Frame Type: WINDOW
    Protocol Type ID: 0x8ab62046
    Protocol Type: http
    Worker: 0
    Offset: 0x000005c0
    Origin ID: 0x0000000100000002
    Origin Namespace: test
    Origin Binding: net0
    Routed ID: 0x0000000100000002
    Routed Namespace: test
    Routed Binding: net0
    Stream ID: 0x3f3f000000000003
    Initial ID: 0x3f3f000000000003
    Reply ID: 0x3f3f000000000002
    Direction: INI
    Sequence: 54
    Acknowledge: 54
    Maximum: 40000
    Timestamp: 0x0000000000000000
    Trace ID: 0x800000000000000f
    Authorization: 0x0000000000000000
    Budget ID: 0x0000000000000000
    Padding: 0
    Minimum: 0
    Capabilities: 0x00
    Progress: 0
    Progress/Maximum: 0/40000

Frame 16: 211 bytes on wire (1688 bits), 211 bytes captured (1688 bits)
Ethernet II, Src: Send_00 (20:53:45:4e:44:00), Dst: Receive_00 (20:52:45:43:56:00)
Internet Protocol Version 6, Src: fe80::3f3f:0:0:2, Dst: fe80::3f3f:0:0:3
Transmission Control Protocol, Src Port: 0, Dst Port: 7114, Seq: 1336, Ack: 850, Len: 137
Zilla Frame
    Frame Type ID: 0x40000002
    Frame Type: WINDOW
    Protocol Type ID: 0x8ab62046
    Protocol Type: http
    Worker: 0
    Offset: 0x00000620
    Origin ID: 0x0000000100000002
    Origin Namespace: test
    Origin Binding: net0
    Routed ID: 0x0000000100000002
    Routed Namespace: test
    Routed Binding: net0
    Stream ID: 0x3f3f000000000003
    Initial ID: 0x3f3f000000000003
    Reply ID: 0x3f3f000000000002
    Direction: INI
    Sequence: 112
    Acknowledge: 112
    Maximum: 40000
    Timestamp: 0x0000000000000000
    Trace ID: 0x8000000000000010
    Authorization: 0x0000000000000000
    Budget ID: 0x0000000000000000
    Padding: 0
    Minimum: 0
    Capabilities: 0x00
    Progress: 0
    Progress/Maximum: 0/40000

Frame 17: 281 bytes on wire (2248 bits), 281 bytes captured (2248 bits)
Ethernet II, Src: Send_00 (20:53:45:4e:44:00), Dst: Receive_00 (20:52:45:43:56:00)
Internet Protocol Version 6, Src: fe80::3f3f:0:0:3, Dst: fe80::3f3f:0:0:2
Transmission Control Protocol, Src Port: 7114, Dst Port: 0, Seq: 850, Ack: 1473, Len: 207
Zilla Frame
    Frame Type ID: 0x00000002
    Frame Type: DATA
    Protocol Type ID: 0x8ab62046
    Protocol Type: http
    Worker: 0
    Offset: 0x00000680
    Origin ID: 0x0000000100000002
    Origin Namespace: test
    Origin Binding: net0
    Routed ID: 0x0000000100000002
    Routed Namespace: test
    Routed Binding: net0
    Stream ID: 0x3f3f000000000002
    Initial ID: 0x3f3f000000000003
    Reply ID: 0x3f3f000000000002
    Direction: REP
    Sequence: 36
    Acknowledge: 36
    Maximum: 40000
    Timestamp: 0x0000000000000000
    Trace ID: 0x8000000000000011
    Authorization: 0x0000000000000000
    Flags: 0x03
        .... ...1 = FIN: Set (1)
        .... ..1. = INIT: Set (1)
        .... .0.. = INCOMPLETE: Not set (0)
        .... 0... = SKIP: Not set (0)
    Budget ID: 0x0000000000000000
    Reserved: 70
    Progress: 70
    Progress/Maximum: 70/40000
    Payload
        Length: 70
        Payload
HyperText Transfer Protocol 2

Frame 18: 239 bytes on wire (1912 bits), 239 bytes captured (1912 bits)
Ethernet II, Src: Send_00 (20:53:45:4e:44:00), Dst: Receive_00 (20:52:45:43:56:00)
Internet Protocol Version 6, Src: fe80::3f3f:0:0:3, Dst: fe80::3f3f:0:0:2
Transmission Control Protocol, Src Port: 7114, Dst Port: 0, Seq: 1057, Ack: 1473, Len: 165
Zilla Frame
    Frame Type ID: 0x00000002
    Frame Type: DATA
    Protocol Type ID: 0x8ab62046
    Protocol Type: http
    Worker: 0
    Offset: 0x00000728
    Origin ID: 0x0000000100000002
    Origin Namespace: test
    Origin Binding: net0
    Routed ID: 0x0000000100000002
    Routed Namespace: test
    Routed Binding: net0
    Stream ID: 0x3f3f000000000002
    Initial ID: 0x3f3f000000000003
    Reply ID: 0x3f3f000000000002
    Direction: REP
    Sequence: 106
    Acknowledge: 36
    Maximum: 40000
    Timestamp: 0x0000000000000000
    Trace ID: 0x8000000000000012
    Authorization: 0x0000000000000000
    Flags: 0x03
        .... ...1 = FIN: Set (1)
        .... ..1. = INIT: Set (1)
        .... .0.. = INCOMPLETE: Not set (0)
        .... 0... = SKIP: Not set (0)
    Budget ID: 0x0000000000000000
    Reserved: 28
    Progress: 98
    Progress/Maximum: 98/40000
    Payload
        Length: 28
        Payload
HyperText Transfer Protocol 2

Frame 19: 321 bytes on wire (2568 bits), 321 bytes captured (2568 bits)
Ethernet II, Src: Send_00 (20:53:45:4e:44:00), Dst: Receive_00 (20:52:45:43:56:00)
Internet Protocol Version 6, Src: fe80::3f3f:0:0:3, Dst: fe80::3f3f:0:0:2
Transmission Control Protocol, Src Port: 7114, Dst Port: 0, Seq: 1222, Ack: 1473, Len: 247
Zilla Frame
    Frame Type ID: 0x00000002
    Frame Type: DATA
    Protocol Type ID: 0x8ab62046
    Protocol Type: http
    Worker: 0
    Offset: 0x000007a8
    Origin ID: 0x0000000100000002
    Origin Namespace: test
    Origin Binding: net0
    Routed ID: 0x0000000100000002
    Routed Namespace: test
    Routed Binding: net0
    Stream ID: 0x3f3f000000000002
    Initial ID: 0x3f3f000000000003
    Reply ID: 0x3f3f000000000002
    Direction: REP
    Sequence: 134
    Acknowledge: 36
    Maximum: 40000
    Timestamp: 0x0000000000000000
    Trace ID: 0x8000000000000013
    Authorization: 0x0000000000000000
    Flags: 0x03
        .... ...1 = FIN: Set (1)
        .... ..1. = INIT: Set (1)
        .... .0.. = INCOMPLETE: Not set (0)
        .... 0... = SKIP: Not set (0)
    Budget ID: 0x0000000000000000
    Reserved: 110
    Progress: 208
    Progress/Maximum: 208/40000
    Payload
        Length: 110
        Payload
HyperText Transfer Protocol 2

Frame 20: 224 bytes on wire (1792 bits), 224 bytes captured (1792 bits)
Ethernet II, Src: Send_00 (20:53:45:4e:44:00), Dst: Receive_00 (20:52:45:43:56:00)
Internet Protocol Version 6, Src: fe80::3f3f:0:0:3, Dst: fe80::3f3f:0:0:2
Transmission Control Protocol, Src Port: 7114, Dst Port: 0, Seq: 1469, Ack: 1473, Len: 150
Zilla Frame
    Frame Type ID: 0x00000002
    Frame Type: DATA
    Protocol Type ID: 0x8ab62046
    Protocol Type: http
    Worker: 0
    Offset: 0x00000878
    Origin ID: 0x0000000100000002
    Origin Namespace: test
    Origin Binding: net0
    Routed ID: 0x0000000100000002
    Routed Namespace: test
    Routed Binding: net0
    Stream ID: 0x3f3f000000000002
    Initial ID: 0x3f3f000000000003
    Reply ID: 0x3f3f000000000002
    Direction: REP
    Sequence: 244
    Acknowledge: 36
    Maximum: 40000
    Timestamp: 0x0000000000000000
    Trace ID: 0x8000000000000014
    Authorization: 0x0000000000000000
    Flags: 0x03
        .... ...1 = FIN: Set (1)
        .... ..1. = INIT: Set (1)
        .... .0.. = INCOMPLETE: Not set (0)
        .... 0... = SKIP: Not set (0)
    Budget ID: 0x0000000000000000
    Reserved: 13
    Progress: 221
    Progress/Maximum: 221/40000
    Payload
        Length: 13
        Payload
HyperText Transfer Protocol 2

Frame 21: 211 bytes on wire (1688 bits), 211 bytes captured (1688 bits)
Ethernet II, Src: Send_00 (20:53:45:4e:44:00), Dst: Receive_00 (20:52:45:43:56:00)
Internet Protocol Version 6, Src: fe80::3f3f:0:0:3, Dst: fe80::3f3f:0:0:2
Transmission Control Protocol, Src Port: 7114, Dst Port: 0, Seq: 1619, Ack: 1473, Len: 137
Zilla Frame
    Frame Type ID: 0x40000002
    Frame Type: WINDOW
    Protocol Type ID: 0x8ab62046
    Protocol Type: http
    Worker: 0
    Offset: 0x000008e8
    Origin ID: 0x0000000100000002
    Origin Namespace: test
    Origin Binding: net0
    Routed ID: 0x0000000100000002
    Routed Namespace: test
    Routed Binding: net0
    Stream ID: 0x3f3f000000000002
    Initial ID: 0x3f3f000000000003
    Reply ID: 0x3f3f000000000002
    Direction: REP
    Sequence: 106
    Acknowledge: 106
    Maximum: 40000
    Timestamp: 0x0000000000000000
    Trace ID: 0x8000000000000015
    Authorization: 0x0000000000000000
    Budget ID: 0x0000000000000000
    Padding: 0
    Minimum: 0
    Capabilities: 0x00
    Progress: 0
    Progress/Maximum: 0/40000

Frame 22: 211 bytes on wire (1688 bits), 211 bytes captured (1688 bits)
Ethernet II, Src: Send_00 (20:53:45:4e:44:00), Dst: Receive_00 (20:52:45:43:56:00)
Internet Protocol Version 6, Src: fe80::3f3f:0:0:3, Dst: fe80::3f3f:0:0:2
Transmission Control Protocol, Src Port: 7114, Dst Port: 0, Seq: 1756, Ack: 1473, Len: 137
Zilla Frame
    Frame Type ID: 0x40000002
    Frame Type: WINDOW
    Protocol Type ID: 0x8ab62046
    Protocol Type: http
    Worker: 0
    Offset: 0x00000948
    Origin ID: 0x0000000100000002
    Origin Namespace: test
    Origin Binding: net0
    Routed ID: 0x0000000100000002
    Routed Namespace: test
    Routed Binding: net0
    Stream ID: 0x3f3f000000000002
    Initial ID: 0x3f3f000000000003
    Reply ID: 0x3f3f000000000002
    Direction: REP
    Sequence: 134
    Acknowledge: 134
    Maximum: 40000
    Timestamp: 0x0000000000000000
    Trace ID: 0x8000000000000016
    Authorization: 0x0000000000000000
    Budget ID: 0x0000000000000000
    Padding: 0
    Minimum: 0
    Capabilities: 0x00
    Progress: 0
    Progress/Maximum: 0/40000

Frame 23: 211 bytes on wire (1688 bits), 211 bytes captured (1688 bits)
Ethernet II, Src: Send_00 (20:53:45:4e:44:00), Dst: Receive_00 (20:52:45:43:56:00)
Internet Protocol Version 6, Src: fe80::3f3f:0:0:3, Dst: fe80::3f3f:0:0:2
Transmission Control Protocol, Src Port: 7114, Dst Port: 0, Seq: 1893, Ack: 1473, Len: 137
Zilla Frame
    Frame Type ID: 0x40000002
    Frame Type: WINDOW
    Protocol Type ID: 0x8ab62046
    Protocol Type: http
    Worker: 0
    Offset: 0x000009a8
    Origin ID: 0x0000000100000002
    Origin Namespace: test
    Origin Binding: net0
    Routed ID: 0x0000000100000002
    Routed Namespace: test
    Routed Binding: net0
    Stream ID: 0x3f3f000000000002
    Initial ID: 0x3f3f000000000003
    Reply ID: 0x3f3f000000000002
    Direction: REP
    Sequence: 244
    Acknowledge: 244
    Maximum: 40000
    Timestamp: 0x0000000000000000
    Trace ID: 0x8000000000000017
    Authorization: 0x0000000000000000
    Budget ID: 0x0000000000000000
    Padding: 0
    Minimum: 0
    Capabilities: 0x00
    Progress: 0
    Progress/Maximum: 0/40000

Frame 24: 211 bytes on wire (1688 bits), 211 bytes captured (1688 bits)
Ethernet II, Src: Send_00 (20:53:45:4e:44:00), Dst: Receive_00 (20:52:45:43:56:00)
Internet Protocol Version 6, Src: fe80::3f3f:0:0:3, Dst: fe80::3f3f:0:0:2
Transmission Control Protocol, Src Port: 7114, Dst Port: 0, Seq: 2030, Ack: 1473, Len: 137
Zilla Frame
    Frame Type ID: 0x40000002
    Frame Type: WINDOW
    Protocol Type ID: 0x8ab62046
    Protocol Type: http
    Worker: 0
    Offset: 0x00000a08
    Origin ID: 0x0000000100000002
    Origin Namespace: test
    Origin Binding: net0
    Routed ID: 0x0000000100000002
    Routed Namespace: test
    Routed Binding: net0
    Stream ID: 0x3f3f000000000002
    Initial ID: 0x3f3f000000000003
    Reply ID: 0x3f3f000000000002
    Direction: REP
    Sequence: 257
    Acknowledge: 257
    Maximum: 40000
    Timestamp: 0x0000000000000000
    Trace ID: 0x8000000000000018
    Authorization: 0x0000000000000000
    Budget ID: 0x0000000000000000
    Padding: 0
    Minimum: 0
    Capabilities: 0x00
    Progress: 0
    Progress/Maximum: 0/40000

Frame 25: 194 bytes on wire (1552 bits), 194 bytes captured (1552 bits)
Ethernet II, Src: Send_00 (20:53:45:4e:44:00), Dst: Receive_00 (20:52:45:43:56:00)
Internet Protocol Version 6, Src: fe80::3f3f:0:0:2, Dst: fe80::3f3f:0:0:3
Transmission Control Protocol, Src Port: 0, Dst Port: 7114, Seq: 1473, Ack: 2167, Len: 120
Zilla Frame
    Frame Type ID: 0x00000003
    Frame Type: END
    Protocol Type ID: 0x8ab62046
    Protocol Type: http
    Worker: 0
    Offset: 0x00000a68
    Origin ID: 0x0000000100000002
    Origin Namespace: test
    Origin Binding: net0
    Routed ID: 0x0000000100000002
    Routed Namespace: test
    Routed Binding: net0
    Stream ID: 0x3f3f000000000003
    Initial ID: 0x3f3f000000000003
    Reply ID: 0x3f3f000000000002
    Direction: INI
    Sequence: 112
    Acknowledge: 112
    Maximum: 40000
    Timestamp: 0x0000000000000000
    Trace ID: 0x8000000000000019
    Authorization: 0x0000000000000000

Frame 26: 194 bytes on wire (1552 bits), 194 bytes captured (1552 bits)
Ethernet II, Src: Send_00 (20:53:45:4e:44:00), Dst: Receive_00 (20:52:45:43:56:00)
Internet Protocol Version 6, Src: fe80::3f3f:0:0:3, Dst: fe80::3f3f:0:0:2
Transmission Control Protocol, Src Port: 7114, Dst Port: 0, Seq: 2167, Ack: 1593, Len: 120
Zilla Frame
    Frame Type ID: 0x00000003
    Frame Type: END
    Protocol Type ID: 0x8ab62046
    Protocol Type: http
    Worker: 0
    Offset: 0x00000ab8
    Origin ID: 0x0000000100000002
    Origin Namespace: test
    Origin Binding: net0
    Routed ID: 0x0000000100000002
    Routed Namespace: test
    Routed Binding: net0
    Stream ID: 0x3f3f000000000002
    Initial ID: 0x3f3f000000000003
    Reply ID: 0x3f3f000000000002
    Direction: REP
    Sequence: 257
    Acknowledge: 257
    Maximum: 40000
    Timestamp: 0x0000000000000000
    Trace ID: 0x800000000000001a
    Authorization: 0x0000000000000000

