Frame 1: 198 bytes on wire (1584 bits), 198 bytes captured (1584 bits)
Ethernet II, Src: Send_00 (20:53:45:4e:44:00), Dst: Receive_00 (20:52:45:43:56:00)
Internet Protocol Version 6, Src: fe80::1, Dst: fe80::
Transmission Control Protocol, Src Port: 7114, Dst Port: 0, Seq: 1, Ack: 1, Len: 124
Zilla Frame
    Frame Type ID: 0x40000003
    Frame Type: SIGNAL
    Protocol Type ID: 0x00000000
    Protocol Type: 
    Worker: 0
    Offset: 0x00000000
    Origin ID: 0x0000000000000000
    Routed ID: 0x0000000000000000
    Stream ID: 0x0000000000000000
    Direction: 
    Sequence: 0
    Acknowledge: 0
    Maximum: 0
    Timestamp: 0x0000000000000000
    Trace ID: 0x0000000000000001
    Authorization: 0x0000000000000000
    Cancel ID: 0xffffffffffffffff
    Signal ID: 0x00000001
    Context ID: 0x00000000
    Payload
        Length: -1

Frame 2: 202 bytes on wire (1616 bits), 202 bytes captured (1616 bits)
Ethernet II, Src: Send_00 (20:53:45:4e:44:00), Dst: Receive_00 (20:52:45:43:56:00)
Internet Protocol Version 6, Src: fe80::1:3f:0:0:8, Dst: fe80::1:3f:0:0:9
Transmission Control Protocol, Src Port: 0, Dst Port: 7114, Seq: 0, Ack: 1, Len: 128
Zilla Frame
    Frame Type ID: 0x00000001
    Frame Type: BEGIN
    Protocol Type ID: 0x00000000
    Protocol Type: 
    Worker: 1
    Offset: 0x00000000
    Origin ID: 0x0000000100000010
    Origin Namespace: test
    Origin Binding: app0
    Routed ID: 0x0000000100000002
    Routed Namespace: test
    Routed Binding: net0
    Stream ID: 0x003f000000000009
    Initial ID: 0x003f000000000009
    Reply ID: 0x003f000000000008
    Direction: INI
    Sequence: 0
    Acknowledge: 0
    Maximum: 0
    Timestamp: 0x0000000000000000
    Trace ID: 0x8000000000000001
    Authorization: 0x0000000000000000
    Affinity: 0x0000000000000000

Frame 3: 238 bytes on wire (1904 bits), 238 bytes captured (1904 bits)
Ethernet II, Src: Send_00 (20:53:45:4e:44:00), Dst: Receive_00 (20:52:45:43:56:00)
Internet Protocol Version 6, Src: fe80::3f00:0:0:2, Dst: fe80::3f00:0:0:3
Transmission Control Protocol, Src Port: 0, Dst Port: 7114, Seq: 0, Ack: 1, Len: 164
Zilla Frame
    Frame Type ID: 0x00000001
    Frame Type: BEGIN
    Protocol Type ID: 0x084b20e1
    Protocol Type: kafka
    Worker: 0
    Offset: 0x00000060
    Origin ID: 0x0000000100000010
    Origin Namespace: test
    Origin Binding: app0
    Routed ID: 0x0000000100000010
    Routed Namespace: test
    Routed Binding: app0
    Stream ID: 0x3f00000000000003
    Initial ID: 0x3f00000000000003
    Reply ID: 0x3f00000000000002
    Direction: INI
    Sequence: 0
    Acknowledge: 0
    Maximum: 0
    Timestamp: 0x0000000000000000
    Trace ID: 0x8000000000000001
    Authorization: 0x0000000000000000
    Affinity: 0x0000000000000000
    Extension: kafka
        Stream Type ID: 0xe1204b08
        Stream Type: kafka
        API: GROUP (253)
        Group ID: test
            Length: 4
            Group ID: test
        Protocol: highlander
            Length: 10
            Protocol: highlander
        Instance ID: 
            Length: -1
            Instance ID: 
        Host: 
            Length: -1
            Host: 
        Port: 0
        Timeout: 45000
        Metadata Length: 0
            Length (varint32): 01
            Length: 0

Frame 4: 211 bytes on wire (1688 bits), 211 bytes captured (1688 bits)
Ethernet II, Src: Send_00 (20:53:45:4e:44:00), Dst: Receive_00 (20:52:45:43:56:00)
Internet Protocol Version 6, Src: fe80::1:3f00:0:0:2, Dst: fe80::1:3f00:0:0:3
Transmission Control Protocol, Src Port: 0, Dst Port: 7114, Seq: 1, Ack: 1, Len: 137
Zilla Frame
    Frame Type ID: 0x40000002
    Frame Type: WINDOW
    Protocol Type ID: 0x084b20e1
    Protocol Type: kafka
    Worker: 1
    Offset: 0x00000058
    Origin ID: 0x0000000100000010
    Origin Namespace: test
    Origin Binding: app0
    Routed ID: 0x0000000100000010
    Routed Namespace: test
    Routed Binding: app0
    Stream ID: 0x3f00000000000003
    Initial ID: 0x3f00000000000003
    Reply ID: 0x3f00000000000002
    Direction: INI
    Sequence: 0
    Acknowledge: 0
    Maximum: 65280
    Timestamp: 0x0000000000000000
    Trace ID: 0x8000000000000001
    Authorization: 0x0000000000000000
    Budget ID: 0x0000000000000000
    Padding: 256
    Minimum: 0
    Capabilities: 0x00
    Progress: 0
    Progress/Maximum: 0/65280

Frame 5: 290 bytes on wire (2320 bits), 290 bytes captured (2320 bits)
Ethernet II, Src: Send_00 (20:53:45:4e:44:00), Dst: Receive_00 (20:52:45:43:56:00)
Internet Protocol Version 6, Src: fe80::3f:0:0:8, Dst: fe80::3f:0:0:9
Transmission Control Protocol, Src Port: 0, Dst Port: 7114, Seq: 1, Ack: 1, Len: 216
Zilla Frame
    Frame Type ID: 0x40000003
    Frame Type: SIGNAL
    Protocol Type ID: 0x00000000
    Protocol Type: 
    Worker: 0
    Offset: 0x000000d8
    Origin ID: 0x0000000100000010
    Origin Namespace: test
    Origin Binding: app0
    Routed ID: 0x0000000100000002
    Routed Namespace: test
    Routed Binding: net0
    Stream ID: 0x003f000000000009
    Initial ID: 0x003f000000000009
    Reply ID: 0x003f000000000008
    Direction: INI
    Sequence: 0
    Acknowledge: 0
    Maximum: 0
    Timestamp: 0x0000000000000000
    Trace ID: 0x0000000000000000
    Authorization: 0x0000000000000000
    Cancel ID: 0xffffffffffffffff
    Signal ID: 0x80000001
    Context ID: 0x00000001
    Payload
        Length: 76
        Payload

Frame 6: 211 bytes on wire (1688 bits), 211 bytes captured (1688 bits)
Ethernet II, Src: Send_00 (20:53:45:4e:44:00), Dst: Receive_00 (20:52:45:43:56:00)
Internet Protocol Version 6, Src: fe80::1:3f:0:0:9, Dst: fe80::1:3f:0:0:8
Transmission Control Protocol, Src Port: 7114, Dst Port: 0, Seq: 1, Ack: 128, Len: 137
Zilla Frame
    Frame Type ID: 0x40000002
    Frame Type: WINDOW
    Protocol Type ID: 0x00000000
    Protocol Type: 
    Worker: 1
    Offset: 0x000000b8
    Origin ID: 0x0000000100000010
    Origin Namespace: test
    Origin Binding: app0
    Routed ID: 0x0000000100000002
    Routed Namespace: test
    Routed Binding: net0
    Stream ID: 0x003f000000000008
    Initial ID: 0x003f000000000009
    Reply ID: 0x003f000000000008
    Direction: REP
    Sequence: 0
    Acknowledge: 0
    Maximum: 65536
    Timestamp: 0x0000000000000000
    Trace ID: 0x8000000000000001
    Authorization: 0x0000000000000000
    Budget ID: 0x0000000000000000
    Padding: 0
    Minimum: 0
    Capabilities: 0x00
    Progress: 0
    Progress/Maximum: 0/65536

Frame 7: 299 bytes on wire (2392 bits), 299 bytes captured (2392 bits)
Ethernet II, Src: Send_00 (20:53:45:4e:44:00), Dst: Receive_00 (20:52:45:43:56:00)
Internet Protocol Version 6, Src: fe80::3f:0:0:8, Dst: fe80::3f:0:0:9
Transmission Control Protocol, Src Port: 0, Dst Port: 7114, Seq: 217, Ack: 1, Len: 225
Zilla Frame
    Frame Type ID: 0x40000003
    Frame Type: SIGNAL
    Protocol Type ID: 0x00000000
    Protocol Type: 
    Worker: 0
    Offset: 0x00000188
    Origin ID: 0x0000000100000010
    Origin Namespace: test
    Origin Binding: app0
    Routed ID: 0x0000000100000002
    Routed Namespace: test
    Routed Binding: net0
    Stream ID: 0x003f000000000009
    Initial ID: 0x003f000000000009
    Reply ID: 0x003f000000000008
    Direction: INI
    Sequence: 0
    Acknowledge: 0
    Maximum: 0
    Timestamp: 0x0000000000000000
    Trace ID: 0x0000000000000000
    Authorization: 0x0000000000000000
    Cancel ID: 0xffffffffffffffff
    Signal ID: 0x80000006
    Context ID: 0x00000002
    Payload
        Length: 85
        Payload

Frame 8: 237 bytes on wire (1896 bits), 237 bytes captured (1896 bits)
Ethernet II, Src: Send_00 (20:53:45:4e:44:00), Dst: Receive_00 (20:52:45:43:56:00)
Internet Protocol Version 6, Src: fe80::1:3f:0:0:8, Dst: fe80::1:3f:0:0:9
Transmission Control Protocol, Src Port: 0, Dst Port: 7114, Seq: 128, Ack: 138, Len: 163
Zilla Frame
    Frame Type ID: 0x00000002
    Frame Type: DATA
    Protocol Type ID: 0x00000000
    Protocol Type: 
    Worker: 1
    Offset: 0x00000118
    Origin ID: 0x0000000100000010
    Origin Namespace: test
    Origin Binding: app0
    Routed ID: 0x0000000100000002
    Routed Namespace: test
    Routed Binding: net0
    Stream ID: 0x003f000000000009
    Initial ID: 0x003f000000000009
    Reply ID: 0x003f000000000008
    Direction: INI
    Sequence: 0
    Acknowledge: 0
    Maximum: 8192
    Timestamp: 0x0000000000000000
    Trace ID: 0x8000000000000003
    Authorization: 0x0000000000000000
    Flags: 0x03
        .... ...1 = FIN: Set (1)
        .... ..1. = INIT: Set (1)
        .... .0.. = INCOMPLETE: Not set (0)
        .... 0... = SKIP: Not set (0)
    Budget ID: 0x0000000000000001
    Reserved: 26
    Progress: 26
    Progress/Maximum: 26/8192
    Payload
        Length: 26
        Payload

Frame 9: 202 bytes on wire (1616 bits), 202 bytes captured (1616 bits)
Ethernet II, Src: Send_00 (20:53:45:4e:44:00), Dst: Receive_00 (20:52:45:43:56:00)
Internet Protocol Version 6, Src: fe80::3f:0:0:9, Dst: fe80::3f:0:0:8
Transmission Control Protocol, Src Port: 7114, Dst Port: 0, Seq: 1, Ack: 442, Len: 128
Zilla Frame
    Frame Type ID: 0x00000001
    Frame Type: BEGIN
    Protocol Type ID: 0x00000000
    Protocol Type: 
    Worker: 0
    Offset: 0x00000240
    Origin ID: 0x0000000100000010
    Origin Namespace: test
    Origin Binding: app0
    Routed ID: 0x0000000100000002
    Routed Namespace: test
    Routed Binding: net0
    Stream ID: 0x003f000000000008
    Initial ID: 0x003f000000000009
    Reply ID: 0x003f000000000008
    Direction: REP
    Sequence: 0
    Acknowledge: 0
    Maximum: 0
    Timestamp: 0x0000000000000000
    Trace ID: 0x8000000000000002
    Authorization: 0x0000000000000000
    Affinity: 0x0000000000000000

Frame 10: 272 bytes on wire (2176 bits), 272 bytes captured (2176 bits)
Ethernet II, Src: Send_00 (20:53:45:4e:44:00), Dst: Receive_00 (20:52:45:43:56:00)
Internet Protocol Version 6, Src: fe80::1:3f:0:0:10, Dst: fe80::1:3f:0:0:11
Transmission Control Protocol, Src Port: 0, Dst Port: 7114, Seq: 0, Ack: 1, Len: 198
Zilla Frame
    Frame Type ID: 0x00000001
    Frame Type: BEGIN
    Protocol Type ID: 0x00000000
    Protocol Type: 
    Worker: 1
    Offset: 0x00000190
    Origin ID: 0x0000000100000010
    Origin Namespace: test
    Origin Binding: app0
    Routed ID: 0x0000000100000002
    Routed Namespace: test
    Routed Binding: net0
    Stream ID: 0x003f000000000011
    Initial ID: 0x003f000000000011
    Reply ID: 0x003f000000000010
    Direction: INI
    Sequence: 0
    Acknowledge: 0
    Maximum: 0
    Timestamp: 0x0000000000000000
    Trace ID: 0x8000000000000005
    Authorization: 0x0000000000000000
    Affinity: 0x0000000000000000
    Extension: proxy
        Stream Type ID: 0x50a8ce8d
        Stream Type: proxy
        Address: INET
            Family: INET (0)
            Protocol: STREAM (0)
            Source: 0.0.0.0
            Source Port: 0
            Destination: broker1.example.com
            Destination Port: 9092
        Info (1 items)
            Length: 26
            Size: 1
        Info: AUTHORITY: broker1.example.com
            Type: AUTHORITY (0x02)
            Length: 19
            Value: broker1.example.com

Frame 11: 211 bytes on wire (1688 bits), 211 bytes captured (1688 bits)
Ethernet II, Src: Send_00 (20:53:45:4e:44:00), Dst: Receive_00 (20:52:45:43:56:00)
Internet Protocol Version 6, Src: fe80::3f:0:0:8, Dst: fe80::3f:0:0:9
Transmission Control Protocol, Src Port: 0, Dst Port: 7114, Seq: 442, Ack: 129, Len: 137
Zilla Frame
    Frame Type ID: 0x40000002
    Frame Type: WINDOW
    Protocol Type ID: 0x00000000
    Protocol Type: 
    Worker: 0
    Offset: 0x00000298
    Origin ID: 0x0000000100000010
    Origin Namespace: test
    Origin Binding: app0
    Routed ID: 0x0000000100000002
    Routed Namespace: test
    Routed Binding: net0
    Stream ID: 0x003f000000000009
    Initial ID: 0x003f000000000009
    Reply ID: 0x003f000000000008
    Direction: INI
    Sequence: 0
    Acknowledge: 0
    Maximum: 8192
    Timestamp: 0x0000000000000000
    Trace ID: 0x8000000000000003
    Authorization: 0x0000000000000000
    Budget ID: 0x0000000000000000
    Padding: 0
    Minimum: 0
    Capabilities: 0x00
    Progress: 0
    Progress/Maximum: 0/8192

Frame 12: 211 bytes on wire (1688 bits), 211 bytes captured (1688 bits)
Ethernet II, Src: Send_00 (20:53:45:4e:44:00), Dst: Receive_00 (20:52:45:43:56:00)
Internet Protocol Version 6, Src: fe80::1:3f:0:0:9, Dst: fe80::1:3f:0:0:8
Transmission Control Protocol, Src Port: 7114, Dst Port: 0, Seq: 138, Ack: 291, Len: 137
Zilla Frame
    Frame Type ID: 0x40000002
    Frame Type: WINDOW
    Protocol Type ID: 0x00000000
    Protocol Type: 
    Worker: 1
    Offset: 0x00000230
    Origin ID: 0x0000000100000010
    Origin Namespace: test
    Origin Binding: app0
    Routed ID: 0x0000000100000002
    Routed Namespace: test
    Routed Binding: net0
    Stream ID: 0x003f000000000008
    Initial ID: 0x003f000000000009
    Reply ID: 0x003f000000000008
    Direction: REP
    Sequence: 49
    Acknowledge: 49
    Maximum: 65536
    Timestamp: 0x0000000000000000
    Trace ID: 0x8000000000000005
    Authorization: 0x0000000000000000
    Budget ID: 0x0000000000000000
    Padding: 0
    Minimum: 0
    Capabilities: 0x00
    Progress: 0
    Progress/Maximum: 0/65536

Frame 13: 325 bytes on wire (2600 bits), 325 bytes captured (2600 bits)
Ethernet II, Src: Send_00 (20:53:45:4e:44:00), Dst: Receive_00 (20:52:45:43:56:00)
Internet Protocol Version 6, Src: fe80::3f:0:0:8, Dst: fe80::3f:0:0:9
Transmission Control Protocol, Src Port: 0, Dst Port: 7114, Seq: 579, Ack: 129, Len: 251
Zilla Frame
    Frame Type ID: 0x40000003
    Frame Type: SIGNAL
    Protocol Type ID: 0x00000000
    Protocol Type: 
    Worker: 0
    Offset: 0x000002f8
    Origin ID: 0x0000000100000010
    Origin Namespace: test
    Origin Binding: app0
    Routed ID: 0x0000000100000002
    Routed Namespace: test
    Routed Binding: net0
    Stream ID: 0x003f000000000009
    Initial ID: 0x003f000000000009
    Reply ID: 0x003f000000000008
    Direction: INI
    Sequence: 0
    Acknowledge: 0
    Maximum: 0
    Timestamp: 0x0000000000000000
    Trace ID: 0x0000000000000000
    Authorization: 0x0000000000000000
    Cancel ID: 0xffffffffffffffff
    Signal ID: 0x80000002
    Context ID: 0x00000003
    Payload
        Length: 111
        Payload

Frame 14: 211 bytes on wire (1688 bits), 211 bytes captured (1688 bits)
Ethernet II, Src: Send_00 (20:53:45:4e:44:00), Dst: Receive_00 (20:52:45:43:56:00)
Internet Protocol Version 6, Src: fe80::1:3f:0:0:11, Dst: fe80::1:3f:0:0:10
Transmission Control Protocol, Src Port: 7114, Dst Port: 0, Seq: 1, Ack: 198, Len: 137
Zilla Frame
    Frame Type ID: 0x40000002
    Frame Type: WINDOW
    Protocol Type ID: 0x00000000
    Protocol Type: 
    Worker: 1
    Offset: 0x00000290
    Origin ID: 0x0000000100000010
    Origin Namespace: test
    Origin Binding: app0
    Routed ID: 0x0000000100000002
    Routed Namespace: test
    Routed Binding: net0
    Stream ID: 0x003f000000000010
    Initial ID: 0x003f000000000011
    Reply ID: 0x003f000000000010
    Direction: REP
    Sequence: 0
    Acknowledge: 0
    Maximum: 65536
    Timestamp: 0x0000000000000000
    Trace ID: 0x8000000000000005
    Authorization: 0x0000000000000000
    Budget ID: 0x0000000000000000
    Padding: 0
    Minimum: 0
    Capabilities: 0x00
    Progress: 0
    Progress/Maximum: 0/65536

Frame 15: 211 bytes on wire (1688 bits), 211 bytes captured (1688 bits)
Ethernet II, Src: Send_00 (20:53:45:4e:44:00), Dst: Receive_00 (20:52:45:43:56:00)
Internet Protocol Version 6, Src: fe80::3f:0:0:8, Dst: fe80::3f:0:0:9
Transmission Control Protocol, Src Port: 0, Dst Port: 7114, Seq: 830, Ack: 129, Len: 137
Zilla Frame
    Frame Type ID: 0x40000002
    Frame Type: WINDOW
    Protocol Type ID: 0x00000000
    Protocol Type: 
    Worker: 0
    Offset: 0x000003c8
    Origin ID: 0x0000000100000010
    Origin Namespace: test
    Origin Binding: app0
    Routed ID: 0x0000000100000002
    Routed Namespace: test
    Routed Binding: net0
    Stream ID: 0x003f000000000009
    Initial ID: 0x003f000000000009
    Reply ID: 0x003f000000000008
    Direction: INI
    Sequence: 26
    Acknowledge: 26
    Maximum: 8192
    Timestamp: 0x0000000000000000
    Trace ID: 0x8000000000000004
    Authorization: 0x0000000000000000
    Budget ID: 0x0000000000000000
    Padding: 0
    Minimum: 0
    Capabilities: 0x00
    Progress: 0
    Progress/Maximum: 0/8192

Frame 16: 336 bytes on wire (2688 bits), 336 bytes captured (2688 bits)
Ethernet II, Src: Send_00 (20:53:45:4e:44:00), Dst: Receive_00 (20:52:45:43:56:00)
Internet Protocol Version 6, Src: fe80::1:3f:0:0:10, Dst: fe80::1:3f:0:0:11
Transmission Control Protocol, Src Port: 0, Dst Port: 7114, Seq: 198, Ack: 138, Len: 262
Zilla Frame
    Frame Type ID: 0x00000002
    Frame Type: DATA
    Protocol Type ID: 0x00000000
    Protocol Type: 
    Worker: 1
    Offset: 0x000002f0
    Origin ID: 0x0000000100000010
    Origin Namespace: test
    Origin Binding: app0
    Routed ID: 0x0000000100000002
    Routed Namespace: test
    Routed Binding: net0
    Stream ID: 0x003f000000000011
    Initial ID: 0x003f000000000011
    Reply ID: 0x003f000000000010
    Direction: INI
    Sequence: 0
    Acknowledge: 0
    Maximum: 8192
    Timestamp: 0x0000000000000000
    Trace ID: 0x8000000000000007
    Authorization: 0x0000000000000000
    Flags: 0x03
        .... ...1 = FIN: Set (1)
        .... ..1. = INIT: Set (1)
        .... .0.. = INCOMPLETE: Not set (0)
        .... 0... = SKIP: Not set (0)
    Budget ID: 0x0000000000000002
    Reserved: 125
    Progress: 125
    Progress/Maximum: 125/8192
    Payload
        Length: 125
        Payload

Frame 17: 260 bytes on wire (2080 bits), 260 bytes captured (2080 bits)
Ethernet II, Src: Send_00 (20:53:45:4e:44:00), Dst: Receive_00 (20:52:45:43:56:00)
Internet Protocol Version 6, Src: fe80::3f:0:0:9, Dst: fe80::3f:0:0:8
Transmission Control Protocol, Src Port: 7114, Dst Port: 0, Seq: 129, Ack: 967, Len: 186
Zilla Frame
    Frame Type ID: 0x00000002
    Frame Type: DATA
    Protocol Type ID: 0x00000000
    Protocol Type: 
    Worker: 0
    Offset: 0x00000428
    Origin ID: 0x0000000100000010
    Origin Namespace: test
    Origin Binding: app0
    Routed ID: 0x0000000100000002
    Routed Namespace: test
    Routed Binding: net0
    Stream ID: 0x003f000000000008
    Initial ID: 0x003f000000000009
    Reply ID: 0x003f000000000008
    Direction: REP
    Sequence: 0
    Acknowledge: 0
    Maximum: 65536
    Timestamp: 0x0000000000000000
    Trace ID: 0x8000000000000005
    Authorization: 0x0000000000000000
    Flags: 0x03
        .... ...1 = FIN: Set (1)
        .... ..1. = INIT: Set (1)
        .... .0.. = INCOMPLETE: Not set (0)
        .... 0... = SKIP: Not set (0)
    Budget ID: 0x0000000000000000
    Reserved: 49
    Progress: 49
    Progress/Maximum: 49/65536
    Payload
        Length: 49
        Payload

Frame 18: 262 bytes on wire (2096 bits), 262 bytes captured (2096 bits)
Ethernet II, Src: Send_00 (20:53:45:4e:44:00), Dst: Receive_00 (20:52:45:43:56:00)
Internet Protocol Version 6, Src: fe80::1:3f00:0:0:3, Dst: fe80::1:3f00:0:0:2
Transmission Control Protocol, Src Port: 7114, Dst Port: 0, Seq: 1, Ack: 138, Len: 188
Zilla Frame
    Frame Type ID: 0x00000001
    Frame Type: BEGIN
    Protocol Type ID: 0x084b20e1
    Protocol Type: kafka
    Worker: 1
    Offset: 0x000003d0
    Origin ID: 0x0000000100000010
    Origin Namespace: test
    Origin Binding: app0
    Routed ID: 0x0000000100000010
    Routed Namespace: test
    Routed Binding: app0
    Stream ID: 0x3f00000000000002
    Initial ID: 0x3f00000000000003
    Reply ID: 0x3f00000000000002
    Direction: REP
    Sequence: 0
    Acknowledge: 0
    Maximum: 0
    Timestamp: 0x0000000000000000
    Trace ID: 0x8000000000000009
    Authorization: 0x0000000000000000
    Affinity: 0x0000000000000000
    Extension: kafka
        Stream Type ID: 0xe1204b08
        Stream Type: kafka
        API: GROUP (253)
        Group ID: test
            Length: 4
            Group ID: test
        Protocol: highlander
            Length: 10
            Protocol: highlander
        Instance ID: zilla
            Length: 5
            Instance ID: zilla
        Host: broker1.example.com
            Length: 19
            Host: broker1.example.com
        Port: 9092
        Timeout: 30000
        Metadata Length: 0
            Length (varint32): 01
            Length: 0

Frame 19: 360 bytes on wire (2880 bits), 360 bytes captured (2880 bits)
Ethernet II, Src: Send_00 (20:53:45:4e:44:00), Dst: Receive_00 (20:52:45:43:56:00)
Internet Protocol Version 6, Src: fe80::3f:0:0:10, Dst: fe80::3f:0:0:11
Transmission Control Protocol, Src Port: 0, Dst Port: 7114, Seq: 1, Ack: 1, Len: 286
Zilla Frame
    Frame Type ID: 0x40000003
    Frame Type: SIGNAL
    Protocol Type ID: 0x00000000
    Protocol Type: 
    Worker: 0
    Offset: 0x000004b8
    Origin ID: 0x0000000100000010
    Origin Namespace: test
    Origin Binding: app0
    Routed ID: 0x0000000100000002
    Routed Namespace: test
    Routed Binding: net0
    Stream ID: 0x003f000000000011
    Initial ID: 0x003f000000000011
    Reply ID: 0x003f000000000010
    Direction: INI
    Sequence: 0
    Acknowledge: 0
    Maximum: 0
    Timestamp: 0x0000000000000000
    Trace ID: 0x0000000000000000
    Authorization: 0x0000000000000000
    Cancel ID: 0xffffffffffffffff
    Signal ID: 0x80000001
    Context ID: 0x00000001
    Payload
        Length: 146
        Payload

Frame 20: 211 bytes on wire (1688 bits), 211 bytes captured (1688 bits)
Ethernet II, Src: Send_00 (20:53:45:4e:44:00), Dst: Receive_00 (20:52:45:43:56:00)
Internet Protocol Version 6, Src: fe80::1:3f:0:0:11, Dst: fe80::1:3f:0:0:10
Transmission Control Protocol, Src Port: 7114, Dst Port: 0, Seq: 138, Ack: 460, Len: 137
Zilla Frame
    Frame Type ID: 0x40000002
    Frame Type: WINDOW
    Protocol Type ID: 0x00000000
    Protocol Type: 
    Worker: 1
    Offset: 0x00000460
    Origin ID: 0x0000000100000010
    Origin Namespace: test
    Origin Binding: app0
    Routed ID: 0x0000000100000002
    Routed Namespace: test
    Routed Binding: net0
    Stream ID: 0x003f000000000010
    Initial ID: 0x003f000000000011
    Reply ID: 0x003f000000000010
    Direction: REP
    Sequence: 147
    Acknowledge: 147
    Maximum: 65536
    Timestamp: 0x0000000000000000
    Trace ID: 0x8000000000000009
    Authorization: 0x0000000000000000
    Budget ID: 0x0000000000000000
    Padding: 0
    Minimum: 0
    Capabilities: 0x00
    Progress: 0
    Progress/Maximum: 0/65536

Frame 21: 282 bytes on wire (2256 bits), 282 bytes captured (2256 bits)
Ethernet II, Src: Send_00 (20:53:45:4e:44:00), Dst: Receive_00 (20:52:45:43:56:00)
Internet Protocol Version 6, Src: fe80::3f:0:0:8, Dst: fe80::3f:0:0:9
Transmission Control Protocol, Src Port: 0, Dst Port: 7114, Seq: 967, Ack: 315, Len: 208
Zilla Frame
    Frame Type ID: 0x40000003
    Frame Type: SIGNAL
    Protocol Type ID: 0x00000000
    Protocol Type: 
    Worker: 0
    Offset: 0x000005b0
    Origin ID: 0x0000000100000010
    Origin Namespace: test
    Origin Binding: app0
    Routed ID: 0x0000000100000002
    Routed Namespace: test
    Routed Binding: net0
    Stream ID: 0x003f000000000009
    Initial ID: 0x003f000000000009
    Reply ID: 0x003f000000000008
    Direction: INI
    Sequence: 0
    Acknowledge: 0
    Maximum: 0
    Timestamp: 0x0000000000000000
    Trace ID: 0x0000000000000000
    Authorization: 0x0000000000000000
    Cancel ID: 0xffffffffffffffff
    Signal ID: 0x80000003
    Context ID: 0x00000004
    Payload
        Length: 68
        Payload

Frame 22: 297 bytes on wire (2376 bits), 297 bytes captured (2376 bits)
Ethernet II, Src: Send_00 (20:53:45:4e:44:00), Dst: Receive_00 (20:52:45:43:56:00)
Internet Protocol Version 6, Src: fe80::1:3f:0:0:10, Dst: fe80::1:3f:0:0:11
Transmission Control Protocol, Src Port: 0, Dst Port: 7114, Seq: 460, Ack: 275, Len: 223
Zilla Frame
    Frame Type ID: 0x00000002
    Frame Type: DATA
    Protocol Type ID: 0x00000000
    Protocol Type: 
    Worker: 1
    Offset: 0x000004c0
    Origin ID: 0x0000000100000010
    Origin Namespace: test
    Origin Binding: app0
    Routed ID: 0x0000000100000002
    Routed Namespace: test
    Routed Binding: net0
    Stream ID: 0x003f000000000011
    Initial ID: 0x003f000000000011
    Reply ID: 0x003f000000000010
    Direction: INI
    Sequence: 125
    Acknowledge: 125
    Maximum: 8192
    Timestamp: 0x0000000000000000
    Trace ID: 0x8000000000000009
    Authorization: 0x0000000000000000
    Flags: 0x03
        .... ...1 = FIN: Set (1)
        .... ..1. = INIT: Set (1)
        .... .0.. = INCOMPLETE: Not set (0)
        .... 0... = SKIP: Not set (0)
    Budget ID: 0x0000000000000002
    Reserved: 86
    Progress: 86
    Progress/Maximum: 86/8192
    Payload
        Length: 86
        Payload

Frame 23: 282 bytes on wire (2256 bits), 282 bytes captured (2256 bits)
Ethernet II, Src: Send_00 (20:53:45:4e:44:00), Dst: Receive_00 (20:52:45:43:56:00)
Internet Protocol Version 6, Src: fe80::3f:0:0:8, Dst: fe80::3f:0:0:9
Transmission Control Protocol, Src Port: 0, Dst Port: 7114, Seq: 1175, Ack: 315, Len: 208
Zilla Frame
    Frame Type ID: 0x40000003
    Frame Type: SIGNAL
    Protocol Type ID: 0x00000000
    Protocol Type: 
    Worker: 0
    Offset: 0x00000658
    Origin ID: 0x0000000100000010
    Origin Namespace: test
    Origin Binding: app0
    Routed ID: 0x0000000100000002
    Routed Namespace: test
    Routed Binding: net0
    Stream ID: 0x003f000000000009
    Initial ID: 0x003f000000000009
    Reply ID: 0x003f000000000008
    Direction: INI
    Sequence: 0
    Acknowledge: 0
    Maximum: 0
    Timestamp: 0x0000000000000000
    Trace ID: 0x0000000000000000
    Authorization: 0x0000000000000000
    Cancel ID: 0xffffffffffffffff
    Signal ID: 0x80000005
    Context ID: 0x00000005
    Payload
        Length: 68
        Payload

Frame 24: 260 bytes on wire (2080 bits), 260 bytes captured (2080 bits)
Ethernet II, Src: Send_00 (20:53:45:4e:44:00), Dst: Receive_00 (20:52:45:43:56:00)
Internet Protocol Version 6, Src: fe80::1:3f00:0:0:3, Dst: fe80::1:3f00:0:0:2
Transmission Control Protocol, Src Port: 7114, Dst Port: 0, Seq: 189, Ack: 138, Len: 186
Zilla Frame
    Frame Type ID: 0x00000005
    Frame Type: FLUSH
    Protocol Type ID: 0x084b20e1
    Protocol Type: kafka
    Worker: 1
    Offset: 0x00000578
    Origin ID: 0x0000000100000010
    Origin Namespace: test
    Origin Binding: app0
    Routed ID: 0x0000000100000010
    Routed Namespace: test
    Routed Binding: app0
    Stream ID: 0x3f00000000000002
    Initial ID: 0x3f00000000000003
    Reply ID: 0x3f00000000000002
    Direction: REP
    Sequence: 0
    Acknowledge: 0
    Maximum: 8192
    Timestamp: 0x0000000000000000
    Trace ID: 0x800000000000000c
    Authorization: 0x0000000000000000
    Budget ID: 0x0000000000000000
    Reserved: 0
    Extension: kafka
        Stream Type ID: 0xe1204b08
        Stream Type: kafka
        API: GROUP (253)
        Generation ID: 0
        Leader ID: memberId-1
            Length: 10
            Leader ID: memberId-1
        Member ID: memberId-1
            Length: 10
            Member ID: memberId-1
        Members (1 items)
            Length: 17
            Size: 1
        Member: memberId-1
            Member ID: memberId-1
                Length: 10
                Member ID: memberId-1
            Metadata Length: 0
                Length (varint32): 01
                Length: 0

Frame 25: 299 bytes on wire (2392 bits), 299 bytes captured (2392 bits)
Ethernet II, Src: Send_00 (20:53:45:4e:44:00), Dst: Receive_00 (20:52:45:43:56:00)
Internet Protocol Version 6, Src: fe80::3f:0:0:8, Dst: fe80::3f:0:0:9
Transmission Control Protocol, Src Port: 0, Dst Port: 7114, Seq: 1383, Ack: 315, Len: 225
Zilla Frame
    Frame Type ID: 0x40000003
    Frame Type: SIGNAL
    Protocol Type ID: 0x00000000
    Protocol Type: 
    Worker: 0
    Offset: 0x00000700
    Origin ID: 0x0000000100000010
    Origin Namespace: test
    Origin Binding: app0
    Routed ID: 0x0000000100000002
    Routed Namespace: test
    Routed Binding: net0
    Stream ID: 0x003f000000000009
    Initial ID: 0x003f000000000009
    Reply ID: 0x003f000000000008
    Direction: INI
    Sequence: 0
    Acknowledge: 0
    Maximum: 0
    Timestamp: 0x0000000000000000
    Trace ID: 0x0000000000000000
    Authorization: 0x0000000000000000
    Cancel ID: 0xffffffffffffffff
    Signal ID: 0x80000006
    Context ID: 0x00000006
    Payload
        Length: 85
        Payload

Frame 26: 211 bytes on wire (1688 bits), 211 bytes captured (1688 bits)
Ethernet II, Src: Send_00 (20:53:45:4e:44:00), Dst: Receive_00 (20:52:45:43:56:00)
Internet Protocol Version 6, Src: fe80::1:3f:0:0:11, Dst: fe80::1:3f:0:0:10
Transmission Control Protocol, Src Port: 7114, Dst Port: 0, Seq: 275, Ack: 683, Len: 137
Zilla Frame
    Frame Type ID: 0x40000002
    Frame Type: WINDOW
    Protocol Type ID: 0x00000000
    Protocol Type: 
    Worker: 1
    Offset: 0x00000608
    Origin ID: 0x0000000100000010
    Origin Namespace: test
    Origin Binding: app0
    Routed ID: 0x0000000100000002
    Routed Namespace: test
    Routed Binding: net0
    Stream ID: 0x003f000000000010
    Initial ID: 0x003f000000000011
    Reply ID: 0x003f000000000010
    Direction: REP
    Sequence: 242
    Acknowledge: 242
    Maximum: 65536
    Timestamp: 0x0000000000000000
    Trace ID: 0x800000000000000c
    Authorization: 0x0000000000000000
    Budget ID: 0x0000000000000000
    Padding: 0
    Minimum: 0
    Capabilities: 0x00
    Progress: 0
    Progress/Maximum: 0/65536

Frame 27: 299 bytes on wire (2392 bits), 299 bytes captured (2392 bits)
Ethernet II, Src: Send_00 (20:53:45:4e:44:00), Dst: Receive_00 (20:52:45:43:56:00)
Internet Protocol Version 6, Src: fe80::3f:0:0:10, Dst: fe80::3f:0:0:11
Transmission Control Protocol, Src Port: 0, Dst Port: 7114, Seq: 287, Ack: 1, Len: 225
Zilla Frame
    Frame Type ID: 0x40000003
    Frame Type: SIGNAL
    Protocol Type ID: 0x00000000
    Protocol Type: 
    Worker: 0
    Offset: 0x000007b8
    Origin ID: 0x0000000100000010
    Origin Namespace: test
    Origin Binding: app0
    Routed ID: 0x0000000100000002
    Routed Namespace: test
    Routed Binding: net0
    Stream ID: 0x003f000000000011
    Initial ID: 0x003f000000000011
    Reply ID: 0x003f000000000010
    Direction: INI
    Sequence: 0
    Acknowledge: 0
    Maximum: 0
    Timestamp: 0x0000000000000000
    Trace ID: 0x0000000000000000
    Authorization: 0x0000000000000000
    Cancel ID: 0xffffffffffffffff
    Signal ID: 0x80000006
    Context ID: 0x00000002
    Payload
        Length: 85
        Payload

Frame 28: 211 bytes on wire (1688 bits), 211 bytes captured (1688 bits)
Ethernet II, Src: Send_00 (20:53:45:4e:44:00), Dst: Receive_00 (20:52:45:43:56:00)
Internet Protocol Version 6, Src: fe80::1:3f00:0:0:2, Dst: fe80::1:3f00:0:0:3
Transmission Control Protocol, Src Port: 0, Dst Port: 7114, Seq: 138, Ack: 375, Len: 137
Zilla Frame
    Frame Type ID: 0x40000002
    Frame Type: WINDOW
    Protocol Type ID: 0x084b20e1
    Protocol Type: kafka
    Worker: 1
    Offset: 0x00000668
    Origin ID: 0x0000000100000010
    Origin Namespace: test
    Origin Binding: app0
    Routed ID: 0x0000000100000010
    Routed Namespace: test
    Routed Binding: app0
    Stream ID: 0x3f00000000000003
    Initial ID: 0x3f00000000000003
    Reply ID: 0x3f00000000000002
    Direction: INI
    Sequence: 256
    Acknowledge: 256
    Maximum: 65280
    Timestamp: 0x0000000000000000
    Trace ID: 0x800000000000000d
    Authorization: 0x0000000000000000
    Budget ID: 0x0000000000000000
    Padding: 256
    Minimum: 0
    Capabilities: 0x00
    Progress: 0
    Progress/Maximum: 0/65280

Frame 29: 202 bytes on wire (1616 bits), 202 bytes captured (1616 bits)
Ethernet II, Src: Send_00 (20:53:45:4e:44:00), Dst: Receive_00 (20:52:45:43:56:00)
Internet Protocol Version 6, Src: fe80::3f:0:0:11, Dst: fe80::3f:0:0:10
Transmission Control Protocol, Src Port: 7114, Dst Port: 0, Seq: 1, Ack: 512, Len: 128
Zilla Frame
    Frame Type ID: 0x00000001
    Frame Type: BEGIN
    Protocol Type ID: 0x00000000
    Protocol Type: 
    Worker: 0
    Offset: 0x00000870
    Origin ID: 0x0000000100000010
    Origin Namespace: test
    Origin Binding: app0
    Routed ID: 0x0000000100000002
    Routed Namespace: test
    Routed Binding: net0
    Stream ID: 0x003f000000000010
    Initial ID: 0x003f000000000011
    Reply ID: 0x003f000000000010
    Direction: REP
    Sequence: 0
    Acknowledge: 0
    Maximum: 0
    Timestamp: 0x0000000000000000
    Trace ID: 0x8000000000000006
    Authorization: 0x0000000000000000
    Affinity: 0x0000000000000000

Frame 30: 279 bytes on wire (2232 bits), 279 bytes captured (2232 bits)
Ethernet II, Src: Send_00 (20:53:45:4e:44:00), Dst: Receive_00 (20:52:45:43:56:00)
Internet Protocol Version 6, Src: fe80::1:3f:0:0:10, Dst: fe80::1:3f:0:0:11
Transmission Control Protocol, Src Port: 0, Dst Port: 7114, Seq: 683, Ack: 412, Len: 205
Zilla Frame
    Frame Type ID: 0x00000002
    Frame Type: DATA
    Protocol Type ID: 0x00000000
    Protocol Type: 
    Worker: 1
    Offset: 0x000006c8
    Origin ID: 0x0000000100000010
    Origin Namespace: test
    Origin Binding: app0
    Routed ID: 0x0000000100000002
    Routed Namespace: test
    Routed Binding: net0
    Stream ID: 0x003f000000000011
    Initial ID: 0x003f000000000011
    Reply ID: 0x003f000000000010
    Direction: INI
    Sequence: 211
    Acknowledge: 211
    Maximum: 8192
    Timestamp: 0x0000000000000000
    Trace ID: 0x800000000000000d
    Authorization: 0x0000000000000000
    Flags: 0x03
        .... ...1 = FIN: Set (1)
        .... ..1. = INIT: Set (1)
        .... .0.. = INCOMPLETE: Not set (0)
        .... 0... = SKIP: Not set (0)
    Budget ID: 0x0000000000000002
    Reserved: 68
    Progress: 68
    Progress/Maximum: 68/8192
    Payload
        Length: 68
        Payload

Frame 31: 211 bytes on wire (1688 bits), 211 bytes captured (1688 bits)
Ethernet II, Src: Send_00 (20:53:45:4e:44:00), Dst: Receive_00 (20:52:45:43:56:00)
Internet Protocol Version 6, Src: fe80::3f:0:0:10, Dst: fe80::3f:0:0:11
Transmission Control Protocol, Src Port: 0, Dst Port: 7114, Seq: 512, Ack: 129, Len: 137
Zilla Frame
    Frame Type ID: 0x40000002
    Frame Type: WINDOW
    Protocol Type ID: 0x00000000
    Protocol Type: 
    Worker: 0
    Offset: 0x000008c8
    Origin ID: 0x0000000100000010
    Origin Namespace: test
    Origin Binding: app0
    Routed ID: 0x0000000100000002
    Routed Namespace: test
    Routed Binding: net0
    Stream ID: 0x003f000000000011
    Initial ID: 0x003f000000000011
    Reply ID: 0x003f000000000010
    Direction: INI
    Sequence: 0
    Acknowledge: 0
    Maximum: 8192
    Timestamp: 0x0000000000000000
    Trace ID: 0x8000000000000007
    Authorization: 0x0000000000000000
    Budget ID: 0x0000000000000000
    Padding: 0
    Minimum: 0
    Capabilities: 0x00
    Progress: 0
    Progress/Maximum: 0/8192

Frame 32: 211 bytes on wire (1688 bits), 211 bytes captured (1688 bits)
Ethernet II, Src: Send_00 (20:53:45:4e:44:00), Dst: Receive_00 (20:52:45:43:56:00)
Internet Protocol Version 6, Src: fe80::1:3f:0:0:11, Dst: fe80::1:3f:0:0:10
Transmission Control Protocol, Src Port: 7114, Dst Port: 0, Seq: 412, Ack: 888, Len: 137
Zilla Frame
    Frame Type ID: 0x40000002
    Frame Type: WINDOW
    Protocol Type ID: 0x00000000
    Protocol Type: 
    Worker: 1
    Offset: 0x00000770
    Origin ID: 0x0000000100000010
    Origin Namespace: test
    Origin Binding: app0
    Routed ID: 0x0000000100000002
    Routed Namespace: test
    Routed Binding: net0
    Stream ID: 0x003f000000000010
    Initial ID: 0x003f000000000011
    Reply ID: 0x003f000000000010
    Direction: REP
    Sequence: 260
    Acknowledge: 260
    Maximum: 65536
    Timestamp: 0x0000000000000000
    Trace ID: 0x800000000000000f
    Authorization: 0x0000000000000000
    Budget ID: 0x0000000000000000
    Padding: 0
    Minimum: 0
    Capabilities: 0x00
    Progress: 0
    Progress/Maximum: 0/65536

Frame 33: 424 bytes on wire (3392 bits), 424 bytes captured (3392 bits)
Ethernet II, Src: Send_00 (20:53:45:4e:44:00), Dst: Receive_00 (20:52:45:43:56:00)
Internet Protocol Version 6, Src: fe80::3f:0:0:10, Dst: fe80::3f:0:0:11
Transmission Control Protocol, Src Port: 0, Dst Port: 7114, Seq: 649, Ack: 129, Len: 350
Zilla Frame
    Frame Type ID: 0x40000003
    Frame Type: SIGNAL
    Protocol Type ID: 0x00000000
    Protocol Type: 
    Worker: 0
    Offset: 0x00000928
    Origin ID: 0x0000000100000010
    Origin Namespace: test
    Origin Binding: app0
    Routed ID: 0x0000000100000002
    Routed Namespace: test
    Routed Binding: net0
    Stream ID: 0x003f000000000011
    Initial ID: 0x003f000000000011
    Reply ID: 0x003f000000000010
    Direction: INI
    Sequence: 0
    Acknowledge: 0
    Maximum: 0
    Timestamp: 0x0000000000000000
    Trace ID: 0x0000000000000000
    Authorization: 0x0000000000000000
    Cancel ID: 0xffffffffffffffff
    Signal ID: 0x80000002
    Context ID: 0x00000003
    Payload
        Length: 210
        Payload

Frame 34: 307 bytes on wire (2456 bits), 307 bytes captured (2456 bits)
Ethernet II, Src: Send_00 (20:53:45:4e:44:00), Dst: Receive_00 (20:52:45:43:56:00)
Internet Protocol Version 6, Src: fe80::1:3f:0:0:10, Dst: fe80::1:3f:0:0:11
Transmission Control Protocol, Src Port: 0, Dst Port: 7114, Seq: 888, Ack: 549, Len: 233
Zilla Frame
    Frame Type ID: 0x00000002
    Frame Type: DATA
    Protocol Type ID: 0x00000000
    Protocol Type: 
    Worker: 1
    Offset: 0x000007d0
    Origin ID: 0x0000000100000010
    Origin Namespace: test
    Origin Binding: app0
    Routed ID: 0x0000000100000002
    Routed Namespace: test
    Routed Binding: net0
    Stream ID: 0x003f000000000011
    Initial ID: 0x003f000000000011
    Reply ID: 0x003f000000000010
    Direction: INI
    Sequence: 279
    Acknowledge: 279
    Maximum: 8192
    Timestamp: 0x0000000000000000
    Trace ID: 0x800000000000000f
    Authorization: 0x0000000000000000
    Flags: 0x03
        .... ...1 = FIN: Set (1)
        .... ..1. = INIT: Set (1)
        .... .0.. = INCOMPLETE: Not set (0)
        .... 0... = SKIP: Not set (0)
    Budget ID: 0x0000000000000002
    Reserved: 96
    Progress: 96
    Progress/Maximum: 96/8192
    Payload
        Length: 96
        Payload

Frame 35: 211 bytes on wire (1688 bits), 211 bytes captured (1688 bits)
Ethernet II, Src: Send_00 (20:53:45:4e:44:00), Dst: Receive_00 (20:52:45:43:56:00)
Internet Protocol Version 6, Src: fe80::3f:0:0:10, Dst: fe80::3f:0:0:11
Transmission Control Protocol, Src Port: 0, Dst Port: 7114, Seq: 999, Ack: 129, Len: 137
Zilla Frame
    Frame Type ID: 0x40000002
    Frame Type: WINDOW
    Protocol Type ID: 0x00000000
    Protocol Type: 
    Worker: 0
    Offset: 0x00000a60
    Origin ID: 0x0000000100000010
    Origin Namespace: test
    Origin Binding: app0
    Routed ID: 0x0000000100000002
    Routed Namespace: test
    Routed Binding: net0
    Stream ID: 0x003f000000000011
    Initial ID: 0x003f000000000011
    Reply ID: 0x003f000000000010
    Direction: INI
    Sequence: 125
    Acknowledge: 125
    Maximum: 8192
    Timestamp: 0x0000000000000000
    Trace ID: 0x8000000000000008
    Authorization: 0x0000000000000000
    Budget ID: 0x0000000000000000
    Padding: 0
    Minimum: 0
    Capabilities: 0x00
    Progress: 0
    Progress/Maximum: 0/8192

Frame 36: 260 bytes on wire (2080 bits), 260 bytes captured (2080 bits)
Ethernet II, Src: Send_00 (20:53:45:4e:44:00), Dst: Receive_00 (20:52:45:43:56:00)
Internet Protocol Version 6, Src: fe80::1:3f00:0:0:3, Dst: fe80::1:3f00:0:0:2
Transmission Control Protocol, Src Port: 7114, Dst Port: 0, Seq: 375, Ack: 275, Len: 186
Zilla Frame
    Frame Type ID: 0x00000005
    Frame Type: FLUSH
    Protocol Type ID: 0x084b20e1
    Protocol Type: kafka
    Worker: 1
    Offset: 0x00000890
    Origin ID: 0x0000000100000010
    Origin Namespace: test
    Origin Binding: app0
    Routed ID: 0x0000000100000010
    Routed Namespace: test
    Routed Binding: app0
    Stream ID: 0x3f00000000000002
    Initial ID: 0x3f00000000000003
    Reply ID: 0x3f00000000000002
    Direction: REP
    Sequence: 0
    Acknowledge: 0
    Maximum: 8192
    Timestamp: 0x0000000000000000
    Trace ID: 0x8000000000000011
    Authorization: 0x0000000000000000
    Budget ID: 0x0000000000000000
    Reserved: 0
    Extension: kafka
        Stream Type ID: 0xe1204b08
        Stream Type: kafka
        API: GROUP (253)
        Generation ID: 1
        Leader ID: memberId-1
            Length: 10
            Leader ID: memberId-1
        Member ID: memberId-1
            Length: 10
            Member ID: memberId-1
        Members (1 items)
            Length: 17
            Size: 1
        Member: memberId-1
            Member ID: memberId-1
                Length: 10
                Member ID: memberId-1
            Metadata Length: 0
                Length (varint32): 01
                Length: 0

Frame 37: 358 bytes on wire (2864 bits), 358 bytes captured (2864 bits)
Ethernet II, Src: Send_00 (20:53:45:4e:44:00), Dst: Receive_00 (20:52:45:43:56:00)
Internet Protocol Version 6, Src: fe80::3f:0:0:11, Dst: fe80::3f:0:0:10
Transmission Control Protocol, Src Port: 7114, Dst Port: 0, Seq: 129, Ack: 1136, Len: 284
Zilla Frame
    Frame Type ID: 0x00000002
    Frame Type: DATA
    Protocol Type ID: 0x00000000
    Protocol Type: 
    Worker: 0
    Offset: 0x00000ac0
    Origin ID: 0x0000000100000010
    Origin Namespace: test
    Origin Binding: app0
    Routed ID: 0x0000000100000002
    Routed Namespace: test
    Routed Binding: net0
    Stream ID: 0x003f000000000010
    Initial ID: 0x003f000000000011
    Reply ID: 0x003f000000000010
    Direction: REP
    Sequence: 0
    Acknowledge: 0
    Maximum: 65536
    Timestamp: 0x0000000000000000
    Trace ID: 0x8000000000000009
    Authorization: 0x0000000000000000
    Flags: 0x03
        .... ...1 = FIN: Set (1)
        .... ..1. = INIT: Set (1)
        .... .0.. = INCOMPLETE: Not set (0)
        .... 0... = SKIP: Not set (0)
    Budget ID: 0x0000000000000000
    Reserved: 147
    Progress: 147
    Progress/Maximum: 147/65536
    Payload
        Length: 147
        Payload

Frame 38: 211 bytes on wire (1688 bits), 211 bytes captured (1688 bits)
Ethernet II, Src: Send_00 (20:53:45:4e:44:00), Dst: Receive_00 (20:52:45:43:56:00)
Internet Protocol Version 6, Src: fe80::1:3f:0:0:11, Dst: fe80::1:3f:0:0:10
Transmission Control Protocol, Src Port: 7114, Dst Port: 0, Seq: 549, Ack: 1121, Len: 137
Zilla Frame
    Frame Type ID: 0x40000002
    Frame Type: WINDOW
    Protocol Type ID: 0x00000000
    Protocol Type: 
    Worker: 1
    Offset: 0x00000920
    Origin ID: 0x0000000100000010
    Origin Namespace: test
    Origin Binding: app0
    Routed ID: 0x0000000100000002
    Routed Namespace: test
    Routed Binding: net0
    Stream ID: 0x003f000000000010
    Initial ID: 0x003f000000000011
    Reply ID: 0x003f000000000010
    Direction: REP
    Sequence: 355
    Acknowledge: 355
    Maximum: 65536
    Timestamp: 0x0000000000000000
    Trace ID: 0x8000000000000011
    Authorization: 0x0000000000000000
    Budget ID: 0x0000000000000000
    Padding: 0
    Minimum: 0
    Capabilities: 0x00
    Progress: 0
    Progress/Maximum: 0/65536

Frame 39: 360 bytes on wire (2880 bits), 360 bytes captured (2880 bits)
Ethernet II, Src: Send_00 (20:53:45:4e:44:00), Dst: Receive_00 (20:52:45:43:56:00)
Internet Protocol Version 6, Src: fe80::3f:0:0:10, Dst: fe80::3f:0:0:11
Transmission Control Protocol, Src Port: 0, Dst Port: 7114, Seq: 1136, Ack: 413, Len: 286
Zilla Frame
    Frame Type ID: 0x40000003
    Frame Type: SIGNAL
    Protocol Type ID: 0x00000000
    Protocol Type: 
    Worker: 0
    Offset: 0x00000bb0
    Origin ID: 0x0000000100000010
    Origin Namespace: test
    Origin Binding: app0
    Routed ID: 0x0000000100000002
    Routed Namespace: test
    Routed Binding: net0
    Stream ID: 0x003f000000000011
    Initial ID: 0x003f000000000011
    Reply ID: 0x003f000000000010
    Direction: INI
    Sequence: 0
    Acknowledge: 0
    Maximum: 0
    Timestamp: 0x0000000000000000
    Trace ID: 0x0000000000000000
    Authorization: 0x0000000000000000
    Cancel ID: 0xffffffffffffffff
    Signal ID: 0x80000001
    Context ID: 0x00000004
    Payload
        Length: 146
        Payload

Frame 40: 211 bytes on wire (1688 bits), 211 bytes captured (1688 bits)
Ethernet II, Src: Send_00 (20:53:45:4e:44:00), Dst: Receive_00 (20:52:45:43:56:00)
Internet Protocol Version 6, Src: fe80::1:3f00:0:0:2, Dst: fe80::1:3f00:0:0:3
Transmission Control Protocol, Src Port: 0, Dst Port: 7114, Seq: 275, Ack: 561, Len: 137
Zilla Frame
    Frame Type ID: 0x40000002
    Frame Type: WINDOW
    Protocol Type ID: 0x084b20e1
    Protocol Type: kafka
    Worker: 1
    Offset: 0x00000980
    Origin ID: 0x0000000100000010
    Origin Namespace: test
    Origin Binding: app0
    Routed ID: 0x0000000100000010
    Routed Namespace: test
    Routed Binding: app0
    Stream ID: 0x3f00000000000003
    Initial ID: 0x3f00000000000003
    Reply ID: 0x3f00000000000002
    Direction: INI
    Sequence: 512
    Acknowledge: 512
    Maximum: 65280
    Timestamp: 0x0000000000000000
    Trace ID: 0x8000000000000012
    Authorization: 0x0000000000000000
    Budget ID: 0x0000000000000000
    Padding: 256
    Minimum: 0
    Capabilities: 0x00
    Progress: 0
    Progress/Maximum: 0/65280

Frame 41: 282 bytes on wire (2256 bits), 282 bytes captured (2256 bits)
Ethernet II, Src: Send_00 (20:53:45:4e:44:00), Dst: Receive_00 (20:52:45:43:56:00)
Internet Protocol Version 6, Src: fe80::3f:0:0:10, Dst: fe80::3f:0:0:11
Transmission Control Protocol, Src Port: 0, Dst Port: 7114, Seq: 1422, Ack: 413, Len: 208
Zilla Frame
    Frame Type ID: 0x40000003
    Frame Type: SIGNAL
    Protocol Type ID: 0x00000000
    Protocol Type: 
    Worker: 0
    Offset: 0x00000ca8
    Origin ID: 0x0000000100000010
    Origin Namespace: test
    Origin Binding: app0
    Routed ID: 0x0000000100000002
    Routed Namespace: test
    Routed Binding: net0
    Stream ID: 0x003f000000000011
    Initial ID: 0x003f000000000011
    Reply ID: 0x003f000000000010
    Direction: INI
    Sequence: 0
    Acknowledge: 0
    Maximum: 0
    Timestamp: 0x0000000000000000
    Trace ID: 0x0000000000000000
    Authorization: 0x0000000000000000
    Cancel ID: 0xffffffffffffffff
    Signal ID: 0x80000003
    Context ID: 0x00000005
    Payload
        Length: 68
        Payload

Frame 42: 279 bytes on wire (2232 bits), 279 bytes captured (2232 bits)
Ethernet II, Src: Send_00 (20:53:45:4e:44:00), Dst: Receive_00 (20:52:45:43:56:00)
Internet Protocol Version 6, Src: fe80::1:3f:0:0:10, Dst: fe80::1:3f:0:0:11
Transmission Control Protocol, Src Port: 0, Dst Port: 7114, Seq: 1121, Ack: 686, Len: 205
Zilla Frame
    Frame Type ID: 0x00000002
    Frame Type: DATA
    Protocol Type ID: 0x00000000
    Protocol Type: 
    Worker: 1
    Offset: 0x000009e0
    Origin ID: 0x0000000100000010
    Origin Namespace: test
    Origin Binding: app0
    Routed ID: 0x0000000100000002
    Routed Namespace: test
    Routed Binding: net0
    Stream ID: 0x003f000000000011
    Initial ID: 0x003f000000000011
    Reply ID: 0x003f000000000010
    Direction: INI
    Sequence: 375
    Acknowledge: 375
    Maximum: 8192
    Timestamp: 0x0000000000000000
    Trace ID: 0x8000000000000012
    Authorization: 0x0000000000000000
    Flags: 0x03
        .... ...1 = FIN: Set (1)
        .... ..1. = INIT: Set (1)
        .... .0.. = INCOMPLETE: Not set (0)
        .... 0... = SKIP: Not set (0)
    Budget ID: 0x0000000000000002
    Reserved: 68
    Progress: 68
    Progress/Maximum: 68/8192
    Payload
        Length: 68
        Payload

Frame 43: 299 bytes on wire (2392 bits), 299 bytes captured (2392 bits)
Ethernet II, Src: Send_00 (20:53:45:4e:44:00), Dst: Receive_00 (20:52:45:43:56:00)
Internet Protocol Version 6, Src: fe80::3f:0:0:10, Dst: fe80::3f:0:0:11
Transmission Control Protocol, Src Port: 0, Dst Port: 7114, Seq: 1630, Ack: 413, Len: 225
Zilla Frame
    Frame Type ID: 0x40000003
    Frame Type: SIGNAL
    Protocol Type ID: 0x00000000
    Protocol Type: 
    Worker: 0
    Offset: 0x00000d50
    Origin ID: 0x0000000100000010
    Origin Namespace: test
    Origin Binding: app0
    Routed ID: 0x0000000100000002
    Routed Namespace: test
    Routed Binding: net0
    Stream ID: 0x003f000000000011
    Initial ID: 0x003f000000000011
    Reply ID: 0x003f000000000010
    Direction: INI
    Sequence: 0
    Acknowledge: 0
    Maximum: 0
    Timestamp: 0x0000000000000000
    Trace ID: 0x0000000000000000
    Authorization: 0x0000000000000000
    Cancel ID: 0xffffffffffffffff
    Signal ID: 0x80000006
    Context ID: 0x00000006
    Payload
        Length: 85
        Payload

Frame 44: 211 bytes on wire (1688 bits), 211 bytes captured (1688 bits)
Ethernet II, Src: Send_00 (20:53:45:4e:44:00), Dst: Receive_00 (20:52:45:43:56:00)
Internet Protocol Version 6, Src: fe80::1:3f00:0:0:3, Dst: fe80::1:3f00:0:0:2
Transmission Control Protocol, Src Port: 7114, Dst Port: 0, Seq: 561, Ack: 412, Len: 137
Zilla Frame
    Frame Type ID: 0x00000002
    Frame Type: DATA
    Protocol Type ID: 0x084b20e1
    Protocol Type: kafka
    Worker: 1
    Offset: 0x00000a88
    Origin ID: 0x0000000100000010
    Origin Namespace: test
    Origin Binding: app0
    Routed ID: 0x0000000100000010
    Routed Namespace: test
    Routed Binding: app0
    Stream ID: 0x3f00000000000002
    Initial ID: 0x3f00000000000003
    Reply ID: 0x3f00000000000002
    Direction: REP
    Sequence: 0
    Acknowledge: 0
    Maximum: 8192
    Timestamp: 0x0000000000000000
    Trace ID: 0x8000000000000014
    Authorization: 0x0000000000000000
    Flags: 0x03
        .... ...1 = FIN: Set (1)
        .... ..1. = INIT: Set (1)
        .... .0.. = INCOMPLETE: Not set (0)
        .... 0... = SKIP: Not set (0)
    Budget ID: 0x0000000000000000
    Reserved: 0
    Progress: 0
    Progress/Maximum: 0/8192
    Payload
        Length: 0

Frame 45: 299 bytes on wire (2392 bits), 299 bytes captured (2392 bits)
Ethernet II, Src: Send_00 (20:53:45:4e:44:00), Dst: Receive_00 (20:52:45:43:56:00)
Internet Protocol Version 6, Src: fe80::3f:0:0:10, Dst: fe80::3f:0:0:11
Transmission Control Protocol, Src Port: 0, Dst Port: 7114, Seq: 1855, Ack: 413, Len: 225
Zilla Frame
    Frame Type ID: 0x40000003
    Frame Type: SIGNAL
    Protocol Type ID: 0x00000000
    Protocol Type: 
    Worker: 0
    Offset: 0x00000e08
    Origin ID: 0x0000000100000010
    Origin Namespace: test
    Origin Binding: app0
    Routed ID: 0x0000000100000002
    Routed Namespace: test
    Routed Binding: net0
    Stream ID: 0x003f000000000011
    Initial ID: 0x003f000000000011
    Reply ID: 0x003f000000000010
    Direction: INI
    Sequence: 0
    Acknowledge: 0
    Maximum: 0
    Timestamp: 0x0000000000000000
    Trace ID: 0x0000000000000000
    Authorization: 0x0000000000000000
    Cancel ID: 0xffffffffffffffff
    Signal ID: 0x80000006
    Context ID: 0x00000007
    Payload
        Length: 85
        Payload

Frame 46: 211 bytes on wire (1688 bits), 211 bytes captured (1688 bits)
Ethernet II, Src: Send_00 (20:53:45:4e:44:00), Dst: Receive_00 (20:52:45:43:56:00)
Internet Protocol Version 6, Src: fe80::1:3f:0:0:11, Dst: fe80::1:3f:0:0:10
Transmission Control Protocol, Src Port: 7114, Dst Port: 0, Seq: 686, Ack: 1326, Len: 137
Zilla Frame
    Frame Type ID: 0x40000002
    Frame Type: WINDOW
    Protocol Type ID: 0x00000000
    Protocol Type: 
    Worker: 1
    Offset: 0x00000ae8
    Origin ID: 0x0000000100000010
    Origin Namespace: test
    Origin Binding: app0
    Routed ID: 0x0000000100000002
    Routed Namespace: test
    Routed Binding: net0
    Stream ID: 0x003f000000000010
    Initial ID: 0x003f000000000011
    Reply ID: 0x003f000000000010
    Direction: REP
    Sequence: 373
    Acknowledge: 373
    Maximum: 65536
    Timestamp: 0x0000000000000000
    Trace ID: 0x8000000000000014
    Authorization: 0x0000000000000000
    Budget ID: 0x0000000000000000
    Padding: 0
    Minimum: 0
    Capabilities: 0x00
    Progress: 0
    Progress/Maximum: 0/65536

Frame 47: 385 bytes on wire (3080 bits), 385 bytes captured (3080 bits)
Ethernet II, Src: Send_00 (20:53:45:4e:44:00), Dst: Receive_00 (20:52:45:43:56:00)
Internet Protocol Version 6, Src: fe80::3f:0:0:10, Dst: fe80::3f:0:0:11
Transmission Control Protocol, Src Port: 0, Dst Port: 7114, Seq: 2080, Ack: 413, Len: 311
Zilla Frame
    Frame Type ID: 0x40000003
    Frame Type: SIGNAL
    Protocol Type ID: 0x00000000
    Protocol Type: 
    Worker: 0
    Offset: 0x00000ec0
    Origin ID: 0x0000000100000010
    Origin Namespace: test
    Origin Binding: app0
    Routed ID: 0x0000000100000002
    Routed Namespace: test
    Routed Binding: net0
    Stream ID: 0x003f000000000011
    Initial ID: 0x003f000000000011
    Reply ID: 0x003f000000000010
    Direction: INI
    Sequence: 0
    Acknowledge: 0
    Maximum: 0
    Timestamp: 0x0000000000000000
    Trace ID: 0x0000000000000000
    Authorization: 0x0000000000000000
    Cancel ID: 0xffffffffffffffff
    Signal ID: 0x80000002
    Context ID: 0x00000008
    Payload
        Length: 171
        Payload
