Frame 1: 198 bytes on wire (1584 bits), 198 bytes captured (1584 bits)
Ethernet II, Src: Send_00 (20:53:45:4e:44:00), Dst: Receive_00 (20:52:45:43:56:00)
Internet Protocol Version 6, Src: fe80::1, Dst: fe80::
Transmission Control Protocol, Src Port: 7114, Dst Port: 0, Seq: 1, Ack: 1, Len: 124
Zilla Frame
    Frame Type ID: 0x40000003
    Frame Type: SIGNAL
    Protocol Type ID: 0x00000000
    Protocol Type: 
    Worker: 0
    Offset: 0x00000000
    Origin ID: 0x0000000000000000
    Routed ID: 0x0000000000000000
    Stream ID: 0x0000000000000000
    Direction: 
    Sequence: 0
    Acknowledge: 0
    Maximum: 0
    Timestamp: 0x0000000000000000
    Trace ID: 0x0000000000000001
    Authorization: 0x0000000000000000
    Cancel ID: 0xffffffffffffffff
    Signal ID: 0x00000001
    Context ID: 0x00000000
    Payload
        Length: -1

Frame 2: 252 bytes on wire (2016 bits), 252 bytes captured (2016 bits)
Ethernet II, Src: Send_00 (20:53:45:4e:44:00), Dst: Receive_00 (20:52:45:43:56:00)
Internet Protocol Version 6, Src: fe80::1:3f:0:0:8, Dst: fe80::1:3f:0:0:9
Transmission Control Protocol, Src Port: 0, Dst Port: 7114, Seq: 0, Ack: 1, Len: 178
Zilla Frame
    Frame Type ID: 0x00000001
    Frame Type: BEGIN
    Protocol Type ID: 0x00000000
    Protocol Type: 
    Worker: 1
    Offset: 0x00000000
    Origin ID: 0x0000000100000010
    Origin Namespace: test
    Origin Binding: app0
    Routed ID: 0x0000000100000002
    Routed Namespace: test
    Routed Binding: net0
    Stream ID: 0x003f000000000009
    Initial ID: 0x003f000000000009
    Reply ID: 0x003f000000000008
    Direction: INI
    Sequence: 0
    Acknowledge: 0
    Maximum: 0
    Timestamp: 0x0000000000000000
    Trace ID: 0x8000000000000001
    Authorization: 0x0000000000000000
    Affinity: 0x0000000000000000
    Extension: proxy
        Stream Type ID: 0x50a8ce8d
        Stream Type: proxy
        Address: INET
            Family: INET (0)
            Protocol: STREAM (0)
            Source: 0.0.0.0
            Source Port: 0
            Destination: localhost
            Destination Port: 9092
        Info (1 items)
            Length: 16
            Size: 1
        Info: AUTHORITY: localhost
            Type: AUTHORITY (0x02)
            Length: 9
            Value: localhost

Frame 3: 303 bytes on wire (2424 bits), 303 bytes captured (2424 bits)
Ethernet II, Src: Send_00 (20:53:45:4e:44:00), Dst: Receive_00 (20:52:45:43:56:00)
Internet Protocol Version 6, Src: fe80::3f00:0:0:2, Dst: fe80::3f00:0:0:3
Transmission Control Protocol, Src Port: 0, Dst Port: 7114, Seq: 0, Ack: 1, Len: 229
Zilla Frame
    Frame Type ID: 0x00000001
    Frame Type: BEGIN
    Protocol Type ID: 0x084b20e1
    Protocol Type: kafka
    Worker: 0
    Offset: 0x00000060
    Origin ID: 0x0000000100000010
    Origin Namespace: test
    Origin Binding: app0
    Routed ID: 0x0000000100000010
    Routed Namespace: test
    Routed Binding: app0
    Stream ID: 0x3f00000000000003
    Initial ID: 0x3f00000000000003
    Reply ID: 0x3f00000000000002
    Direction: INI
    Sequence: 0
    Acknowledge: 0
    Maximum: 0
    Timestamp: 0x0000000000000000
    Trace ID: 0x8000000000000001
    Authorization: 0x0000000000000000
    Affinity: 0x0000000000000000
    Extension: kafka
        Stream Type ID: 0xe1204b08
        Stream Type: kafka
        API: MERGED (255)
        Capabilities: FETCH_ONLY (2)
        Topic: test
            Length: 4
            Topic: test
        Group ID: 
            Length: -1
            Group ID: 
        Consumer ID: 
            Length: -1
            Consumer ID: 
        Timeout: 0
        Partitions (2 items)
            Length: 64
            Size: 2
        Partition: 0 [0]
            Partition ID: 0
            Partition Offset: 0
            Stable Offset: -1
            Latest Offset: -1
            Metadata: 
                Length: -1
                Metadata: 
        Partition: 1 [0]
            Partition ID: 1
            Partition Offset: 0
            Stable Offset: -1
            Latest Offset: -1
            Metadata: 
                Length: -1
                Metadata: 
        Filters (0 items)
            Length: 4
            Size: 0
        Evaluation: LAZY (0)
        Isolation: READ_COMMITTED (1)
        Delta Type: NONE (0)
        Ack Mode ID: -1
        Ack Mode: IN_SYNC_REPLICAS

Frame 4: 211 bytes on wire (1688 bits), 211 bytes captured (1688 bits)
Ethernet II, Src: Send_00 (20:53:45:4e:44:00), Dst: Receive_00 (20:52:45:43:56:00)
Internet Protocol Version 6, Src: fe80::1:3f:0:0:9, Dst: fe80::1:3f:0:0:8
Transmission Control Protocol, Src Port: 7114, Dst Port: 0, Seq: 1, Ack: 178, Len: 137
Zilla Frame
    Frame Type ID: 0x40000002
    Frame Type: WINDOW
    Protocol Type ID: 0x00000000
    Protocol Type: 
    Worker: 1
    Offset: 0x00000088
    Origin ID: 0x0000000100000010
    Origin Namespace: test
    Origin Binding: app0
    Routed ID: 0x0000000100000002
    Routed Namespace: test
    Routed Binding: net0
    Stream ID: 0x003f000000000008
    Initial ID: 0x003f000000000009
    Reply ID: 0x003f000000000008
    Direction: REP
    Sequence: 0
    Acknowledge: 0
    Maximum: 8192
    Timestamp: 0x0000000000000000
    Trace ID: 0x8000000000000001
    Authorization: 0x0000000000000000
    Budget ID: 0x0000000000000000
    Padding: 0
    Minimum: 0
    Capabilities: 0x00
    Progress: 0
    Progress/Maximum: 0/8192

Frame 5: 429 bytes on wire (3432 bits), 429 bytes captured (3432 bits)
Ethernet II, Src: Send_00 (20:53:45:4e:44:00), Dst: Receive_00 (20:52:45:43:56:00)
Internet Protocol Version 6, Src: fe80::2, Dst: fe80::3
Transmission Control Protocol, Src Port: 0, Dst Port: 7114, Seq: 0, Ack: 1, Len: 355
Zilla Frame
    Frame Type ID: 0x00000001
    Frame Type: BEGIN
    Protocol Type ID: 0x084b20e1
    Protocol Type: kafka
    Worker: 0
    Offset: 0x00000120
    Origin ID: 0x0000000100000010
    Origin Namespace: test
    Origin Binding: app0
    Routed ID: 0x0000000100000010
    Routed Namespace: test
    Routed Binding: app0
    Stream ID: 0x0000000000000003
    Initial ID: 0x0000000000000003
    Reply ID: 0x0000000000000002
    Direction: INI
    Sequence: 0
    Acknowledge: 0
    Maximum: 0
    Timestamp: 0x0000000000000000
    Trace ID: 0x8000000000000001
    Authorization: 0x0000000000000000
    Affinity: 0x0000000000000000
    Extension: kafka
        Stream Type ID: 0xe1204b08
        Stream Type: kafka
        API: DESCRIBE (32)
        Topic: test
            Length: 4
            Topic: test
        Configs (11 items)
            Length: 212
            Size: 11
        Config: cleanup.policy
            Length: 14
            Config: cleanup.policy
        Config: max.message.bytes
            Length: 17
            Config: max.message.bytes
        Config: segment.bytes
            Length: 13
            Config: segment.bytes
        Config: segment.index.bytes
            Length: 19
            Config: segment.index.bytes
        Config: segment.ms
            Length: 10
            Config: segment.ms
        Config: retention.bytes
            Length: 15
            Config: retention.bytes
        Config: retention.ms
            Length: 12
            Config: retention.ms
        Config: delete.retention.ms
            Length: 19
            Config: delete.retention.ms
        Config: min.compaction.lag.ms
            Length: 21
            Config: min.compaction.lag.ms
        Config: max.compaction.lag.ms
            Length: 21
            Config: max.compaction.lag.ms
        Config: min.cleanable.dirty.ratio
            Length: 25
            Config: min.cleanable.dirty.ratio

Frame 6: 453 bytes on wire (3624 bits), 453 bytes captured (3624 bits)
Ethernet II, Src: Send_00 (20:53:45:4e:44:00), Dst: Receive_00 (20:52:45:43:56:00)
Internet Protocol Version 6, Src: fe80::1:3f:0:0:8, Dst: fe80::1:3f:0:0:9
Transmission Control Protocol, Src Port: 0, Dst Port: 7114, Seq: 178, Ack: 138, Len: 379
Zilla Frame
    Frame Type ID: 0x00000002
    Frame Type: DATA
    Protocol Type ID: 0x00000000
    Protocol Type: 
    Worker: 1
    Offset: 0x000000e8
    Origin ID: 0x0000000100000010
    Origin Namespace: test
    Origin Binding: app0
    Routed ID: 0x0000000100000002
    Routed Namespace: test
    Routed Binding: net0
    Stream ID: 0x003f000000000009
    Initial ID: 0x003f000000000009
    Reply ID: 0x003f000000000008
    Direction: INI
    Sequence: 0
    Acknowledge: 0
    Maximum: 8192
    Timestamp: 0x0000000000000000
    Trace ID: 0x8000000000000003
    Authorization: 0x0000000000000000
    Flags: 0x03
        .... ...1 = FIN: Set (1)
        .... ..1. = INIT: Set (1)
        .... .0.. = INCOMPLETE: Not set (0)
        .... 0... = SKIP: Not set (0)
    Budget ID: 0x0000000000000001
    Reserved: 242
    Progress: 242
    Progress/Maximum: 242/8192
    Payload
        Length: 242
        Payload

Frame 7: 340 bytes on wire (2720 bits), 340 bytes captured (2720 bits)
Ethernet II, Src: Send_00 (20:53:45:4e:44:00), Dst: Receive_00 (20:52:45:43:56:00)
Internet Protocol Version 6, Src: fe80::3f:0:0:8, Dst: fe80::3f:0:0:9
Transmission Control Protocol, Src Port: 0, Dst Port: 7114, Seq: 1, Ack: 1, Len: 266
Zilla Frame
    Frame Type ID: 0x40000003
    Frame Type: SIGNAL
    Protocol Type ID: 0x00000000
    Protocol Type: 
    Worker: 0
    Offset: 0x00000258
    Origin ID: 0x0000000100000010
    Origin Namespace: test
    Origin Binding: app0
    Routed ID: 0x0000000100000002
    Routed Namespace: test
    Routed Binding: net0
    Stream ID: 0x003f000000000009
    Initial ID: 0x003f000000000009
    Reply ID: 0x003f000000000008
    Direction: INI
    Sequence: 0
    Acknowledge: 0
    Maximum: 0
    Timestamp: 0x0000000000000000
    Trace ID: 0x0000000000000000
    Authorization: 0x0000000000000000
    Cancel ID: 0xffffffffffffffff
    Signal ID: 0x80000001
    Context ID: 0x00000001
    Payload
        Length: 126
        Payload

Frame 8: 211 bytes on wire (1688 bits), 211 bytes captured (1688 bits)
Ethernet II, Src: Send_00 (20:53:45:4e:44:00), Dst: Receive_00 (20:52:45:43:56:00)
Internet Protocol Version 6, Src: fe80::1:3f00:0:0:2, Dst: fe80::1:3f00:0:0:3
Transmission Control Protocol, Src Port: 0, Dst Port: 7114, Seq: 1, Ack: 1, Len: 137
Zilla Frame
    Frame Type ID: 0x40000002
    Frame Type: WINDOW
    Protocol Type ID: 0x084b20e1
    Protocol Type: kafka
    Worker: 1
    Offset: 0x00000238
    Origin ID: 0x0000000100000010
    Origin Namespace: test
    Origin Binding: app0
    Routed ID: 0x0000000100000010
    Routed Namespace: test
    Routed Binding: app0
    Stream ID: 0x3f00000000000003
    Initial ID: 0x3f00000000000003
    Reply ID: 0x3f00000000000002
    Direction: INI
    Sequence: 0
    Acknowledge: 0
    Maximum: 0
    Timestamp: 0x0000000000000000
    Trace ID: 0x8000000000000005
    Authorization: 0x0000000000000000
    Budget ID: 0x0000000000000000
    Padding: 0
    Minimum: 0
    Capabilities: 0x00
    Progress: 0
    Progress/Maximum: 0/0

Frame 9: 299 bytes on wire (2392 bits), 299 bytes captured (2392 bits)
Ethernet II, Src: Send_00 (20:53:45:4e:44:00), Dst: Receive_00 (20:52:45:43:56:00)
Internet Protocol Version 6, Src: fe80::3f:0:0:8, Dst: fe80::3f:0:0:9
Transmission Control Protocol, Src Port: 0, Dst Port: 7114, Seq: 267, Ack: 1, Len: 225
Zilla Frame
    Frame Type ID: 0x40000003
    Frame Type: SIGNAL
    Protocol Type ID: 0x00000000
    Protocol Type: 
    Worker: 0
    Offset: 0x00000338
    Origin ID: 0x0000000100000010
    Origin Namespace: test
    Origin Binding: app0
    Routed ID: 0x0000000100000002
    Routed Namespace: test
    Routed Binding: net0
    Stream ID: 0x003f000000000009
    Initial ID: 0x003f000000000009
    Reply ID: 0x003f000000000008
    Direction: INI
    Sequence: 0
    Acknowledge: 0
    Maximum: 0
    Timestamp: 0x0000000000000000
    Trace ID: 0x0000000000000000
    Authorization: 0x0000000000000000
    Cancel ID: 0xffffffffffffffff
    Signal ID: 0x80000006
    Context ID: 0x00000002
    Payload
        Length: 85
        Payload

Frame 10: 211 bytes on wire (1688 bits), 211 bytes captured (1688 bits)
Ethernet II, Src: Send_00 (20:53:45:4e:44:00), Dst: Receive_00 (20:52:45:43:56:00)
Internet Protocol Version 6, Src: fe80::1:3f:0:0:9, Dst: fe80::1:3f:0:0:8
Transmission Control Protocol, Src Port: 7114, Dst Port: 0, Seq: 138, Ack: 557, Len: 137
Zilla Frame
    Frame Type ID: 0x40000002
    Frame Type: WINDOW
    Protocol Type ID: 0x00000000
    Protocol Type: 
    Worker: 1
    Offset: 0x00000298
    Origin ID: 0x0000000100000010
    Origin Namespace: test
    Origin Binding: app0
    Routed ID: 0x0000000100000002
    Routed Namespace: test
    Routed Binding: net0
    Stream ID: 0x003f000000000008
    Initial ID: 0x003f000000000009
    Reply ID: 0x003f000000000008
    Direction: REP
    Sequence: 376
    Acknowledge: 376
    Maximum: 8192
    Timestamp: 0x0000000000000000
    Trace ID: 0x8000000000000005
    Authorization: 0x0000000000000000
    Budget ID: 0x0000000000000000
    Padding: 0
    Minimum: 0
    Capabilities: 0x00
    Progress: 0
    Progress/Maximum: 0/8192

Frame 11: 202 bytes on wire (1616 bits), 202 bytes captured (1616 bits)
Ethernet II, Src: Send_00 (20:53:45:4e:44:00), Dst: Receive_00 (20:52:45:43:56:00)
Internet Protocol Version 6, Src: fe80::3f:0:0:9, Dst: fe80::3f:0:0:8
Transmission Control Protocol, Src Port: 7114, Dst Port: 0, Seq: 1, Ack: 492, Len: 128
Zilla Frame
    Frame Type ID: 0x00000001
    Frame Type: BEGIN
    Protocol Type ID: 0x00000000
    Protocol Type: 
    Worker: 0
    Offset: 0x000003f0
    Origin ID: 0x0000000100000010
    Origin Namespace: test
    Origin Binding: app0
    Routed ID: 0x0000000100000002
    Routed Namespace: test
    Routed Binding: net0
    Stream ID: 0x003f000000000008
    Initial ID: 0x003f000000000009
    Reply ID: 0x003f000000000008
    Direction: REP
    Sequence: 0
    Acknowledge: 0
    Maximum: 0
    Timestamp: 0x0000000000000000
    Trace ID: 0x8000000000000002
    Authorization: 0x0000000000000000
    Affinity: 0x0000000000000000

Frame 12: 241 bytes on wire (1928 bits), 241 bytes captured (1928 bits)
Ethernet II, Src: Send_00 (20:53:45:4e:44:00), Dst: Receive_00 (20:52:45:43:56:00)
Internet Protocol Version 6, Src: fe80::1:3f:0:0:8, Dst: fe80::1:3f:0:0:9
Transmission Control Protocol, Src Port: 0, Dst Port: 7114, Seq: 557, Ack: 275, Len: 167
Zilla Frame
    Frame Type ID: 0x00000002
    Frame Type: DATA
    Protocol Type ID: 0x00000000
    Protocol Type: 
    Worker: 1
    Offset: 0x000002f8
    Origin ID: 0x0000000100000010
    Origin Namespace: test
    Origin Binding: app0
    Routed ID: 0x0000000100000002
    Routed Namespace: test
    Routed Binding: net0
    Stream ID: 0x003f000000000009
    Initial ID: 0x003f000000000009
    Reply ID: 0x003f000000000008
    Direction: INI
    Sequence: 242
    Acknowledge: 242
    Maximum: 8192
    Timestamp: 0x0000000000000000
    Trace ID: 0x8000000000000005
    Authorization: 0x0000000000000000
    Flags: 0x03
        .... ...1 = FIN: Set (1)
        .... ..1. = INIT: Set (1)
        .... .0.. = INCOMPLETE: Not set (0)
        .... 0... = SKIP: Not set (0)
    Budget ID: 0x0000000000000001
    Reserved: 30
    Progress: 30
    Progress/Maximum: 30/8192
    Payload
        Length: 30
        Payload

Frame 13: 211 bytes on wire (1688 bits), 211 bytes captured (1688 bits)
Ethernet II, Src: Send_00 (20:53:45:4e:44:00), Dst: Receive_00 (20:52:45:43:56:00)
Internet Protocol Version 6, Src: fe80::3f:0:0:8, Dst: fe80::3f:0:0:9
Transmission Control Protocol, Src Port: 0, Dst Port: 7114, Seq: 492, Ack: 129, Len: 137
Zilla Frame
    Frame Type ID: 0x40000002
    Frame Type: WINDOW
    Protocol Type ID: 0x00000000
    Protocol Type: 
    Worker: 0
    Offset: 0x00000448
    Origin ID: 0x0000000100000010
    Origin Namespace: test
    Origin Binding: app0
    Routed ID: 0x0000000100000002
    Routed Namespace: test
    Routed Binding: net0
    Stream ID: 0x003f000000000009
    Initial ID: 0x003f000000000009
    Reply ID: 0x003f000000000008
    Direction: INI
    Sequence: 0
    Acknowledge: 0
    Maximum: 8192
    Timestamp: 0x0000000000000000
    Trace ID: 0x8000000000000003
    Authorization: 0x0000000000000000
    Budget ID: 0x0000000000000000
    Padding: 0
    Minimum: 0
    Capabilities: 0x00
    Progress: 0
    Progress/Maximum: 0/8192

Frame 14: 211 bytes on wire (1688 bits), 211 bytes captured (1688 bits)
Ethernet II, Src: Send_00 (20:53:45:4e:44:00), Dst: Receive_00 (20:52:45:43:56:00)
Internet Protocol Version 6, Src: fe80::1:3f:0:0:9, Dst: fe80::1:3f:0:0:8
Transmission Control Protocol, Src Port: 7114, Dst Port: 0, Seq: 275, Ack: 724, Len: 137
Zilla Frame
    Frame Type ID: 0x40000002
    Frame Type: WINDOW
    Protocol Type ID: 0x00000000
    Protocol Type: 
    Worker: 1
    Offset: 0x00000378
    Origin ID: 0x0000000100000010
    Origin Namespace: test
    Origin Binding: app0
    Routed ID: 0x0000000100000002
    Routed Namespace: test
    Routed Binding: net0
    Stream ID: 0x003f000000000008
    Initial ID: 0x003f000000000009
    Reply ID: 0x003f000000000008
    Direction: REP
    Sequence: 530
    Acknowledge: 530
    Maximum: 8192
    Timestamp: 0x0000000000000000
    Trace ID: 0x8000000000000007
    Authorization: 0x0000000000000000
    Budget ID: 0x0000000000000000
    Padding: 0
    Minimum: 0
    Capabilities: 0x00
    Progress: 0
    Progress/Maximum: 0/8192

Frame 15: 541 bytes on wire (4328 bits), 541 bytes captured (4328 bits)
Ethernet II, Src: Send_00 (20:53:45:4e:44:00), Dst: Receive_00 (20:52:45:43:56:00)
Internet Protocol Version 6, Src: fe80::3f:0:0:8, Dst: fe80::3f:0:0:9
Transmission Control Protocol, Src Port: 0, Dst Port: 7114, Seq: 629, Ack: 129, Len: 467
Zilla Frame
    Frame Type ID: 0x40000003
    Frame Type: SIGNAL
    Protocol Type ID: 0x00000000
    Protocol Type: 
    Worker: 0
    Offset: 0x000004a8
    Origin ID: 0x0000000100000010
    Origin Namespace: test
    Origin Binding: app0
    Routed ID: 0x0000000100000002
    Routed Namespace: test
    Routed Binding: net0
    Stream ID: 0x003f000000000009
    Initial ID: 0x003f000000000009
    Reply ID: 0x003f000000000008
    Direction: INI
    Sequence: 0
    Acknowledge: 0
    Maximum: 0
    Timestamp: 0x0000000000000000
    Trace ID: 0x0000000000000000
    Authorization: 0x0000000000000000
    Cancel ID: 0xffffffffffffffff
    Signal ID: 0x80000002
    Context ID: 0x00000003
    Payload
        Length: 327
        Payload

Frame 16: 272 bytes on wire (2176 bits), 272 bytes captured (2176 bits)
Ethernet II, Src: Send_00 (20:53:45:4e:44:00), Dst: Receive_00 (20:52:45:43:56:00)
Internet Protocol Version 6, Src: fe80::1:3f:0:0:12, Dst: fe80::1:3f:0:0:13
Transmission Control Protocol, Src Port: 0, Dst Port: 7114, Seq: 0, Ack: 1, Len: 198
Zilla Frame
    Frame Type ID: 0x00000001
    Frame Type: BEGIN
    Protocol Type ID: 0x00000000
    Protocol Type: 
    Worker: 1
    Offset: 0x000003d8
    Origin ID: 0x0000000100000010
    Origin Namespace: test
    Origin Binding: app0
    Routed ID: 0x0000000100000002
    Routed Namespace: test
    Routed Binding: net0
    Stream ID: 0x003f000000000013
    Initial ID: 0x003f000000000013
    Reply ID: 0x003f000000000012
    Direction: INI
    Sequence: 0
    Acknowledge: 0
    Maximum: 0
    Timestamp: 0x0000000000000000
    Trace ID: 0x8000000000000007
    Authorization: 0x0000000000000000
    Affinity: 0x0000000000000001
    Extension: proxy
        Stream Type ID: 0x50a8ce8d
        Stream Type: proxy
        Address: INET
            Family: INET (0)
            Protocol: STREAM (0)
            Source: 0.0.0.0
            Source Port: 0
            Destination: broker1.example.com
            Destination Port: 9092
        Info (1 items)
            Length: 26
            Size: 1
        Info: AUTHORITY: broker1.example.com
            Type: AUTHORITY (0x02)
            Length: 19
            Value: broker1.example.com

Frame 17: 211 bytes on wire (1688 bits), 211 bytes captured (1688 bits)
Ethernet II, Src: Send_00 (20:53:45:4e:44:00), Dst: Receive_00 (20:52:45:43:56:00)
Internet Protocol Version 6, Src: fe80::3f:0:0:8, Dst: fe80::3f:0:0:9
Transmission Control Protocol, Src Port: 0, Dst Port: 7114, Seq: 1096, Ack: 129, Len: 137
Zilla Frame
    Frame Type ID: 0x40000002
    Frame Type: WINDOW
    Protocol Type ID: 0x00000000
    Protocol Type: 
    Worker: 0
    Offset: 0x00000650
    Origin ID: 0x0000000100000010
    Origin Namespace: test
    Origin Binding: app0
    Routed ID: 0x0000000100000002
    Routed Namespace: test
    Routed Binding: net0
    Stream ID: 0x003f000000000009
    Initial ID: 0x003f000000000009
    Reply ID: 0x003f000000000008
    Direction: INI
    Sequence: 242
    Acknowledge: 242
    Maximum: 8192
    Timestamp: 0x0000000000000000
    Trace ID: 0x8000000000000004
    Authorization: 0x0000000000000000
    Budget ID: 0x0000000000000000
    Padding: 0
    Minimum: 0
    Capabilities: 0x00
    Progress: 0
    Progress/Maximum: 0/8192

Frame 18: 272 bytes on wire (2176 bits), 272 bytes captured (2176 bits)
Ethernet II, Src: Send_00 (20:53:45:4e:44:00), Dst: Receive_00 (20:52:45:43:56:00)
Internet Protocol Version 6, Src: fe80::1:3f:0:0:14, Dst: fe80::1:3f:0:0:15
Transmission Control Protocol, Src Port: 0, Dst Port: 7114, Seq: 0, Ack: 1, Len: 198
Zilla Frame
    Frame Type ID: 0x00000001
    Frame Type: BEGIN
    Protocol Type ID: 0x00000000
    Protocol Type: 
    Worker: 1
    Offset: 0x00000478
    Origin ID: 0x0000000100000010
    Origin Namespace: test
    Origin Binding: app0
    Routed ID: 0x0000000100000002
    Routed Namespace: test
    Routed Binding: net0
    Stream ID: 0x003f000000000015
    Initial ID: 0x003f000000000015
    Reply ID: 0x003f000000000014
    Direction: INI
    Sequence: 0
    Acknowledge: 0
    Maximum: 0
    Timestamp: 0x0000000000000000
    Trace ID: 0x8000000000000007
    Authorization: 0x0000000000000000
    Affinity: 0x0000000000000002
    Extension: proxy
        Stream Type ID: 0x50a8ce8d
        Stream Type: proxy
        Address: INET
            Family: INET (0)
            Protocol: STREAM (0)
            Source: 0.0.0.0
            Source Port: 0
            Destination: broker2.example.com
            Destination Port: 9092
        Info (1 items)
            Length: 26
            Size: 1
        Info: AUTHORITY: broker2.example.com
            Type: AUTHORITY (0x02)
            Length: 19
            Value: broker2.example.com

Frame 19: 587 bytes on wire (4696 bits), 587 bytes captured (4696 bits)
Ethernet II, Src: Send_00 (20:53:45:4e:44:00), Dst: Receive_00 (20:52:45:43:56:00)
Internet Protocol Version 6, Src: fe80::3f:0:0:9, Dst: fe80::3f:0:0:8
Transmission Control Protocol, Src Port: 7114, Dst Port: 0, Seq: 129, Ack: 1233, Len: 513
Zilla Frame
    Frame Type ID: 0x00000002
    Frame Type: DATA
    Protocol Type ID: 0x00000000
    Protocol Type: 
    Worker: 0
    Offset: 0x000006b0
    Origin ID: 0x0000000100000010
    Origin Namespace: test
    Origin Binding: app0
    Routed ID: 0x0000000100000002
    Routed Namespace: test
    Routed Binding: net0
    Stream ID: 0x003f000000000008
    Initial ID: 0x003f000000000009
    Reply ID: 0x003f000000000008
    Direction: REP
    Sequence: 0
    Acknowledge: 0
    Maximum: 8192
    Timestamp: 0x0000000000000000
    Trace ID: 0x8000000000000005
    Authorization: 0x0000000000000000
    Flags: 0x03
        .... ...1 = FIN: Set (1)
        .... ..1. = INIT: Set (1)
        .... .0.. = INCOMPLETE: Not set (0)
        .... 0... = SKIP: Not set (0)
    Budget ID: 0x0000000000000000
    Reserved: 376
    Progress: 376
    Progress/Maximum: 376/8192
    Payload
        Length: 376
        Payload

Frame 20: 211 bytes on wire (1688 bits), 211 bytes captured (1688 bits)
Ethernet II, Src: Send_00 (20:53:45:4e:44:00), Dst: Receive_00 (20:52:45:43:56:00)
Internet Protocol Version 6, Src: fe80::1:3f:0:0:13, Dst: fe80::1:3f:0:0:12
Transmission Control Protocol, Src Port: 7114, Dst Port: 0, Seq: 1, Ack: 198, Len: 137
Zilla Frame
    Frame Type ID: 0x40000002
    Frame Type: WINDOW
    Protocol Type ID: 0x00000000
    Protocol Type: 
    Worker: 1
    Offset: 0x00000518
    Origin ID: 0x0000000100000010
    Origin Namespace: test
    Origin Binding: app0
    Routed ID: 0x0000000100000002
    Routed Namespace: test
    Routed Binding: net0
    Stream ID: 0x003f000000000012
    Initial ID: 0x003f000000000013
    Reply ID: 0x003f000000000012
    Direction: REP
    Sequence: 0
    Acknowledge: 0
    Maximum: 8192
    Timestamp: 0x0000000000000000
    Trace ID: 0x8000000000000008
    Authorization: 0x0000000000000000
    Budget ID: 0x0000000000000000
    Padding: 0
    Minimum: 0
    Capabilities: 0x00
    Progress: 0
    Progress/Maximum: 0/8192

Frame 21: 211 bytes on wire (1688 bits), 211 bytes captured (1688 bits)
Ethernet II, Src: Send_00 (20:53:45:4e:44:00), Dst: Receive_00 (20:52:45:43:56:00)
Internet Protocol Version 6, Src: fe80::2, Dst: fe80::3
Transmission Control Protocol, Src Port: 0, Dst Port: 7114, Seq: 355, Ack: 1, Len: 137
Zilla Frame
    Frame Type ID: 0x40000002
    Frame Type: WINDOW
    Protocol Type ID: 0x084b20e1
    Protocol Type: kafka
    Worker: 0
    Offset: 0x00000888
    Origin ID: 0x0000000100000010
    Origin Namespace: test
    Origin Binding: app0
    Routed ID: 0x0000000100000010
    Routed Namespace: test
    Routed Binding: app0
    Stream ID: 0x0000000000000003
    Initial ID: 0x0000000000000003
    Reply ID: 0x0000000000000002
    Direction: INI
    Sequence: 0
    Acknowledge: 0
    Maximum: 0
    Timestamp: 0x0000000000000000
    Trace ID: 0x8000000000000005
    Authorization: 0x0000000000000000
    Budget ID: 0x0000000000000000
    Padding: 0
    Minimum: 0
    Capabilities: 0x00
    Progress: 0
    Progress/Maximum: 0/0

Frame 22: 285 bytes on wire (2280 bits), 285 bytes captured (2280 bits)
Ethernet II, Src: Send_00 (20:53:45:4e:44:00), Dst: Receive_00 (20:52:45:43:56:00)
Internet Protocol Version 6, Src: fe80::1:3f:0:0:12, Dst: fe80::1:3f:0:0:13
Transmission Control Protocol, Src Port: 0, Dst Port: 7114, Seq: 198, Ack: 138, Len: 211
Zilla Frame
    Frame Type ID: 0x00000002
    Frame Type: DATA
    Protocol Type ID: 0x00000000
    Protocol Type: 
    Worker: 1
    Offset: 0x00000578
    Origin ID: 0x0000000100000010
    Origin Namespace: test
    Origin Binding: app0
    Routed ID: 0x0000000100000002
    Routed Namespace: test
    Routed Binding: net0
    Stream ID: 0x003f000000000013
    Initial ID: 0x003f000000000013
    Reply ID: 0x003f000000000012
    Direction: INI
    Sequence: 0
    Acknowledge: 0
    Maximum: 8192
    Timestamp: 0x0000000000000000
    Trace ID: 0x8000000000000009
    Authorization: 0x0000000000000000
    Flags: 0x03
        .... ...1 = FIN: Set (1)
        .... ..1. = INIT: Set (1)
        .... .0.. = INCOMPLETE: Not set (0)
        .... 0... = SKIP: Not set (0)
    Budget ID: 0x0000000000000000
    Reserved: 74
    Progress: 74
    Progress/Maximum: 74/8192
    Payload
        Length: 74
        Payload

Frame 23: 429 bytes on wire (3432 bits), 429 bytes captured (3432 bits)
Ethernet II, Src: Send_00 (20:53:45:4e:44:00), Dst: Receive_00 (20:52:45:43:56:00)
Internet Protocol Version 6, Src: fe80::3, Dst: fe80::2
Transmission Control Protocol, Src Port: 7114, Dst Port: 0, Seq: 1, Ack: 492, Len: 355
Zilla Frame
    Frame Type ID: 0x00000001
    Frame Type: BEGIN
    Protocol Type ID: 0x084b20e1
    Protocol Type: kafka
    Worker: 0
    Offset: 0x000008e8
    Origin ID: 0x0000000100000010
    Origin Namespace: test
    Origin Binding: app0
    Routed ID: 0x0000000100000010
    Routed Namespace: test
    Routed Binding: app0
    Stream ID: 0x0000000000000002
    Initial ID: 0x0000000000000003
    Reply ID: 0x0000000000000002
    Direction: REP
    Sequence: 0
    Acknowledge: 0
    Maximum: 0
    Timestamp: 0x0000000000000000
    Trace ID: 0x8000000000000005
    Authorization: 0x0000000000000000
    Affinity: 0x0000000000000000
    Extension: kafka
        Stream Type ID: 0xe1204b08
        Stream Type: kafka
        API: DESCRIBE (32)
        Topic: test
            Length: 4
            Topic: test
        Configs (11 items)
            Length: 212
            Size: 11
        Config: cleanup.policy
            Length: 14
            Config: cleanup.policy
        Config: max.message.bytes
            Length: 17
            Config: max.message.bytes
        Config: segment.bytes
            Length: 13
            Config: segment.bytes
        Config: segment.index.bytes
            Length: 19
            Config: segment.index.bytes
        Config: segment.ms
            Length: 10
            Config: segment.ms
        Config: retention.bytes
            Length: 15
            Config: retention.bytes
        Config: retention.ms
            Length: 12
            Config: retention.ms
        Config: delete.retention.ms
            Length: 19
            Config: delete.retention.ms
        Config: min.compaction.lag.ms
            Length: 21
            Config: min.compaction.lag.ms
        Config: max.compaction.lag.ms
            Length: 21
            Config: max.compaction.lag.ms
        Config: min.cleanable.dirty.ratio
            Length: 25
            Config: min.cleanable.dirty.ratio

Frame 24: 211 bytes on wire (1688 bits), 211 bytes captured (1688 bits)
Ethernet II, Src: Send_00 (20:53:45:4e:44:00), Dst: Receive_00 (20:52:45:43:56:00)
Internet Protocol Version 6, Src: fe80::1:3f:0:0:15, Dst: fe80::1:3f:0:0:14
Transmission Control Protocol, Src Port: 7114, Dst Port: 0, Seq: 1, Ack: 198, Len: 137
Zilla Frame
    Frame Type ID: 0x40000002
    Frame Type: WINDOW
    Protocol Type ID: 0x00000000
    Protocol Type: 
    Worker: 1
    Offset: 0x00000620
    Origin ID: 0x0000000100000010
    Origin Namespace: test
    Origin Binding: app0
    Routed ID: 0x0000000100000002
    Routed Namespace: test
    Routed Binding: net0
    Stream ID: 0x003f000000000014
    Initial ID: 0x003f000000000015
    Reply ID: 0x003f000000000014
    Direction: REP
    Sequence: 0
    Acknowledge: 0
    Maximum: 8192
    Timestamp: 0x0000000000000000
    Trace ID: 0x800000000000000a
    Authorization: 0x0000000000000000
    Budget ID: 0x0000000000000000
    Padding: 0
    Minimum: 0
    Capabilities: 0x00
    Progress: 0
    Progress/Maximum: 0/8192

Frame 25: 536 bytes on wire (4288 bits), 536 bytes captured (4288 bits)
Ethernet II, Src: Send_00 (20:53:45:4e:44:00), Dst: Receive_00 (20:52:45:43:56:00)
Internet Protocol Version 6, Src: fe80::3, Dst: fe80::2
Transmission Control Protocol, Src Port: 7114, Dst Port: 0, Seq: 356, Ack: 492, Len: 462
Zilla Frame
    Frame Type ID: 0x00000002
    Frame Type: DATA
    Protocol Type ID: 0x084b20e1
    Protocol Type: kafka
    Worker: 0
    Offset: 0x00000a20
    Origin ID: 0x0000000100000010
    Origin Namespace: test
    Origin Binding: app0
    Routed ID: 0x0000000100000010
    Routed Namespace: test
    Routed Binding: app0
    Stream ID: 0x0000000000000002
    Initial ID: 0x0000000000000003
    Reply ID: 0x0000000000000002
    Direction: REP
    Sequence: 0
    Acknowledge: 0
    Maximum: 0
    Timestamp: 0x0000000000000000
    Trace ID: 0x8000000000000005
    Authorization: 0x0000000000000000
    Flags: 0x03
        .... ...1 = FIN: Set (1)
        .... ..1. = INIT: Set (1)
        .... .0.. = INCOMPLETE: Not set (0)
        .... 0... = SKIP: Not set (0)
    Budget ID: 0x0000000000000000
    Reserved: 0
    Progress: 0
    Progress/Maximum: 0/0
    Payload
        Length: -1
    Extension: kafka
        Stream Type ID: 0xe1204b08
        Stream Type: kafka
        API: DESCRIBE (32)
        Configs (11 items)
            Length: 316
            Size: 11
        Config: cleanup.policy: delete
            Name: cleanup.policy
                Length: 14
                Name: cleanup.policy
            Value: delete
                Length: 6
                Value: delete
        Config: max.message.bytes: 1000012
            Name: max.message.bytes
                Length: 17
                Name: max.message.bytes
            Value: 1000012
                Length: 7
                Value: 1000012
        Config: segment.bytes: 1073741824
            Name: segment.bytes
                Length: 13
                Name: segment.bytes
            Value: 1073741824
                Length: 10
                Value: 1073741824
        Config: segment.index.bytes: 10485760
            Name: segment.index.bytes
                Length: 19
                Name: segment.index.bytes
            Value: 10485760
                Length: 8
                Value: 10485760
        Config: segment.ms: 604800000
            Name: segment.ms
                Length: 10
                Name: segment.ms
            Value: 604800000
                Length: 9
                Value: 604800000
        Config: retention.bytes: -1
            Name: retention.bytes
                Length: 15
                Name: retention.bytes
            Value: -1
                Length: 2
                Value: -1
        Config: retention.ms: 604800000
            Name: retention.ms
                Length: 12
                Name: retention.ms
            Value: 604800000
                Length: 9
                Value: 604800000
        Config: delete.retention.ms: 86400000
            Name: delete.retention.ms
                Length: 19
                Name: delete.retention.ms
            Value: 86400000
                Length: 8
                Value: 86400000
        Config: min.compaction.lag.ms: 0
            Name: min.compaction.lag.ms
                Length: 21
                Name: min.compaction.lag.ms
            Value: 0
                Length: 1
                Value: 0
        Config: max.compaction.lag.ms: 9223372036854775807
            Name: max.compaction.lag.ms
                Length: 21
                Name: max.compaction.lag.ms
            Value: 9223372036854775807
                Length: 19
                Value: 9223372036854775807
        Config: min.cleanable.dirty.ratio: 0.5
            Name: min.cleanable.dirty.ratio
                Length: 25
                Name: min.cleanable.dirty.ratio
            Value: 0.5
                Length: 3
                Value: 0.5

Frame 26: 285 bytes on wire (2280 bits), 285 bytes captured (2280 bits)
Ethernet II, Src: Send_00 (20:53:45:4e:44:00), Dst: Receive_00 (20:52:45:43:56:00)
Internet Protocol Version 6, Src: fe80::1:3f:0:0:14, Dst: fe80::1:3f:0:0:15
Transmission Control Protocol, Src Port: 0, Dst Port: 7114, Seq: 198, Ack: 138, Len: 211
Zilla Frame
    Frame Type ID: 0x00000002
    Frame Type: DATA
    Protocol Type ID: 0x00000000
    Protocol Type: 
    Worker: 1
    Offset: 0x00000680
    Origin ID: 0x0000000100000010
    Origin Namespace: test
    Origin Binding: app0
    Routed ID: 0x0000000100000002
    Routed Namespace: test
    Routed Binding: net0
    Stream ID: 0x003f000000000015
    Initial ID: 0x003f000000000015
    Reply ID: 0x003f000000000014
    Direction: INI
    Sequence: 0
    Acknowledge: 0
    Maximum: 8192
    Timestamp: 0x0000000000000000
    Trace ID: 0x800000000000000b
    Authorization: 0x0000000000000000
    Flags: 0x03
        .... ...1 = FIN: Set (1)
        .... ..1. = INIT: Set (1)
        .... .0.. = INCOMPLETE: Not set (0)
        .... 0... = SKIP: Not set (0)
    Budget ID: 0x0000000000000000
    Reserved: 74
    Progress: 74
    Progress/Maximum: 74/8192
    Payload
        Length: 74
        Payload

Frame 27: 299 bytes on wire (2392 bits), 299 bytes captured (2392 bits)
Ethernet II, Src: Send_00 (20:53:45:4e:44:00), Dst: Receive_00 (20:52:45:43:56:00)
Internet Protocol Version 6, Src: fe80::3f:0:0:8, Dst: fe80::3f:0:0:9
Transmission Control Protocol, Src Port: 0, Dst Port: 7114, Seq: 1233, Ack: 642, Len: 225
Zilla Frame
    Frame Type ID: 0x40000003
    Frame Type: SIGNAL
    Protocol Type ID: 0x00000000
    Protocol Type: 
    Worker: 0
    Offset: 0x00000bc8
    Origin ID: 0x0000000100000010
    Origin Namespace: test
    Origin Binding: app0
    Routed ID: 0x0000000100000002
    Routed Namespace: test
    Routed Binding: net0
    Stream ID: 0x003f000000000009
    Initial ID: 0x003f000000000009
    Reply ID: 0x003f000000000008
    Direction: INI
    Sequence: 0
    Acknowledge: 0
    Maximum: 0
    Timestamp: 0x0000000000000000
    Trace ID: 0x0000000000000000
    Authorization: 0x0000000000000000
    Cancel ID: 0xffffffffffffffff
    Signal ID: 0x80000006
    Context ID: 0x00000005
    Payload
        Length: 85
        Payload

Frame 28: 211 bytes on wire (1688 bits), 211 bytes captured (1688 bits)
Ethernet II, Src: Send_00 (20:53:45:4e:44:00), Dst: Receive_00 (20:52:45:43:56:00)
Internet Protocol Version 6, Src: fe80::1:3f:0:0:13, Dst: fe80::1:3f:0:0:12
Transmission Control Protocol, Src Port: 7114, Dst Port: 0, Seq: 138, Ack: 409, Len: 137
Zilla Frame
    Frame Type ID: 0x40000002
    Frame Type: WINDOW
    Protocol Type ID: 0x00000000
    Protocol Type: 
    Worker: 1
    Offset: 0x00000728
    Origin ID: 0x0000000100000010
    Origin Namespace: test
    Origin Binding: app0
    Routed ID: 0x0000000100000002
    Routed Namespace: test
    Routed Binding: net0
    Stream ID: 0x003f000000000012
    Initial ID: 0x003f000000000013
    Reply ID: 0x003f000000000012
    Direction: REP
    Sequence: 125
    Acknowledge: 125
    Maximum: 8192
    Timestamp: 0x0000000000000000
    Trace ID: 0x800000000000000e
    Authorization: 0x0000000000000000
    Budget ID: 0x0000000000000000
    Padding: 0
    Minimum: 0
    Capabilities: 0x00
    Progress: 0
    Progress/Maximum: 0/8192

Frame 29: 211 bytes on wire (1688 bits), 211 bytes captured (1688 bits)
Ethernet II, Src: Send_00 (20:53:45:4e:44:00), Dst: Receive_00 (20:52:45:43:56:00)
Internet Protocol Version 6, Src: fe80::3, Dst: fe80::2
Transmission Control Protocol, Src Port: 7114, Dst Port: 0, Seq: 818, Ack: 492, Len: 137
Zilla Frame
    Frame Type ID: 0x40000002
    Frame Type: WINDOW
    Protocol Type ID: 0x084b20e1
    Protocol Type: kafka
    Worker: 0
    Offset: 0x00000c80
    Origin ID: 0x0000000100000010
    Origin Namespace: test
    Origin Binding: app0
    Routed ID: 0x0000000100000010
    Routed Namespace: test
    Routed Binding: app0
    Stream ID: 0x0000000000000002
    Initial ID: 0x0000000000000003
    Reply ID: 0x0000000000000002
    Direction: REP
    Sequence: 0
    Acknowledge: 0
    Maximum: 8192
    Timestamp: 0x0000000000000000
    Trace ID: 0x8000000000000005
    Authorization: 0x0000000000000000
    Budget ID: 0x0000000000000000
    Padding: 0
    Minimum: 0
    Capabilities: 0x00
    Progress: 0
    Progress/Maximum: 0/8192

Frame 30: 211 bytes on wire (1688 bits), 211 bytes captured (1688 bits)
Ethernet II, Src: Send_00 (20:53:45:4e:44:00), Dst: Receive_00 (20:52:45:43:56:00)
Internet Protocol Version 6, Src: fe80::1:3f:0:0:15, Dst: fe80::1:3f:0:0:14
Transmission Control Protocol, Src Port: 7114, Dst Port: 0, Seq: 138, Ack: 409, Len: 137
Zilla Frame
    Frame Type ID: 0x40000002
    Frame Type: WINDOW
    Protocol Type ID: 0x00000000
    Protocol Type: 
    Worker: 1
    Offset: 0x00000788
    Origin ID: 0x0000000100000010
    Origin Namespace: test
    Origin Binding: app0
    Routed ID: 0x0000000100000002
    Routed Namespace: test
    Routed Binding: net0
    Stream ID: 0x003f000000000014
    Initial ID: 0x003f000000000015
    Reply ID: 0x003f000000000014
    Direction: REP
    Sequence: 125
    Acknowledge: 125
    Maximum: 8192
    Timestamp: 0x0000000000000000
    Trace ID: 0x800000000000000f
    Authorization: 0x0000000000000000
    Budget ID: 0x0000000000000000
    Padding: 0
    Minimum: 0
    Capabilities: 0x00
    Progress: 0
    Progress/Maximum: 0/8192

Frame 31: 213 bytes on wire (1704 bits), 213 bytes captured (1704 bits)
Ethernet II, Src: Send_00 (20:53:45:4e:44:00), Dst: Receive_00 (20:52:45:43:56:00)
Internet Protocol Version 6, Src: fe80::a, Dst: fe80::b
Transmission Control Protocol, Src Port: 0, Dst Port: 7114, Seq: 0, Ack: 1, Len: 139
Zilla Frame
    Frame Type ID: 0x00000001
    Frame Type: BEGIN
    Protocol Type ID: 0x084b20e1
    Protocol Type: kafka
    Worker: 0
    Offset: 0x00000ce0
    Origin ID: 0x0000000100000010
    Origin Namespace: test
    Origin Binding: app0
    Routed ID: 0x0000000100000010
    Routed Namespace: test
    Routed Binding: app0
    Stream ID: 0x000000000000000b
    Initial ID: 0x000000000000000b
    Reply ID: 0x000000000000000a
    Direction: INI
    Sequence: 0
    Acknowledge: 0
    Maximum: 0
    Timestamp: 0x0000000000000000
    Trace ID: 0x8000000000000005
    Authorization: 0x0000000000000000
    Affinity: 0x0000000000000000
    Extension: kafka
        Stream Type ID: 0xe1204b08
        Stream Type: kafka
        API: META (3)
        Topic: test
            Length: 4
            Topic: test

Frame 32: 285 bytes on wire (2280 bits), 285 bytes captured (2280 bits)
Ethernet II, Src: Send_00 (20:53:45:4e:44:00), Dst: Receive_00 (20:52:45:43:56:00)
Internet Protocol Version 6, Src: fe80::1:3f:0:0:12, Dst: fe80::1:3f:0:0:13
Transmission Control Protocol, Src Port: 0, Dst Port: 7114, Seq: 409, Ack: 275, Len: 211
Zilla Frame
    Frame Type ID: 0x00000002
    Frame Type: DATA
    Protocol Type ID: 0x00000000
    Protocol Type: 
    Worker: 1
    Offset: 0x000007e8
    Origin ID: 0x0000000100000010
    Origin Namespace: test
    Origin Binding: app0
    Routed ID: 0x0000000100000002
    Routed Namespace: test
    Routed Binding: net0
    Stream ID: 0x003f000000000013
    Initial ID: 0x003f000000000013
    Reply ID: 0x003f000000000012
    Direction: INI
    Sequence: 74
    Acknowledge: 74
    Maximum: 8192
    Timestamp: 0x0000000000000000
    Trace ID: 0x800000000000000e
    Authorization: 0x0000000000000000
    Flags: 0x03
        .... ...1 = FIN: Set (1)
        .... ..1. = INIT: Set (1)
        .... .0.. = INCOMPLETE: Not set (0)
        .... 0... = SKIP: Not set (0)
    Budget ID: 0x0000000000000000
    Reserved: 74
    Progress: 74
    Progress/Maximum: 74/8192
    Payload
        Length: 74
        Payload

Frame 33: 340 bytes on wire (2720 bits), 340 bytes captured (2720 bits)
Ethernet II, Src: Send_00 (20:53:45:4e:44:00), Dst: Receive_00 (20:52:45:43:56:00)
Internet Protocol Version 6, Src: fe80::3f:0:0:8, Dst: fe80::3f:0:0:9
Transmission Control Protocol, Src Port: 0, Dst Port: 7114, Seq: 1458, Ack: 642, Len: 266
Zilla Frame
    Frame Type ID: 0x40000003
    Frame Type: SIGNAL
    Protocol Type ID: 0x00000000
    Protocol Type: 
    Worker: 0
    Offset: 0x00000d40
    Origin ID: 0x0000000100000010
    Origin Namespace: test
    Origin Binding: app0
    Routed ID: 0x0000000100000002
    Routed Namespace: test
    Routed Binding: net0
    Stream ID: 0x003f000000000009
    Initial ID: 0x003f000000000009
    Reply ID: 0x003f000000000008
    Direction: INI
    Sequence: 0
    Acknowledge: 0
    Maximum: 0
    Timestamp: 0x0000000000000000
    Trace ID: 0x0000000000000000
    Authorization: 0x0000000000000000
    Cancel ID: 0xffffffffffffffff
    Signal ID: 0x80000001
    Context ID: 0x00000006
    Payload
        Length: 126
        Payload

Frame 34: 303 bytes on wire (2424 bits), 303 bytes captured (2424 bits)
Ethernet II, Src: Send_00 (20:53:45:4e:44:00), Dst: Receive_00 (20:52:45:43:56:00)
Internet Protocol Version 6, Src: fe80::1:3f00:0:0:3, Dst: fe80::1:3f00:0:0:2
Transmission Control Protocol, Src Port: 7114, Dst Port: 0, Seq: 1, Ack: 138, Len: 229
Zilla Frame
    Frame Type ID: 0x00000001
    Frame Type: BEGIN
    Protocol Type ID: 0x084b20e1
    Protocol Type: kafka
    Worker: 1
    Offset: 0x00000890
    Origin ID: 0x0000000100000010
    Origin Namespace: test
    Origin Binding: app0
    Routed ID: 0x0000000100000010
    Routed Namespace: test
    Routed Binding: app0
    Stream ID: 0x3f00000000000002
    Initial ID: 0x3f00000000000003
    Reply ID: 0x3f00000000000002
    Direction: REP
    Sequence: 0
    Acknowledge: 0
    Maximum: 0
    Timestamp: 0x0000000000000000
    Trace ID: 0x800000000000000f
    Authorization: 0x0000000000000000
    Affinity: 0x0000000000000000
    Extension: kafka
        Stream Type ID: 0xe1204b08
        Stream Type: kafka
        API: MERGED (255)
        Capabilities: FETCH_ONLY (2)
        Topic: test
            Length: 4
            Topic: test
        Group ID: 
            Length: -1
            Group ID: 
        Consumer ID: 
            Length: -1
            Consumer ID: 
        Timeout: 0
        Partitions (2 items)
            Length: 64
            Size: 2
        Partition: 0 [0]
            Partition ID: 0
            Partition Offset: 0
            Stable Offset: 2
            Latest Offset: 2
            Metadata: 
                Length: -1
                Metadata: 
        Partition: 1 [0]
            Partition ID: 1
            Partition Offset: 0
            Stable Offset: 2
            Latest Offset: 2
            Metadata: 
                Length: -1
                Metadata: 
        Filters (0 items)
            Length: 4
            Size: 0
        Evaluation: LAZY (0)
        Isolation: READ_COMMITTED (1)
        Delta Type: NONE (0)
        Ack Mode ID: -1
        Ack Mode: IN_SYNC_REPLICAS

Frame 35: 299 bytes on wire (2392 bits), 299 bytes captured (2392 bits)
Ethernet II, Src: Send_00 (20:53:45:4e:44:00), Dst: Receive_00 (20:52:45:43:56:00)
Internet Protocol Version 6, Src: fe80::3f:0:0:8, Dst: fe80::3f:0:0:9
Transmission Control Protocol, Src Port: 0, Dst Port: 7114, Seq: 1724, Ack: 642, Len: 225
Zilla Frame
    Frame Type ID: 0x40000003
    Frame Type: SIGNAL
    Protocol Type ID: 0x00000000
    Protocol Type: 
    Worker: 0
    Offset: 0x00000e20
    Origin ID: 0x0000000100000010
    Origin Namespace: test
    Origin Binding: app0
    Routed ID: 0x0000000100000002
    Routed Namespace: test
    Routed Binding: net0
    Stream ID: 0x003f000000000009
    Initial ID: 0x003f000000000009
    Reply ID: 0x003f000000000008
    Direction: INI
    Sequence: 0
    Acknowledge: 0
    Maximum: 0
    Timestamp: 0x0000000000000000
    Trace ID: 0x0000000000000000
    Authorization: 0x0000000000000000
    Cancel ID: 0xffffffffffffffff
    Signal ID: 0x80000006
    Context ID: 0x00000007
    Payload
        Length: 85
        Payload

Frame 36: 285 bytes on wire (2280 bits), 285 bytes captured (2280 bits)
Ethernet II, Src: Send_00 (20:53:45:4e:44:00), Dst: Receive_00 (20:52:45:43:56:00)
Internet Protocol Version 6, Src: fe80::1:3f:0:0:14, Dst: fe80::1:3f:0:0:15
Transmission Control Protocol, Src Port: 0, Dst Port: 7114, Seq: 409, Ack: 275, Len: 211
Zilla Frame
    Frame Type ID: 0x00000002
    Frame Type: DATA
    Protocol Type ID: 0x00000000
    Protocol Type: 
    Worker: 1
    Offset: 0x00000950
    Origin ID: 0x0000000100000010
    Origin Namespace: test
    Origin Binding: app0
    Routed ID: 0x0000000100000002
    Routed Namespace: test
    Routed Binding: net0
    Stream ID: 0x003f000000000015
    Initial ID: 0x003f000000000015
    Reply ID: 0x003f000000000014
    Direction: INI
    Sequence: 74
    Acknowledge: 74
    Maximum: 8192
    Timestamp: 0x0000000000000000
    Trace ID: 0x800000000000000f
    Authorization: 0x0000000000000000
    Flags: 0x03
        .... ...1 = FIN: Set (1)
        .... ..1. = INIT: Set (1)
        .... .0.. = INCOMPLETE: Not set (0)
        .... 0... = SKIP: Not set (0)
    Budget ID: 0x0000000000000000
    Reserved: 74
    Progress: 74
    Progress/Maximum: 74/8192
    Payload
        Length: 74
        Payload

Frame 37: 329 bytes on wire (2632 bits), 329 bytes captured (2632 bits)
Ethernet II, Src: Send_00 (20:53:45:4e:44:00), Dst: Receive_00 (20:52:45:43:56:00)
Internet Protocol Version 6, Src: fe80::3f:0:0:8, Dst: fe80::3f:0:0:9
Transmission Control Protocol, Src Port: 0, Dst Port: 7114, Seq: 1949, Ack: 642, Len: 255
Zilla Frame
    Frame Type ID: 0x40000003
    Frame Type: SIGNAL
    Protocol Type ID: 0x00000000
    Protocol Type: 
    Worker: 0
    Offset: 0x00000ed8
    Origin ID: 0x0000000100000010
    Origin Namespace: test
    Origin Binding: app0
    Routed ID: 0x0000000100000002
    Routed Namespace: test
    Routed Binding: net0
    Stream ID: 0x003f000000000009
    Initial ID: 0x003f000000000009
    Reply ID: 0x003f000000000008
    Direction: INI
    Sequence: 0
    Acknowledge: 0
    Maximum: 0
    Timestamp: 0x0000000000000000
    Trace ID: 0x0000000000000000
    Authorization: 0x0000000000000000
    Cancel ID: 0xffffffffffffffff
    Signal ID: 0x80000002
    Context ID: 0x00000008
    Payload
        Length: 115
        Payload
