Frame 1: 202 bytes on wire (1616 bits), 202 bytes captured (1616 bits)
Ethernet II, Src: Send_00 (20:53:45:4e:44:00), Dst: Receive_00 (20:52:45:43:56:00)
Internet Protocol Version 6, Src: fe80::3f3f:0:0:2, Dst: fe80::3f3f:0:0:3
Transmission Control Protocol, Src Port: 0, Dst Port: 7114, Seq: 0, Ack: 1, Len: 128
Zilla Frame
    Frame Type ID: 0x00000001
    Frame Type: BEGIN
    Protocol Type ID: 0xd0d41a76
    Protocol Type: mqtt
    Worker: 0
    Offset: 0x00000000
    Origin ID: 0x0000000100000002
    Origin Namespace: test
    Origin Binding: net0
    Routed ID: 0x0000000100000002
    Routed Namespace: test
    Routed Binding: net0
    Stream ID: 0x3f3f000000000003
    Initial ID: 0x3f3f000000000003
    Reply ID: 0x3f3f000000000002
    Direction: INI
    Sequence: 0
    Acknowledge: 0
    Maximum: 0
    Timestamp: 0x0000000000000000
    Trace ID: 0x8000000000000001
    Authorization: 0x0000000000000000
    Affinity: 0x0000000000000000

Frame 2: 202 bytes on wire (1616 bits), 202 bytes captured (1616 bits)
Ethernet II, Src: Send_00 (20:53:45:4e:44:00), Dst: Receive_00 (20:52:45:43:56:00)
Internet Protocol Version 6, Src: fe80::3f3f:0:0:3, Dst: fe80::3f3f:0:0:2
Transmission Control Protocol, Src Port: 7114, Dst Port: 0, Seq: 1, Ack: 128, Len: 128
Zilla Frame
    Frame Type ID: 0x00000001
    Frame Type: BEGIN
    Protocol Type ID: 0xd0d41a76
    Protocol Type: mqtt
    Worker: 0
    Offset: 0x00000058
    Origin ID: 0x0000000100000002
    Origin Namespace: test
    Origin Binding: net0
    Routed ID: 0x0000000100000002
    Routed Namespace: test
    Routed Binding: net0
    Stream ID: 0x3f3f000000000002
    Initial ID: 0x3f3f000000000003
    Reply ID: 0x3f3f000000000002
    Direction: REP
    Sequence: 0
    Acknowledge: 0
    Maximum: 0
    Timestamp: 0x0000000000000000
    Trace ID: 0x8000000000000002
    Authorization: 0x0000000000000000
    Affinity: 0x0000000000000000

Frame 3: 211 bytes on wire (1688 bits), 211 bytes captured (1688 bits)
Ethernet II, Src: Send_00 (20:53:45:4e:44:00), Dst: Receive_00 (20:52:45:43:56:00)
Internet Protocol Version 6, Src: fe80::3f3f:0:0:2, Dst: fe80::3f3f:0:0:3
Transmission Control Protocol, Src Port: 0, Dst Port: 7114, Seq: 128, Ack: 129, Len: 137
Zilla Frame
    Frame Type ID: 0x40000002
    Frame Type: WINDOW
    Protocol Type ID: 0xd0d41a76
    Protocol Type: mqtt
    Worker: 0
    Offset: 0x000000b0
    Origin ID: 0x0000000100000002
    Origin Namespace: test
    Origin Binding: net0
    Routed ID: 0x0000000100000002
    Routed Namespace: test
    Routed Binding: net0
    Stream ID: 0x3f3f000000000003
    Initial ID: 0x3f3f000000000003
    Reply ID: 0x3f3f000000000002
    Direction: INI
    Sequence: 0
    Acknowledge: 0
    Maximum: 8192
    Timestamp: 0x0000000000000000
    Trace ID: 0x8000000000000003
    Authorization: 0x0000000000000000
    Budget ID: 0x0000000000000000
    Padding: 0
    Minimum: 0
    Capabilities: 0x00
    Progress: 0
    Progress/Maximum: 0/8192

Frame 4: 211 bytes on wire (1688 bits), 211 bytes captured (1688 bits)
Ethernet II, Src: Send_00 (20:53:45:4e:44:00), Dst: Receive_00 (20:52:45:43:56:00)
Internet Protocol Version 6, Src: fe80::3f3f:0:0:3, Dst: fe80::3f3f:0:0:2
Transmission Control Protocol, Src Port: 7114, Dst Port: 0, Seq: 129, Ack: 265, Len: 137
Zilla Frame
    Frame Type ID: 0x40000002
    Frame Type: WINDOW
    Protocol Type ID: 0xd0d41a76
    Protocol Type: mqtt
    Worker: 0
    Offset: 0x00000110
    Origin ID: 0x0000000100000002
    Origin Namespace: test
    Origin Binding: net0
    Routed ID: 0x0000000100000002
    Routed Namespace: test
    Routed Binding: net0
    Stream ID: 0x3f3f000000000002
    Initial ID: 0x3f3f000000000003
    Reply ID: 0x3f3f000000000002
    Direction: REP
    Sequence: 0
    Acknowledge: 0
    Maximum: 8192
    Timestamp: 0x0000000000000000
    Trace ID: 0x8000000000000004
    Authorization: 0x0000000000000000
    Budget ID: 0x0000000000000000
    Padding: 0
    Minimum: 0
    Capabilities: 0x00
    Progress: 0
    Progress/Maximum: 0/8192

Frame 5: 237 bytes on wire (1896 bits), 237 bytes captured (1896 bits)
Ethernet II, Src: Send_00 (20:53:45:4e:44:00), Dst: Receive_00 (20:52:45:43:56:00)
Internet Protocol Version 6, Src: fe80::3f3f:0:0:2, Dst: fe80::3f3f:0:0:3
Transmission Control Protocol, Src Port: 0, Dst Port: 7114, Seq: 265, Ack: 266, Len: 163
Zilla Frame
    Frame Type ID: 0x00000002
    Frame Type: DATA
    Protocol Type ID: 0xd0d41a76
    Protocol Type: mqtt
    Worker: 0
    Offset: 0x00000170
    Origin ID: 0x0000000100000002
    Origin Namespace: test
    Origin Binding: net0
    Routed ID: 0x0000000100000002
    Routed Namespace: test
    Routed Binding: net0
    Stream ID: 0x3f3f000000000003
    Initial ID: 0x3f3f000000000003
    Reply ID: 0x3f3f000000000002
    Direction: INI
    Sequence: 0
    Acknowledge: 0
    Maximum: 8192
    Timestamp: 0x0000000000000000
    Trace ID: 0x8000000000000005
    Authorization: 0x0000000000000000
    Flags: 0x03
        .... ...1 = FIN: Set (1)
        .... ..1. = INIT: Set (1)
        .... .0.. = INCOMPLETE: Not set (0)
        .... 0... = SKIP: Not set (0)
    Budget ID: 0x0000000000000000
    Reserved: 26
    Progress: 26
    Progress/Maximum: 26/8192
    Payload
        Length: 26
        Payload
MQ Telemetry Transport Protocol, Connect Command

Frame 6: 211 bytes on wire (1688 bits), 211 bytes captured (1688 bits)
Ethernet II, Src: Send_00 (20:53:45:4e:44:00), Dst: Receive_00 (20:52:45:43:56:00)
Internet Protocol Version 6, Src: fe80::3f3f:0:0:2, Dst: fe80::3f3f:0:0:3
Transmission Control Protocol, Src Port: 0, Dst Port: 7114, Seq: 428, Ack: 266, Len: 137
Zilla Frame
    Frame Type ID: 0x40000002
    Frame Type: WINDOW
    Protocol Type ID: 0xd0d41a76
    Protocol Type: mqtt
    Worker: 0
    Offset: 0x000001e8
    Origin ID: 0x0000000100000002
    Origin Namespace: test
    Origin Binding: net0
    Routed ID: 0x0000000100000002
    Routed Namespace: test
    Routed Binding: net0
    Stream ID: 0x3f3f000000000003
    Initial ID: 0x3f3f000000000003
    Reply ID: 0x3f3f000000000002
    Direction: INI
    Sequence: 26
    Acknowledge: 26
    Maximum: 8192
    Timestamp: 0x0000000000000000
    Trace ID: 0x8000000000000006
    Authorization: 0x0000000000000000
    Budget ID: 0x0000000000000000
    Padding: 0
    Minimum: 0
    Capabilities: 0x00
    Progress: 0
    Progress/Maximum: 0/8192

Frame 7: 216 bytes on wire (1728 bits), 216 bytes captured (1728 bits)
Ethernet II, Src: Send_00 (20:53:45:4e:44:00), Dst: Receive_00 (20:52:45:43:56:00)
Internet Protocol Version 6, Src: fe80::3f3f:0:0:3, Dst: fe80::3f3f:0:0:2
Transmission Control Protocol, Src Port: 7114, Dst Port: 0, Seq: 266, Ack: 565, Len: 142
Zilla Frame
    Frame Type ID: 0x00000002
    Frame Type: DATA
    Protocol Type ID: 0xd0d41a76
    Protocol Type: mqtt
    Worker: 0
    Offset: 0x00000248
    Origin ID: 0x0000000100000002
    Origin Namespace: test
    Origin Binding: net0
    Routed ID: 0x0000000100000002
    Routed Namespace: test
    Routed Binding: net0
    Stream ID: 0x3f3f000000000002
    Initial ID: 0x3f3f000000000003
    Reply ID: 0x3f3f000000000002
    Direction: REP
    Sequence: 0
    Acknowledge: 0
    Maximum: 8192
    Timestamp: 0x0000000000000000
    Trace ID: 0x8000000000000007
    Authorization: 0x0000000000000000
    Flags: 0x03
        .... ...1 = FIN: Set (1)
        .... ..1. = INIT: Set (1)
        .... .0.. = INCOMPLETE: Not set (0)
        .... 0... = SKIP: Not set (0)
    Budget ID: 0x0000000000000000
    Reserved: 5
    Progress: 5
    Progress/Maximum: 5/8192
    Payload
        Length: 5
        Payload
MQ Telemetry Transport Protocol, Connect Ack

Frame 8: 211 bytes on wire (1688 bits), 211 bytes captured (1688 bits)
Ethernet II, Src: Send_00 (20:53:45:4e:44:00), Dst: Receive_00 (20:52:45:43:56:00)
Internet Protocol Version 6, Src: fe80::3f3f:0:0:3, Dst: fe80::3f3f:0:0:2
Transmission Control Protocol, Src Port: 7114, Dst Port: 0, Seq: 408, Ack: 565, Len: 137
Zilla Frame
    Frame Type ID: 0x40000002
    Frame Type: WINDOW
    Protocol Type ID: 0xd0d41a76
    Protocol Type: mqtt
    Worker: 0
    Offset: 0x000002b0
    Origin ID: 0x0000000100000002
    Origin Namespace: test
    Origin Binding: net0
    Routed ID: 0x0000000100000002
    Routed Namespace: test
    Routed Binding: net0
    Stream ID: 0x3f3f000000000002
    Initial ID: 0x3f3f000000000003
    Reply ID: 0x3f3f000000000002
    Direction: REP
    Sequence: 5
    Acknowledge: 5
    Maximum: 8192
    Timestamp: 0x0000000000000000
    Trace ID: 0x8000000000000008
    Authorization: 0x0000000000000000
    Budget ID: 0x0000000000000000
    Padding: 0
    Minimum: 0
    Capabilities: 0x00
    Progress: 0
    Progress/Maximum: 0/8192

Frame 9: 231 bytes on wire (1848 bits), 231 bytes captured (1848 bits)
Ethernet II, Src: Send_00 (20:53:45:4e:44:00), Dst: Receive_00 (20:52:45:43:56:00)
Internet Protocol Version 6, Src: fe80::3f3f:0:0:2, Dst: fe80::3f3f:0:0:3
Transmission Control Protocol, Src Port: 0, Dst Port: 7114, Seq: 565, Ack: 545, Len: 157
Zilla Frame
    Frame Type ID: 0x00000002
    Frame Type: DATA
    Protocol Type ID: 0xd0d41a76
    Protocol Type: mqtt
    Worker: 0
    Offset: 0x00000310
    Origin ID: 0x0000000100000002
    Origin Namespace: test
    Origin Binding: net0
    Routed ID: 0x0000000100000002
    Routed Namespace: test
    Routed Binding: net0
    Stream ID: 0x3f3f000000000003
    Initial ID: 0x3f3f000000000003
    Reply ID: 0x3f3f000000000002
    Direction: INI
    Sequence: 26
    Acknowledge: 26
    Maximum: 8192
    Timestamp: 0x0000000000000000
    Trace ID: 0x8000000000000009
    Authorization: 0x0000000000000000
    Flags: 0x03
        .... ...1 = FIN: Set (1)
        .... ..1. = INIT: Set (1)
        .... .0.. = INCOMPLETE: Not set (0)
        .... 0... = SKIP: Not set (0)
    Budget ID: 0x0000000000000000
    Reserved: 20
    Progress: 20
    Progress/Maximum: 20/8192
    Payload
        Length: 20
        Payload
MQ Telemetry Transport Protocol, Subscribe Request

Frame 10: 211 bytes on wire (1688 bits), 211 bytes captured (1688 bits)
Ethernet II, Src: Send_00 (20:53:45:4e:44:00), Dst: Receive_00 (20:52:45:43:56:00)
Internet Protocol Version 6, Src: fe80::3f3f:0:0:2, Dst: fe80::3f3f:0:0:3
Transmission Control Protocol, Src Port: 0, Dst Port: 7114, Seq: 722, Ack: 545, Len: 137
Zilla Frame
    Frame Type ID: 0x40000002
    Frame Type: WINDOW
    Protocol Type ID: 0xd0d41a76
    Protocol Type: mqtt
    Worker: 0
    Offset: 0x00000388
    Origin ID: 0x0000000100000002
    Origin Namespace: test
    Origin Binding: net0
    Routed ID: 0x0000000100000002
    Routed Namespace: test
    Routed Binding: net0
    Stream ID: 0x3f3f000000000003
    Initial ID: 0x3f3f000000000003
    Reply ID: 0x3f3f000000000002
    Direction: INI
    Sequence: 46
    Acknowledge: 46
    Maximum: 8192
    Timestamp: 0x0000000000000000
    Trace ID: 0x800000000000000a
    Authorization: 0x0000000000000000
    Budget ID: 0x0000000000000000
    Padding: 0
    Minimum: 0
    Capabilities: 0x00
    Progress: 0
    Progress/Maximum: 0/8192

Frame 11: 217 bytes on wire (1736 bits), 217 bytes captured (1736 bits)
Ethernet II, Src: Send_00 (20:53:45:4e:44:00), Dst: Receive_00 (20:52:45:43:56:00)
Internet Protocol Version 6, Src: fe80::3f3f:0:0:3, Dst: fe80::3f3f:0:0:2
Transmission Control Protocol, Src Port: 7114, Dst Port: 0, Seq: 545, Ack: 859, Len: 143
Zilla Frame
    Frame Type ID: 0x00000002
    Frame Type: DATA
    Protocol Type ID: 0xd0d41a76
    Protocol Type: mqtt
    Worker: 0
    Offset: 0x000003e8
    Origin ID: 0x0000000100000002
    Origin Namespace: test
    Origin Binding: net0
    Routed ID: 0x0000000100000002
    Routed Namespace: test
    Routed Binding: net0
    Stream ID: 0x3f3f000000000002
    Initial ID: 0x3f3f000000000003
    Reply ID: 0x3f3f000000000002
    Direction: REP
    Sequence: 5
    Acknowledge: 5
    Maximum: 8192
    Timestamp: 0x0000000000000000
    Trace ID: 0x800000000000000b
    Authorization: 0x0000000000000000
    Flags: 0x03
        .... ...1 = FIN: Set (1)
        .... ..1. = INIT: Set (1)
        .... .0.. = INCOMPLETE: Not set (0)
        .... 0... = SKIP: Not set (0)
    Budget ID: 0x0000000000000000
    Reserved: 6
    Progress: 6
    Progress/Maximum: 6/8192
    Payload
        Length: 6
        Payload
MQ Telemetry Transport Protocol, Subscribe Ack

Frame 12: 237 bytes on wire (1896 bits), 237 bytes captured (1896 bits)
Ethernet II, Src: Send_00 (20:53:45:4e:44:00), Dst: Receive_00 (20:52:45:43:56:00)
Internet Protocol Version 6, Src: fe80::3f3f:0:0:3, Dst: fe80::3f3f:0:0:2
Transmission Control Protocol, Src Port: 7114, Dst Port: 0, Seq: 688, Ack: 859, Len: 163
Zilla Frame
    Frame Type ID: 0x00000002
    Frame Type: DATA
    Protocol Type ID: 0xd0d41a76
    Protocol Type: mqtt
    Worker: 0
    Offset: 0x00000450
    Origin ID: 0x0000000100000002
    Origin Namespace: test
    Origin Binding: net0
    Routed ID: 0x0000000100000002
    Routed Namespace: test
    Routed Binding: net0
    Stream ID: 0x3f3f000000000002
    Initial ID: 0x3f3f000000000003
    Reply ID: 0x3f3f000000000002
    Direction: REP
    Sequence: 11
    Acknowledge: 5
    Maximum: 8192
    Timestamp: 0x0000000000000000
    Trace ID: 0x800000000000000c
    Authorization: 0x0000000000000000
    Flags: 0x03
        .... ...1 = FIN: Set (1)
        .... ..1. = INIT: Set (1)
        .... .0.. = INCOMPLETE: Not set (0)
        .... 0... = SKIP: Not set (0)
    Budget ID: 0x0000000000000000
    Reserved: 26
    Progress: 32
    Progress/Maximum: 32/8192
    Payload
        Length: 26
        Payload
MQ Telemetry Transport Protocol, Publish Message

Frame 13: 211 bytes on wire (1688 bits), 211 bytes captured (1688 bits)
Ethernet II, Src: Send_00 (20:53:45:4e:44:00), Dst: Receive_00 (20:52:45:43:56:00)
Internet Protocol Version 6, Src: fe80::3f3f:0:0:3, Dst: fe80::3f3f:0:0:2
Transmission Control Protocol, Src Port: 7114, Dst Port: 0, Seq: 851, Ack: 859, Len: 137
Zilla Frame
    Frame Type ID: 0x40000002
    Frame Type: WINDOW
    Protocol Type ID: 0xd0d41a76
    Protocol Type: mqtt
    Worker: 0
    Offset: 0x000004c8
    Origin ID: 0x0000000100000002
    Origin Namespace: test
    Origin Binding: net0
    Routed ID: 0x0000000100000002
    Routed Namespace: test
    Routed Binding: net0
    Stream ID: 0x3f3f000000000002
    Initial ID: 0x3f3f000000000003
    Reply ID: 0x3f3f000000000002
    Direction: REP
    Sequence: 11
    Acknowledge: 11
    Maximum: 8192
    Timestamp: 0x0000000000000000
    Trace ID: 0x800000000000000d
    Authorization: 0x0000000000000000
    Budget ID: 0x0000000000000000
    Padding: 0
    Minimum: 0
    Capabilities: 0x00
    Progress: 0
    Progress/Maximum: 0/8192

Frame 14: 211 bytes on wire (1688 bits), 211 bytes captured (1688 bits)
Ethernet II, Src: Send_00 (20:53:45:4e:44:00), Dst: Receive_00 (20:52:45:43:56:00)
Internet Protocol Version 6, Src: fe80::3f3f:0:0:3, Dst: fe80::3f3f:0:0:2
Transmission Control Protocol, Src Port: 7114, Dst Port: 0, Seq: 988, Ack: 859, Len: 137
Zilla Frame
    Frame Type ID: 0x40000002
    Frame Type: WINDOW
    Protocol Type ID: 0xd0d41a76
    Protocol Type: mqtt
    Worker: 0
    Offset: 0x00000528
    Origin ID: 0x0000000100000002
    Origin Namespace: test
    Origin Binding: net0
    Routed ID: 0x0000000100000002
    Routed Namespace: test
    Routed Binding: net0
    Stream ID: 0x3f3f000000000002
    Initial ID: 0x3f3f000000000003
    Reply ID: 0x3f3f000000000002
    Direction: REP
    Sequence: 37
    Acknowledge: 37
    Maximum: 8192
    Timestamp: 0x0000000000000000
    Trace ID: 0x800000000000000e
    Authorization: 0x0000000000000000
    Budget ID: 0x0000000000000000
    Padding: 0
    Minimum: 0
    Capabilities: 0x00
    Progress: 0
    Progress/Maximum: 0/8192
