Frame 1: 238 bytes on wire (1904 bits), 238 bytes captured (1904 bits)
Ethernet II, Src: Send_00 (20:53:45:4e:44:00), Dst: Receive_00 (20:52:45:43:56:00)
Internet Protocol Version 6, Src: fe80::3f3f:0:0:2, Dst: fe80::3f3f:0:0:3
Transmission Control Protocol, Src Port: 0, Dst Port: 7114, Seq: 0, Ack: 1, Len: 164
Zilla Frame
    Frame Type ID: 0x00000001
    Frame Type: BEGIN
    Protocol Type ID: 0x00000000
    Protocol Type: 
    Worker: 0
    Offset: 0x00000000
    Origin ID: 0x0000000100000002
    Origin Namespace: test
    Origin Binding: app0
    Routed ID: 0x0000000100000002
    Routed Namespace: test
    Routed Binding: app0
    Stream ID: 0x3f3f000000000003
    Initial ID: 0x3f3f000000000003
    Reply ID: 0x3f3f000000000002
    Direction: INI
    Sequence: 0
    Acknowledge: 0
    Maximum: 0
    Timestamp: 0x0000000000000000
    Trace ID: 0x8000000000000001
    Authorization: 0x0000000000000000
    Affinity: 0x0000000000000000
    Extension: mqtt
        Stream Type ID: 0x761ad4d0
        Stream Type: mqtt
        Kind: SESSION (2)
        Flags: 0x02
            .... ..1. = CLEAN_START: Set (1)
            .... .0.. = WILL: Not set (0)
        Expiry: 0
        Subscribe QoS Maximum: 0
        Publish QoS Maximum: 0
        Packet Size Maximum: 0
        Capabilities: 0x00
            .... ...0 = RETAIN: Not set (0)
            .... ..0. = WILDCARD: Not set (0)
            .... .0.. = SUBSCRIPTION_IDS: Not set (0)
            .... 0... = SHARED_SUBSCRIPTIONS: Not set (0)
        Client ID: client
            Length: 6
            Client ID: client
        Packet IDs (-1 items)
            Size: -1

Frame 2: 238 bytes on wire (1904 bits), 238 bytes captured (1904 bits)
Ethernet II, Src: Send_00 (20:53:45:4e:44:00), Dst: Receive_00 (20:52:45:43:56:00)
Internet Protocol Version 6, Src: fe80::3f3f:0:0:3, Dst: fe80::3f3f:0:0:2
Transmission Control Protocol, Src Port: 7114, Dst Port: 0, Seq: 1, Ack: 164, Len: 164
Zilla Frame
    Frame Type ID: 0x00000001
    Frame Type: BEGIN
    Protocol Type ID: 0x00000000
    Protocol Type: 
    Worker: 0
    Offset: 0x00000078
    Origin ID: 0x0000000100000002
    Origin Namespace: test
    Origin Binding: app0
    Routed ID: 0x0000000100000002
    Routed Namespace: test
    Routed Binding: app0
    Stream ID: 0x3f3f000000000002
    Initial ID: 0x3f3f000000000003
    Reply ID: 0x3f3f000000000002
    Direction: REP
    Sequence: 0
    Acknowledge: 0
    Maximum: 0
    Timestamp: 0x0000000000000000
    Trace ID: 0x8000000000000002
    Authorization: 0x0000000000000000
    Affinity: 0x0000000000000000
    Extension: mqtt
        Stream Type ID: 0x761ad4d0
        Stream Type: mqtt
        Kind: SESSION (2)
        Flags: 0x02
            .... ..1. = CLEAN_START: Set (1)
            .... .0.. = WILL: Not set (0)
        Expiry: 0
        Subscribe QoS Maximum: 2
        Publish QoS Maximum: 2
        Packet Size Maximum: 66560
        Capabilities: 0x0f
            .... ...1 = RETAIN: Set (1)
            .... ..1. = WILDCARD: Set (1)
            .... .1.. = SUBSCRIPTION_IDS: Set (1)
            .... 1... = SHARED_SUBSCRIPTIONS: Set (1)
        Client ID: client
            Length: 6
            Client ID: client
        Packet IDs (-1 items)
            Size: -1

Frame 3: 211 bytes on wire (1688 bits), 211 bytes captured (1688 bits)
Ethernet II, Src: Send_00 (20:53:45:4e:44:00), Dst: Receive_00 (20:52:45:43:56:00)
Internet Protocol Version 6, Src: fe80::3f3f:0:0:2, Dst: fe80::3f3f:0:0:3
Transmission Control Protocol, Src Port: 0, Dst Port: 7114, Seq: 164, Ack: 165, Len: 137
Zilla Frame
    Frame Type ID: 0x40000002
    Frame Type: WINDOW
    Protocol Type ID: 0x00000000
    Protocol Type: 
    Worker: 0
    Offset: 0x000000f0
    Origin ID: 0x0000000100000002
    Origin Namespace: test
    Origin Binding: app0
    Routed ID: 0x0000000100000002
    Routed Namespace: test
    Routed Binding: app0
    Stream ID: 0x3f3f000000000003
    Initial ID: 0x3f3f000000000003
    Reply ID: 0x3f3f000000000002
    Direction: INI
    Sequence: 0
    Acknowledge: 0
    Maximum: 8192
    Timestamp: 0x0000000000000000
    Trace ID: 0x8000000000000003
    Authorization: 0x0000000000000000
    Budget ID: 0x0000000000000000
    Padding: 0
    Minimum: 0
    Capabilities: 0x00
    Progress: 0
    Progress/Maximum: 0/8192

Frame 4: 211 bytes on wire (1688 bits), 211 bytes captured (1688 bits)
Ethernet II, Src: Send_00 (20:53:45:4e:44:00), Dst: Receive_00 (20:52:45:43:56:00)
Internet Protocol Version 6, Src: fe80::3f3f:0:0:3, Dst: fe80::3f3f:0:0:2
Transmission Control Protocol, Src Port: 7114, Dst Port: 0, Seq: 165, Ack: 301, Len: 137
Zilla Frame
    Frame Type ID: 0x40000002
    Frame Type: WINDOW
    Protocol Type ID: 0x00000000
    Protocol Type: 
    Worker: 0
    Offset: 0x00000150
    Origin ID: 0x0000000100000002
    Origin Namespace: test
    Origin Binding: app0
    Routed ID: 0x0000000100000002
    Routed Namespace: test
    Routed Binding: app0
    Stream ID: 0x3f3f000000000002
    Initial ID: 0x3f3f000000000003
    Reply ID: 0x3f3f000000000002
    Direction: REP
    Sequence: 0
    Acknowledge: 0
    Maximum: 8192
    Timestamp: 0x0000000000000000
    Trace ID: 0x8000000000000004
    Authorization: 0x0000000000000000
    Budget ID: 0x0000000000000000
    Padding: 0
    Minimum: 0
    Capabilities: 0x00
    Progress: 0
    Progress/Maximum: 0/8192

Frame 5: 211 bytes on wire (1688 bits), 211 bytes captured (1688 bits)
Ethernet II, Src: Send_00 (20:53:45:4e:44:00), Dst: Receive_00 (20:52:45:43:56:00)
Internet Protocol Version 6, Src: fe80::3f3f:0:0:3, Dst: fe80::3f3f:0:0:2
Transmission Control Protocol, Src Port: 7114, Dst Port: 0, Seq: 302, Ack: 301, Len: 137
Zilla Frame
    Frame Type ID: 0x00000002
    Frame Type: DATA
    Protocol Type ID: 0x00000000
    Protocol Type: 
    Worker: 0
    Offset: 0x000001b0
    Origin ID: 0x0000000100000002
    Origin Namespace: test
    Origin Binding: app0
    Routed ID: 0x0000000100000002
    Routed Namespace: test
    Routed Binding: app0
    Stream ID: 0x3f3f000000000002
    Initial ID: 0x3f3f000000000003
    Reply ID: 0x3f3f000000000002
    Direction: REP
    Sequence: 0
    Acknowledge: 0
    Maximum: 8192
    Timestamp: 0x0000000000000000
    Trace ID: 0x8000000000000005
    Authorization: 0x0000000000000000
    Flags: 0x03
        .... ...1 = FIN: Set (1)
        .... ..1. = INIT: Set (1)
        .... .0.. = INCOMPLETE: Not set (0)
        .... 0... = SKIP: Not set (0)
    Budget ID: 0x0000000000000000
    Reserved: 0
    Progress: 0
    Progress/Maximum: 0/8192
    Payload
        Length: 0

Frame 6: 211 bytes on wire (1688 bits), 211 bytes captured (1688 bits)
Ethernet II, Src: Send_00 (20:53:45:4e:44:00), Dst: Receive_00 (20:52:45:43:56:00)
Internet Protocol Version 6, Src: fe80::3f3f:0:0:3, Dst: fe80::3f3f:0:0:2
Transmission Control Protocol, Src Port: 7114, Dst Port: 0, Seq: 439, Ack: 301, Len: 137
Zilla Frame
    Frame Type ID: 0x40000002
    Frame Type: WINDOW
    Protocol Type ID: 0x00000000
    Protocol Type: 
    Worker: 0
    Offset: 0x00000210
    Origin ID: 0x0000000100000002
    Origin Namespace: test
    Origin Binding: app0
    Routed ID: 0x0000000100000002
    Routed Namespace: test
    Routed Binding: app0
    Stream ID: 0x3f3f000000000002
    Initial ID: 0x3f3f000000000003
    Reply ID: 0x3f3f000000000002
    Direction: REP
    Sequence: 0
    Acknowledge: 0
    Maximum: 8192
    Timestamp: 0x0000000000000000
    Trace ID: 0x8000000000000006
    Authorization: 0x0000000000000000
    Budget ID: 0x0000000000000000
    Padding: 0
    Minimum: 0
    Capabilities: 0x00
    Progress: 0
    Progress/Maximum: 0/8192

Frame 7: 257 bytes on wire (2056 bits), 257 bytes captured (2056 bits)
Ethernet II, Src: Send_00 (20:53:45:4e:44:00), Dst: Receive_00 (20:52:45:43:56:00)
Internet Protocol Version 6, Src: fe80::3f3f:0:0:2, Dst: fe80::3f3f:0:0:3
Transmission Control Protocol, Src Port: 0, Dst Port: 7114, Seq: 301, Ack: 576, Len: 183
Zilla Frame
    Frame Type ID: 0x00000002
    Frame Type: DATA
    Protocol Type ID: 0x00000000
    Protocol Type: 
    Worker: 0
    Offset: 0x00000270
    Origin ID: 0x0000000100000002
    Origin Namespace: test
    Origin Binding: app0
    Routed ID: 0x0000000100000002
    Routed Namespace: test
    Routed Binding: app0
    Stream ID: 0x3f3f000000000003
    Initial ID: 0x3f3f000000000003
    Reply ID: 0x3f3f000000000002
    Direction: INI
    Sequence: 0
    Acknowledge: 0
    Maximum: 8192
    Timestamp: 0x0000000000000000
    Trace ID: 0x8000000000000007
    Authorization: 0x0000000000000000
    Flags: 0x03
        .... ...1 = FIN: Set (1)
        .... ..1. = INIT: Set (1)
        .... .0.. = INCOMPLETE: Not set (0)
        .... 0... = SKIP: Not set (0)
    Budget ID: 0x0000000000000000
    Reserved: 28
    Progress: 28
    Progress/Maximum: 28/8192
    Payload
        Length: 28
        Payload
    Extension: mqtt
        Stream Type ID: 0x761ad4d0
        Stream Type: mqtt
        Kind: SESSION (2)
        Deferred: 0
        Data Kind: STATE (0x00)

Frame 8: 211 bytes on wire (1688 bits), 211 bytes captured (1688 bits)
Ethernet II, Src: Send_00 (20:53:45:4e:44:00), Dst: Receive_00 (20:52:45:43:56:00)
Internet Protocol Version 6, Src: fe80::3f3f:0:0:2, Dst: fe80::3f3f:0:0:3
Transmission Control Protocol, Src Port: 0, Dst Port: 7114, Seq: 484, Ack: 576, Len: 137
Zilla Frame
    Frame Type ID: 0x40000002
    Frame Type: WINDOW
    Protocol Type ID: 0x00000000
    Protocol Type: 
    Worker: 0
    Offset: 0x00000300
    Origin ID: 0x0000000100000002
    Origin Namespace: test
    Origin Binding: app0
    Routed ID: 0x0000000100000002
    Routed Namespace: test
    Routed Binding: app0
    Stream ID: 0x3f3f000000000003
    Initial ID: 0x3f3f000000000003
    Reply ID: 0x3f3f000000000002
    Direction: INI
    Sequence: 28
    Acknowledge: 28
    Maximum: 8192
    Timestamp: 0x0000000000000000
    Trace ID: 0x8000000000000008
    Authorization: 0x0000000000000000
    Budget ID: 0x0000000000000000
    Padding: 0
    Minimum: 0
    Capabilities: 0x00
    Progress: 0
    Progress/Maximum: 0/8192

Frame 9: 239 bytes on wire (1912 bits), 239 bytes captured (1912 bits)
Ethernet II, Src: Send_00 (20:53:45:4e:44:00), Dst: Receive_00 (20:52:45:43:56:00)
Internet Protocol Version 6, Src: fe80::3f3f:0:0:3, Dst: fe80::3f3f:0:0:2
Transmission Control Protocol, Src Port: 7114, Dst Port: 0, Seq: 576, Ack: 621, Len: 165
Zilla Frame
    Frame Type ID: 0x00000002
    Frame Type: DATA
    Protocol Type ID: 0x00000000
    Protocol Type: 
    Worker: 0
    Offset: 0x00000360
    Origin ID: 0x0000000100000002
    Origin Namespace: test
    Origin Binding: app0
    Routed ID: 0x0000000100000002
    Routed Namespace: test
    Routed Binding: app0
    Stream ID: 0x3f3f000000000002
    Initial ID: 0x3f3f000000000003
    Reply ID: 0x3f3f000000000002
    Direction: REP
    Sequence: 0
    Acknowledge: 0
    Maximum: 8192
    Timestamp: 0x0000000000000000
    Trace ID: 0x8000000000000009
    Authorization: 0x0000000000000000
    Flags: 0x03
        .... ...1 = FIN: Set (1)
        .... ..1. = INIT: Set (1)
        .... .0.. = INCOMPLETE: Not set (0)
        .... 0... = SKIP: Not set (0)
    Budget ID: 0x0000000000000000
    Reserved: 28
    Progress: 28
    Progress/Maximum: 28/8192
    Payload
        Length: 28
        Payload

Frame 10: 211 bytes on wire (1688 bits), 211 bytes captured (1688 bits)
Ethernet II, Src: Send_00 (20:53:45:4e:44:00), Dst: Receive_00 (20:52:45:43:56:00)
Internet Protocol Version 6, Src: fe80::3f3f:0:0:3, Dst: fe80::3f3f:0:0:2
Transmission Control Protocol, Src Port: 7114, Dst Port: 0, Seq: 741, Ack: 621, Len: 137
Zilla Frame
    Frame Type ID: 0x40000002
    Frame Type: WINDOW
    Protocol Type ID: 0x00000000
    Protocol Type: 
    Worker: 0
    Offset: 0x000003e0
    Origin ID: 0x0000000100000002
    Origin Namespace: test
    Origin Binding: app0
    Routed ID: 0x0000000100000002
    Routed Namespace: test
    Routed Binding: app0
    Stream ID: 0x3f3f000000000002
    Initial ID: 0x3f3f000000000003
    Reply ID: 0x3f3f000000000002
    Direction: REP
    Sequence: 28
    Acknowledge: 28
    Maximum: 8192
    Timestamp: 0x0000000000000000
    Trace ID: 0x800000000000000a
    Authorization: 0x0000000000000000
    Budget ID: 0x0000000000000000
    Padding: 0
    Minimum: 0
    Capabilities: 0x00
    Progress: 0
    Progress/Maximum: 0/8192

Frame 11: 206 bytes on wire (1648 bits), 206 bytes captured (1648 bits)
Ethernet II, Src: Send_00 (20:53:45:4e:44:00), Dst: Receive_00 (20:52:45:43:56:00)
Internet Protocol Version 6, Src: fe80::3f3f:0:0:2, Dst: fe80::3f3f:0:0:3
Transmission Control Protocol, Src Port: 0, Dst Port: 7114, Seq: 621, Ack: 878, Len: 132
Zilla Frame
    Frame Type ID: 0x00000003
    Frame Type: END
    Protocol Type ID: 0x00000000
    Protocol Type: 
    Worker: 0
    Offset: 0x00000440
    Origin ID: 0x0000000100000002
    Origin Namespace: test
    Origin Binding: app0
    Routed ID: 0x0000000100000002
    Routed Namespace: test
    Routed Binding: app0
    Stream ID: 0x3f3f000000000003
    Initial ID: 0x3f3f000000000003
    Reply ID: 0x3f3f000000000002
    Direction: INI
    Sequence: 28
    Acknowledge: 28
    Maximum: 8192
    Timestamp: 0x0000000000000000
    Trace ID: 0x800000000000000b
    Authorization: 0x0000000000000000
    Budget ID: 0x0000000000000000
    Reserved: 0

Frame 12: 206 bytes on wire (1648 bits), 206 bytes captured (1648 bits)
Ethernet II, Src: Send_00 (20:53:45:4e:44:00), Dst: Receive_00 (20:52:45:43:56:00)
Internet Protocol Version 6, Src: fe80::3f3f:0:0:3, Dst: fe80::3f3f:0:0:2
Transmission Control Protocol, Src Port: 7114, Dst Port: 0, Seq: 878, Ack: 753, Len: 132
Zilla Frame
    Frame Type ID: 0x00000003
    Frame Type: END
    Protocol Type ID: 0x00000000
    Protocol Type: 
    Worker: 0
    Offset: 0x00000498
    Origin ID: 0x0000000100000002
    Origin Namespace: test
    Origin Binding: app0
    Routed ID: 0x0000000100000002
    Routed Namespace: test
    Routed Binding: app0
    Stream ID: 0x3f3f000000000002
    Initial ID: 0x3f3f000000000003
    Reply ID: 0x3f3f000000000002
    Direction: REP
    Sequence: 28
    Acknowledge: 28
    Maximum: 8192
    Timestamp: 0x0000000000000000
    Trace ID: 0x800000000000000c
    Authorization: 0x0000000000000000
    Budget ID: 0x0000000000000000
    Reserved: 0

Frame 13: 251 bytes on wire (2008 bits), 251 bytes captured (2008 bits)
Ethernet II, Src: Send_00 (20:53:45:4e:44:00), Dst: Receive_00 (20:52:45:43:56:00)
Internet Protocol Version 6, Src: fe80::3f3f:0:0:4, Dst: fe80::3f3f:0:0:5
Transmission Control Protocol, Src Port: 0, Dst Port: 7114, Seq: 0, Ack: 1, Len: 177
Zilla Frame
    Frame Type ID: 0x00000001
    Frame Type: BEGIN
    Protocol Type ID: 0x00000000
    Protocol Type: 
    Worker: 0
    Offset: 0x000004f0
    Origin ID: 0x0000000100000002
    Origin Namespace: test
    Origin Binding: app0
    Routed ID: 0x0000000100000002
    Routed Namespace: test
    Routed Binding: app0
    Stream ID: 0x3f3f000000000005
    Initial ID: 0x3f3f000000000005
    Reply ID: 0x3f3f000000000004
    Direction: INI
    Sequence: 0
    Acknowledge: 0
    Maximum: 0
    Timestamp: 0x0000000000000000
    Trace ID: 0x800000000000000d
    Authorization: 0x0000000000000000
    Affinity: 0x0000000000000000
    Extension: mqtt
        Stream Type ID: 0x761ad4d0
        Stream Type: mqtt
        Kind: SUBSCRIBE (1)
        Client ID: client
            Length: 6
            Client ID: client
        QoS: AT_MOST_ONCE (0)
        Topic Filters (1 items)
            Length: 23
            Size: 1
        Topic Filter: sensor/one
            Subscription ID: 0x00000001
            QoS: AT_MOST_ONCE (0)
            Flags: 0x01
                .... ...1 = SEND_RETAINED: Set (1)
                .... ..0. = RETAIN_AS_PUBLISHED: Not set (0)
                .... .0.. = NO_LOCAL: Not set (0)
                .... 0... = RETAIN: Not set (0)
            Reason Code: 0
            Pattern: sensor/one
                Length: 10
                Pattern: sensor/one

Frame 14: 202 bytes on wire (1616 bits), 202 bytes captured (1616 bits)
Ethernet II, Src: Send_00 (20:53:45:4e:44:00), Dst: Receive_00 (20:52:45:43:56:00)
Internet Protocol Version 6, Src: fe80::3f3f:0:0:5, Dst: fe80::3f3f:0:0:4
Transmission Control Protocol, Src Port: 7114, Dst Port: 0, Seq: 1, Ack: 177, Len: 128
Zilla Frame
    Frame Type ID: 0x00000001
    Frame Type: BEGIN
    Protocol Type ID: 0x00000000
    Protocol Type: 
    Worker: 0
    Offset: 0x00000578
    Origin ID: 0x0000000100000002
    Origin Namespace: test
    Origin Binding: app0
    Routed ID: 0x0000000100000002
    Routed Namespace: test
    Routed Binding: app0
    Stream ID: 0x3f3f000000000004
    Initial ID: 0x3f3f000000000005
    Reply ID: 0x3f3f000000000004
    Direction: REP
    Sequence: 0
    Acknowledge: 0
    Maximum: 0
    Timestamp: 0x0000000000000000
    Trace ID: 0x800000000000000e
    Authorization: 0x0000000000000000
    Affinity: 0x0000000000000000

Frame 15: 211 bytes on wire (1688 bits), 211 bytes captured (1688 bits)
Ethernet II, Src: Send_00 (20:53:45:4e:44:00), Dst: Receive_00 (20:52:45:43:56:00)
Internet Protocol Version 6, Src: fe80::3f3f:0:0:4, Dst: fe80::3f3f:0:0:5
Transmission Control Protocol, Src Port: 0, Dst Port: 7114, Seq: 177, Ack: 129, Len: 137
Zilla Frame
    Frame Type ID: 0x40000002
    Frame Type: WINDOW
    Protocol Type ID: 0x00000000
    Protocol Type: 
    Worker: 0
    Offset: 0x000005d0
    Origin ID: 0x0000000100000002
    Origin Namespace: test
    Origin Binding: app0
    Routed ID: 0x0000000100000002
    Routed Namespace: test
    Routed Binding: app0
    Stream ID: 0x3f3f000000000005
    Initial ID: 0x3f3f000000000005
    Reply ID: 0x3f3f000000000004
    Direction: INI
    Sequence: 0
    Acknowledge: 0
    Maximum: 8192
    Timestamp: 0x0000000000000000
    Trace ID: 0x800000000000000f
    Authorization: 0x0000000000000000
    Budget ID: 0x0000000000000000
    Padding: 0
    Minimum: 0
    Capabilities: 0x00
    Progress: 0
    Progress/Maximum: 0/8192

Frame 16: 211 bytes on wire (1688 bits), 211 bytes captured (1688 bits)
Ethernet II, Src: Send_00 (20:53:45:4e:44:00), Dst: Receive_00 (20:52:45:43:56:00)
Internet Protocol Version 6, Src: fe80::3f3f:0:0:5, Dst: fe80::3f3f:0:0:4
Transmission Control Protocol, Src Port: 7114, Dst Port: 0, Seq: 129, Ack: 314, Len: 137
Zilla Frame
    Frame Type ID: 0x40000002
    Frame Type: WINDOW
    Protocol Type ID: 0x00000000
    Protocol Type: 
    Worker: 0
    Offset: 0x00000630
    Origin ID: 0x0000000100000002
    Origin Namespace: test
    Origin Binding: app0
    Routed ID: 0x0000000100000002
    Routed Namespace: test
    Routed Binding: app0
    Stream ID: 0x3f3f000000000004
    Initial ID: 0x3f3f000000000005
    Reply ID: 0x3f3f000000000004
    Direction: REP
    Sequence: 0
    Acknowledge: 0
    Maximum: 8192
    Timestamp: 0x0000000000000000
    Trace ID: 0x8000000000000010
    Authorization: 0x0000000000000000
    Budget ID: 0x0000000000000000
    Padding: 0
    Minimum: 0
    Capabilities: 0x00
    Progress: 0
    Progress/Maximum: 0/8192

Frame 17: 281 bytes on wire (2248 bits), 281 bytes captured (2248 bits)
Ethernet II, Src: Send_00 (20:53:45:4e:44:00), Dst: Receive_00 (20:52:45:43:56:00)
Internet Protocol Version 6, Src: fe80::3f3f:0:0:5, Dst: fe80::3f3f:0:0:4
Transmission Control Protocol, Src Port: 7114, Dst Port: 0, Seq: 266, Ack: 314, Len: 207
Zilla Frame
    Frame Type ID: 0x00000002
    Frame Type: DATA
    Protocol Type ID: 0x00000000
    Protocol Type: 
    Worker: 0
    Offset: 0x00000690
    Origin ID: 0x0000000100000002
    Origin Namespace: test
    Origin Binding: app0
    Routed ID: 0x0000000100000002
    Routed Namespace: test
    Routed Binding: app0
    Stream ID: 0x3f3f000000000004
    Initial ID: 0x3f3f000000000005
    Reply ID: 0x3f3f000000000004
    Direction: REP
    Sequence: 0
    Acknowledge: 0
    Maximum: 8192
    Timestamp: 0x0000000000000000
    Trace ID: 0x8000000000000011
    Authorization: 0x0000000000000000
    Flags: 0x03
        .... ...1 = FIN: Set (1)
        .... ..1. = INIT: Set (1)
        .... .0.. = INCOMPLETE: Not set (0)
        .... 0... = SKIP: Not set (0)
    Budget ID: 0x0000000000000000
    Reserved: 7
    Progress: 7
    Progress/Maximum: 7/8192
    Payload
        Length: 7
        Payload
    Extension: mqtt
        Stream Type ID: 0x761ad4d0
        Stream Type: mqtt
        Kind: SUBSCRIBE (1)
        Deferred: 0
        Topic: sensor/one
            Length: 10
            Topic: sensor/one
        Packet ID: 0x0000
        QoS: AT_MOST_ONCE (0)
        Flags: 0x00
            .... ...0 = RETAIN: Not set (0)
        Subscription IDs (1 items)
            Length: 5
            Size: 1
        Subscription ID: 1
            Subscription ID (varuint32): 01
            Subscription ID: 1
        Expiry Interval: -1
        Content Type: 
            Length: -1
            Content Type: 
        Payload Format: TEXT (1)
        Response Topic: 
            Length: -1
            Response Topic: 
        Correlation
            Length: -1
        Properties (0 items)
            Length: 4
            Size: 0

Frame 18: 211 bytes on wire (1688 bits), 211 bytes captured (1688 bits)
Ethernet II, Src: Send_00 (20:53:45:4e:44:00), Dst: Receive_00 (20:52:45:43:56:00)
Internet Protocol Version 6, Src: fe80::3f3f:0:0:5, Dst: fe80::3f3f:0:0:4
Transmission Control Protocol, Src Port: 7114, Dst Port: 0, Seq: 473, Ack: 314, Len: 137
Zilla Frame
    Frame Type ID: 0x40000002
    Frame Type: WINDOW
    Protocol Type ID: 0x00000000
    Protocol Type: 
    Worker: 0
    Offset: 0x00000738
    Origin ID: 0x0000000100000002
    Origin Namespace: test
    Origin Binding: app0
    Routed ID: 0x0000000100000002
    Routed Namespace: test
    Routed Binding: app0
    Stream ID: 0x3f3f000000000004
    Initial ID: 0x3f3f000000000005
    Reply ID: 0x3f3f000000000004
    Direction: REP
    Sequence: 7
    Acknowledge: 7
    Maximum: 8192
    Timestamp: 0x0000000000000000
    Trace ID: 0x8000000000000012
    Authorization: 0x0000000000000000
    Budget ID: 0x0000000000000000
    Padding: 0
    Minimum: 0
    Capabilities: 0x00
    Progress: 0
    Progress/Maximum: 0/8192

Frame 19: 206 bytes on wire (1648 bits), 206 bytes captured (1648 bits)
Ethernet II, Src: Send_00 (20:53:45:4e:44:00), Dst: Receive_00 (20:52:45:43:56:00)
Internet Protocol Version 6, Src: fe80::3f3f:0:0:4, Dst: fe80::3f3f:0:0:5
Transmission Control Protocol, Src Port: 0, Dst Port: 7114, Seq: 314, Ack: 610, Len: 132
Zilla Frame
    Frame Type ID: 0x00000003
    Frame Type: END
    Protocol Type ID: 0x00000000
    Protocol Type: 
    Worker: 0
    Offset: 0x00000798
    Origin ID: 0x0000000100000002
    Origin Namespace: test
    Origin Binding: app0
    Routed ID: 0x0000000100000002
    Routed Namespace: test
    Routed Binding: app0
    Stream ID: 0x3f3f000000000005
    Initial ID: 0x3f3f000000000005
    Reply ID: 0x3f3f000000000004
    Direction: INI
    Sequence: 0
    Acknowledge: 0
    Maximum: 8192
    Timestamp: 0x0000000000000000
    Trace ID: 0x8000000000000013
    Authorization: 0x0000000000000000
    Budget ID: 0x0000000000000000
    Reserved: 0

Frame 20: 206 bytes on wire (1648 bits), 206 bytes captured (1648 bits)
Ethernet II, Src: Send_00 (20:53:45:4e:44:00), Dst: Receive_00 (20:52:45:43:56:00)
Internet Protocol Version 6, Src: fe80::3f3f:0:0:5, Dst: fe80::3f3f:0:0:4
Transmission Control Protocol, Src Port: 7114, Dst Port: 0, Seq: 610, Ack: 446, Len: 132
Zilla Frame
    Frame Type ID: 0x00000003
    Frame Type: END
    Protocol Type ID: 0x00000000
    Protocol Type: 
    Worker: 0
    Offset: 0x000007f0
    Origin ID: 0x0000000100000002
    Origin Namespace: test
    Origin Binding: app0
    Routed ID: 0x0000000100000002
    Routed Namespace: test
    Routed Binding: app0
    Stream ID: 0x3f3f000000000004
    Initial ID: 0x3f3f000000000005
    Reply ID: 0x3f3f000000000004
    Direction: REP
    Sequence: 7
    Acknowledge: 7
    Maximum: 8192
    Timestamp: 0x0000000000000000
    Trace ID: 0x8000000000000014
    Authorization: 0x0000000000000000
    Budget ID: 0x0000000000000000
    Reserved: 0

