Frame 1: 228 bytes on wire (1824 bits), 228 bytes captured (1824 bits)
Ethernet II, Src: Send_00 (20:53:45:4e:44:00), Dst: Receive_00 (20:52:45:43:56:00)
Internet Protocol Version 6, Src: fe80::3f3f:0:0:2, Dst: fe80::3f3f:0:0:3
Transmission Control Protocol, Src Port: 0, Dst Port: 7114, Seq: 0, Ack: 1, Len: 154
Zilla Frame
    Frame Type ID: 0x00000001
    Frame Type: BEGIN
    Protocol Type ID: 0x8dcea850
    Protocol Type: proxy
    Worker: 0
    Offset: 0x00000000
    Origin ID: 0x0000000100000002
    Origin Namespace: test
    Origin Binding: net0
    Routed ID: 0x0000000100000002
    Routed Namespace: test
    Routed Binding: net0
    Stream ID: 0x3f3f000000000003
    Initial ID: 0x3f3f000000000003
    Reply ID: 0x3f3f000000000002
    Direction: INI
    Sequence: 0
    Acknowledge: 0
    Maximum: 0
    Timestamp: 0x0000000000000000
    Trace ID: 0x8000000000000001
    Authorization: 0x0000000000000000
    Affinity: 0x0000000000000000
    Extension: proxy
        Stream Type ID: 0x50a8ce8d
        Stream Type: proxy
        Address: INET4
            Family: INET4 (1)
            Protocol: STREAM (0)
            Source: 192.168.0.1
            Source Port: 32768
            Destination: 192.168.0.254
            Destination Port: 443
        Info (0 items)
            Length: 4
            Size: 0

Frame 2: 211 bytes on wire (1688 bits), 211 bytes captured (1688 bits)
Ethernet II, Src: Send_00 (20:53:45:4e:44:00), Dst: Receive_00 (20:52:45:43:56:00)
Internet Protocol Version 6, Src: fe80::3f3f:0:0:2, Dst: fe80::3f3f:0:0:3
Transmission Control Protocol, Src Port: 0, Dst Port: 7114, Seq: 154, Ack: 1, Len: 137
Zilla Frame
    Frame Type ID: 0x40000002
    Frame Type: WINDOW
    Protocol Type ID: 0x8dcea850
    Protocol Type: proxy
    Worker: 0
    Offset: 0x00000070
    Origin ID: 0x0000000100000002
    Origin Namespace: test
    Origin Binding: net0
    Routed ID: 0x0000000100000002
    Routed Namespace: test
    Routed Binding: net0
    Stream ID: 0x3f3f000000000003
    Initial ID: 0x3f3f000000000003
    Reply ID: 0x3f3f000000000002
    Direction: INI
    Sequence: 0
    Acknowledge: 0
    Maximum: 8192
    Timestamp: 0x0000000000000000
    Trace ID: 0x8000000000000002
    Authorization: 0x0000000000000000
    Budget ID: 0x0000000000000000
    Padding: 0
    Minimum: 0
    Capabilities: 0x00
    Progress: 0
    Progress/Maximum: 0/8192

Frame 3: 227 bytes on wire (1816 bits), 227 bytes captured (1816 bits)
Ethernet II, Src: Send_00 (20:53:45:4e:44:00), Dst: Receive_00 (20:52:45:43:56:00)
Internet Protocol Version 6, Src: fe80::3f3f:0:0:2, Dst: fe80::3f3f:0:0:3
Transmission Control Protocol, Src Port: 0, Dst Port: 7114, Seq: 291, Ack: 1, Len: 153
Zilla Frame
    Frame Type ID: 0x00000002
    Frame Type: DATA
    Protocol Type ID: 0x8dcea850
    Protocol Type: proxy
    Worker: 0
    Offset: 0x000000d0
    Origin ID: 0x0000000100000002
    Origin Namespace: test
    Origin Binding: net0
    Routed ID: 0x0000000100000002
    Routed Namespace: test
    Routed Binding: net0
    Stream ID: 0x3f3f000000000003
    Initial ID: 0x3f3f000000000003
    Reply ID: 0x3f3f000000000002
    Direction: INI
    Sequence: 0
    Acknowledge: 0
    Maximum: 8192
    Timestamp: 0x0000000000000000
    Trace ID: 0x8000000000000003
    Authorization: 0x0000000000000000
    Flags: 0x03
        .... ...1 = FIN: Set (1)
        .... ..1. = INIT: Set (1)
        .... .0.. = INCOMPLETE: Not set (0)
        .... 0... = SKIP: Not set (0)
    Budget ID: 0x0000000000000000
    Reserved: 16
    Progress: 16
    Progress/Maximum: 16/8192
    Payload
        Length: 16
        Payload

Frame 4: 211 bytes on wire (1688 bits), 211 bytes captured (1688 bits)
Ethernet II, Src: Send_00 (20:53:45:4e:44:00), Dst: Receive_00 (20:52:45:43:56:00)
Internet Protocol Version 6, Src: fe80::3f3f:0:0:2, Dst: fe80::3f3f:0:0:3
Transmission Control Protocol, Src Port: 0, Dst Port: 7114, Seq: 444, Ack: 1, Len: 137
Zilla Frame
    Frame Type ID: 0x40000002
    Frame Type: WINDOW
    Protocol Type ID: 0x8dcea850
    Protocol Type: proxy
    Worker: 0
    Offset: 0x00000140
    Origin ID: 0x0000000100000002
    Origin Namespace: test
    Origin Binding: net0
    Routed ID: 0x0000000100000002
    Routed Namespace: test
    Routed Binding: net0
    Stream ID: 0x3f3f000000000003
    Initial ID: 0x3f3f000000000003
    Reply ID: 0x3f3f000000000002
    Direction: INI
    Sequence: 16
    Acknowledge: 16
    Maximum: 8192
    Timestamp: 0x0000000000000000
    Trace ID: 0x8000000000000004
    Authorization: 0x0000000000000000
    Budget ID: 0x0000000000000000
    Padding: 0
    Minimum: 0
    Capabilities: 0x00
    Progress: 0
    Progress/Maximum: 0/8192
