Frame 1: 198 bytes on wire (1584 bits), 198 bytes captured (1584 bits)
Ethernet II, Src: Send_00 (20:53:45:4e:44:00), Dst: Receive_00 (20:52:45:43:56:00)
Internet Protocol Version 6, Src: fe80::1, Dst: fe80::
Transmission Control Protocol, Src Port: 7114, Dst Port: 0, Seq: 1, Ack: 1, Len: 124
Zilla Frame
    Frame Type ID: 0x40000003
    Frame Type: SIGNAL
    Protocol Type ID: 0x00000000
    Protocol Type: 
    Worker: 0
    Offset: 0x00000000
    Origin ID: 0x0000000000000000
    Routed ID: 0x0000000000000000
    Stream ID: 0x0000000000000000
    Direction: 
    Sequence: 0
    Acknowledge: 0
    Maximum: 0
    Timestamp: 0x0000000000000001
    Trace ID: 0x0000000000000001
    Authorization: 0x0000000000000000
    Cancel ID: 0x0000000000007701
    Signal ID: 0x00007702
    Context ID: 0x00007703
    Payload
        Length: -1

Frame 2: 198 bytes on wire (1584 bits), 198 bytes captured (1584 bits)
Ethernet II, Src: Send_00 (20:53:45:4e:44:00), Dst: Receive_00 (20:52:45:43:56:00)
Internet Protocol Version 6, Src: fe80:0:0:1::1, Dst: fe80:0:0:1::
Transmission Control Protocol, Src Port: 7114, Dst Port: 0, Seq: 1, Ack: 1, Len: 124
Zilla Frame
    Frame Type ID: 0x40000003
    Frame Type: SIGNAL
    Protocol Type ID: 0x00000000
    Protocol Type: 
    Worker: 1
    Offset: 0x00000000
    Origin ID: 0x0000000000000000
    Routed ID: 0x0000000000000000
    Stream ID: 0x0000000000000000
    Direction: 
    Sequence: 0
    Acknowledge: 0
    Maximum: 0
    Timestamp: 0x0000000000000001
    Trace ID: 0x0100000000000001
    Authorization: 0x0000000000000000
    Cancel ID: 0x0000000000008801
    Signal ID: 0x00008802
    Context ID: 0x00008803
    Payload
        Length: -1

Frame 3: 198 bytes on wire (1584 bits), 198 bytes captured (1584 bits)
Ethernet II, Src: Send_00 (20:53:45:4e:44:00), Dst: Receive_00 (20:52:45:43:56:00)
Internet Protocol Version 6, Src: fe80:0:0:2::1, Dst: fe80:0:0:2::
Transmission Control Protocol, Src Port: 7114, Dst Port: 0, Seq: 1, Ack: 1, Len: 124
Zilla Frame
    Frame Type ID: 0x40000003
    Frame Type: SIGNAL
    Protocol Type ID: 0x00000000
    Protocol Type: 
    Worker: 2
    Offset: 0x00000000
    Origin ID: 0x0000000000000000
    Routed ID: 0x0000000000000000
    Stream ID: 0x0000000000000000
    Direction: 
    Sequence: 0
    Acknowledge: 0
    Maximum: 0
    Timestamp: 0x0000000000000001
    Trace ID: 0x0200000000000001
    Authorization: 0x0000000000000000
    Cancel ID: 0x0000000000008801
    Signal ID: 0x00009902
    Context ID: 0x00009903
    Payload
        Length: -1

Frame 4: 210 bytes on wire (1680 bits), 210 bytes captured (1680 bits)
Ethernet II, Src: Send_00 (20:53:45:4e:44:00), Dst: Receive_00 (20:52:45:43:56:00)
Internet Protocol Version 6, Src: fe80::1, Dst: fe80::
Transmission Control Protocol, Src Port: 7114, Dst Port: 0, Seq: 125, Ack: 1, Len: 136
Zilla Frame
    Frame Type ID: 0x40000003
    Frame Type: SIGNAL
    Protocol Type ID: 0x00000000
    Protocol Type: 
    Worker: 0
    Offset: 0x00000060
    Origin ID: 0x0000000000000000
    Routed ID: 0x0000000000000000
    Stream ID: 0x0000000000000000
    Direction: 
    Sequence: 0
    Acknowledge: 0
    Maximum: 0
    Timestamp: 0x0000000000000002
    Trace ID: 0x0000000000000000
    Authorization: 0x0000000000000000
    Cancel ID: 0x0000000000007801
    Signal ID: 0x00007802
    Context ID: 0x00007803
    Payload
        Length: 12
        Payload

Frame 5: 233 bytes on wire (1864 bits), 233 bytes captured (1864 bits)
Ethernet II, Src: Send_00 (20:53:45:4e:44:00), Dst: Receive_00 (20:52:45:43:56:00)
Internet Protocol Version 6, Src: fe80::1:101:0:0:4, Dst: fe80::1:101:0:0:5
Transmission Control Protocol, Src Port: 0, Dst Port: 7114, Seq: 0, Ack: 1, Len: 159
Zilla Frame
    Frame Type ID: 0x00000001
    Frame Type: BEGIN
    Protocol Type ID: 0x8ab62046
    Protocol Type: http
    Worker: 1
    Offset: 0x00000060
    Origin ID: 0x000000090000000b
    Origin Namespace: example
    Origin Binding: north_tcp_server
    Routed ID: 0x000000090000000d
    Routed Namespace: example
    Routed Binding: north_http_server
    Stream ID: 0x0101000000000005
    Initial ID: 0x0101000000000005
    Reply ID: 0x0101000000000004
    Direction: INI
    Sequence: 0
    Acknowledge: 0
    Maximum: 0
    Timestamp: 0x0000000000000002
    Trace ID: 0x0100000000000003
    Authorization: 0x0000000000000000
    Affinity: 0x0101000000000005

Frame 6: 233 bytes on wire (1864 bits), 233 bytes captured (1864 bits)
Ethernet II, Src: Send_00 (20:53:45:4e:44:00), Dst: Receive_00 (20:52:45:43:56:00)
Internet Protocol Version 6, Src: fe80::2:202:0:0:4, Dst: fe80::2:202:0:0:5
Transmission Control Protocol, Src Port: 0, Dst Port: 7114, Seq: 0, Ack: 1, Len: 159
Zilla Frame
    Frame Type ID: 0x00000001
    Frame Type: BEGIN
    Protocol Type ID: 0x8ab62046
    Protocol Type: http
    Worker: 2
    Offset: 0x00000060
    Origin ID: 0x000000090000000b
    Origin Namespace: example
    Origin Binding: north_tcp_server
    Routed ID: 0x000000090000000d
    Routed Namespace: example
    Routed Binding: north_http_server
    Stream ID: 0x0202000000000005
    Initial ID: 0x0202000000000005
    Reply ID: 0x0202000000000004
    Direction: INI
    Sequence: 0
    Acknowledge: 0
    Maximum: 0
    Timestamp: 0x0000000000000002
    Trace ID: 0x0200000000000003
    Authorization: 0x0000000000000000
    Affinity: 0x0202000000000005

Frame 7: 233 bytes on wire (1864 bits), 233 bytes captured (1864 bits)
Ethernet II, Src: Send_00 (20:53:45:4e:44:00), Dst: Receive_00 (20:52:45:43:56:00)
Internet Protocol Version 6, Src: fe80::4, Dst: fe80::5
Transmission Control Protocol, Src Port: 0, Dst Port: 7114, Seq: 0, Ack: 1, Len: 159
Zilla Frame
    Frame Type ID: 0x00000001
    Frame Type: BEGIN
    Protocol Type ID: 0x8ab62046
    Protocol Type: http
    Worker: 0
    Offset: 0x000000d0
    Origin ID: 0x000000090000000b
    Origin Namespace: example
    Origin Binding: north_tcp_server
    Routed ID: 0x000000090000000d
    Routed Namespace: example
    Routed Binding: north_http_server
    Stream ID: 0x0000000000000005
    Initial ID: 0x0000000000000005
    Reply ID: 0x0000000000000004
    Direction: INI
    Sequence: 0
    Acknowledge: 0
    Maximum: 0
    Timestamp: 0x0000000000000003
    Trace ID: 0x0000000000000003
    Authorization: 0x0000000000000000
    Affinity: 0x0000000000000005

Frame 8: 225 bytes on wire (1800 bits), 225 bytes captured (1800 bits)
Ethernet II, Src: Send_00 (20:53:45:4e:44:00), Dst: Receive_00 (20:52:45:43:56:00)
Internet Protocol Version 6, Src: fe80::1:101:0:0:5, Dst: fe80::1:101:0:0:4
Transmission Control Protocol, Src Port: 7114, Dst Port: 0, Seq: 1, Ack: 159, Len: 151
Zilla Frame
    Frame Type ID: 0x00000003
    Frame Type: END
    Protocol Type ID: 0x8ab62046
    Protocol Type: http
    Worker: 1
    Offset: 0x000000b8
    Origin ID: 0x000000090000000b
    Origin Namespace: example
    Origin Binding: north_tcp_server
    Routed ID: 0x000000090000000d
    Routed Namespace: example
    Routed Binding: north_http_server
    Stream ID: 0x0101000000000004
    Initial ID: 0x0101000000000005
    Reply ID: 0x0101000000000004
    Direction: REP
    Sequence: 703
    Acknowledge: 704
    Maximum: 4444
    Timestamp: 0x0000000000000003
    Trace ID: 0x0100000000000003
    Authorization: 0x0000000000000000

Frame 9: 225 bytes on wire (1800 bits), 225 bytes captured (1800 bits)
Ethernet II, Src: Send_00 (20:53:45:4e:44:00), Dst: Receive_00 (20:52:45:43:56:00)
Internet Protocol Version 6, Src: fe80::2:202:0:0:5, Dst: fe80::2:202:0:0:4
Transmission Control Protocol, Src Port: 7114, Dst Port: 0, Seq: 1, Ack: 159, Len: 151
Zilla Frame
    Frame Type ID: 0x00000003
    Frame Type: END
    Protocol Type ID: 0x8ab62046
    Protocol Type: http
    Worker: 2
    Offset: 0x000000b8
    Origin ID: 0x000000090000000b
    Origin Namespace: example
    Origin Binding: north_tcp_server
    Routed ID: 0x000000090000000d
    Routed Namespace: example
    Routed Binding: north_http_server
    Stream ID: 0x0202000000000004
    Initial ID: 0x0202000000000005
    Reply ID: 0x0202000000000004
    Direction: REP
    Sequence: 703
    Acknowledge: 704
    Maximum: 4444
    Timestamp: 0x0000000000000003
    Trace ID: 0x0200000000000003
    Authorization: 0x0000000000000000

Frame 10: 242 bytes on wire (1936 bits), 242 bytes captured (1936 bits)
Ethernet II, Src: Send_00 (20:53:45:4e:44:00), Dst: Receive_00 (20:52:45:43:56:00)
Internet Protocol Version 6, Src: fe80::4, Dst: fe80::5
Transmission Control Protocol, Src Port: 0, Dst Port: 7114, Seq: 159, Ack: 1, Len: 168
Zilla Frame
    Frame Type ID: 0x40000002
    Frame Type: WINDOW
    Protocol Type ID: 0x8ab62046
    Protocol Type: http
    Worker: 0
    Offset: 0x00000128
    Origin ID: 0x000000090000000b
    Origin Namespace: example
    Origin Binding: north_tcp_server
    Routed ID: 0x000000090000000d
    Routed Namespace: example
    Routed Binding: north_http_server
    Stream ID: 0x0000000000000005
    Initial ID: 0x0000000000000005
    Reply ID: 0x0000000000000004
    Direction: INI
    Sequence: 0
    Acknowledge: 0
    Maximum: 65536
    Timestamp: 0x0000000000000004
    Trace ID: 0x0000000000000003
    Authorization: 0x0000000000000000
    Budget ID: 0x0000000000000000
    Padding: 0
    Minimum: 0
    Capabilities: 0x00
    Progress: 0
    Progress/Maximum: 0/65536

Frame 11: 233 bytes on wire (1864 bits), 233 bytes captured (1864 bits)
Ethernet II, Src: Send_00 (20:53:45:4e:44:00), Dst: Receive_00 (20:52:45:43:56:00)
Internet Protocol Version 6, Src: fe80::5, Dst: fe80::4
Transmission Control Protocol, Src Port: 7114, Dst Port: 0, Seq: 1, Ack: 327, Len: 159
Zilla Frame
    Frame Type ID: 0x00000001
    Frame Type: BEGIN
    Protocol Type ID: 0x8ab62046
    Protocol Type: http
    Worker: 0
    Offset: 0x00000188
    Origin ID: 0x000000090000000b
    Origin Namespace: example
    Origin Binding: north_tcp_server
    Routed ID: 0x000000090000000d
    Routed Namespace: example
    Routed Binding: north_http_server
    Stream ID: 0x0000000000000004
    Initial ID: 0x0000000000000005
    Reply ID: 0x0000000000000004
    Direction: REP
    Sequence: 1
    Acknowledge: 0
    Maximum: 0
    Timestamp: 0x0000000000000005
    Trace ID: 0x0000000000000003
    Authorization: 0x0000000000000000
    Affinity: 0x0000000000000000

Frame 12: 242 bytes on wire (1936 bits), 242 bytes captured (1936 bits)
Ethernet II, Src: Send_00 (20:53:45:4e:44:00), Dst: Receive_00 (20:52:45:43:56:00)
Internet Protocol Version 6, Src: fe80::5, Dst: fe80::4
Transmission Control Protocol, Src Port: 7114, Dst Port: 0, Seq: 160, Ack: 327, Len: 168
Zilla Frame
    Frame Type ID: 0x40000002
    Frame Type: WINDOW
    Protocol Type ID: 0x8ab62046
    Protocol Type: http
    Worker: 0
    Offset: 0x000001e0
    Origin ID: 0x000000090000000b
    Origin Namespace: example
    Origin Binding: north_tcp_server
    Routed ID: 0x000000090000000d
    Routed Namespace: example
    Routed Binding: north_http_server
    Stream ID: 0x0000000000000004
    Initial ID: 0x0000000000000005
    Reply ID: 0x0000000000000004
    Direction: REP
    Sequence: 0
    Acknowledge: 0
    Maximum: 65536
    Timestamp: 0x0000000000000006
    Trace ID: 0x0000000000000003
    Authorization: 0x0000000000000000
    Budget ID: 0x0000000000000000
    Padding: 0
    Minimum: 0
    Capabilities: 0x00
    Progress: 0
    Progress/Maximum: 0/65536

Frame 13: 241 bytes on wire (1928 bits), 241 bytes captured (1928 bits)
Ethernet II, Src: Send_00 (20:53:45:4e:44:00), Dst: Receive_00 (20:52:45:43:56:00)
Internet Protocol Version 6, Src: fe80::76, Dst: fe80::77
Transmission Control Protocol, Src Port: 0, Dst Port: 7114, Seq: 0, Ack: 1, Len: 167
Zilla Frame
    Frame Type ID: 0x00000001
    Frame Type: BEGIN
    Protocol Type ID: 0x00000000
    Protocol Type: 
    Worker: 0
    Offset: 0x00000240
    Origin ID: 0x000000090000000d
    Origin Namespace: example
    Origin Binding: north_http_server
    Routed ID: 0x000000090000000e
    Routed Namespace: example
    Routed Binding: north_http_kafka_mapping
    Stream ID: 0x0000000000000077
    Initial ID: 0x0000000000000077
    Reply ID: 0x0000000000000076
    Direction: INI
    Sequence: 71
    Acknowledge: 72
    Maximum: 73
    Timestamp: 0x0000000000000007
    Trace ID: 0x0000000000004202
    Authorization: 0x0000000000004203
    Affinity: 0x0000000000004204

Frame 14: 372 bytes on wire (2976 bits), 372 bytes captured (2976 bits)
Ethernet II, Src: Send_00 (20:53:45:4e:44:00), Dst: Receive_00 (20:52:45:43:56:00)
Internet Protocol Version 6, Src: fe80::4, Dst: fe80::5
Transmission Control Protocol, Src Port: 0, Dst Port: 7114, Seq: 327, Ack: 328, Len: 298
Zilla Frame
    Frame Type ID: 0x00000002
    Frame Type: DATA
    Protocol Type ID: 0x8ab62046
    Protocol Type: http
    Worker: 0
    Offset: 0x00000298
    Origin ID: 0x000000090000000b
    Origin Namespace: example
    Origin Binding: north_tcp_server
    Routed ID: 0x000000090000000d
    Routed Namespace: example
    Routed Binding: north_http_server
    Stream ID: 0x0000000000000005
    Initial ID: 0x0000000000000005
    Reply ID: 0x0000000000000004
    Direction: INI
    Sequence: 123
    Acknowledge: 456
    Maximum: 777
    Timestamp: 0x0000000000000008
    Trace ID: 0x0000000000000003
    Authorization: 0x0000000000000000
    Flags: 0x03
        .... ...1 = FIN: Set (1)
        .... ..1. = INIT: Set (1)
        .... .0.. = INCOMPLETE: Not set (0)
        .... 0... = SKIP: Not set (0)
    Budget ID: 0x0000000000004205
    Reserved: 16902
    Progress: 16569
    Progress/Maximum: 16569/777
    Payload
        Length: 130
        Payload
Hypertext Transfer Protocol
    POST / HTTP/1.1\n
        [Expert Info (Chat/Sequence): POST / HTTP/1.1\n]
            [POST / HTTP/1.1\n]
            [Severity level: Chat]
            [Group: Sequence]
        Request Method: POST
        Request URI: /
        Request Version: HTTP/1.1
    Host: localhost:8080\n
    User-Agent: curl/7.85.0\n
    Accept: */*\n
    Content-Type: text/plain\n
    Content-Length: 12\n
        [Content length: 12]
    \n
    [Full request URI: http://localhost:8080/]
    [HTTP request 1/1]
    File Data: 12 bytes
Line-based text data: text/plain (1 lines)

Frame 15: 316 bytes on wire (2528 bits), 316 bytes captured (2528 bits)
Ethernet II, Src: Send_00 (20:53:45:4e:44:00), Dst: Receive_00 (20:52:45:43:56:00)
Internet Protocol Version 6, Src: fe80::5, Dst: fe80::4
Transmission Control Protocol, Src Port: 7114, Dst Port: 0, Seq: 328, Ack: 625, Len: 242
Zilla Frame
    Frame Type ID: 0x00000002
    Frame Type: DATA
    Protocol Type ID: 0x8ab62046
    Protocol Type: http
    Worker: 0
    Offset: 0x00000378
    Origin ID: 0x000000090000000b
    Origin Namespace: example
    Origin Binding: north_tcp_server
    Routed ID: 0x000000090000000d
    Routed Namespace: example
    Routed Binding: north_http_server
    Stream ID: 0x0000000000000004
    Initial ID: 0x0000000000000005
    Reply ID: 0x0000000000000004
    Direction: REP
    Sequence: 123
    Acknowledge: 456
    Maximum: 777
    Timestamp: 0x0000000000000009
    Trace ID: 0x0000000000000003
    Authorization: 0x0000000000000000
    Flags: 0x03
        .... ...1 = FIN: Set (1)
        .... ..1. = INIT: Set (1)
        .... .0.. = INCOMPLETE: Not set (0)
        .... 0... = SKIP: Not set (0)
    Budget ID: 0x0000000000004205
    Reserved: 16902
    Progress: 16569
    Progress/Maximum: 16569/777
    Payload
        Length: 74
        Payload
Hypertext Transfer Protocol
    HTTP/1.1 200 OK\n
        [Expert Info (Chat/Sequence): HTTP/1.1 200 OK\n]
            [HTTP/1.1 200 OK\n]
            [Severity level: Chat]
            [Group: Sequence]
        Response Version: HTTP/1.1
        Status Code: 200
        [Status Code Description: OK]
        Response Phrase: OK
    Content-Type: text/plain\n
    Content-Length: 13\n
        [Content length: 13]
    \n
    [HTTP response 1/1]
    [Time since request: 0.000000000 seconds]
    [Request in frame: 14]
    [Request URI: http://localhost:8080/]
    File Data: 13 bytes
Line-based text data: text/plain (1 lines)

Frame 16: 225 bytes on wire (1800 bits), 225 bytes captured (1800 bits)
Ethernet II, Src: Send_00 (20:53:45:4e:44:00), Dst: Receive_00 (20:52:45:43:56:00)
Internet Protocol Version 6, Src: fe80::5, Dst: fe80::4
Transmission Control Protocol, Src Port: 7114, Dst Port: 0, Seq: 570, Ack: 625, Len: 151
Zilla Frame
    Frame Type ID: 0x40000004
    Frame Type: CHALLENGE
    Protocol Type ID: 0x8ab62046
    Protocol Type: http
    Worker: 0
    Offset: 0x00000420
    Origin ID: 0x000000090000000b
    Origin Namespace: example
    Origin Binding: north_tcp_server
    Routed ID: 0x000000090000000d
    Routed Namespace: example
    Routed Binding: north_http_server
    Stream ID: 0x0000000000000004
    Initial ID: 0x0000000000000005
    Reply ID: 0x0000000000000004
    Direction: REP
    Sequence: 201
    Acknowledge: 202
    Maximum: 22222
    Timestamp: 0x000000000000000a
    Trace ID: 0x0000000000000003
    Authorization: 0x0000000000007742

Frame 17: 295 bytes on wire (2360 bits), 295 bytes captured (2360 bits)
Ethernet II, Src: Send_00 (20:53:45:4e:44:00), Dst: Receive_00 (20:52:45:43:56:00)
Internet Protocol Version 6, Src: fe80::4, Dst: fe80::5
Transmission Control Protocol, Src Port: 0, Dst Port: 7114, Seq: 625, Ack: 721, Len: 221
Zilla Frame
    Frame Type ID: 0x00000002
    Frame Type: DATA
    Protocol Type ID: 0x8ab62046
    Protocol Type: http
    Worker: 0
    Offset: 0x00000470
    Origin ID: 0x000000090000000b
    Origin Namespace: example
    Origin Binding: north_tcp_server
    Routed ID: 0x000000090000000d
    Routed Namespace: example
    Routed Binding: north_http_server
    Stream ID: 0x0000000000000005
    Initial ID: 0x0000000000000005
    Reply ID: 0x0000000000000004
    Direction: INI
    Sequence: 123
    Acknowledge: 456
    Maximum: 777
    Timestamp: 0x000000000000000b
    Trace ID: 0x0000000000000003
    Authorization: 0x0000000000000000
    Flags: 0x03
        .... ...1 = FIN: Set (1)
        .... ..1. = INIT: Set (1)
        .... .0.. = INCOMPLETE: Not set (0)
        .... 0... = SKIP: Not set (0)
    Budget ID: 0x0000000000004405
    Reserved: 16902
    Progress: 16569
    Progress/Maximum: 16569/777
    Payload
        Length: 53
        Payload
HyperText Transfer Protocol 2
    Stream: HEADERS, Stream ID: 1, Length 44, POST /
        Length: 44
        Type: HEADERS (1)
        Flags: 0x04, End Headers
            00.0 ..0. = Unused: 0x00
            ..0. .... = Priority: False
            .... 0... = Padded: False
            .... .1.. = End Headers: True
            .... ...0 = End Stream: False
        0... .... .... .... .... .... .... .... = Reserved: 0x0
        .000 0000 0000 0000 0000 0000 0000 0001 = Stream Identifier: 1
        [Pad Length: 0]
        Header Block Fragment: 8387418aa0e41d139d09b8e85a67847a8825b650c3cb85717f53032a2f2a5f87497ca58ae819aa0f0d023132
        [Header Length: 184]
        [Header Count: 8]
        Header: :method: POST
            Name Length: 7
            Name: :method
            Value Length: 4
            Value: POST
            :method: POST
            [Unescaped: POST]
            Representation: Indexed Header Field
            Index: 3
        Header: :scheme: https
            Name Length: 7
            Name: :scheme
            Value Length: 5
            Value: https
            :scheme: https
            [Unescaped: https]
            Representation: Indexed Header Field
            Index: 7
        Header: :authority: localhost:7143
            Name Length: 10
            Name: :authority
            Value Length: 14
            Value: localhost:7143
            :authority: localhost:7143
            [Unescaped: localhost:7143]
            Representation: Literal Header Field with Incremental Indexing - Indexed Name
            Index: 1
        Header: :path: /
            Name Length: 5
            Name: :path
            Value Length: 1
            Value: /
            :path: /
            [Unescaped: /]
            Representation: Indexed Header Field
            Index: 4
        Header: user-agent: curl/8.1.2
            Name Length: 10
            Name: user-agent
            Value Length: 10
            Value: curl/8.1.2
            user-agent: curl/8.1.2
            [Unescaped: curl/8.1.2]
            Representation: Literal Header Field with Incremental Indexing - Indexed Name
            Index: 58
        Header: accept: */*
            Name Length: 6
            Name: accept
            Value Length: 3
            Value: */*
            accept: */*
            [Unescaped: */*]
            Representation: Literal Header Field with Incremental Indexing - Indexed Name
            Index: 19
        Header: content-type: text/plain
            Name Length: 12
            Name: content-type
            Value Length: 10
            Value: text/plain
            content-type: text/plain
            [Unescaped: text/plain]
            Representation: Literal Header Field with Incremental Indexing - Indexed Name
            Index: 31
        Header: content-length: 12
            Name Length: 14
            Name: content-length
            Value Length: 2
            Value: 12
            content-length: 12
            [Unescaped: 12]
            Representation: Literal Header Field without Indexing - Indexed Name
            Index: 28
        [Full request URI: https://localhost:7143/]

Frame 18: 289 bytes on wire (2312 bits), 289 bytes captured (2312 bits)
Ethernet II, Src: Send_00 (20:53:45:4e:44:00), Dst: Receive_00 (20:52:45:43:56:00)
Internet Protocol Version 6, Src: fe80::5, Dst: fe80::4
Transmission Control Protocol, Src Port: 7114, Dst Port: 0, Seq: 721, Ack: 846, Len: 215
Zilla Frame
    Frame Type ID: 0x00000002
    Frame Type: DATA
    Protocol Type ID: 0x8ab62046
    Protocol Type: http
    Worker: 0
    Offset: 0x00000508
    Origin ID: 0x000000090000000b
    Origin Namespace: example
    Origin Binding: north_tcp_server
    Routed ID: 0x000000090000000d
    Routed Namespace: example
    Routed Binding: north_http_server
    Stream ID: 0x0000000000000004
    Initial ID: 0x0000000000000005
    Reply ID: 0x0000000000000004
    Direction: REP
    Sequence: 123
    Acknowledge: 456
    Maximum: 777
    Timestamp: 0x000000000000000c
    Trace ID: 0x0000000000000003
    Authorization: 0x0000000000000000
    Flags: 0x03
        .... ...1 = FIN: Set (1)
        .... ..1. = INIT: Set (1)
        .... .0.. = INCOMPLETE: Not set (0)
        .... 0... = SKIP: Not set (0)
    Budget ID: 0x0000000000004405
    Reserved: 16902
    Progress: 16569
    Progress/Maximum: 16569/777
    Payload
        Length: 47
        Payload
HyperText Transfer Protocol 2
    Stream: HEADERS, Stream ID: 1, Length 38, 200 OK
        Length: 38
        Type: HEADERS (1)
        Flags: 0x04, End Headers
            00.0 ..0. = Unused: 0x00
            ..0. .... = Priority: False
            .... 0... = Padded: False
            .... .1.. = End Headers: True
            .... ...0 = End Stream: False
        0... .... .... .... .... .... .... .... = Reserved: 0x0
        .000 0000 0000 0000 0000 0000 0000 0001 = Stream Identifier: 1
        [Pad Length: 0]
        Header Block Fragment: 880f2b0a6375726c2f382e312e320f04032a2f2a0f100a746578742f706c61696e0f0d023132
        [Header Length: 117]
        [Header Count: 5]
        Header: :status: 200 OK
            Name Length: 7
            Name: :status
            Value Length: 3
            Value: 200
            :status: 200
            [Unescaped: 200]
            Representation: Indexed Header Field
            Index: 8
        Header: user-agent: curl/8.1.2
            Name Length: 10
            Name: user-agent
            Value Length: 10
            Value: curl/8.1.2
            user-agent: curl/8.1.2
            [Unescaped: curl/8.1.2]
            Representation: Literal Header Field without Indexing - Indexed Name
            Index: 58
        Header: accept: */*
            Name Length: 6
            Name: accept
            Value Length: 3
            Value: */*
            accept: */*
            [Unescaped: */*]
            Representation: Literal Header Field without Indexing - Indexed Name
            Index: 19
        Header: content-type: text/plain
            Name Length: 12
            Name: content-type
            Value Length: 10
            Value: text/plain
            content-type: text/plain
            [Unescaped: text/plain]
            Representation: Literal Header Field without Indexing - Indexed Name
            Index: 31
        Header: content-length: 12
            Name Length: 14
            Name: content-length
            Value Length: 2
            Value: 12
            content-length: 12
            [Unescaped: 12]
            Representation: Literal Header Field without Indexing - Indexed Name
            Index: 28
        [Time since request: 0.000000000 seconds]
        [Request in frame: 17]

Frame 19: 254 bytes on wire (2032 bits), 254 bytes captured (2032 bits)
Ethernet II, Src: Send_00 (20:53:45:4e:44:00), Dst: Receive_00 (20:52:45:43:56:00)
Internet Protocol Version 6, Src: fe80::5, Dst: fe80::4
Transmission Control Protocol, Src Port: 7114, Dst Port: 0, Seq: 936, Ack: 846, Len: 180
Zilla Frame
    Frame Type ID: 0x00000002
    Frame Type: DATA
    Protocol Type ID: 0x8ab62046
    Protocol Type: http
    Worker: 0
    Offset: 0x00000598
    Origin ID: 0x000000090000000b
    Origin Namespace: example
    Origin Binding: north_tcp_server
    Routed ID: 0x000000090000000d
    Routed Namespace: example
    Routed Binding: north_http_server
    Stream ID: 0x0000000000000004
    Initial ID: 0x0000000000000005
    Reply ID: 0x0000000000000004
    Direction: REP
    Sequence: 123
    Acknowledge: 456
    Maximum: 777
    Timestamp: 0x000000000000000d
    Trace ID: 0x0000000000000003
    Authorization: 0x0000000000000000
    Flags: 0x03
        .... ...1 = FIN: Set (1)
        .... ..1. = INIT: Set (1)
        .... .0.. = INCOMPLETE: Not set (0)
        .... 0... = SKIP: Not set (0)
    Budget ID: 0x0000000000004405
    Reserved: 16902
    Progress: 16569
    Progress/Maximum: 16569/777
    Payload
        Length: 12
        Payload

Frame 20: 237 bytes on wire (1896 bits), 237 bytes captured (1896 bits)
Ethernet II, Src: Send_00 (20:53:45:4e:44:00), Dst: Receive_00 (20:52:45:43:56:00)
Internet Protocol Version 6, Src: fe80::5, Dst: fe80::4
Transmission Control Protocol, Src Port: 7114, Dst Port: 0, Seq: 1116, Ack: 846, Len: 163
Zilla Frame
    Frame Type ID: 0x00000005
    Frame Type: FLUSH
    Protocol Type ID: 0x8ab62046
    Protocol Type: http
    Worker: 0
    Offset: 0x00000608
    Origin ID: 0x000000090000000b
    Origin Namespace: example
    Origin Binding: north_tcp_server
    Routed ID: 0x000000090000000d
    Routed Namespace: example
    Routed Binding: north_http_server
    Stream ID: 0x0000000000000004
    Initial ID: 0x0000000000000005
    Reply ID: 0x0000000000000004
    Direction: REP
    Sequence: 301
    Acknowledge: 302
    Maximum: 3344
    Timestamp: 0x000000000000000e
    Trace ID: 0x0000000000000003
    Authorization: 0x0000000000000000
    Budget ID: 0x0000000000003300
    Reserved: 13059

Frame 21: 225 bytes on wire (1800 bits), 225 bytes captured (1800 bits)
Ethernet II, Src: Send_00 (20:53:45:4e:44:00), Dst: Receive_00 (20:52:45:43:56:00)
Internet Protocol Version 6, Src: fe80::4, Dst: fe80::5
Transmission Control Protocol, Src Port: 0, Dst Port: 7114, Seq: 846, Ack: 1279, Len: 151
Zilla Frame
    Frame Type ID: 0x00000004
    Frame Type: ABORT
    Protocol Type ID: 0x8ab62046
    Protocol Type: http
    Worker: 0
    Offset: 0x00000660
    Origin ID: 0x000000090000000b
    Origin Namespace: example
    Origin Binding: north_tcp_server
    Routed ID: 0x000000090000000d
    Routed Namespace: example
    Routed Binding: north_http_server
    Stream ID: 0x0000000000000005
    Initial ID: 0x0000000000000005
    Reply ID: 0x0000000000000004
    Direction: INI
    Sequence: 401
    Acknowledge: 402
    Maximum: 4477
    Timestamp: 0x000000000000000f
    Trace ID: 0x0000000000000003
    Authorization: 0x0000000000000000

Frame 22: 225 bytes on wire (1800 bits), 225 bytes captured (1800 bits)
Ethernet II, Src: Send_00 (20:53:45:4e:44:00), Dst: Receive_00 (20:52:45:43:56:00)
Internet Protocol Version 6, Src: fe80::7, Dst: fe80::6
Transmission Control Protocol, Src Port: 7114, Dst Port: 0, Seq: 1, Ack: 1, Len: 151
Zilla Frame
    Frame Type ID: 0x40000001
    Frame Type: RESET
    Protocol Type ID: 0x8ab62046
    Protocol Type: http
    Worker: 0
    Offset: 0x000006b0
    Origin ID: 0x000000090000000b
    Origin Namespace: example
    Origin Binding: north_tcp_server
    Routed ID: 0x000000090000000d
    Routed Namespace: example
    Routed Binding: north_http_server
    Stream ID: 0x0000000000000006
    Initial ID: 0x0000000000000007
    Reply ID: 0x0000000000000006
    Direction: REP
    Sequence: 501
    Acknowledge: 502
    Maximum: 5577
    Timestamp: 0x0000000000000010
    Trace ID: 0x0000000000000003
    Authorization: 0x0000000000000000

Frame 23: 225 bytes on wire (1800 bits), 225 bytes captured (1800 bits)
Ethernet II, Src: Send_00 (20:53:45:4e:44:00), Dst: Receive_00 (20:52:45:43:56:00)
Internet Protocol Version 6, Src: fe80::4, Dst: fe80::5
Transmission Control Protocol, Src Port: 0, Dst Port: 7114, Seq: 997, Ack: 1279, Len: 151
Zilla Frame
    Frame Type ID: 0x00000003
    Frame Type: END
    Protocol Type ID: 0x8ab62046
    Protocol Type: http
    Worker: 0
    Offset: 0x00000700
    Origin ID: 0x000000090000000b
    Origin Namespace: example
    Origin Binding: north_tcp_server
    Routed ID: 0x000000090000000d
    Routed Namespace: example
    Routed Binding: north_http_server
    Stream ID: 0x0000000000000005
    Initial ID: 0x0000000000000005
    Reply ID: 0x0000000000000004
    Direction: INI
    Sequence: 701
    Acknowledge: 702
    Maximum: 7777
    Timestamp: 0x0000000000000011
    Trace ID: 0x0000000000000003
    Authorization: 0x0000000000000000

Frame 24: 225 bytes on wire (1800 bits), 225 bytes captured (1800 bits)
Ethernet II, Src: Send_00 (20:53:45:4e:44:00), Dst: Receive_00 (20:52:45:43:56:00)
Internet Protocol Version 6, Src: fe80::5, Dst: fe80::4
Transmission Control Protocol, Src Port: 7114, Dst Port: 0, Seq: 1279, Ack: 1148, Len: 151
Zilla Frame
    Frame Type ID: 0x00000003
    Frame Type: END
    Protocol Type ID: 0x8ab62046
    Protocol Type: http
    Worker: 0
    Offset: 0x00000750
    Origin ID: 0x000000090000000b
    Origin Namespace: example
    Origin Binding: north_tcp_server
    Routed ID: 0x000000090000000d
    Routed Namespace: example
    Routed Binding: north_http_server
    Stream ID: 0x0000000000000004
    Initial ID: 0x0000000000000005
    Reply ID: 0x0000000000000004
    Direction: REP
    Sequence: 703
    Acknowledge: 704
    Maximum: 4444
    Timestamp: 0x0000000000000012
    Trace ID: 0x0000000000000003
    Authorization: 0x0000000000000000

Frame 25: 280 bytes on wire (2240 bits), 280 bytes captured (2240 bits)
Ethernet II, Src: Send_00 (20:53:45:4e:44:00), Dst: Receive_00 (20:52:45:43:56:00)
Internet Protocol Version 6, Src: fe80::8, Dst: fe80::9
Transmission Control Protocol, Src Port: 0, Dst Port: 7114, Seq: 0, Ack: 1, Len: 206
Zilla Frame
    Frame Type ID: 0x00000001
    Frame Type: BEGIN
    Protocol Type ID: 0x084b20e1
    Protocol Type: kafka
    Worker: 0
    Offset: 0x000007a0
    Origin ID: 0x0000000900000011
    Origin Namespace: example
    Origin Binding: south_kafka_client
    Routed ID: 0x0000000900000012
    Routed Namespace: example
    Routed Binding: south_tcp_client
    Stream ID: 0x0000000000000009
    Initial ID: 0x0000000000000009
    Reply ID: 0x0000000000000008
    Direction: INI
    Sequence: 0
    Acknowledge: 0
    Maximum: 0
    Timestamp: 0x0000000000000013
    Trace ID: 0x0000000000000009
    Authorization: 0x0000000000000000
    Affinity: 0x0000000000000000
    Extension: proxy
        Stream Type ID: 0x50a8ce8d
        Stream Type: proxy
        Address: INET
            Family: INET (0)
            Protocol: STREAM (0)
            Source: 192.168.0.77
            Source Port: 12345
            Destination: 192.168.0.42
            Destination Port: 442
        Info (0 items)
            Length: 4
            Size: 0

Frame 26: 342 bytes on wire (2736 bits), 342 bytes captured (2736 bits)
Ethernet II, Src: Send_00 (20:53:45:4e:44:00), Dst: Receive_00 (20:52:45:43:56:00)
Internet Protocol Version 6, Src: fe80::8, Dst: fe80::9
Transmission Control Protocol, Src Port: 0, Dst Port: 7114, Seq: 0, Ack: 1, Len: 268
Zilla Frame
    Frame Type ID: 0x00000001
    Frame Type: BEGIN
    Protocol Type ID: 0x084b20e1
    Protocol Type: kafka
    Worker: 0
    Offset: 0x00000828
    Origin ID: 0x0000000900000011
    Origin Namespace: example
    Origin Binding: south_kafka_client
    Routed ID: 0x0000000900000012
    Routed Namespace: example
    Routed Binding: south_tcp_client
    Stream ID: 0x0000000000000009
    Initial ID: 0x0000000000000009
    Reply ID: 0x0000000000000008
    Direction: INI
    Sequence: 0
    Acknowledge: 0
    Maximum: 0
    Timestamp: 0x0000000000000014
    Trace ID: 0x0000000000000009
    Authorization: 0x0000000000000000
    Affinity: 0x0000000000000000
    Extension: proxy
        Stream Type ID: 0x50a8ce8d
        Stream Type: proxy
        Address: INET4
            Family: INET4 (1)
            Protocol: STREAM (0)
            Source: 192.168.0.1
            Source Port: 32768
            Destination: 192.168.0.254
            Destination Port: 443
        Info (9 items)
            Length: 86
            Size: 9
        Info: ALPN: alpn
            Type: ALPN (0x01)
            Length: 4
            Value: alpn
        Info: AUTHORITY: authority
            Type: AUTHORITY (0x02)
            Length: 9
            Value: authority
        Info: IDENTITY: 0x12345678
            Type: IDENTITY (0x05)
            Length: 4
            Value: 12345678
        Info: NAMESPACE: namespace
            Type: NAMESPACE (0x30)
            Length: 9
            Value: namespace
        Info: SECURE: VERSION: TLSv1.3
            Type: SECURE (0x20)
            Secure Type: VERSION (0x21)
            Length: 7
            Value: TLSv1.3
        Info: SECURE: NAME: name
            Type: SECURE (0x20)
            Secure Type: NAME (0x22)
            Length: 4
            Value: name
        Info: SECURE: CIPHER: cipher
            Type: SECURE (0x20)
            Secure Type: CIPHER (0x23)
            Length: 6
            Value: cipher
        Info: SECURE: SIGNATURE: signature
            Type: SECURE (0x20)
            Secure Type: SIGNATURE (0x24)
            Length: 9
            Value: signature
        Info: SECURE: KEY: key
            Type: SECURE (0x20)
            Secure Type: KEY (0x25)
            Length: 3
            Value: key

Frame 27: 284 bytes on wire (2272 bits), 284 bytes captured (2272 bits)
Ethernet II, Src: Send_00 (20:53:45:4e:44:00), Dst: Receive_00 (20:52:45:43:56:00)
Internet Protocol Version 6, Src: fe80::8, Dst: fe80::9
Transmission Control Protocol, Src Port: 0, Dst Port: 7114, Seq: 0, Ack: 1, Len: 210
Zilla Frame
    Frame Type ID: 0x00000001
    Frame Type: BEGIN
    Protocol Type ID: 0x084b20e1
    Protocol Type: kafka
    Worker: 0
    Offset: 0x000008e8
    Origin ID: 0x0000000900000011
    Origin Namespace: example
    Origin Binding: south_kafka_client
    Routed ID: 0x0000000900000012
    Routed Namespace: example
    Routed Binding: south_tcp_client
    Stream ID: 0x0000000000000009
    Initial ID: 0x0000000000000009
    Reply ID: 0x0000000000000008
    Direction: INI
    Sequence: 0
    Acknowledge: 0
    Maximum: 0
    Timestamp: 0x0000000000000015
    Trace ID: 0x0000000000000009
    Authorization: 0x0000000000000000
    Affinity: 0x0000000000000000
    Extension: proxy
        Stream Type ID: 0x50a8ce8d
        Stream Type: proxy
        Address: INET6
            Family: INET6 (2)
            Protocol: STREAM (0)
            Source: fd12:3456:789a:1::1
            Source Port: 32768
            Destination: fd12:3456:789a:1::fe
            Destination Port: 443
        Info (0 items)
            Length: 4
            Size: 0

Frame 28: 464 bytes on wire (3712 bits), 464 bytes captured (3712 bits)
Ethernet II, Src: Send_00 (20:53:45:4e:44:00), Dst: Receive_00 (20:52:45:43:56:00)
Internet Protocol Version 6, Src: fe80::8, Dst: fe80::9
Transmission Control Protocol, Src Port: 0, Dst Port: 7114, Seq: 0, Ack: 1, Len: 390
Zilla Frame
    Frame Type ID: 0x00000001
    Frame Type: BEGIN
    Protocol Type ID: 0x084b20e1
    Protocol Type: kafka
    Worker: 0
    Offset: 0x00000970
    Origin ID: 0x0000000900000011
    Origin Namespace: example
    Origin Binding: south_kafka_client
    Routed ID: 0x0000000900000012
    Routed Namespace: example
    Routed Binding: south_tcp_client
    Stream ID: 0x0000000000000009
    Initial ID: 0x0000000000000009
    Reply ID: 0x0000000000000008
    Direction: INI
    Sequence: 0
    Acknowledge: 0
    Maximum: 0
    Timestamp: 0x0000000000000016
    Trace ID: 0x0000000000000009
    Authorization: 0x0000000000000000
    Affinity: 0x0000000000000000
    Extension: proxy
        Stream Type ID: 0x50a8ce8d
        Stream Type: proxy
        Address: UNIX
            Family: UNIX (3)
            Protocol: DATAGRAM (1)
            Source: unix-source
            Destination: unix-destination
        Info (0 items)
            Length: 4
            Size: 0

Frame 29: 247 bytes on wire (1976 bits), 247 bytes captured (1976 bits)
Ethernet II, Src: Send_00 (20:53:45:4e:44:00), Dst: Receive_00 (20:52:45:43:56:00)
Internet Protocol Version 6, Src: fe80::8, Dst: fe80::9
Transmission Control Protocol, Src Port: 0, Dst Port: 7114, Seq: 0, Ack: 1, Len: 173
Zilla Frame
    Frame Type ID: 0x00000001
    Frame Type: BEGIN
    Protocol Type ID: 0x084b20e1
    Protocol Type: kafka
    Worker: 0
    Offset: 0x00000ab0
    Origin ID: 0x0000000900000011
    Origin Namespace: example
    Origin Binding: south_kafka_client
    Routed ID: 0x0000000900000012
    Routed Namespace: example
    Routed Binding: south_tcp_client
    Stream ID: 0x0000000000000009
    Initial ID: 0x0000000000000009
    Reply ID: 0x0000000000000008
    Direction: INI
    Sequence: 0
    Acknowledge: 0
    Maximum: 0
    Timestamp: 0x0000000000000017
    Trace ID: 0x0000000000000009
    Authorization: 0x0000000000000000
    Affinity: 0x0000000000000000
    Extension: proxy
        Stream Type ID: 0x50a8ce8d
        Stream Type: proxy
        Address: NONE
            Family: NONE (4)
        Info (0 items)
            Length: 4
            Size: 0

Frame 30: 286 bytes on wire (2288 bits), 286 bytes captured (2288 bits)
Ethernet II, Src: Send_00 (20:53:45:4e:44:00), Dst: Receive_00 (20:52:45:43:56:00)
Internet Protocol Version 6, Src: fe80::10, Dst: fe80::11
Transmission Control Protocol, Src Port: 0, Dst Port: 7114, Seq: 0, Ack: 1, Len: 212
Zilla Frame
    Frame Type ID: 0x00000001
    Frame Type: BEGIN
    Protocol Type ID: 0x8ab62046
    Protocol Type: http
    Worker: 0
    Offset: 0x00000b18
    Origin ID: 0x000000090000000b
    Origin Namespace: example
    Origin Binding: north_tcp_server
    Routed ID: 0x000000090000000d
    Routed Namespace: example
    Routed Binding: north_http_server
    Stream ID: 0x0000000000000011
    Initial ID: 0x0000000000000011
    Reply ID: 0x0000000000000010
    Direction: INI
    Sequence: 0
    Acknowledge: 0
    Maximum: 0
    Timestamp: 0x0000000000000018
    Trace ID: 0x0000000000000011
    Authorization: 0x0000000000000000
    Affinity: 0x0000000000000000
    Extension: http
        Stream Type ID: 0x4620b68a
        Stream Type: http
        Headers (3 items)
            Length: 45
            Size: 3
        Header: :scheme: http
            Length: 7
            Name: :scheme
            Length: 4
