Frame 1: 198 bytes on wire (1584 bits), 198 bytes captured (1584 bits)
Ethernet II, Src: Send_00 (20:53:45:4e:44:00), Dst: Receive_00 (20:52:45:43:56:00)
Internet Protocol Version 6, Src: fe80::1, Dst: fe80::
Transmission Control Protocol, Src Port: 7114, Dst Port: 0, Seq: 1, Ack: 1, Len: 124
Zilla Frame
    Frame Type ID: 0x40000003
    Frame Type: SIGNAL
    Protocol Type ID: 0x00000000
    Protocol Type: 
    Worker: 0
    Offset: 0x00000000
    Origin ID: 0x0000000000000000
    Routed ID: 0x0000000000000000
    Stream ID: 0x0000000000000000
    Direction: 
    Sequence: 0
    Acknowledge: 0
    Maximum: 0
    Timestamp: [timestamp]
    Trace ID: 0x0000000000000001
    Authorization: 0x0000000000000000
    Cancel ID: 0xffffffffffffffff
    Signal ID: 0x00000001
    Context ID: 0x00000000
    Payload
        Length: -1

Frame 2: 211 bytes on wire (1688 bits), 211 bytes captured (1688 bits)
Ethernet II, Src: Send_00 (20:53:45:4e:44:00), Dst: Receive_00 (20:52:45:43:56:00)
Internet Protocol Version 6, Src: fe80::1:3f00:0:0:2, Dst: fe80::1:3f00:0:0:3
Transmission Control Protocol, Src Port: 0, Dst Port: 7114, Seq: 1, Ack: 1, Len: 137
Zilla Frame
    Frame Type ID: 0x40000002
    Frame Type: WINDOW
    Protocol Type ID: 0x8ab62046
    Protocol Type: http
    Worker: 1
    Offset: 0x00000000
    Origin ID: 0x0000000100000009
    Origin Namespace: test
    Origin Binding: net0
    Routed ID: 0x0000000100000009
    Routed Namespace: test
    Routed Binding: net0
    Stream ID: 0x3f00000000000003
    Initial ID: 0x3f00000000000003
    Reply ID: 0x3f00000000000002
    Direction: INI
    Sequence: 0
    Acknowledge: 0
    Maximum: 65536
    Timestamp: [timestamp]
    Trace ID: 0x8000000000000001
    Authorization: 0x0000000000000000
    Budget ID: 0x0000000000000000
    Padding: 0
    Minimum: 0
    Capabilities: 0x00
    Progress: 0
    Progress/Maximum: 0/65536

Frame 3: 202 bytes on wire (1616 bits), 202 bytes captured (1616 bits)
Ethernet II, Src: Send_00 (20:53:45:4e:44:00), Dst: Receive_00 (20:52:45:43:56:00)
Internet Protocol Version 6, Src: fe80::3f00:0:0:2, Dst: fe80::3f00:0:0:3
Transmission Control Protocol, Src Port: 0, Dst Port: 7114, Seq: 0, Ack: 1, Len: 128
Zilla Frame
    Frame Type ID: 0x00000001
    Frame Type: BEGIN
    Protocol Type ID: 0x8ab62046
    Protocol Type: http
    Worker: 0
    Offset: 0x00000060
    Origin ID: 0x0000000100000009
    Origin Namespace: test
    Origin Binding: net0
    Routed ID: 0x0000000100000009
    Routed Namespace: test
    Routed Binding: net0
    Stream ID: 0x3f00000000000003
    Initial ID: 0x3f00000000000003
    Reply ID: 0x3f00000000000002
    Direction: INI
    Sequence: 0
    Acknowledge: 0
    Maximum: 0
    Timestamp: [timestamp]
    Trace ID: 0x8000000000000001
    Authorization: 0x0000000000000000
    Affinity: 0x0000000000000000

Frame 4: 202 bytes on wire (1616 bits), 202 bytes captured (1616 bits)
Ethernet II, Src: Send_00 (20:53:45:4e:44:00), Dst: Receive_00 (20:52:45:43:56:00)
Internet Protocol Version 6, Src: fe80::1:3f00:0:0:3, Dst: fe80::1:3f00:0:0:2
Transmission Control Protocol, Src Port: 7114, Dst Port: 0, Seq: 1, Ack: 138, Len: 128
Zilla Frame
    Frame Type ID: 0x00000001
    Frame Type: BEGIN
    Protocol Type ID: 0x8ab62046
    Protocol Type: http
    Worker: 1
    Offset: 0x00000060
    Origin ID: 0x0000000100000009
    Origin Namespace: test
    Origin Binding: net0
    Routed ID: 0x0000000100000009
    Routed Namespace: test
    Routed Binding: net0
    Stream ID: 0x3f00000000000002
    Initial ID: 0x3f00000000000003
    Reply ID: 0x3f00000000000002
    Direction: REP
    Sequence: 0
    Acknowledge: 0
    Maximum: 0
    Timestamp: [timestamp]
    Trace ID: 0x8000000000000001
    Authorization: 0x0000000000000000
    Affinity: 0x0000000000000000

Frame 5: 211 bytes on wire (1688 bits), 211 bytes captured (1688 bits)
Ethernet II, Src: Send_00 (20:53:45:4e:44:00), Dst: Receive_00 (20:52:45:43:56:00)
Internet Protocol Version 6, Src: fe80::3f00:0:0:3, Dst: fe80::3f00:0:0:2
Transmission Control Protocol, Src Port: 7114, Dst Port: 0, Seq: 1, Ack: 128, Len: 137
Zilla Frame
    Frame Type ID: 0x40000002
    Frame Type: WINDOW
    Protocol Type ID: 0x8ab62046
    Protocol Type: http
    Worker: 0
    Offset: 0x000000b8
    Origin ID: 0x0000000100000009
    Origin Namespace: test
    Origin Binding: net0
    Routed ID: 0x0000000100000009
    Routed Namespace: test
    Routed Binding: net0
    Stream ID: 0x3f00000000000002
    Initial ID: 0x3f00000000000003
    Reply ID: 0x3f00000000000002
    Direction: REP
    Sequence: 0
    Acknowledge: 0
    Maximum: 40000
    Timestamp: [timestamp]
    Trace ID: 0x8000000000000002
    Authorization: 0x0000000000000000
    Budget ID: 0x0000000000000000
    Padding: 0
    Minimum: 0
    Capabilities: 0x00
    Progress: 0
    Progress/Maximum: 0/40000

Frame 6: 238 bytes on wire (1904 bits), 238 bytes captured (1904 bits)
Ethernet II, Src: Send_00 (20:53:45:4e:44:00), Dst: Receive_00 (20:52:45:43:56:00)
Internet Protocol Version 6, Src: fe80::1:3f00:0:0:3, Dst: fe80::1:3f00:0:0:2
Transmission Control Protocol, Src Port: 7114, Dst Port: 0, Seq: 129, Ack: 138, Len: 164
Zilla Frame
    Frame Type ID: 0x00000002
    Frame Type: DATA
    Protocol Type ID: 0x8ab62046
    Protocol Type: http
    Worker: 1
    Offset: 0x000000b8
    Origin ID: 0x0000000100000009
    Origin Namespace: test
    Origin Binding: net0
    Routed ID: 0x0000000100000009
    Routed Namespace: test
    Routed Binding: net0
    Stream ID: 0x3f00000000000002
    Initial ID: 0x3f00000000000003
    Reply ID: 0x3f00000000000002
    Direction: REP
    Sequence: 0
    Acknowledge: 0
    Maximum: 40000
    Timestamp: [timestamp]
    Trace ID: 0x8000000000000003
    Authorization: 0x0000000000000000
    Flags: 0x03
        .... ...1 = FIN: Set (1)
        .... ..1. = INIT: Set (1)
        .... .0.. = INCOMPLETE: Not set (0)
        .... 0... = SKIP: Not set (0)
    Budget ID: 0x0000000000000000
    Reserved: 27
    Progress: 27
    Progress/Maximum: 27/40000
    Payload
        Length: 27
        Payload
HyperText Transfer Protocol 2

Frame 7: 235 bytes on wire (1880 bits), 235 bytes captured (1880 bits)
Ethernet II, Src: Send_00 (20:53:45:4e:44:00), Dst: Receive_00 (20:52:45:43:56:00)
Internet Protocol Version 6, Src: fe80::3f00:0:0:2, Dst: fe80::3f00:0:0:3
Transmission Control Protocol, Src Port: 0, Dst Port: 7114, Seq: 128, Ack: 138, Len: 161
Zilla Frame
    Frame Type ID: 0x00000002
    Frame Type: DATA
    Protocol Type ID: 0x8ab62046
    Protocol Type: http
    Worker: 0
    Offset: 0x00000118
    Origin ID: 0x0000000100000009
    Origin Namespace: test
    Origin Binding: net0
    Routed ID: 0x0000000100000009
    Routed Namespace: test
    Routed Binding: net0
    Stream ID: 0x3f00000000000003
    Initial ID: 0x3f00000000000003
    Reply ID: 0x3f00000000000002
    Direction: INI
    Sequence: 0
    Acknowledge: 0
    Maximum: 65536
    Timestamp: [timestamp]
    Trace ID: 0x8000000000000003
    Authorization: 0x0000000000000000
    Flags: 0x03
        .... ...1 = FIN: Set (1)
        .... ..1. = INIT: Set (1)
        .... .0.. = INCOMPLETE: Not set (0)
        .... 0... = SKIP: Not set (0)
    Budget ID: 0x0000000000000000
    Reserved: 24
    Progress: 24
    Progress/Maximum: 24/65536
    Payload
        Length: 24
        Payload
HyperText Transfer Protocol 2

Frame 8: 211 bytes on wire (1688 bits), 211 bytes captured (1688 bits)
Ethernet II, Src: Send_00 (20:53:45:4e:44:00), Dst: Receive_00 (20:52:45:43:56:00)
Internet Protocol Version 6, Src: fe80::1:3f00:0:0:2, Dst: fe80::1:3f00:0:0:3
Transmission Control Protocol, Src Port: 0, Dst Port: 7114, Seq: 138, Ack: 293, Len: 137
Zilla Frame
    Frame Type ID: 0x40000002
    Frame Type: WINDOW
    Protocol Type ID: 0x8ab62046
    Protocol Type: http
    Worker: 1
    Offset: 0x00000130
    Origin ID: 0x0000000100000009
    Origin Namespace: test
    Origin Binding: net0
    Routed ID: 0x0000000100000009
    Routed Namespace: test
    Routed Binding: net0
    Stream ID: 0x3f00000000000003
    Initial ID: 0x3f00000000000003
    Reply ID: 0x3f00000000000002
    Direction: INI
    Sequence: 24
    Acknowledge: 24
    Maximum: 65536
    Timestamp: [timestamp]
    Trace ID: 0x8000000000000003
    Authorization: 0x0000000000000000
    Budget ID: 0x0000000000000000
    Padding: 0
    Minimum: 0
    Capabilities: 0x00
    Progress: 0
    Progress/Maximum: 0/65536

Frame 9: 211 bytes on wire (1688 bits), 211 bytes captured (1688 bits)
Ethernet II, Src: Send_00 (20:53:45:4e:44:00), Dst: Receive_00 (20:52:45:43:56:00)
Internet Protocol Version 6, Src: fe80::3f00:0:0:3, Dst: fe80::3f00:0:0:2
Transmission Control Protocol, Src Port: 7114, Dst Port: 0, Seq: 138, Ack: 289, Len: 137
Zilla Frame
    Frame Type ID: 0x40000002
    Frame Type: WINDOW
    Protocol Type ID: 0x8ab62046
    Protocol Type: http
    Worker: 0
    Offset: 0x00000190
    Origin ID: 0x0000000100000009
    Origin Namespace: test
    Origin Binding: net0
    Routed ID: 0x0000000100000009
    Routed Namespace: test
    Routed Binding: net0
    Stream ID: 0x3f00000000000002
    Initial ID: 0x3f00000000000003
    Reply ID: 0x3f00000000000002
    Direction: REP
    Sequence: 27
    Acknowledge: 27
    Maximum: 40000
    Timestamp: [timestamp]
    Trace ID: 0x8000000000000004
    Authorization: 0x0000000000000000
    Budget ID: 0x0000000000000000
    Padding: 0
    Minimum: 0
    Capabilities: 0x00
    Progress: 0
    Progress/Maximum: 0/40000

Frame 10: 220 bytes on wire (1760 bits), 220 bytes captured (1760 bits)
Ethernet II, Src: Send_00 (20:53:45:4e:44:00), Dst: Receive_00 (20:52:45:43:56:00)
Internet Protocol Version 6, Src: fe80::1:3f00:0:0:3, Dst: fe80::1:3f00:0:0:2
Transmission Control Protocol, Src Port: 7114, Dst Port: 0, Seq: 293, Ack: 275, Len: 146
Zilla Frame
    Frame Type ID: 0x00000002
    Frame Type: DATA
    Protocol Type ID: 0x8ab62046
    Protocol Type: http
    Worker: 1
    Offset: 0x00000190
    Origin ID: 0x0000000100000009
    Origin Namespace: test
    Origin Binding: net0
    Routed ID: 0x0000000100000009
    Routed Namespace: test
    Routed Binding: net0
    Stream ID: 0x3f00000000000002
    Initial ID: 0x3f00000000000003
    Reply ID: 0x3f00000000000002
    Direction: REP
    Sequence: 27
    Acknowledge: 27
    Maximum: 40000
    Timestamp: [timestamp]
    Trace ID: 0x8000000000000005
    Authorization: 0x0000000000000000
    Flags: 0x03
        .... ...1 = FIN: Set (1)
        .... ..1. = INIT: Set (1)
        .... .0.. = INCOMPLETE: Not set (0)
        .... 0... = SKIP: Not set (0)
    Budget ID: 0x0000000000000000
    Reserved: 9
    Progress: 9
    Progress/Maximum: 9/40000
    Payload
        Length: 9
        Payload
HyperText Transfer Protocol 2

Frame 11: 232 bytes on wire (1856 bits), 232 bytes captured (1856 bits)
Ethernet II, Src: Send_00 (20:53:45:4e:44:00), Dst: Receive_00 (20:52:45:43:56:00)
Internet Protocol Version 6, Src: fe80::3f00:0:0:2, Dst: fe80::3f00:0:0:3
Transmission Control Protocol, Src Port: 0, Dst Port: 7114, Seq: 289, Ack: 275, Len: 158
Zilla Frame
    Frame Type ID: 0x00000002
    Frame Type: DATA
    Protocol Type ID: 0x8ab62046
    Protocol Type: http
    Worker: 0
    Offset: 0x000001f0
    Origin ID: 0x0000000100000009
    Origin Namespace: test
    Origin Binding: net0
    Routed ID: 0x0000000100000009
    Routed Namespace: test
    Routed Binding: net0
    Stream ID: 0x3f00000000000003
    Initial ID: 0x3f00000000000003
    Reply ID: 0x3f00000000000002
    Direction: INI
    Sequence: 24
    Acknowledge: 24
    Maximum: 65536
    Timestamp: [timestamp]
    Trace ID: 0x8000000000000005
    Authorization: 0x0000000000000000
    Flags: 0x03
        .... ...1 = FIN: Set (1)
        .... ..1. = INIT: Set (1)
        .... .0.. = INCOMPLETE: Not set (0)
        .... 0... = SKIP: Not set (0)
    Budget ID: 0x0000000000000000
    Reserved: 21
    Progress: 21
    Progress/Maximum: 21/65536
    Payload
        Length: 21
        Payload
HyperText Transfer Protocol 2

Frame 12: 211 bytes on wire (1688 bits), 211 bytes captured (1688 bits)
Ethernet II, Src: Send_00 (20:53:45:4e:44:00), Dst: Receive_00 (20:52:45:43:56:00)
Internet Protocol Version 6, Src: fe80::1:3f00:0:0:2, Dst: fe80::1:3f00:0:0:3
Transmission Control Protocol, Src Port: 0, Dst Port: 7114, Seq: 275, Ack: 439, Len: 137
Zilla Frame
    Frame Type ID: 0x40000002
    Frame Type: WINDOW
    Protocol Type ID: 0x8ab62046
    Protocol Type: http
    Worker: 1
    Offset: 0x000001f8
    Origin ID: 0x0000000100000009
    Origin Namespace: test
    Origin Binding: net0
    Routed ID: 0x0000000100000009
    Routed Namespace: test
    Routed Binding: net0
    Stream ID: 0x3f00000000000003
    Initial ID: 0x3f00000000000003
    Reply ID: 0x3f00000000000002
    Direction: INI
    Sequence: 45
    Acknowledge: 45
    Maximum: 65536
    Timestamp: [timestamp]
    Trace ID: 0x8000000000000005
    Authorization: 0x0000000000000000
    Budget ID: 0x0000000000000000
    Padding: 0
    Minimum: 0
    Capabilities: 0x00
    Progress: 0
    Progress/Maximum: 0/65536

Frame 13: 211 bytes on wire (1688 bits), 211 bytes captured (1688 bits)
Ethernet II, Src: Send_00 (20:53:45:4e:44:00), Dst: Receive_00 (20:52:45:43:56:00)
Internet Protocol Version 6, Src: fe80::3f00:0:0:3, Dst: fe80::3f00:0:0:2
Transmission Control Protocol, Src Port: 7114, Dst Port: 0, Seq: 275, Ack: 447, Len: 137
Zilla Frame
    Frame Type ID: 0x40000002
    Frame Type: WINDOW
    Protocol Type ID: 0x8ab62046
    Protocol Type: http
    Worker: 0
    Offset: 0x00000268
    Origin ID: 0x0000000100000009
    Origin Namespace: test
    Origin Binding: net0
    Routed ID: 0x0000000100000009
    Routed Namespace: test
    Routed Binding: net0
    Stream ID: 0x3f00000000000002
    Initial ID: 0x3f00000000000003
    Reply ID: 0x3f00000000000002
    Direction: REP
    Sequence: 36
    Acknowledge: 36
    Maximum: 40000
    Timestamp: [timestamp]
    Trace ID: 0x8000000000000006
    Authorization: 0x0000000000000000
    Budget ID: 0x0000000000000000
    Padding: 0
    Minimum: 0
    Capabilities: 0x00
    Progress: 0
    Progress/Maximum: 0/40000

Frame 14: 211 bytes on wire (1688 bits), 211 bytes captured (1688 bits)
Ethernet II, Src: Send_00 (20:53:45:4e:44:00), Dst: Receive_00 (20:52:45:43:56:00)
Internet Protocol Version 6, Src: fe80::1:3f00:0:0:2, Dst: fe80::1:3f00:0:0:3
Transmission Control Protocol, Src Port: 0, Dst Port: 7114, Seq: 412, Ack: 439, Len: 137
Zilla Frame
    Frame Type ID: 0x40000002
    Frame Type: WINDOW
    Protocol Type ID: 0x8ab62046
    Protocol Type: http
    Worker: 1
    Offset: 0x00000258
    Origin ID: 0x0000000100000009
    Origin Namespace: test
    Origin Binding: net0
    Routed ID: 0x0000000100000009
    Routed Namespace: test
    Routed Binding: net0
    Stream ID: 0x3f00000000000003
    Initial ID: 0x3f00000000000003
    Reply ID: 0x3f00000000000002
    Direction: INI
    Sequence: 54
    Acknowledge: 54
    Maximum: 65536
    Timestamp: [timestamp]
    Trace ID: 0x8000000000000007
    Authorization: 0x0000000000000000
    Budget ID: 0x0000000000000000
    Padding: 0
    Minimum: 0
    Capabilities: 0x00
    Progress: 0
    Progress/Maximum: 0/65536

Frame 15: 220 bytes on wire (1760 bits), 220 bytes captured (1760 bits)
Ethernet II, Src: Send_00 (20:53:45:4e:44:00), Dst: Receive_00 (20:52:45:43:56:00)
Internet Protocol Version 6, Src: fe80::3f00:0:0:2, Dst: fe80::3f00:0:0:3
Transmission Control Protocol, Src Port: 0, Dst Port: 7114, Seq: 447, Ack: 412, Len: 146
Zilla Frame
    Frame Type ID: 0x00000002
    Frame Type: DATA
    Protocol Type ID: 0x8ab62046
    Protocol Type: http
    Worker: 0
    Offset: 0x000002c8
    Origin ID: 0x0000000100000009
    Origin Namespace: test
    Origin Binding: net0
    Routed ID: 0x0000000100000009
    Routed Namespace: test
    Routed Binding: net0
    Stream ID: 0x3f00000000000003
    Initial ID: 0x3f00000000000003
    Reply ID: 0x3f00000000000002
    Direction: INI
    Sequence: 45
    Acknowledge: 45
    Maximum: 65536
    Timestamp: [timestamp]
    Trace ID: 0x8000000000000007
    Authorization: 0x0000000000000000
    Flags: 0x03
        .... ...1 = FIN: Set (1)
        .... ..1. = INIT: Set (1)
        .... .0.. = INCOMPLETE: Not set (0)
        .... 0... = SKIP: Not set (0)
    Budget ID: 0x0000000000000000
    Reserved: 9
    Progress: 9
    Progress/Maximum: 9/65536
    Payload
        Length: 9
        Payload
HyperText Transfer Protocol 2

Frame 16: 308 bytes on wire (2464 bits), 308 bytes captured (2464 bits)
Ethernet II, Src: Send_00 (20:53:45:4e:44:00), Dst: Receive_00 (20:52:45:43:56:00)
Internet Protocol Version 6, Src: fe80::1:3f:0:0:2, Dst: fe80::1:3f:0:0:3
Transmission Control Protocol, Src Port: 0, Dst Port: 7114, Seq: 0, Ack: 1, Len: 234
Zilla Frame
    Frame Type ID: 0x00000001
    Frame Type: BEGIN
    Protocol Type ID: 0x00000000
    Protocol Type: 
    Worker: 1
    Offset: 0x000002b8
    Origin ID: 0x0000000100000009
    Origin Namespace: test
    Origin Binding: net0
    Routed ID: 0x0000000100000002
    Routed Namespace: test
    Routed Binding: app0
    Stream ID: 0x003f000000000003
    Initial ID: 0x003f000000000003
    Reply ID: 0x003f000000000002
    Direction: INI
    Sequence: 0
    Acknowledge: 0
    Maximum: 0
    Timestamp: [timestamp]
    Trace ID: 0x8000000000000008
    Authorization: 0x0000000000000001
    Affinity: 0x0000000000000000
    Extension: http
        Stream Type ID: 0x4620b68a
        Stream Type: http
        Headers (5 items)
            Length: 98
            Size: 5
        Header: :method: GET
            Length: 7
            Name: :method
            Length: 3
            Value: GET
        Header: :scheme: https
            Length: 7
            Name: :scheme
            Length: 5
            Value: https
        Header: :path: /
            Length: 5
            Name: :path
            Length: 1
            Value: /
        Header: :authority: example.com:9090
            Length: 10
            Name: :authority
            Length: 16
            Value: example.com:9090
        Header: authorization: Bearer TOKEN
            Length: 13
            Name: authorization
            Length: 12
            Value: Bearer TOKEN

Frame 17: 269 bytes on wire (2152 bits), 269 bytes captured (2152 bits)
Ethernet II, Src: Send_00 (20:53:45:4e:44:00), Dst: Receive_00 (20:52:45:43:56:00)
Internet Protocol Version 6, Src: fe80::3f00:0:0:2, Dst: fe80::3f00:0:0:3
Transmission Control Protocol, Src Port: 0, Dst Port: 7114, Seq: 593, Ack: 412, Len: 195
Zilla Frame
    Frame Type ID: 0x00000002
    Frame Type: DATA
    Protocol Type ID: 0x8ab62046
    Protocol Type: http
    Worker: 0
    Offset: 0x00000330
    Origin ID: 0x0000000100000009
    Origin Namespace: test
    Origin Binding: net0
    Routed ID: 0x0000000100000009
    Routed Namespace: test
    Routed Binding: net0
    Stream ID: 0x3f00000000000003
    Initial ID: 0x3f00000000000003
    Reply ID: 0x3f00000000000002
    Direction: INI
    Sequence: 54
    Acknowledge: 45
    Maximum: 65536
    Timestamp: [timestamp]
    Trace ID: 0x8000000000000008
    Authorization: 0x0000000000000000
    Flags: 0x03
        .... ...1 = FIN: Set (1)
        .... ..1. = INIT: Set (1)
        .... .0.. = INCOMPLETE: Not set (0)
        .... 0... = SKIP: Not set (0)
    Budget ID: 0x0000000000000000
    Reserved: 58
    Progress: 67
    Progress/Maximum: 67/65536
    Payload
        Length: 58
        Payload
HyperText Transfer Protocol 2

Frame 18: 211 bytes on wire (1688 bits), 211 bytes captured (1688 bits)
Ethernet II, Src: Send_00 (20:53:45:4e:44:00), Dst: Receive_00 (20:52:45:43:56:00)
Internet Protocol Version 6, Src: fe80::1:3f:0:0:3, Dst: fe80::1:3f:0:0:2
Transmission Control Protocol, Src Port: 7114, Dst Port: 0, Seq: 1, Ack: 234, Len: 137
Zilla Frame
    Frame Type ID: 0x40000002
    Frame Type: WINDOW
    Protocol Type ID: 0x00000000
    Protocol Type: 
    Worker: 1
    Offset: 0x00000378
    Origin ID: 0x0000000100000009
    Origin Namespace: test
    Origin Binding: net0
    Routed ID: 0x0000000100000002
    Routed Namespace: test
    Routed Binding: app0
    Stream ID: 0x003f000000000002
    Initial ID: 0x003f000000000003
    Reply ID: 0x003f000000000002
    Direction: REP
    Sequence: 0
    Acknowledge: 0
    Maximum: 65535
    Timestamp: [timestamp]
    Trace ID: 0x8000000000000008
    Authorization: 0x0000000000000001
    Budget ID: 0x0000000000000001
    Padding: 36
    Minimum: 0
    Capabilities: 0x00
    Progress: 0
    Progress/Maximum: 0/65535

Frame 19: 211 bytes on wire (1688 bits), 211 bytes captured (1688 bits)
Ethernet II, Src: Send_00 (20:53:45:4e:44:00), Dst: Receive_00 (20:52:45:43:56:00)
Internet Protocol Version 6, Src: fe80::3f:0:0:2, Dst: fe80::3f:0:0:3
Transmission Control Protocol, Src Port: 0, Dst Port: 7114, Seq: 1, Ack: 1, Len: 137
Zilla Frame
    Frame Type ID: 0x40000002
    Frame Type: WINDOW
    Protocol Type ID: 0x00000000
    Protocol Type: 
    Worker: 0
    Offset: 0x000003c8
    Origin ID: 0x0000000100000009
    Origin Namespace: test
    Origin Binding: net0
    Routed ID: 0x0000000100000002
    Routed Namespace: test
    Routed Binding: app0
    Stream ID: 0x003f000000000003
    Initial ID: 0x003f000000000003
    Reply ID: 0x003f000000000002
    Direction: INI
    Sequence: 0
    Acknowledge: 0
    Maximum: 8192
    Timestamp: [timestamp]
    Trace ID: 0x8000000000000009
    Authorization: 0x0000000000000000
    Budget ID: 0x0000000000000000
    Padding: 0
    Minimum: 0
    Capabilities: 0x01
    Progress: 0
    Progress/Maximum: 0/8192

Frame 20: 211 bytes on wire (1688 bits), 211 bytes captured (1688 bits)
Ethernet II, Src: Send_00 (20:53:45:4e:44:00), Dst: Receive_00 (20:52:45:43:56:00)
Internet Protocol Version 6, Src: fe80::1:3f00:0:0:2, Dst: fe80::1:3f00:0:0:3
Transmission Control Protocol, Src Port: 0, Dst Port: 7114, Seq: 549, Ack: 439, Len: 137
Zilla Frame
    Frame Type ID: 0x40000002
    Frame Type: WINDOW
    Protocol Type ID: 0x8ab62046
    Protocol Type: http
    Worker: 1
    Offset: 0x000003d8
    Origin ID: 0x0000000100000009
    Origin Namespace: test
    Origin Binding: net0
    Routed ID: 0x0000000100000009
    Routed Namespace: test
    Routed Binding: net0
    Stream ID: 0x3f00000000000003
    Initial ID: 0x3f00000000000003
    Reply ID: 0x3f00000000000002
    Direction: INI
    Sequence: 112
    Acknowledge: 112
    Maximum: 65536
    Timestamp: [timestamp]
    Trace ID: 0x8000000000000008
    Authorization: 0x0000000000000000
    Budget ID: 0x0000000000000000
    Padding: 0
    Minimum: 0
    Capabilities: 0x00
    Progress: 0
    Progress/Maximum: 0/65536

Frame 21: 309 bytes on wire (2472 bits), 309 bytes captured (2472 bits)
Ethernet II, Src: Send_00 (20:53:45:4e:44:00), Dst: Receive_00 (20:52:45:43:56:00)
Internet Protocol Version 6, Src: fe80::3f:0:0:3, Dst: fe80::3f:0:0:2
Transmission Control Protocol, Src Port: 7114, Dst Port: 0, Seq: 1, Ack: 138, Len: 235
Zilla Frame
    Frame Type ID: 0x00000001
    Frame Type: BEGIN
    Protocol Type ID: 0x00000000
    Protocol Type: 
    Worker: 0
    Offset: 0x00000428
    Origin ID: 0x0000000100000009
    Origin Namespace: test
    Origin Binding: net0
    Routed ID: 0x0000000100000002
    Routed Namespace: test
    Routed Binding: app0
    Stream ID: 0x003f000000000002
    Initial ID: 0x003f000000000003
    Reply ID: 0x003f000000000002
    Direction: REP
    Sequence: 0
    Acknowledge: 0
    Maximum: 65535
    Timestamp: [timestamp]
    Trace ID: 0x800000000000000a
    Authorization: 0x0000000000000000
    Affinity: 0x0000000000000000
    Extension: http
        Stream Type ID: 0x4620b68a
        Stream Type: http
        Headers (4 items)
            Length: 99
            Size: 4
        Header: :status: 200
            Length: 7
            Name: :status
            Length: 3
            Value: 200
        Header: server: Zilla
            Length: 6
            Name: server
            Length: 5
            Value: Zilla
        Header: date: Tue, 02 Feb 2022 22:22:22 GMT
            Length: 4
            Name: date
            Length: 29
            Value: Tue, 02 Feb 2022 22:22:22 GMT
        Header: content-type: text/event-stream
            Length: 12
            Name: content-type
            Length: 17
            Value: text/event-stream

Frame 22: 194 bytes on wire (1552 bits), 194 bytes captured (1552 bits)
Ethernet II, Src: Send_00 (20:53:45:4e:44:00), Dst: Receive_00 (20:52:45:43:56:00)
Internet Protocol Version 6, Src: fe80::1:3f:0:0:2, Dst: fe80::1:3f:0:0:3
Transmission Control Protocol, Src Port: 0, Dst Port: 7114, Seq: 234, Ack: 138, Len: 120
Zilla Frame
    Frame Type ID: 0x00000003
    Frame Type: END
    Protocol Type ID: 0x00000000
    Protocol Type: 
    Worker: 1
    Offset: 0x00000438
    Origin ID: 0x0000000100000009
    Origin Namespace: test
    Origin Binding: net0
    Routed ID: 0x0000000100000002
    Routed Namespace: test
    Routed Binding: app0
    Stream ID: 0x003f000000000003
    Initial ID: 0x003f000000000003
    Reply ID: 0x003f000000000002
    Direction: INI
    Sequence: 0
    Acknowledge: 0
    Maximum: 8192
    Timestamp: [timestamp]
    Trace ID: 0x8000000000000009
    Authorization: 0x0000000000000001

Frame 23: 230 bytes on wire (1840 bits), 230 bytes captured (1840 bits)
Ethernet II, Src: Send_00 (20:53:45:4e:44:00), Dst: Receive_00 (20:52:45:43:56:00)
Internet Protocol Version 6, Src: fe80::3f:0:0:3, Dst: fe80::3f:0:0:2
Transmission Control Protocol, Src Port: 7114, Dst Port: 0, Seq: 236, Ack: 138, Len: 156
Zilla Frame
    Frame Type ID: 0x00000002
    Frame Type: DATA
    Protocol Type ID: 0x00000000
    Protocol Type: 
    Worker: 0
    Offset: 0x000004e8
    Origin ID: 0x0000000100000009
    Origin Namespace: test
    Origin Binding: net0
    Routed ID: 0x0000000100000002
    Routed Namespace: test
    Routed Binding: app0
    Stream ID: 0x003f000000000002
    Initial ID: 0x003f000000000003
    Reply ID: 0x003f000000000002
    Direction: REP
    Sequence: 0
    Acknowledge: 0
    Maximum: 65535
    Timestamp: [timestamp]
    Trace ID: 0x800000000000000b
    Authorization: 0x0000000000000000
    Flags: 0x03
        .... ...1 = FIN: Set (1)
        .... ..1. = INIT: Set (1)
        .... .0.. = INCOMPLETE: Not set (0)
        .... 0... = SKIP: Not set (0)
    Budget ID: 0x0000000000000001
    Reserved: 55
    Progress: 55
    Progress/Maximum: 55/65535
    Payload
        Length: 19
        Payload

Frame 24: 281 bytes on wire (2248 bits), 281 bytes captured (2248 bits)
Ethernet II, Src: Send_00 (20:53:45:4e:44:00), Dst: Receive_00 (20:52:45:43:56:00)
Internet Protocol Version 6, Src: fe80::1:3f00:0:0:3, Dst: fe80::1:3f00:0:0:2
Transmission Control Protocol, Src Port: 7114, Dst Port: 0, Seq: 439, Ack: 686, Len: 207
Zilla Frame
    Frame Type ID: 0x00000002
    Frame Type: DATA
    Protocol Type ID: 0x8ab62046
    Protocol Type: http
    Worker: 1
    Offset: 0x00000488
    Origin ID: 0x0000000100000009
    Origin Namespace: test
    Origin Binding: net0
    Routed ID: 0x0000000100000009
    Routed Namespace: test
    Routed Binding: net0
    Stream ID: 0x3f00000000000002
    Initial ID: 0x3f00000000000003
    Reply ID: 0x3f00000000000002
    Direction: REP
    Sequence: 36
    Acknowledge: 36
    Maximum: 40000
    Timestamp: [timestamp]
    Trace ID: 0x800000000000000a
    Authorization: 0x0000000000000000
    Flags: 0x03
        .... ...1 = FIN: Set (1)
        .... ..1. = INIT: Set (1)
        .... .0.. = INCOMPLETE: Not set (0)
        .... 0... = SKIP: Not set (0)
    Budget ID: 0x0000000000000000
    Reserved: 70
    Progress: 70
    Progress/Maximum: 70/40000
    Payload
        Length: 70
        Payload
HyperText Transfer Protocol 2

Frame 25: 211 bytes on wire (1688 bits), 211 bytes captured (1688 bits)
Ethernet II, Src: Send_00 (20:53:45:4e:44:00), Dst: Receive_00 (20:52:45:43:56:00)
Internet Protocol Version 6, Src: fe80::3f00:0:0:3, Dst: fe80::3f00:0:0:2
Transmission Control Protocol, Src Port: 7114, Dst Port: 0, Seq: 412, Ack: 788, Len: 137
Zilla Frame
    Frame Type ID: 0x40000002
    Frame Type: WINDOW
    Protocol Type ID: 0x8ab62046
    Protocol Type: http
    Worker: 0
    Offset: 0x00000558
    Origin ID: 0x0000000100000009
    Origin Namespace: test
    Origin Binding: net0
    Routed ID: 0x0000000100000009
    Routed Namespace: test
    Routed Binding: net0
    Stream ID: 0x3f00000000000002
    Initial ID: 0x3f00000000000003
    Reply ID: 0x3f00000000000002
    Direction: REP
    Sequence: 106
    Acknowledge: 106
    Maximum: 40000
    Timestamp: [timestamp]
    Trace ID: 0x800000000000000c
    Authorization: 0x0000000000000000
    Budget ID: 0x0000000000000000
    Padding: 0
    Minimum: 0
    Capabilities: 0x00
    Progress: 0
    Progress/Maximum: 0/40000

Frame 26: 239 bytes on wire (1912 bits), 239 bytes captured (1912 bits)
Ethernet II, Src: Send_00 (20:53:45:4e:44:00), Dst: Receive_00 (20:52:45:43:56:00)
Internet Protocol Version 6, Src: fe80::1:3f00:0:0:3, Dst: fe80::1:3f00:0:0:2
Transmission Control Protocol, Src Port: 7114, Dst Port: 0, Seq: 646, Ack: 686, Len: 165
Zilla Frame
    Frame Type ID: 0x00000002
    Frame Type: DATA
    Protocol Type ID: 0x8ab62046
    Protocol Type: http
    Worker: 1
    Offset: 0x00000530
    Origin ID: 0x0000000100000009
    Origin Namespace: test
    Origin Binding: net0
    Routed ID: 0x0000000100000009
    Routed Namespace: test
    Routed Binding: net0
    Stream ID: 0x3f00000000000002
    Initial ID: 0x3f00000000000003
    Reply ID: 0x3f00000000000002
    Direction: REP
    Sequence: 106
    Acknowledge: 36
    Maximum: 40000
    Timestamp: [timestamp]
    Trace ID: 0x800000000000000b
    Authorization: 0x0000000000000000
    Flags: 0x03
        .... ...1 = FIN: Set (1)
        .... ..1. = INIT: Set (1)
        .... .0.. = INCOMPLETE: Not set (0)
        .... 0... = SKIP: Not set (0)
    Budget ID: 0x0000000000000000
    Reserved: 28
    Progress: 98
    Progress/Maximum: 98/40000
    Payload
        Length: 28
        Payload
HyperText Transfer Protocol 2

Frame 27: 211 bytes on wire (1688 bits), 211 bytes captured (1688 bits)
Ethernet II, Src: Send_00 (20:53:45:4e:44:00), Dst: Receive_00 (20:52:45:43:56:00)
Internet Protocol Version 6, Src: fe80::3f00:0:0:3, Dst: fe80::3f00:0:0:2
Transmission Control Protocol, Src Port: 7114, Dst Port: 0, Seq: 549, Ack: 788, Len: 137
Zilla Frame
    Frame Type ID: 0x40000002
    Frame Type: WINDOW
    Protocol Type ID: 0x8ab62046
    Protocol Type: http
    Worker: 0
    Offset: 0x000005b8
    Origin ID: 0x0000000100000009
    Origin Namespace: test
    Origin Binding: net0
    Routed ID: 0x0000000100000009
    Routed Namespace: test
    Routed Binding: net0
    Stream ID: 0x3f00000000000002
    Initial ID: 0x3f00000000000003
    Reply ID: 0x3f00000000000002
    Direction: REP
    Sequence: 134
    Acknowledge: 134
    Maximum: 40000
    Timestamp: [timestamp]
    Trace ID: 0x800000000000000d
    Authorization: 0x0000000000000000
    Budget ID: 0x0000000000000000
    Padding: 0
    Minimum: 0
    Capabilities: 0x00
    Progress: 0
    Progress/Maximum: 0/40000

Frame 28: 267 bytes on wire (2136 bits), 267 bytes captured (2136 bits)
Ethernet II, Src: Send_00 (20:53:45:4e:44:00), Dst: Receive_00 (20:52:45:43:56:00)
Internet Protocol Version 6, Src: fe80::1:3f:0:0:3, Dst: fe80::1:3f:0:0:2
Transmission Control Protocol, Src Port: 7114, Dst Port: 0, Seq: 138, Ack: 354, Len: 193
Zilla Frame
    Frame Type ID: 0x40000004
    Frame Type: CHALLENGE
    Protocol Type ID: 0x00000000
    Protocol Type: 
    Worker: 1
    Offset: 0x000005b0
    Origin ID: 0x0000000100000009
    Origin Namespace: test
    Origin Binding: net0
    Routed ID: 0x0000000100000002
    Routed Namespace: test
    Routed Binding: app0
    Stream ID: 0x003f000000000002
    Initial ID: 0x003f000000000003
    Reply ID: 0x003f000000000002
    Direction: REP
    Sequence: 55
    Acknowledge: 0
    Maximum: 65535
    Timestamp: [timestamp]
    Trace ID: 0x8000000000000008
    Authorization: 0x0000000000000001
    Extension: http
        Stream Type ID: 0x4620b68a
        Stream Type: http
        Headers (2 items)
            Length: 65
            Size: 2
        Header: :method: POST
            Length: 7
            Name: :method
            Length: 4
            Value: POST
        Header: content-type: application/x-challenge-response
            Length: 12
            Name: content-type
            Length: 32
            Value: application/x-challenge-response

Frame 29: 214 bytes on wire (1712 bits), 214 bytes captured (1712 bits)
Ethernet II, Src: Send_00 (20:53:45:4e:44:00), Dst: Receive_00 (20:52:45:43:56:00)
Internet Protocol Version 6, Src: fe80::3f00:0:0:3, Dst: fe80::3f00:0:0:2
Transmission Control Protocol, Src Port: 7114, Dst Port: 0, Seq: 686, Ack: 788, Len: 140
Zilla Frame
    Frame Type ID: 0x40000003
    Frame Type: SIGNAL
    Protocol Type ID: 0x00000000
    Protocol Type: 
    Worker: 0
    Offset: 0x00000618
    Origin ID: 0x0000000100000009
    Origin Namespace: test
    Origin Binding: net0
    Routed ID: 0x0000000100000002
    Routed Namespace: test
    Routed Binding: app0
    Stream ID: 0x3f00000000000002
    Initial ID: 0x3f00000000000003
    Reply ID: 0x3f00000000000002
    Direction: REP
    Sequence: 0
    Acknowledge: 0
    Maximum: 0
    Timestamp: [timestamp]
    Trace ID: 0x8000000000000008
    Authorization: 0x0000000000000000
    Cancel ID: 0xffffffffffffffff
    Signal ID: 0x00000002
    Context ID: 0x00000001
    Payload
        Length: -1

Frame 30: 321 bytes on wire (2568 bits), 321 bytes captured (2568 bits)
Ethernet II, Src: Send_00 (20:53:45:4e:44:00), Dst: Receive_00 (20:52:45:43:56:00)
Internet Protocol Version 6, Src: fe80::1:3f00:0:0:3, Dst: fe80::1:3f00:0:0:2
Transmission Control Protocol, Src Port: 7114, Dst Port: 0, Seq: 811, Ack: 686, Len: 247
Zilla Frame
    Frame Type ID: 0x00000002
    Frame Type: DATA
    Protocol Type ID: 0x8ab62046
    Protocol Type: http
    Worker: 1
    Offset: 0x00000648
    Origin ID: 0x0000000100000009
    Origin Namespace: test
    Origin Binding: net0
    Routed ID: 0x0000000100000009
    Routed Namespace: test
    Routed Binding: net0
    Stream ID: 0x3f00000000000002
    Initial ID: 0x3f00000000000003
    Reply ID: 0x3f00000000000002
    Direction: REP
    Sequence: 134
    Acknowledge: 134
    Maximum: 40000
    Timestamp: [timestamp]
    Trace ID: 0x800000000000000e
    Authorization: 0x0000000000000000
    Flags: 0x03
        .... ...1 = FIN: Set (1)
        .... ..1. = INIT: Set (1)
        .... .0.. = INCOMPLETE: Not set (0)
        .... 0... = SKIP: Not set (0)
    Budget ID: 0x0000000000000000
    Reserved: 110
    Progress: 110
    Progress/Maximum: 110/40000
    Payload
        Length: 110
        Payload
HyperText Transfer Protocol 2

Frame 31: 312 bytes on wire (2496 bits), 312 bytes captured (2496 bits)
Ethernet II, Src: Send_00 (20:53:45:4e:44:00), Dst: Receive_00 (20:52:45:43:56:00)
Internet Protocol Version 6, Src: fe80::3f:0:0:3, Dst: fe80::3f:0:0:2
Transmission Control Protocol, Src Port: 7114, Dst Port: 0, Seq: 392, Ack: 138, Len: 238
Zilla Frame
    Frame Type ID: 0x00000002
    Frame Type: DATA
    Protocol Type ID: 0x00000000
    Protocol Type: 
    Worker: 0
    Offset: 0x00000678
    Origin ID: 0x0000000100000009
    Origin Namespace: test
    Origin Binding: net0
    Routed ID: 0x0000000100000002
    Routed Namespace: test
    Routed Binding: app0
    Stream ID: 0x003f000000000002
    Initial ID: 0x003f000000000003
    Reply ID: 0x003f000000000002
    Direction: REP
    Sequence: 55
    Acknowledge: 0
    Maximum: 65535
    Timestamp: [timestamp]
    Trace ID: 0x800000000000000e
    Authorization: 0x0000000000000000
    Flags: 0x03
        .... ...1 = FIN: Set (1)
        .... ..1. = INIT: Set (1)
        .... .0.. = INCOMPLETE: Not set (0)
        .... 0... = SKIP: Not set (0)
    Budget ID: 0x0000000000000001
    Reserved: 137
    Progress: 192
    Progress/Maximum: 192/65535
    Payload
        Length: 101
        Payload

Frame 32: 194 bytes on wire (1552 bits), 194 bytes captured (1552 bits)
Ethernet II, Src: Send_00 (20:53:45:4e:44:00), Dst: Receive_00 (20:52:45:43:56:00)
Internet Protocol Version 6, Src: fe80::1:3f:0:0:3, Dst: fe80::1:3f:0:0:2
Transmission Control Protocol, Src Port: 7114, Dst Port: 0, Seq: 331, Ack: 354, Len: 120
Zilla Frame
    Frame Type ID: 0x40000001
    Frame Type: RESET
    Protocol Type ID: 0x00000000
    Protocol Type: 
    Worker: 1
    Offset: 0x00000718
    Origin ID: 0x0000000100000009
    Origin Namespace: test
    Origin Binding: net0
    Routed ID: 0x0000000100000002
    Routed Namespace: test
    Routed Binding: app0
    Stream ID: 0x003f000000000002
    Initial ID: 0x003f000000000003
    Reply ID: 0x003f000000000002
    Direction: REP
    Sequence: 192
    Acknowledge: 0
    Maximum: 65535
    Timestamp: [timestamp]
    Trace ID: 0x8000000000000008
    Authorization: 0x0000000000000001

Frame 33: 211 bytes on wire (1688 bits), 211 bytes captured (1688 bits)
Ethernet II, Src: Send_00 (20:53:45:4e:44:00), Dst: Receive_00 (20:52:45:43:56:00)
Internet Protocol Version 6, Src: fe80::3f00:0:0:3, Dst: fe80::3f00:0:0:2
Transmission Control Protocol, Src Port: 7114, Dst Port: 0, Seq: 826, Ack: 788, Len: 137
Zilla Frame
    Frame Type ID: 0x40000002
    Frame Type: WINDOW
    Protocol Type ID: 0x8ab62046
    Protocol Type: http
    Worker: 0
    Offset: 0x00000740
    Origin ID: 0x0000000100000009
    Origin Namespace: test
    Origin Binding: net0
    Routed ID: 0x0000000100000009
    Routed Namespace: test
    Routed Binding: net0
    Stream ID: 0x3f00000000000002
    Initial ID: 0x3f00000000000003
    Reply ID: 0x3f00000000000002
    Direction: REP
    Sequence: 244
    Acknowledge: 244
    Maximum: 40000
    Timestamp: [timestamp]
    Trace ID: 0x800000000000000f
    Authorization: 0x0000000000000000
    Budget ID: 0x0000000000000000
    Padding: 0
    Minimum: 0
    Capabilities: 0x00
    Progress: 0
    Progress/Maximum: 0/40000

Frame 34: 224 bytes on wire (1792 bits), 224 bytes captured (1792 bits)
Ethernet II, Src: Send_00 (20:53:45:4e:44:00), Dst: Receive_00 (20:52:45:43:56:00)
Internet Protocol Version 6, Src: fe80::1:3f00:0:0:3, Dst: fe80::1:3f00:0:0:2
Transmission Control Protocol, Src Port: 7114, Dst Port: 0, Seq: 1058, Ack: 686, Len: 150
Zilla Frame
    Frame Type ID: 0x00000002
    Frame Type: DATA
    Protocol Type ID: 0x8ab62046
    Protocol Type: http
    Worker: 1
    Offset: 0x00000768
    Origin ID: 0x0000000100000009
    Origin Namespace: test
    Origin Binding: net0
    Routed ID: 0x0000000100000009
    Routed Namespace: test
    Routed Binding: net0
    Stream ID: 0x3f00000000000002
    Initial ID: 0x3f00000000000003
    Reply ID: 0x3f00000000000002
    Direction: REP
    Sequence: 244
    Acknowledge: 244
    Maximum: 40000
    Timestamp: [timestamp]
    Trace ID: 0x8000000000000008
    Authorization: 0x0000000000000000
    Flags: 0x03
        .... ...1 = FIN: Set (1)
        .... ..1. = INIT: Set (1)
        .... .0.. = INCOMPLETE: Not set (0)
        .... 0... = SKIP: Not set (0)
    Budget ID: 0x0000000000000000
    Reserved: 13
    Progress: 13
    Progress/Maximum: 13/40000
    Payload
        Length: 13
        Payload
HyperText Transfer Protocol 2

Frame 35: 214 bytes on wire (1712 bits), 214 bytes captured (1712 bits)
Ethernet II, Src: Send_00 (20:53:45:4e:44:00), Dst: Receive_00 (20:52:45:43:56:00)
Internet Protocol Version 6, Src: fe80::3f00:0:0:3, Dst: fe80::3f00:0:0:2
Transmission Control Protocol, Src Port: 7114, Dst Port: 0, Seq: 963, Ack: 788, Len: 140
Zilla Frame
    Frame Type ID: 0x40000003
    Frame Type: SIGNAL
    Protocol Type ID: 0x00000000
    Protocol Type: 
    Worker: 0
    Offset: 0x000007a0
    Origin ID: 0x0000000100000009
    Origin Namespace: test
    Origin Binding: net0
    Routed ID: 0x0000000100000002
    Routed Namespace: test
    Routed Binding: app0
    Stream ID: 0x3f00000000000002
    Initial ID: 0x3f00000000000003
    Reply ID: 0x3f00000000000002
    Direction: REP
    Sequence: 0
    Acknowledge: 0
    Maximum: 0
    Timestamp: [timestamp]
    Trace ID: 0x8000000000000008
    Authorization: 0x0000000000000000
    Cancel ID: 0xffffffffffffffff
    Signal ID: 0x00000002
    Context ID: 0x00000001
    Payload
        Length: -1

Frame 36: 194 bytes on wire (1552 bits), 194 bytes captured (1552 bits)
Ethernet II, Src: Send_00 (20:53:45:4e:44:00), Dst: Receive_00 (20:52:45:43:56:00)
Internet Protocol Version 6, Src: fe80::1:3f00:0:0:3, Dst: fe80::1:3f00:0:0:2
Transmission Control Protocol, Src Port: 7114, Dst Port: 0, Seq: 1208, Ack: 686, Len: 120
Zilla Frame
    Frame Type ID: 0x00000003
    Frame Type: END
    Protocol Type ID: 0x8ab62046
    Protocol Type: http
    Worker: 1
    Offset: 0x000007d8
    Origin ID: 0x0000000100000009
    Origin Namespace: test
    Origin Binding: net0
    Routed ID: 0x0000000100000009
    Routed Namespace: test
    Routed Binding: net0
    Stream ID: 0x3f00000000000002
    Initial ID: 0x3f00000000000003
    Reply ID: 0x3f00000000000002
    Direction: REP
    Sequence: 257
    Acknowledge: 257
    Maximum: 40000
    Timestamp: [timestamp]
    Trace ID: 0x8000000000000011
    Authorization: 0x0000000000000000

Frame 37: 211 bytes on wire (1688 bits), 211 bytes captured (1688 bits)
Ethernet II, Src: Send_00 (20:53:45:4e:44:00), Dst: Receive_00 (20:52:45:43:56:00)
Internet Protocol Version 6, Src: fe80::3f00:0:0:3, Dst: fe80::3f00:0:0:2
Transmission Control Protocol, Src Port: 7114, Dst Port: 0, Seq: 1103, Ack: 788, Len: 137
Zilla Frame
    Frame Type ID: 0x40000002
    Frame Type: WINDOW
    Protocol Type ID: 0x8ab62046
    Protocol Type: http
    Worker: 0
    Offset: 0x00000800
    Origin ID: 0x0000000100000009
    Origin Namespace: test
    Origin Binding: net0
    Routed ID: 0x0000000100000009
    Routed Namespace: test
    Routed Binding: net0
    Stream ID: 0x3f00000000000002
    Initial ID: 0x3f00000000000003
    Reply ID: 0x3f00000000000002
    Direction: REP
    Sequence: 257
    Acknowledge: 257
    Maximum: 40000
    Timestamp: [timestamp]
    Trace ID: 0x8000000000000010
    Authorization: 0x0000000000000000
    Budget ID: 0x0000000000000000
    Padding: 0
    Minimum: 0
    Capabilities: 0x00
    Progress: 0
    Progress/Maximum: 0/40000

Frame 38: 194 bytes on wire (1552 bits), 194 bytes captured (1552 bits)
Ethernet II, Src: Send_00 (20:53:45:4e:44:00), Dst: Receive_00 (20:52:45:43:56:00)
Internet Protocol Version 6, Src: fe80::3f00:0:0:2, Dst: fe80::3f00:0:0:3
Transmission Control Protocol, Src Port: 0, Dst Port: 7114, Seq: 788, Ack: 1240, Len: 120
Zilla Frame
    Frame Type ID: 0x00000003
    Frame Type: END
    Protocol Type ID: 0x8ab62046
    Protocol Type: http
    Worker: 0
    Offset: 0x00000860
    Origin ID: 0x0000000100000009
    Origin Namespace: test
    Origin Binding: net0
    Routed ID: 0x0000000100000009
    Routed Namespace: test
    Routed Binding: net0
    Stream ID: 0x3f00000000000003
    Initial ID: 0x3f00000000000003
    Reply ID: 0x3f00000000000002
    Direction: INI
    Sequence: 112
    Acknowledge: 112
    Maximum: 65536
    Timestamp: [timestamp]
    Trace ID: 0x8000000000000011
    Authorization: 0x0000000000000000

Frame 39: 194 bytes on wire (1552 bits), 194 bytes captured (1552 bits)
Ethernet II, Src: Send_00 (20:53:45:4e:44:00), Dst: Receive_00 (20:52:45:43:56:00)
Internet Protocol Version 6, Src: fe80::3f00:0:0:3, Dst: fe80::3f00:0:0:2
Transmission Control Protocol, Src Port: 7114, Dst Port: 0, Seq: 1240, Ack: 908, Len: 120
Zilla Frame
    Frame Type ID: 0x40000001
    Frame Type: RESET
    Protocol Type ID: 0x8ab62046
    Protocol Type: http
    Worker: 0
    Offset: 0x000008b0
    Origin ID: 0x0000000100000009
    Origin Namespace: test
    Origin Binding: net0
    Routed ID: 0x0000000100000009
    Routed Namespace: test
    Routed Binding: net0
    Stream ID: 0x3f00000000000002
    Initial ID: 0x3f00000000000003
    Reply ID: 0x3f00000000000002
    Direction: REP
    Sequence: 257
    Acknowledge: 257
    Maximum: 40000
    Timestamp: [timestamp]
    Trace ID: 0x8000000000000012
    Authorization: 0x0000000000000000

