Frame 1: 198 bytes on wire (1584 bits), 198 bytes captured (1584 bits)
Ethernet II, Src: Send_00 (20:53:45:4e:44:00), Dst: Receive_00 (20:52:45:43:56:00)
Internet Protocol Version 6, Src: fe80::1, Dst: fe80::
Transmission Control Protocol, Src Port: 7114, Dst Port: 0, Seq: 1, Ack: 1, Len: 124
Zilla Frame
    Frame Type ID: 0x40000003
    Frame Type: SIGNAL
    Protocol Type ID: 0x00000000
    Protocol Type: 
    Worker: 0
    Offset: 0x00000000
    Origin ID: 0x0000000000000000
    Routed ID: 0x0000000000000000
    Stream ID: 0x0000000000000000
    Direction: 
    Sequence: 0
    Acknowledge: 0
    Maximum: 0
    Timestamp: 0x0000000000000001
    Trace ID: 0x0000000000000001
    Authorization: 0x0000000000000000
    Cancel ID: 0x0000000000007701
    Signal ID: 0x00007702
    Context ID: 0x00007703
    Payload
        Length: -1

Frame 2: 198 bytes on wire (1584 bits), 198 bytes captured (1584 bits)
Ethernet II, Src: Send_00 (20:53:45:4e:44:00), Dst: Receive_00 (20:52:45:43:56:00)
Internet Protocol Version 6, Src: fe80:0:0:1::1, Dst: fe80:0:0:1::
Transmission Control Protocol, Src Port: 7114, Dst Port: 0, Seq: 1, Ack: 1, Len: 124
Zilla Frame
    Frame Type ID: 0x40000003
    Frame Type: SIGNAL
    Protocol Type ID: 0x00000000
    Protocol Type: 
    Worker: 1
    Offset: 0x00000000
    Origin ID: 0x0000000000000000
    Routed ID: 0x0000000000000000
    Stream ID: 0x0000000000000000
    Direction: 
    Sequence: 0
    Acknowledge: 0
    Maximum: 0
    Timestamp: 0x0000000000000001
    Trace ID: 0x0100000000000001
    Authorization: 0x0000000000000000
    Cancel ID: 0x0000000000008801
    Signal ID: 0x00008802
    Context ID: 0x00008803
    Payload
        Length: -1

Frame 3: 198 bytes on wire (1584 bits), 198 bytes captured (1584 bits)
Ethernet II, Src: Send_00 (20:53:45:4e:44:00), Dst: Receive_00 (20:52:45:43:56:00)
Internet Protocol Version 6, Src: fe80:0:0:2::1, Dst: fe80:0:0:2::
Transmission Control Protocol, Src Port: 7114, Dst Port: 0, Seq: 1, Ack: 1, Len: 124
Zilla Frame
    Frame Type ID: 0x40000003
    Frame Type: SIGNAL
    Protocol Type ID: 0x00000000
    Protocol Type: 
    Worker: 2
    Offset: 0x00000000
    Origin ID: 0x0000000000000000
    Routed ID: 0x0000000000000000
    Stream ID: 0x0000000000000000
    Direction: 
    Sequence: 0
    Acknowledge: 0
    Maximum: 0
    Timestamp: 0x0000000000000001
    Trace ID: 0x0200000000000001
    Authorization: 0x0000000000000000
    Cancel ID: 0x0000000000008801
    Signal ID: 0x00009902
    Context ID: 0x00009903
    Payload
        Length: -1

Frame 4: 210 bytes on wire (1680 bits), 210 bytes captured (1680 bits)
Ethernet II, Src: Send_00 (20:53:45:4e:44:00), Dst: Receive_00 (20:52:45:43:56:00)
Internet Protocol Version 6, Src: fe80::1, Dst: fe80::
Transmission Control Protocol, Src Port: 7114, Dst Port: 0, Seq: 125, Ack: 1, Len: 136
Zilla Frame
    Frame Type ID: 0x40000003
    Frame Type: SIGNAL
    Protocol Type ID: 0x00000000
    Protocol Type: 
    Worker: 0
    Offset: 0x00000060
    Origin ID: 0x0000000000000000
    Routed ID: 0x0000000000000000
    Stream ID: 0x0000000000000000
    Direction: 
    Sequence: 0
    Acknowledge: 0
    Maximum: 0
    Timestamp: 0x0000000000000002
    Trace ID: 0x0000000000000000
    Authorization: 0x0000000000000000
    Cancel ID: 0x0000000000007801
    Signal ID: 0x00007802
    Context ID: 0x00007803
    Payload
        Length: 12
        Payload

Frame 5: 233 bytes on wire (1864 bits), 233 bytes captured (1864 bits)
Ethernet II, Src: Send_00 (20:53:45:4e:44:00), Dst: Receive_00 (20:52:45:43:56:00)
Internet Protocol Version 6, Src: fe80::1:101:0:0:4, Dst: fe80::1:101:0:0:5
Transmission Control Protocol, Src Port: 0, Dst Port: 7114, Seq: 0, Ack: 1, Len: 159
Zilla Frame
    Frame Type ID: 0x00000001
    Frame Type: BEGIN
    Protocol Type ID: 0x8ab62046
    Protocol Type: http
    Worker: 1
    Offset: 0x00000060
    Origin ID: 0x000000090000000b
    Origin Namespace: example
    Origin Binding: north_tcp_server
    Routed ID: 0x000000090000000d
    Routed Namespace: example
    Routed Binding: north_http_server
    Stream ID: 0x0101000000000005
    Initial ID: 0x0101000000000005
    Reply ID: 0x0101000000000004
    Direction: INI
    Sequence: 0
    Acknowledge: 0
    Maximum: 0
    Timestamp: 0x0000000000000002
    Trace ID: 0x0100000000000003
    Authorization: 0x0000000000000000
    Affinity: 0x0101000000000005

Frame 6: 233 bytes on wire (1864 bits), 233 bytes captured (1864 bits)
Ethernet II, Src: Send_00 (20:53:45:4e:44:00), Dst: Receive_00 (20:52:45:43:56:00)
Internet Protocol Version 6, Src: fe80::2:202:0:0:4, Dst: fe80::2:202:0:0:5
Transmission Control Protocol, Src Port: 0, Dst Port: 7114, Seq: 0, Ack: 1, Len: 159
Zilla Frame
    Frame Type ID: 0x00000001
    Frame Type: BEGIN
    Protocol Type ID: 0x8ab62046
    Protocol Type: http
    Worker: 2
    Offset: 0x00000060
    Origin ID: 0x000000090000000b
    Origin Namespace: example
    Origin Binding: north_tcp_server
    Routed ID: 0x000000090000000d
    Routed Namespace: example
    Routed Binding: north_http_server
    Stream ID: 0x0202000000000005
    Initial ID: 0x0202000000000005
    Reply ID: 0x0202000000000004
    Direction: INI
    Sequence: 0
    Acknowledge: 0
    Maximum: 0
    Timestamp: 0x0000000000000002
    Trace ID: 0x0200000000000003
    Authorization: 0x0000000000000000
    Affinity: 0x0202000000000005

Frame 7: 233 bytes on wire (1864 bits), 233 bytes captured (1864 bits)
Ethernet II, Src: Send_00 (20:53:45:4e:44:00), Dst: Receive_00 (20:52:45:43:56:00)
Internet Protocol Version 6, Src: fe80::4, Dst: fe80::5
Transmission Control Protocol, Src Port: 0, Dst Port: 7114, Seq: 0, Ack: 1, Len: 159
Zilla Frame
    Frame Type ID: 0x00000001
    Frame Type: BEGIN
    Protocol Type ID: 0x8ab62046
    Protocol Type: http
    Worker: 0
    Offset: 0x000000d0
    Origin ID: 0x000000090000000b
    Origin Namespace: example
    Origin Binding: north_tcp_server
    Routed ID: 0x000000090000000d
    Routed Namespace: example
    Routed Binding: north_http_server
    Stream ID: 0x0000000000000005
    Initial ID: 0x0000000000000005
    Reply ID: 0x0000000000000004
    Direction: INI
    Sequence: 0
    Acknowledge: 0
    Maximum: 0
    Timestamp: 0x0000000000000003
    Trace ID: 0x0000000000000003
    Authorization: 0x0000000000000000
    Affinity: 0x0000000000000005

Frame 8: 225 bytes on wire (1800 bits), 225 bytes captured (1800 bits)
Ethernet II, Src: Send_00 (20:53:45:4e:44:00), Dst: Receive_00 (20:52:45:43:56:00)
Internet Protocol Version 6, Src: fe80::1:101:0:0:5, Dst: fe80::1:101:0:0:4
Transmission Control Protocol, Src Port: 7114, Dst Port: 0, Seq: 1, Ack: 159, Len: 151
Zilla Frame
    Frame Type ID: 0x00000003
    Frame Type: END
    Protocol Type ID: 0x8ab62046
    Protocol Type: http
    Worker: 1
    Offset: 0x000000b8
    Origin ID: 0x000000090000000b
    Origin Namespace: example
    Origin Binding: north_tcp_server
    Routed ID: 0x000000090000000d
    Routed Namespace: example
    Routed Binding: north_http_server
    Stream ID: 0x0101000000000004
    Initial ID: 0x0101000000000005
    Reply ID: 0x0101000000000004
    Direction: REP
    Sequence: 703
    Acknowledge: 704
    Maximum: 4444
    Timestamp: 0x0000000000000003
    Trace ID: 0x0100000000000003
    Authorization: 0x0000000000000000

Frame 9: 225 bytes on wire (1800 bits), 225 bytes captured (1800 bits)
Ethernet II, Src: Send_00 (20:53:45:4e:44:00), Dst: Receive_00 (20:52:45:43:56:00)
Internet Protocol Version 6, Src: fe80::2:202:0:0:5, Dst: fe80::2:202:0:0:4
Transmission Control Protocol, Src Port: 7114, Dst Port: 0, Seq: 1, Ack: 159, Len: 151
Zilla Frame
    Frame Type ID: 0x00000003
    Frame Type: END
    Protocol Type ID: 0x8ab62046
    Protocol Type: http
    Worker: 2
    Offset: 0x000000b8
    Origin ID: 0x000000090000000b
    Origin Namespace: example
    Origin Binding: north_tcp_server
    Routed ID: 0x000000090000000d
    Routed Namespace: example
    Routed Binding: north_http_server
    Stream ID: 0x0202000000000004
    Initial ID: 0x0202000000000005
    Reply ID: 0x0202000000000004
    Direction: REP
    Sequence: 703
    Acknowledge: 704
    Maximum: 4444
    Timestamp: 0x0000000000000003
    Trace ID: 0x0200000000000003
    Authorization: 0x0000000000000000

Frame 10: 242 bytes on wire (1936 bits), 242 bytes captured (1936 bits)
Ethernet II, Src: Send_00 (20:53:45:4e:44:00), Dst: Receive_00 (20:52:45:43:56:00)
Internet Protocol Version 6, Src: fe80::4, Dst: fe80::5
Transmission Control Protocol, Src Port: 0, Dst Port: 7114, Seq: 159, Ack: 1, Len: 168
Zilla Frame
    Frame Type ID: 0x40000002
    Frame Type: WINDOW
    Protocol Type ID: 0x8ab62046
    Protocol Type: http
    Worker: 0
    Offset: 0x00000128
    Origin ID: 0x000000090000000b
    Origin Namespace: example
    Origin Binding: north_tcp_server
    Routed ID: 0x000000090000000d
    Routed Namespace: example
    Routed Binding: north_http_server
    Stream ID: 0x0000000000000005
    Initial ID: 0x0000000000000005
    Reply ID: 0x0000000000000004
    Direction: INI
    Sequence: 0
    Acknowledge: 0
    Maximum: 65536
    Timestamp: 0x0000000000000004
    Trace ID: 0x0000000000000003
    Authorization: 0x0000000000000000
    Budget ID: 0x0000000000000000
    Padding: 0
    Minimum: 0
    Capabilities: 0x00
    Progress: 0
    Progress/Maximum: 0/65536

Frame 11: 233 bytes on wire (1864 bits), 233 bytes captured (1864 bits)
Ethernet II, Src: Send_00 (20:53:45:4e:44:00), Dst: Receive_00 (20:52:45:43:56:00)
Internet Protocol Version 6, Src: fe80::5, Dst: fe80::4
Transmission Control Protocol, Src Port: 7114, Dst Port: 0, Seq: 1, Ack: 327, Len: 159
Zilla Frame
    Frame Type ID: 0x00000001
    Frame Type: BEGIN
    Protocol Type ID: 0x8ab62046
    Protocol Type: http
    Worker: 0
    Offset: 0x00000188
    Origin ID: 0x000000090000000b
    Origin Namespace: example
    Origin Binding: north_tcp_server
    Routed ID: 0x000000090000000d
    Routed Namespace: example
    Routed Binding: north_http_server
    Stream ID: 0x0000000000000004
    Initial ID: 0x0000000000000005
    Reply ID: 0x0000000000000004
    Direction: REP
    Sequence: 1
    Acknowledge: 0
    Maximum: 0
    Timestamp: 0x0000000000000005
    Trace ID: 0x0000000000000003
    Authorization: 0x0000000000000000
    Affinity: 0x0000000000000000

Frame 12: 242 bytes on wire (1936 bits), 242 bytes captured (1936 bits)
Ethernet II, Src: Send_00 (20:53:45:4e:44:00), Dst: Receive_00 (20:52:45:43:56:00)
Internet Protocol Version 6, Src: fe80::5, Dst: fe80::4
Transmission Control Protocol, Src Port: 7114, Dst Port: 0, Seq: 160, Ack: 327, Len: 168
Zilla Frame
    Frame Type ID: 0x40000002
    Frame Type: WINDOW
    Protocol Type ID: 0x8ab62046
    Protocol Type: http
    Worker: 0
    Offset: 0x000001e0
    Origin ID: 0x000000090000000b
    Origin Namespace: example
    Origin Binding: north_tcp_server
    Routed ID: 0x000000090000000d
    Routed Namespace: example
    Routed Binding: north_http_server
    Stream ID: 0x0000000000000004
    Initial ID: 0x0000000000000005
    Reply ID: 0x0000000000000004
    Direction: REP
    Sequence: 0
    Acknowledge: 0
    Maximum: 65536
    Timestamp: 0x0000000000000006
    Trace ID: 0x0000000000000003
    Authorization: 0x0000000000000000
    Budget ID: 0x0000000000000000
    Padding: 0
    Minimum: 0
    Capabilities: 0x00
    Progress: 0
    Progress/Maximum: 0/65536

Frame 13: 232 bytes on wire (1856 bits), 232 bytes captured (1856 bits)
Ethernet II, Src: Send_00 (20:53:45:4e:44:00), Dst: Receive_00 (20:52:45:43:56:00)
Internet Protocol Version 6, Src: fe80::76, Dst: fe80::77
Transmission Control Protocol, Src Port: 0, Dst Port: 7114, Seq: 0, Ack: 1, Len: 158
Zilla Frame
    Frame Type ID: 0x00000001
    Frame Type: BEGIN
    Protocol Type ID: 0x99f321bc
    Protocol Type: tls
    Worker: 0
    Offset: 0x00000240
    Origin ID: 0x000000090000000b
    Origin Namespace: example
    Origin Binding: north_tcp_server
    Routed ID: 0x000000090000000c
    Routed Namespace: example
    Routed Binding: north_tls_server
    Stream ID: 0x0000000000000077
    Initial ID: 0x0000000000000077
    Reply ID: 0x0000000000000076
    Direction: INI
    Sequence: 71
    Acknowledge: 72
    Maximum: 73
    Timestamp: 0x0000000000000007
    Trace ID: 0x0000000000004202
    Authorization: 0x0000000000004203
    Affinity: 0x0000000000004204

Frame 14: 372 bytes on wire (2976 bits), 372 bytes captured (2976 bits)
Ethernet II, Src: Send_00 (20:53:45:4e:44:00), Dst: Receive_00 (20:52:45:43:56:00)
Internet Protocol Version 6, Src: fe80::4, Dst: fe80::5
Transmission Control Protocol, Src Port: 0, Dst Port: 7114, Seq: 327, Ack: 328, Len: 298
Zilla Frame
    Frame Type ID: 0x00000002
    Frame Type: DATA
    Protocol Type ID: 0x8ab62046
    Protocol Type: http
    Worker: 0
    Offset: 0x00000298
    Origin ID: 0x000000090000000b
    Origin Namespace: example
    Origin Binding: north_tcp_server
    Routed ID: 0x000000090000000d
    Routed Namespace: example
    Routed Binding: north_http_server
    Stream ID: 0x0000000000000005
    Initial ID: 0x0000000000000005
    Reply ID: 0x0000000000000004
    Direction: INI
    Sequence: 123
    Acknowledge: 456
    Maximum: 777
    Timestamp: 0x0000000000000008
    Trace ID: 0x0000000000000003
    Authorization: 0x0000000000000000
    Flags: 0x03
        .... ...1 = FIN: Set (1)
        .... ..1. = INIT: Set (1)
        .... .0.. = INCOMPLETE: Not set (0)
        .... 0... = SKIP: Not set (0)
    Budget ID: 0x0000000000004205
    Reserved: 16902
    Progress: 16569
    Progress/Maximum: 16569/777
    Payload
        Length: 130
        Payload
Hypertext Transfer Protocol
    POST / HTTP/1.1\n
        [Expert Info (Chat/Sequence): POST / HTTP/1.1\n]
            [POST / HTTP/1.1\n]
            [Severity level: Chat]
            [Group: Sequence]
        Request Method: POST
        Request URI: /
        Request Version: HTTP/1.1
    Host: localhost:8080\n
    User-Agent: curl/7.85.0\n
    Accept: */*\n
    Content-Type: text/plain\n
    Content-Length: 12\n
        [Content length: 12]
    \n
    [Full request URI: http://localhost:8080/]
    [HTTP request 1/1]
    File Data: 12 bytes
Line-based text data: text/plain (1 lines)

Frame 15: 316 bytes on wire (2528 bits), 316 bytes captured (2528 bits)
Ethernet II, Src: Send_00 (20:53:45:4e:44:00), Dst: Receive_00 (20:52:45:43:56:00)
Internet Protocol Version 6, Src: fe80::5, Dst: fe80::4
Transmission Control Protocol, Src Port: 7114, Dst Port: 0, Seq: 328, Ack: 625, Len: 242
Zilla Frame
    Frame Type ID: 0x00000002
    Frame Type: DATA
    Protocol Type ID: 0x8ab62046
    Protocol Type: http
    Worker: 0
    Offset: 0x00000378
    Origin ID: 0x000000090000000b
    Origin Namespace: example
    Origin Binding: north_tcp_server
    Routed ID: 0x000000090000000d
    Routed Namespace: example
    Routed Binding: north_http_server
    Stream ID: 0x0000000000000004
    Initial ID: 0x0000000000000005
    Reply ID: 0x0000000000000004
    Direction: REP
    Sequence: 123
    Acknowledge: 456
    Maximum: 777
    Timestamp: 0x0000000000000009
    Trace ID: 0x0000000000000003
    Authorization: 0x0000000000000000
    Flags: 0x03
        .... ...1 = FIN: Set (1)
        .... ..1. = INIT: Set (1)
        .... .0.. = INCOMPLETE: Not set (0)
        .... 0... = SKIP: Not set (0)
    Budget ID: 0x0000000000004205
    Reserved: 16902
    Progress: 16569
    Progress/Maximum: 16569/777
    Payload
        Length: 74
        Payload
Hypertext Transfer Protocol
    HTTP/1.1 200 OK\n
        [Expert Info (Chat/Sequence): HTTP/1.1 200 OK\n]
            [HTTP/1.1 200 OK\n]
            [Severity level: Chat]
            [Group: Sequence]
        Response Version: HTTP/1.1
        Status Code: 200
        [Status Code Description: OK]
        Response Phrase: OK
    Content-Type: text/plain\n
    Content-Length: 13\n
        [Content length: 13]
    \n
    [HTTP response 1/1]
    [Time since request: 0.000000000 seconds]
    [Request in frame: 14]
    [Request URI: http://localhost:8080/]
    File Data: 13 bytes
Line-based text data: text/plain (1 lines)

Frame 16: 225 bytes on wire (1800 bits), 225 bytes captured (1800 bits)
Ethernet II, Src: Send_00 (20:53:45:4e:44:00), Dst: Receive_00 (20:52:45:43:56:00)
Internet Protocol Version 6, Src: fe80::5, Dst: fe80::4
Transmission Control Protocol, Src Port: 7114, Dst Port: 0, Seq: 570, Ack: 625, Len: 151
Zilla Frame
    Frame Type ID: 0x40000004
    Frame Type: CHALLENGE
    Protocol Type ID: 0x8ab62046
    Protocol Type: http
    Worker: 0
    Offset: 0x00000420
    Origin ID: 0x000000090000000b
    Origin Namespace: example
    Origin Binding: north_tcp_server
    Routed ID: 0x000000090000000d
    Routed Namespace: example
    Routed Binding: north_http_server
    Stream ID: 0x0000000000000004
    Initial ID: 0x0000000000000005
    Reply ID: 0x0000000000000004
    Direction: REP
    Sequence: 201
    Acknowledge: 202
    Maximum: 22222
    Timestamp: 0x000000000000000a
    Trace ID: 0x0000000000000003
    Authorization: 0x0000000000007742

Frame 17: 295 bytes on wire (2360 bits), 295 bytes captured (2360 bits)
Ethernet II, Src: Send_00 (20:53:45:4e:44:00), Dst: Receive_00 (20:52:45:43:56:00)
Internet Protocol Version 6, Src: fe80::4, Dst: fe80::5
Transmission Control Protocol, Src Port: 0, Dst Port: 7114, Seq: 625, Ack: 721, Len: 221
Zilla Frame
    Frame Type ID: 0x00000002
    Frame Type: DATA
    Protocol Type ID: 0x8ab62046
    Protocol Type: http
    Worker: 0
    Offset: 0x00000470
    Origin ID: 0x000000090000000b
    Origin Namespace: example
    Origin Binding: north_tcp_server
    Routed ID: 0x000000090000000d
    Routed Namespace: example
    Routed Binding: north_http_server
    Stream ID: 0x0000000000000005
    Initial ID: 0x0000000000000005
    Reply ID: 0x0000000000000004
    Direction: INI
    Sequence: 123
    Acknowledge: 456
    Maximum: 777
    Timestamp: 0x000000000000000b
    Trace ID: 0x0000000000000003
    Authorization: 0x0000000000000000
    Flags: 0x03
        .... ...1 = FIN: Set (1)
        .... ..1. = INIT: Set (1)
        .... .0.. = INCOMPLETE: Not set (0)
        .... 0... = SKIP: Not set (0)
    Budget ID: 0x0000000000004405
    Reserved: 16902
    Progress: 16569
    Progress/Maximum: 16569/777
    Payload
        Length: 53
        Payload
HyperText Transfer Protocol 2
    Stream: HEADERS, Stream ID: 1, Length 44, POST /
        Length: 44
        Type: HEADERS (1)
        Flags: 0x04, End Headers
            00.0 ..0. = Unused: 0x00
            ..0. .... = Priority: False
            .... 0... = Padded: False
            .... .1.. = End Headers: True
            .... ...0 = End Stream: False
        0... .... .... .... .... .... .... .... = Reserved: 0x0
        .000 0000 0000 0000 0000 0000 0000 0001 = Stream Identifier: 1
        [Pad Length: 0]
        Header Block Fragment: 8387418aa0e41d139d09b8e85a67847a8825b650c3cb85717f53032a2f2a5f87497ca58ae819aa0f0d023132
        [Header Length: 184]
        [Header Count: 8]
        Header: :method: POST
            Name Length: 7
            Name: :method
            Value Length: 4
            Value: POST
            :method: POST
            [Unescaped: POST]
            Representation: Indexed Header Field
            Index: 3
        Header: :scheme: https
            Name Length: 7
            Name: :scheme
            Value Length: 5
            Value: https
            :scheme: https
            [Unescaped: https]
            Representation: Indexed Header Field
            Index: 7
        Header: :authority: localhost:7143
            Name Length: 10
            Name: :authority
            Value Length: 14
            Value: localhost:7143
            :authority: localhost:7143
            [Unescaped: localhost:7143]
            Representation: Literal Header Field with Incremental Indexing - Indexed Name
            Index: 1
        Header: :path: /
            Name Length: 5
            Name: :path
            Value Length: 1
            Value: /
            :path: /
            [Unescaped: /]
            Representation: Indexed Header Field
            Index: 4
        Header: user-agent: curl/8.1.2
            Name Length: 10
            Name: user-agent
            Value Length: 10
            Value: curl/8.1.2
            user-agent: curl/8.1.2
            [Unescaped: curl/8.1.2]
            Representation: Literal Header Field with Incremental Indexing - Indexed Name
            Index: 58
        Header: accept: */*
            Name Length: 6
            Name: accept
            Value Length: 3
            Value: */*
            accept: */*
            [Unescaped: */*]
            Representation: Literal Header Field with Incremental Indexing - Indexed Name
            Index: 19
        Header: content-type: text/plain
            Name Length: 12
            Name: content-type
            Value Length: 10
            Value: text/plain
            content-type: text/plain
            [Unescaped: text/plain]
            Representation: Literal Header Field with Incremental Indexing - Indexed Name
            Index: 31
        Header: content-length: 12
            Name Length: 14
            Name: content-length
            Value Length: 2
            Value: 12
            content-length: 12
            [Unescaped: 12]
            Representation: Literal Header Field without Indexing - Indexed Name
            Index: 28
        [Full request URI: https://localhost:7143/]

Frame 18: 289 bytes on wire (2312 bits), 289 bytes captured (2312 bits)
Ethernet II, Src: Send_00 (20:53:45:4e:44:00), Dst: Receive_00 (20:52:45:43:56:00)
Internet Protocol Version 6, Src: fe80::5, Dst: fe80::4
Transmission Control Protocol, Src Port: 7114, Dst Port: 0, Seq: 721, Ack: 846, Len: 215
Zilla Frame
    Frame Type ID: 0x00000002
    Frame Type: DATA
    Protocol Type ID: 0x8ab62046
    Protocol Type: http
    Worker: 0
    Offset: 0x00000508
    Origin ID: 0x000000090000000b
    Origin Namespace: example
    Origin Binding: north_tcp_server
    Routed ID: 0x000000090000000d
    Routed Namespace: example
    Routed Binding: north_http_server
    Stream ID: 0x0000000000000004
    Initial ID: 0x0000000000000005
    Reply ID: 0x0000000000000004
    Direction: REP
    Sequence: 123
    Acknowledge: 456
    Maximum: 777
    Timestamp: 0x000000000000000c
    Trace ID: 0x0000000000000003
    Authorization: 0x0000000000000000
    Flags: 0x03
        .... ...1 = FIN: Set (1)
        .... ..1. = INIT: Set (1)
        .... .0.. = INCOMPLETE: Not set (0)
        .... 0... = SKIP: Not set (0)
    Budget ID: 0x0000000000004405
    Reserved: 16902
    Progress: 16569
    Progress/Maximum: 16569/777
    Payload
        Length: 47
        Payload
HyperText Transfer Protocol 2
    Stream: HEADERS, Stream ID: 1, Length 38, 200 OK
        Length: 38
        Type: HEADERS (1)
        Flags: 0x04, End Headers
            00.0 ..0. = Unused: 0x00
            ..0. .... = Priority: False
            .... 0... = Padded: False
            .... .1.. = End Headers: True
            .... ...0 = End Stream: False
        0... .... .... .... .... .... .... .... = Reserved: 0x0
        .000 0000 0000 0000 0000 0000 0000 0001 = Stream Identifier: 1
        [Pad Length: 0]
        Header Block Fragment: 880f2b0a6375726c2f382e312e320f04032a2f2a0f100a746578742f706c61696e0f0d023132
        [Header Length: 117]
        [Header Count: 5]
        Header: :status: 200 OK
            Name Length: 7
            Name: :status
            Value Length: 3
            Value: 200
            :status: 200
            [Unescaped: 200]
            Representation: Indexed Header Field
            Index: 8
        Header: user-agent: curl/8.1.2
            Name Length: 10
            Name: user-agent
            Value Length: 10
            Value: curl/8.1.2
            user-agent: curl/8.1.2
            [Unescaped: curl/8.1.2]
            Representation: Literal Header Field without Indexing - Indexed Name
            Index: 58
        Header: accept: */*
            Name Length: 6
            Name: accept
            Value Length: 3
            Value: */*
            accept: */*
            [Unescaped: */*]
            Representation: Literal Header Field without Indexing - Indexed Name
            Index: 19
        Header: content-type: text/plain
            Name Length: 12
            Name: content-type
            Value Length: 10
            Value: text/plain
            content-type: text/plain
            [Unescaped: text/plain]
            Representation: Literal Header Field without Indexing - Indexed Name
            Index: 31
        Header: content-length: 12
            Name Length: 14
            Name: content-length
            Value Length: 2
            Value: 12
            content-length: 12
            [Unescaped: 12]
            Representation: Literal Header Field without Indexing - Indexed Name
            Index: 28
        [Time since request: 0.000000000 seconds]
        [Request in frame: 17]

Frame 19: 254 bytes on wire (2032 bits), 254 bytes captured (2032 bits)
Ethernet II, Src: Send_00 (20:53:45:4e:44:00), Dst: Receive_00 (20:52:45:43:56:00)
Internet Protocol Version 6, Src: fe80::5, Dst: fe80::4
Transmission Control Protocol, Src Port: 7114, Dst Port: 0, Seq: 936, Ack: 846, Len: 180
Zilla Frame
    Frame Type ID: 0x00000002
    Frame Type: DATA
    Protocol Type ID: 0x8ab62046
    Protocol Type: http
    Worker: 0
    Offset: 0x00000598
    Origin ID: 0x000000090000000b
    Origin Namespace: example
    Origin Binding: north_tcp_server
    Routed ID: 0x000000090000000d
    Routed Namespace: example
    Routed Binding: north_http_server
    Stream ID: 0x0000000000000004
    Initial ID: 0x0000000000000005
    Reply ID: 0x0000000000000004
    Direction: REP
    Sequence: 123
    Acknowledge: 456
    Maximum: 777
    Timestamp: 0x000000000000000d
    Trace ID: 0x0000000000000003
    Authorization: 0x0000000000000000
    Flags: 0x03
        .... ...1 = FIN: Set (1)
        .... ..1. = INIT: Set (1)
        .... .0.. = INCOMPLETE: Not set (0)
        .... 0... = SKIP: Not set (0)
    Budget ID: 0x0000000000004405
    Reserved: 16902
    Progress: 16569
    Progress/Maximum: 16569/777
    Payload
        Length: 12
        Payload

Frame 20: 237 bytes on wire (1896 bits), 237 bytes captured (1896 bits)
Ethernet II, Src: Send_00 (20:53:45:4e:44:00), Dst: Receive_00 (20:52:45:43:56:00)
Internet Protocol Version 6, Src: fe80::5, Dst: fe80::4
Transmission Control Protocol, Src Port: 7114, Dst Port: 0, Seq: 1116, Ack: 846, Len: 163
Zilla Frame
    Frame Type ID: 0x00000005
    Frame Type: FLUSH
    Protocol Type ID: 0x8ab62046
    Protocol Type: http
    Worker: 0
    Offset: 0x00000608
    Origin ID: 0x000000090000000b
    Origin Namespace: example
    Origin Binding: north_tcp_server
    Routed ID: 0x000000090000000d
    Routed Namespace: example
    Routed Binding: north_http_server
    Stream ID: 0x0000000000000004
    Initial ID: 0x0000000000000005
    Reply ID: 0x0000000000000004
    Direction: REP
    Sequence: 301
    Acknowledge: 302
    Maximum: 3344
    Timestamp: 0x000000000000000e
    Trace ID: 0x0000000000000003
    Authorization: 0x0000000000000000
    Budget ID: 0x0000000000003300
    Reserved: 13059

Frame 21: 225 bytes on wire (1800 bits), 225 bytes captured (1800 bits)
Ethernet II, Src: Send_00 (20:53:45:4e:44:00), Dst: Receive_00 (20:52:45:43:56:00)
Internet Protocol Version 6, Src: fe80::4, Dst: fe80::5
Transmission Control Protocol, Src Port: 0, Dst Port: 7114, Seq: 846, Ack: 1279, Len: 151
Zilla Frame
    Frame Type ID: 0x00000004
    Frame Type: ABORT
    Protocol Type ID: 0x8ab62046
    Protocol Type: http
    Worker: 0
    Offset: 0x00000660
    Origin ID: 0x000000090000000b
    Origin Namespace: example
    Origin Binding: north_tcp_server
    Routed ID: 0x000000090000000d
    Routed Namespace: example
    Routed Binding: north_http_server
    Stream ID: 0x0000000000000005
    Initial ID: 0x0000000000000005
    Reply ID: 0x0000000000000004
    Direction: INI
    Sequence: 401
    Acknowledge: 402
    Maximum: 4477
    Timestamp: 0x000000000000000f
    Trace ID: 0x0000000000000003
    Authorization: 0x0000000000000000

Frame 22: 225 bytes on wire (1800 bits), 225 bytes captured (1800 bits)
Ethernet II, Src: Send_00 (20:53:45:4e:44:00), Dst: Receive_00 (20:52:45:43:56:00)
Internet Protocol Version 6, Src: fe80::7, Dst: fe80::6
Transmission Control Protocol, Src Port: 7114, Dst Port: 0, Seq: 1, Ack: 1, Len: 151
Zilla Frame
    Frame Type ID: 0x40000001
    Frame Type: RESET
    Protocol Type ID: 0x8ab62046
    Protocol Type: http
    Worker: 0
    Offset: 0x000006b0
    Origin ID: 0x000000090000000b
    Origin Namespace: example
    Origin Binding: north_tcp_server
    Routed ID: 0x000000090000000d
    Routed Namespace: example
    Routed Binding: north_http_server
    Stream ID: 0x0000000000000006
    Initial ID: 0x0000000000000007
    Reply ID: 0x0000000000000006
    Direction: REP
    Sequence: 501
    Acknowledge: 502
    Maximum: 5577
    Timestamp: 0x0000000000000010
    Trace ID: 0x0000000000000003
    Authorization: 0x0000000000000000

Frame 23: 225 bytes on wire (1800 bits), 225 bytes captured (1800 bits)
Ethernet II, Src: Send_00 (20:53:45:4e:44:00), Dst: Receive_00 (20:52:45:43:56:00)
Internet Protocol Version 6, Src: fe80::4, Dst: fe80::5
Transmission Control Protocol, Src Port: 0, Dst Port: 7114, Seq: 997, Ack: 1279, Len: 151
Zilla Frame
    Frame Type ID: 0x00000003
    Frame Type: END
    Protocol Type ID: 0x8ab62046
    Protocol Type: http
    Worker: 0
    Offset: 0x00000700
    Origin ID: 0x000000090000000b
    Origin Namespace: example
    Origin Binding: north_tcp_server
    Routed ID: 0x000000090000000d
    Routed Namespace: example
    Routed Binding: north_http_server
    Stream ID: 0x0000000000000005
    Initial ID: 0x0000000000000005
    Reply ID: 0x0000000000000004
    Direction: INI
    Sequence: 701
    Acknowledge: 702
    Maximum: 7777
    Timestamp: 0x0000000000000011
    Trace ID: 0x0000000000000003
    Authorization: 0x0000000000000000

Frame 24: 225 bytes on wire (1800 bits), 225 bytes captured (1800 bits)
Ethernet II, Src: Send_00 (20:53:45:4e:44:00), Dst: Receive_00 (20:52:45:43:56:00)
Internet Protocol Version 6, Src: fe80::5, Dst: fe80::4
Transmission Control Protocol, Src Port: 7114, Dst Port: 0, Seq: 1279, Ack: 1148, Len: 151
Zilla Frame
    Frame Type ID: 0x00000003
    Frame Type: END
    Protocol Type ID: 0x8ab62046
    Protocol Type: http
    Worker: 0
    Offset: 0x00000750
    Origin ID: 0x000000090000000b
    Origin Namespace: example
    Origin Binding: north_tcp_server
    Routed ID: 0x000000090000000d
    Routed Namespace: example
    Routed Binding: north_http_server
    Stream ID: 0x0000000000000004
    Initial ID: 0x0000000000000005
    Reply ID: 0x0000000000000004
    Direction: REP
    Sequence: 703
    Acknowledge: 704
    Maximum: 4444
    Timestamp: 0x0000000000000012
    Trace ID: 0x0000000000000003
    Authorization: 0x0000000000000000

Frame 25: 280 bytes on wire (2240 bits), 280 bytes captured (2240 bits)
Ethernet II, Src: Send_00 (20:53:45:4e:44:00), Dst: Receive_00 (20:52:45:43:56:00)
Internet Protocol Version 6, Src: fe80::8, Dst: fe80::9
Transmission Control Protocol, Src Port: 0, Dst Port: 7114, Seq: 0, Ack: 1, Len: 206
Zilla Frame
    Frame Type ID: 0x00000001
    Frame Type: BEGIN
    Protocol Type ID: 0x084b20e1
    Protocol Type: kafka
    Worker: 0
    Offset: 0x000007a0
    Origin ID: 0x0000000900000011
    Origin Namespace: example
    Origin Binding: south_kafka_client
    Routed ID: 0x0000000900000012
    Routed Namespace: example
    Routed Binding: south_tcp_client
    Stream ID: 0x0000000000000009
    Initial ID: 0x0000000000000009
    Reply ID: 0x0000000000000008
    Direction: INI
    Sequence: 0
    Acknowledge: 0
    Maximum: 0
    Timestamp: 0x0000000000000013
    Trace ID: 0x0000000000000009
    Authorization: 0x0000000000000000
    Affinity: 0x0000000000000000
    Extension: proxy
        Stream Type ID: 0x50a8ce8d
        Stream Type: proxy
        Address: INET
            Family: INET (0)
            Protocol: STREAM (0)
            Source: 192.168.0.77
            Source Port: 12345
            Destination: 192.168.0.42
            Destination Port: 442
        Info (0 items)
            Length: 4
            Size: 0

Frame 26: 342 bytes on wire (2736 bits), 342 bytes captured (2736 bits)
Ethernet II, Src: Send_00 (20:53:45:4e:44:00), Dst: Receive_00 (20:52:45:43:56:00)
Internet Protocol Version 6, Src: fe80::8, Dst: fe80::9
Transmission Control Protocol, Src Port: 0, Dst Port: 7114, Seq: 0, Ack: 1, Len: 268
Zilla Frame
    Frame Type ID: 0x00000001
    Frame Type: BEGIN
    Protocol Type ID: 0x084b20e1
    Protocol Type: kafka
    Worker: 0
    Offset: 0x00000828
    Origin ID: 0x0000000900000011
    Origin Namespace: example
    Origin Binding: south_kafka_client
    Routed ID: 0x0000000900000012
    Routed Namespace: example
    Routed Binding: south_tcp_client
    Stream ID: 0x0000000000000009
    Initial ID: 0x0000000000000009
    Reply ID: 0x0000000000000008
    Direction: INI
    Sequence: 0
    Acknowledge: 0
    Maximum: 0
    Timestamp: 0x0000000000000014
    Trace ID: 0x0000000000000009
    Authorization: 0x0000000000000000
    Affinity: 0x0000000000000000
    Extension: proxy
        Stream Type ID: 0x50a8ce8d
        Stream Type: proxy
        Address: INET4
            Family: INET4 (1)
            Protocol: STREAM (0)
            Source: 192.168.0.1
            Source Port: 32768
            Destination: 192.168.0.254
            Destination Port: 443
        Info (9 items)
            Length: 86
            Size: 9
        Info: ALPN: alpn
            Type: ALPN (0x01)
            Length: 4
            Value: alpn
        Info: AUTHORITY: authority
            Type: AUTHORITY (0x02)
            Length: 9
            Value: authority
        Info: IDENTITY: 0x12345678
            Type: IDENTITY (0x05)
            Length: 4
            Value: 12345678
        Info: NAMESPACE: namespace
            Type: NAMESPACE (0x30)
            Length: 9
            Value: namespace
        Info: SECURE: VERSION: TLSv1.3
            Type: SECURE (0x20)
            Secure Type: VERSION (0x21)
            Length: 7
            Value: TLSv1.3
        Info: SECURE: NAME: name
            Type: SECURE (0x20)
            Secure Type: NAME (0x22)
            Length: 4
            Value: name
        Info: SECURE: CIPHER: cipher
            Type: SECURE (0x20)
            Secure Type: CIPHER (0x23)
            Length: 6
            Value: cipher
        Info: SECURE: SIGNATURE: signature
            Type: SECURE (0x20)
            Secure Type: SIGNATURE (0x24)
            Length: 9
            Value: signature
        Info: SECURE: KEY: key
            Type: SECURE (0x20)
            Secure Type: KEY (0x25)
            Length: 3
            Value: key

Frame 27: 284 bytes on wire (2272 bits), 284 bytes captured (2272 bits)
Ethernet II, Src: Send_00 (20:53:45:4e:44:00), Dst: Receive_00 (20:52:45:43:56:00)
Internet Protocol Version 6, Src: fe80::8, Dst: fe80::9
Transmission Control Protocol, Src Port: 0, Dst Port: 7114, Seq: 0, Ack: 1, Len: 210
Zilla Frame
    Frame Type ID: 0x00000001
    Frame Type: BEGIN
    Protocol Type ID: 0x084b20e1
    Protocol Type: kafka
    Worker: 0
    Offset: 0x000008e8
    Origin ID: 0x0000000900000011
    Origin Namespace: example
    Origin Binding: south_kafka_client
    Routed ID: 0x0000000900000012
    Routed Namespace: example
    Routed Binding: south_tcp_client
    Stream ID: 0x0000000000000009
    Initial ID: 0x0000000000000009
    Reply ID: 0x0000000000000008
    Direction: INI
    Sequence: 0
    Acknowledge: 0
    Maximum: 0
    Timestamp: 0x0000000000000015
    Trace ID: 0x0000000000000009
    Authorization: 0x0000000000000000
    Affinity: 0x0000000000000000
    Extension: proxy
        Stream Type ID: 0x50a8ce8d
        Stream Type: proxy
        Address: INET6
            Family: INET6 (2)
            Protocol: STREAM (0)
            Source: fd12:3456:789a:1::1
            Source Port: 32768
            Destination: fd12:3456:789a:1::fe
            Destination Port: 443
        Info (0 items)
            Length: 4
            Size: 0

Frame 28: 464 bytes on wire (3712 bits), 464 bytes captured (3712 bits)
Ethernet II, Src: Send_00 (20:53:45:4e:44:00), Dst: Receive_00 (20:52:45:43:56:00)
Internet Protocol Version 6, Src: fe80::8, Dst: fe80::9
Transmission Control Protocol, Src Port: 0, Dst Port: 7114, Seq: 0, Ack: 1, Len: 390
Zilla Frame
    Frame Type ID: 0x00000001
    Frame Type: BEGIN
    Protocol Type ID: 0x084b20e1
    Protocol Type: kafka
    Worker: 0
    Offset: 0x00000970
    Origin ID: 0x0000000900000011
    Origin Namespace: example
    Origin Binding: south_kafka_client
    Routed ID: 0x0000000900000012
    Routed Namespace: example
    Routed Binding: south_tcp_client
    Stream ID: 0x0000000000000009
    Initial ID: 0x0000000000000009
    Reply ID: 0x0000000000000008
    Direction: INI
    Sequence: 0
    Acknowledge: 0
    Maximum: 0
    Timestamp: 0x0000000000000016
    Trace ID: 0x0000000000000009
    Authorization: 0x0000000000000000
    Affinity: 0x0000000000000000
    Extension: proxy
        Stream Type ID: 0x50a8ce8d
        Stream Type: proxy
        Address: UNIX
            Family: UNIX (3)
            Protocol: DATAGRAM (1)
            Source: unix-source
            Destination: unix-destination
        Info (0 items)
            Length: 4
            Size: 0

Frame 29: 247 bytes on wire (1976 bits), 247 bytes captured (1976 bits)
Ethernet II, Src: Send_00 (20:53:45:4e:44:00), Dst: Receive_00 (20:52:45:43:56:00)
Internet Protocol Version 6, Src: fe80::8, Dst: fe80::9
Transmission Control Protocol, Src Port: 0, Dst Port: 7114, Seq: 0, Ack: 1, Len: 173
Zilla Frame
    Frame Type ID: 0x00000001
    Frame Type: BEGIN
    Protocol Type ID: 0x084b20e1
    Protocol Type: kafka
    Worker: 0
    Offset: 0x00000ab0
    Origin ID: 0x0000000900000011
    Origin Namespace: example
    Origin Binding: south_kafka_client
    Routed ID: 0x0000000900000012
    Routed Namespace: example
    Routed Binding: south_tcp_client
    Stream ID: 0x0000000000000009
    Initial ID: 0x0000000000000009
    Reply ID: 0x0000000000000008
    Direction: INI
    Sequence: 0
    Acknowledge: 0
    Maximum: 0
    Timestamp: 0x0000000000000017
    Trace ID: 0x0000000000000009
    Authorization: 0x0000000000000000
    Affinity: 0x0000000000000000
    Extension: proxy
        Stream Type ID: 0x50a8ce8d
        Stream Type: proxy
        Address: NONE
            Family: NONE (4)
        Info (0 items)
            Length: 4
            Size: 0

Frame 30: 286 bytes on wire (2288 bits), 286 bytes captured (2288 bits)
Ethernet II, Src: Send_00 (20:53:45:4e:44:00), Dst: Receive_00 (20:52:45:43:56:00)
Internet Protocol Version 6, Src: fe80::10, Dst: fe80::11
Transmission Control Protocol, Src Port: 0, Dst Port: 7114, Seq: 0, Ack: 1, Len: 212
Zilla Frame
    Frame Type ID: 0x00000001
    Frame Type: BEGIN
    Protocol Type ID: 0x8ab62046
    Protocol Type: http
    Worker: 0
    Offset: 0x00000b18
    Origin ID: 0x000000090000000b
    Origin Namespace: example
    Origin Binding: north_tcp_server
    Routed ID: 0x000000090000000d
    Routed Namespace: example
    Routed Binding: north_http_server
    Stream ID: 0x0000000000000011
    Initial ID: 0x0000000000000011
    Reply ID: 0x0000000000000010
    Direction: INI
    Sequence: 0
    Acknowledge: 0
    Maximum: 0
    Timestamp: 0x0000000000000018
    Trace ID: 0x0000000000000011
    Authorization: 0x0000000000000000
    Affinity: 0x0000000000000000
    Extension: http
        Stream Type ID: 0x4620b68a
        Stream Type: http
        Headers (3 items)
            Length: 45
            Size: 3
        Header: :scheme: http
            Length: 7
            Name: :scheme
            Length: 4
            Value: http
        Header: :method: GET
            Length: 7
            Name: :method
            Length: 3
            Value: GET
        Header: :path: /hello
            Length: 5
            Name: :path
            Length: 6
            Value: /hello

Frame 31: 278 bytes on wire (2224 bits), 278 bytes captured (2224 bits)
Ethernet II, Src: Send_00 (20:53:45:4e:44:00), Dst: Receive_00 (20:52:45:43:56:00)
Internet Protocol Version 6, Src: fe80::10, Dst: fe80::11
Transmission Control Protocol, Src Port: 0, Dst Port: 7114, Seq: 212, Ack: 1, Len: 204
Zilla Frame
    Frame Type ID: 0x40000004
    Frame Type: CHALLENGE
    Protocol Type ID: 0x8ab62046
    Protocol Type: http
    Worker: 0
    Offset: 0x00000ba8
    Origin ID: 0x000000090000000b
    Origin Namespace: example
    Origin Binding: north_tcp_server
    Routed ID: 0x000000090000000d
    Routed Namespace: example
    Routed Binding: north_http_server
    Stream ID: 0x0000000000000011
    Initial ID: 0x0000000000000011
    Reply ID: 0x0000000000000010
    Direction: INI
    Sequence: 201
    Acknowledge: 202
    Maximum: 22222
    Timestamp: 0x0000000000000019
    Trace ID: 0x0000000000000011
    Authorization: 0x0000000000007742
    Extension: http
        Stream Type ID: 0x4620b68a
        Stream Type: http
        Headers (3 items)
            Length: 45
            Size: 3
        Header: :scheme: http
            Length: 7
            Name: :scheme
            Length: 4
            Value: http
        Header: :method: GET
            Length: 7
            Name: :method
            Length: 3
            Value: GET
        Header: :path: /hello
            Length: 5
            Name: :path
            Length: 6
            Value: /hello

Frame 32: 298 bytes on wire (2384 bits), 298 bytes captured (2384 bits)
Ethernet II, Src: Send_00 (20:53:45:4e:44:00), Dst: Receive_00 (20:52:45:43:56:00)
Internet Protocol Version 6, Src: fe80::11, Dst: fe80::10
Transmission Control Protocol, Src Port: 7114, Dst Port: 0, Seq: 1, Ack: 416, Len: 224
Zilla Frame
    Frame Type ID: 0x00000005
    Frame Type: FLUSH
    Protocol Type ID: 0x8ab62046
    Protocol Type: http
    Worker: 0
    Offset: 0x00000c30
    Origin ID: 0x000000090000000b
    Origin Namespace: example
    Origin Binding: north_tcp_server
    Routed ID: 0x000000090000000d
    Routed Namespace: example
    Routed Binding: north_http_server
    Stream ID: 0x0000000000000010
    Initial ID: 0x0000000000000011
    Reply ID: 0x0000000000000010
    Direction: REP
    Sequence: 301
    Acknowledge: 302
    Maximum: 3344
    Timestamp: 0x0000000000000020
    Trace ID: 0x0000000000000011
    Authorization: 0x0000000000000000
    Budget ID: 0x0000000000000000
    Reserved: 0
    Extension: http
        Stream Type ID: 0x4620b68a
        Stream Type: http
        Promise ID: 0x0000000000000042
        Promises (3 items)
            Length: 45
            Size: 3
        Promise: :scheme: http
            Length: 7
            Name: :scheme
            Length: 4
            Value: http
        Promise: :method: GET
            Length: 7
            Name: :method
            Length: 3
            Value: GET
        Promise: :path: /hello
            Length: 5
            Name: :path
            Length: 6
            Value: /hello

Frame 33: 278 bytes on wire (2224 bits), 278 bytes captured (2224 bits)
Ethernet II, Src: Send_00 (20:53:45:4e:44:00), Dst: Receive_00 (20:52:45:43:56:00)
Internet Protocol Version 6, Src: fe80::11, Dst: fe80::10
Transmission Control Protocol, Src Port: 7114, Dst Port: 0, Seq: 225, Ack: 416, Len: 204
Zilla Frame
    Frame Type ID: 0x40000001
    Frame Type: RESET
    Protocol Type ID: 0x8ab62046
    Protocol Type: http
    Worker: 0
    Offset: 0x00000cc8
    Origin ID: 0x000000090000000b
    Origin Namespace: example
    Origin Binding: north_tcp_server
    Routed ID: 0x000000090000000d
    Routed Namespace: example
    Routed Binding: north_http_server
    Stream ID: 0x0000000000000010
    Initial ID: 0x0000000000000011
    Reply ID: 0x0000000000000010
    Direction: REP
    Sequence: 501
    Acknowledge: 502
    Maximum: 5577
    Timestamp: 0x0000000000000021
    Trace ID: 0x0000000000000011
    Authorization: 0x0000000000000000
    Extension: http
        Stream Type ID: 0x4620b68a
        Stream Type: http
        Headers (3 items)
            Length: 45
            Size: 3
        Header: :scheme: http
            Length: 7
            Name: :scheme
            Length: 4
            Value: http
        Header: :method: GET
            Length: 7
            Name: :method
            Length: 3
            Value: GET
        Header: :path: /hello
            Length: 5
            Name: :path
            Length: 6
            Value: /hello

Frame 34: 278 bytes on wire (2224 bits), 278 bytes captured (2224 bits)
Ethernet II, Src: Send_00 (20:53:45:4e:44:00), Dst: Receive_00 (20:52:45:43:56:00)
Internet Protocol Version 6, Src: fe80::10, Dst: fe80::11
Transmission Control Protocol, Src Port: 0, Dst Port: 7114, Seq: 416, Ack: 429, Len: 204
Zilla Frame
    Frame Type ID: 0x00000003
    Frame Type: END
    Protocol Type ID: 0x8ab62046
    Protocol Type: http
    Worker: 0
    Offset: 0x00000d50
    Origin ID: 0x000000090000000b
    Origin Namespace: example
    Origin Binding: north_tcp_server
    Routed ID: 0x000000090000000d
    Routed Namespace: example
    Routed Binding: north_http_server
    Stream ID: 0x0000000000000011
    Initial ID: 0x0000000000000011
    Reply ID: 0x0000000000000010
    Direction: INI
    Sequence: 742
    Acknowledge: 427
    Maximum: 60000
    Timestamp: 0x0000000000000022
    Trace ID: 0x0000000000000011
    Authorization: 0x0000000000000000
    Extension: http
        Stream Type ID: 0x4620b68a
        Stream Type: http
        Trailers (3 items)
            Length: 45
            Size: 3
        Trailer: :scheme: http
            Length: 7
            Name: :scheme
            Length: 4
            Value: http
        Trailer: :method: GET
            Length: 7
            Name: :method
            Length: 3
            Value: GET
        Trailer: :path: /hello
            Length: 5
            Name: :path
            Length: 6
            Value: /hello

Frame 35: 369 bytes on wire (2952 bits), 369 bytes captured (2952 bits)
Ethernet II, Src: Send_00 (20:53:45:4e:44:00), Dst: Receive_00 (20:52:45:43:56:00)
Internet Protocol Version 6, Src: fe80::12, Dst: fe80::13
Transmission Control Protocol, Src Port: 0, Dst Port: 7114, Seq: 0, Ack: 1, Len: 295
Zilla Frame
    Frame Type ID: 0x00000001
    Frame Type: BEGIN
    Protocol Type ID: 0x00000000
    Protocol Type: 
    Worker: 0
    Offset: 0x00000dd8
    Origin ID: 0x000000090000001a
    Origin Namespace: example
    Origin Binding: north_grpc_server
    Routed ID: 0x000000090000001b
    Routed Namespace: example
    Routed Binding: north_grpc_kafka_mapping
    Stream ID: 0x0000000000000013
    Initial ID: 0x0000000000000013
    Reply ID: 0x0000000000000012
    Direction: INI
    Sequence: 0
    Acknowledge: 0
    Maximum: 0
    Timestamp: 0x0000000000000023
    Trace ID: 0x0000000000000013
    Authorization: 0x0000000000000000
    Affinity: 0x0000000000000000
    Extension: grpc
        Stream Type ID: 0x3a58c7f9
        Stream Type: grpc
        Scheme: http
            Length: 4
            Scheme: http
        Authority: localhost:7153
            Length: 14
            Authority: localhost:7153
        Service: example.EchoService
            Length: 19
            Service: example.EchoService
        Method: EchoUnary
            Length: 9
            Method: EchoUnary
        Metadata (3 items)
            Length: 66
            Size: 3
        Metadata: [TEXT] grpc-accept-encoding: gzip
            Type: TEXT (0)
            Length (Varint): 28
            Length: 20
            Name: grpc-accept-encoding
            Length (Varint): 08
            Length: 4
            Value: gzip
        Metadata: [TEXT] metadata-2: hello
            Type: TEXT (0)
            Length (Varint): 14
            Length: 10
            Name: metadata-2
            Length (Varint): 0a
            Length: 5
            Value: hello
        Metadata: [BASE64] metadata-3: 4242
            Type: BASE64 (1)
            Length (Varint): 14
            Length: 10
            Name: metadata-3
            Length (Varint): 08
            Length: 4
            Value: 4242

Frame 36: 539 bytes on wire (4312 bits), 539 bytes captured (4312 bits)
Ethernet II, Src: Send_00 (20:53:45:4e:44:00), Dst: Receive_00 (20:52:45:43:56:00)
Internet Protocol Version 6, Src: fe80::13, Dst: fe80::12
Transmission Control Protocol, Src Port: 7114, Dst Port: 0, Seq: 1, Ack: 295, Len: 465
Zilla Frame
    Frame Type ID: 0x00000001
    Frame Type: BEGIN
    Protocol Type ID: 0x00000000
    Protocol Type: 
    Worker: 0
    Offset: 0x00000eb0
    Origin ID: 0x000000090000001a
    Origin Namespace: example
    Origin Binding: north_grpc_server
    Routed ID: 0x000000090000001b
    Routed Namespace: example
    Routed Binding: north_grpc_kafka_mapping
    Stream ID: 0x0000000000000012
    Initial ID: 0x0000000000000013
    Reply ID: 0x0000000000000012
    Direction: REP
    Sequence: 0
    Acknowledge: 0
    Maximum: 0
    Timestamp: 0x0000000000000024
    Trace ID: 0x0000000000000013
    Authorization: 0x0000000000000000
    Affinity: 0x0000000000000000
    Extension: grpc
        Stream Type ID: 0x3a58c7f9
        Stream Type: grpc
        Scheme: http
            Length: 4
            Scheme: http
        Authority: localhost:7153
            Length: 14
            Authority: localhost:7153
        Service: example.EchoService
            Length: 19
            Service: example.EchoService
        Method: EchoUnary
            Length: 9
            Method: EchoUnary
        Metadata (2 items)
            Length: 236
            Size: 2
        Metadata: [TEXT] long field: ZZZZZZZZZZZZZZZZZZZZZZZZZZZZZZZZZZZZZZZZZZZZZZZZZZZZZZZZZZZZZZZZZZZZZZZZZZZZZZZZZZZZZZZZZZZZZZZZZZZZZZZZZZZZZZZZZZZZZZZZZZZZZZZZZZZZZZZZZZZZZZZZZZZZZZZZZZZZZZZZZZZZZZZZZZZZZZZZZZZZZZZZZZZZZZZZZZZZZZZZ
            Type: TEXT (0)
            Length (Varint): 14
            Length: 10
            Name: long field
            Length (Varint): 9003
            Length: 200
            Value: ZZZZZZZZZZZZZZZZZZZZZZZZZZZZZZZZZZZZZZZZZZZZZZZZZZZZZZZZZZZZZZZZZZZZZZZZZZZZZZZZZZZZZZZZZZZZZZZZZZZZZZZZZZZZZZZZZZZZZZZZZZZZZZZZZZZZZZZZZZZZZZZZZZZZZZZZZZZZZZZZZZZZZZZZZZZZZZZZZZZZZZZZZZZZZZZZZZZZZZZZ
        Metadata: [TEXT] metadata-2: hello
            Type: TEXT (0)
            Length (Varint): 14
            Length: 10
            Name: metadata-2
            Length (Varint): 0a
            Length: 5
            Value: hello

Frame 37: 258 bytes on wire (2064 bits), 258 bytes captured (2064 bits)
Ethernet II, Src: Send_00 (20:53:45:4e:44:00), Dst: Receive_00 (20:52:45:43:56:00)
Internet Protocol Version 6, Src: fe80::12, Dst: fe80::13
Transmission Control Protocol, Src Port: 0, Dst Port: 7114, Seq: 295, Ack: 466, Len: 184
Zilla Frame
    Frame Type ID: 0x00000002
    Frame Type: DATA
    Protocol Type ID: 0x00000000
    Protocol Type: 
    Worker: 0
    Offset: 0x00001030
    Origin ID: 0x000000090000001a
    Origin Namespace: example
    Origin Binding: north_grpc_server
    Routed ID: 0x000000090000001b
    Routed Namespace: example
    Routed Binding: north_grpc_kafka_mapping
    Stream ID: 0x0000000000000013
    Initial ID: 0x0000000000000013
    Reply ID: 0x0000000000000012
    Direction: INI
    Sequence: 0
    Acknowledge: 0
    Maximum: 0
    Timestamp: 0x0000000000000025
    Trace ID: 0x0000000000000013
    Authorization: 0x0000000000000000
    Flags: 0x03
        .... ...1 = FIN: Set (1)
        .... ..1. = INIT: Set (1)
        .... .0.. = INCOMPLETE: Not set (0)
        .... 0... = SKIP: Not set (0)
    Budget ID: 0x0000000000000013
    Reserved: 66
    Progress: 66
    Progress/Maximum: 66/0
    Payload
        Length: -1
    Extension: grpc
        Stream Type ID: 0x3a58c7f9
        Stream Type: grpc
        Deferred: 42

Frame 38: 258 bytes on wire (2064 bits), 258 bytes captured (2064 bits)
Ethernet II, Src: Send_00 (20:53:45:4e:44:00), Dst: Receive_00 (20:52:45:43:56:00)
Internet Protocol Version 6, Src: fe80::13, Dst: fe80::12
Transmission Control Protocol, Src Port: 7114, Dst Port: 0, Seq: 466, Ack: 479, Len: 184
Zilla Frame
    Frame Type ID: 0x00000002
    Frame Type: DATA
    Protocol Type ID: 0x00000000
    Protocol Type: 
    Worker: 0
    Offset: 0x00001098
    Origin ID: 0x000000090000001a
    Origin Namespace: example
    Origin Binding: north_grpc_server
    Routed ID: 0x000000090000001b
    Routed Namespace: example
    Routed Binding: north_grpc_kafka_mapping
    Stream ID: 0x0000000000000012
    Initial ID: 0x0000000000000013
    Reply ID: 0x0000000000000012
    Direction: REP
    Sequence: 0
    Acknowledge: 0
    Maximum: 0
    Timestamp: 0x0000000000000026
    Trace ID: 0x0000000000000013
    Authorization: 0x0000000000000000
    Flags: 0x03
        .... ...1 = FIN: Set (1)
        .... ..1. = INIT: Set (1)
        .... .0.. = INCOMPLETE: Not set (0)
        .... 0... = SKIP: Not set (0)
    Budget ID: 0x0000000000000013
    Reserved: 66
    Progress: 66
    Progress/Maximum: 66/0
    Payload
        Length: 0
    Extension: grpc
        Stream Type ID: 0x3a58c7f9
        Stream Type: grpc
        Deferred: 77

Frame 39: 270 bytes on wire (2160 bits), 270 bytes captured (2160 bits)
Ethernet II, Src: Send_00 (20:53:45:4e:44:00), Dst: Receive_00 (20:52:45:43:56:00)
Internet Protocol Version 6, Src: fe80::12, Dst: fe80::13
Transmission Control Protocol, Src Port: 0, Dst Port: 7114, Seq: 479, Ack: 650, Len: 196
Zilla Frame
    Frame Type ID: 0x00000002
    Frame Type: DATA
    Protocol Type ID: 0x00000000
    Protocol Type: 
    Worker: 0
    Offset: 0x00001100
    Origin ID: 0x000000090000001a
    Origin Namespace: example
    Origin Binding: north_grpc_server
    Routed ID: 0x000000090000001b
    Routed Namespace: example
    Routed Binding: north_grpc_kafka_mapping
    Stream ID: 0x0000000000000013
    Initial ID: 0x0000000000000013
    Reply ID: 0x0000000000000012
    Direction: INI
    Sequence: 0
    Acknowledge: 0
    Maximum: 0
    Timestamp: 0x0000000000000027
    Trace ID: 0x0000000000000013
    Authorization: 0x0000000000000000
    Flags: 0x03
        .... ...1 = FIN: Set (1)
        .... ..1. = INIT: Set (1)
        .... .0.. = INCOMPLETE: Not set (0)
        .... 0... = SKIP: Not set (0)
    Budget ID: 0x0000000000000013
    Reserved: 66
    Progress: 66
    Progress/Maximum: 66/0
    Payload
        Length: 12
        Payload
    Extension: grpc
        Stream Type ID: 0x3a58c7f9
        Stream Type: grpc
        Deferred: 88

Frame 40: 246 bytes on wire (1968 bits), 246 bytes captured (1968 bits)
Ethernet II, Src: Send_00 (20:53:45:4e:44:00), Dst: Receive_00 (20:52:45:43:56:00)
Internet Protocol Version 6, Src: fe80::12, Dst: fe80::13
Transmission Control Protocol, Src Port: 0, Dst Port: 7114, Seq: 675, Ack: 650, Len: 172
Zilla Frame
    Frame Type ID: 0x00000004
    Frame Type: ABORT
    Protocol Type ID: 0x00000000
    Protocol Type: 
    Worker: 0
    Offset: 0x00001178
    Origin ID: 0x000000090000001a
    Origin Namespace: example
    Origin Binding: north_grpc_server
    Routed ID: 0x000000090000001b
    Routed Namespace: example
    Routed Binding: north_grpc_kafka_mapping
    Stream ID: 0x0000000000000013
    Initial ID: 0x0000000000000013
    Reply ID: 0x0000000000000012
    Direction: INI
    Sequence: 0
    Acknowledge: 0
    Maximum: 0
    Timestamp: 0x0000000000000028
    Trace ID: 0x0000000000000013
    Authorization: 0x0000000000000000
    Extension: grpc
        Stream Type ID: 0x3a58c7f9
        Stream Type: grpc
        Status: aborted
            Length: 7
            Status: aborted

Frame 41: 244 bytes on wire (1952 bits), 244 bytes captured (1952 bits)
Ethernet II, Src: Send_00 (20:53:45:4e:44:00), Dst: Receive_00 (20:52:45:43:56:00)
Internet Protocol Version 6, Src: fe80::13, Dst: fe80::12
Transmission Control Protocol, Src Port: 7114, Dst Port: 0, Seq: 650, Ack: 847, Len: 170
Zilla Frame
    Frame Type ID: 0x40000001
    Frame Type: RESET
    Protocol Type ID: 0x00000000
    Protocol Type: 
    Worker: 0
    Offset: 0x000011d8
    Origin ID: 0x000000090000001a
    Origin Namespace: example
    Origin Binding: north_grpc_server
    Routed ID: 0x000000090000001b
    Routed Namespace: example
    Routed Binding: north_grpc_kafka_mapping
    Stream ID: 0x0000000000000012
    Initial ID: 0x0000000000000013
    Reply ID: 0x0000000000000012
    Direction: REP
    Sequence: 0
    Acknowledge: 0
    Maximum: 0
    Timestamp: 0x0000000000000029
    Trace ID: 0x0000000000000013
    Authorization: 0x0000000000000000
    Extension: grpc
        Stream Type ID: 0x3a58c7f9
        Stream Type: grpc
        Status: reset
            Length: 5
            Status: reset

Frame 42: 267 bytes on wire (2136 bits), 267 bytes captured (2136 bits)
Ethernet II, Src: Send_00 (20:53:45:4e:44:00), Dst: Receive_00 (20:52:45:43:56:00)
Internet Protocol Version 6, Src: fe80::14, Dst: fe80::15
Transmission Control Protocol, Src Port: 0, Dst Port: 7114, Seq: 0, Ack: 1, Len: 193
Zilla Frame
    Frame Type ID: 0x00000001
    Frame Type: BEGIN
    Protocol Type ID: 0x00000000
    Protocol Type: 
    Worker: 0
    Offset: 0x00001230
    Origin ID: 0x000000090000001c
    Origin Namespace: example
    Origin Binding: north_sse_server
    Routed ID: 0x000000090000001d
    Routed Namespace: example
    Routed Binding: south_sse_client
    Stream ID: 0x0000000000000015
    Initial ID: 0x0000000000000015
    Reply ID: 0x0000000000000014
    Direction: INI
    Sequence: 0
    Acknowledge: 0
    Maximum: 0
    Timestamp: 0x000000000000002a
    Trace ID: 0x0000000000000015
    Authorization: 0x0000000000000000
    Affinity: 0x0000000000000000
    Extension: sse
        Stream Type ID: 0x2e9e4003
        Stream Type: sse
        Scheme: http
            Length: 4
            Scheme: http
        Authority: localhost:7153
            Length: 14
            Authority: localhost:7153
        Path: /hello
            Length: 6
            Path: /hello
        Last ID: 
            Length: -1
            Last ID: 

Frame 43: 273 bytes on wire (2184 bits), 273 bytes captured (2184 bits)
Ethernet II, Src: Send_00 (20:53:45:4e:44:00), Dst: Receive_00 (20:52:45:43:56:00)
Internet Protocol Version 6, Src: fe80::15, Dst: fe80::14
Transmission Control Protocol, Src Port: 7114, Dst Port: 0, Seq: 1, Ack: 193, Len: 199
Zilla Frame
    Frame Type ID: 0x00000001
    Frame Type: BEGIN
    Protocol Type ID: 0x00000000
    Protocol Type: 
    Worker: 0
    Offset: 0x000012a8
    Origin ID: 0x000000090000001c
    Origin Namespace: example
    Origin Binding: north_sse_server
    Routed ID: 0x000000090000001d
    Routed Namespace: example
    Routed Binding: south_sse_client
    Stream ID: 0x0000000000000014
    Initial ID: 0x0000000000000015
    Reply ID: 0x0000000000000014
    Direction: REP
    Sequence: 0
    Acknowledge: 0
    Maximum: 0
    Timestamp: 0x000000000000002b
    Trace ID: 0x0000000000000015
    Authorization: 0x0000000000000000
    Affinity: 0x0000000000000000
    Extension: sse
        Stream Type ID: 0x2e9e4003
        Stream Type: sse
        Scheme: http
            Length: 4
            Scheme: http
        Authority: localhost:7153
            Length: 14
            Authority: localhost:7153
        Path: /hello
            Length: 6
            Path: /hello
        Last ID: lastId
            Length: 6
            Last ID: lastId

Frame 44: 261 bytes on wire (2088 bits), 261 bytes captured (2088 bits)
Ethernet II, Src: Send_00 (20:53:45:4e:44:00), Dst: Receive_00 (20:52:45:43:56:00)
Internet Protocol Version 6, Src: fe80::14, Dst: fe80::15
Transmission Control Protocol, Src Port: 0, Dst Port: 7114, Seq: 193, Ack: 200, Len: 187
Zilla Frame
    Frame Type ID: 0x00000002
    Frame Type: DATA
    Protocol Type ID: 0x00000000
    Protocol Type: 
    Worker: 0
    Offset: 0x00001328
    Origin ID: 0x000000090000001c
    Origin Namespace: example
    Origin Binding: north_sse_server
    Routed ID: 0x000000090000001d
    Routed Namespace: example
    Routed Binding: south_sse_client
    Stream ID: 0x0000000000000015
    Initial ID: 0x0000000000000015
    Reply ID: 0x0000000000000014
    Direction: INI
    Sequence: 0
    Acknowledge: 0
    Maximum: 0
    Timestamp: 0x000000000000002c
    Trace ID: 0x0000000000000015
    Authorization: 0x0000000000000000
    Flags: 0x03
        .... ...1 = FIN: Set (1)
        .... ..1. = INIT: Set (1)
        .... .0.. = INCOMPLETE: Not set (0)
        .... 0... = SKIP: Not set (0)
    Budget ID: 0x0000000000000015
    Reserved: 66
    Progress: 66
    Progress/Maximum: 66/0
    Payload
        Length: -1
    Extension: sse
        Stream Type ID: 0x2e9e4003
        Stream Type: sse
        Timestamp: 0x000000000000002c
        ID: id
            Length: 2
            ID: id
        Type: type
            Length: 4
            Type: type

Frame 45: 273 bytes on wire (2184 bits), 273 bytes captured (2184 bits)
Ethernet II, Src: Send_00 (20:53:45:4e:44:00), Dst: Receive_00 (20:52:45:43:56:00)
Internet Protocol Version 6, Src: fe80::15, Dst: fe80::14
Transmission Control Protocol, Src Port: 7114, Dst Port: 0, Seq: 200, Ack: 380, Len: 199
Zilla Frame
    Frame Type ID: 0x00000002
    Frame Type: DATA
    Protocol Type ID: 0x00000000
    Protocol Type: 
    Worker: 0
    Offset: 0x000013a0
    Origin ID: 0x000000090000001c
    Origin Namespace: example
    Origin Binding: north_sse_server
    Routed ID: 0x000000090000001d
    Routed Namespace: example
    Routed Binding: south_sse_client
    Stream ID: 0x0000000000000014
    Initial ID: 0x0000000000000015
    Reply ID: 0x0000000000000014
    Direction: REP
    Sequence: 0
    Acknowledge: 0
    Maximum: 0
    Timestamp: 0x000000000000002d
    Trace ID: 0x0000000000000015
    Authorization: 0x0000000000000000
    Flags: 0x03
        .... ...1 = FIN: Set (1)
        .... ..1. = INIT: Set (1)
        .... .0.. = INCOMPLETE: Not set (0)
        .... 0... = SKIP: Not set (0)
    Budget ID: 0x0000000000000015
    Reserved: 66
    Progress: 66
    Progress/Maximum: 66/0
    Payload
        Length: 10
        Payload
    Extension: sse
        Stream Type ID: 0x2e9e4003
        Stream Type: sse
        Timestamp: 0x000000000000002d
        ID: 
            Length: -1
            ID: 
        Type: fortytwo
            Length: 8
            Type: fortytwo

Frame 46: 239 bytes on wire (1912 bits), 239 bytes captured (1912 bits)
Ethernet II, Src: Send_00 (20:53:45:4e:44:00), Dst: Receive_00 (20:52:45:43:56:00)
Internet Protocol Version 6, Src: fe80::15, Dst: fe80::14
Transmission Control Protocol, Src Port: 7114, Dst Port: 0, Seq: 399, Ack: 380, Len: 165
Zilla Frame
    Frame Type ID: 0x00000003
    Frame Type: END
    Protocol Type ID: 0x00000000
    Protocol Type: 
    Worker: 0
    Offset: 0x00001420
    Origin ID: 0x000000090000001c
    Origin Namespace: example
    Origin Binding: north_sse_server
    Routed ID: 0x000000090000001d
    Routed Namespace: example
    Routed Binding: south_sse_client
    Stream ID: 0x0000000000000014
    Initial ID: 0x0000000000000015
    Reply ID: 0x0000000000000014
    Direction: REP
    Sequence: 0
    Acknowledge: 0
    Maximum: 0
    Timestamp: 0x000000000000002e
    Trace ID: 0x0000000000000015
    Authorization: 0x0000000000000000
    Extension: sse
        Stream Type ID: 0x2e9e4003
        Stream Type: sse
        Id: sse-end-id
            Length: 10
            ID: sse-end-id

Frame 47: 268 bytes on wire (2144 bits), 268 bytes captured (2144 bits)
Ethernet II, Src: Send_00 (20:53:45:4e:44:00), Dst: Receive_00 (20:52:45:43:56:00)
Internet Protocol Version 6, Src: fe80::16, Dst: fe80::17
Transmission Control Protocol, Src Port: 0, Dst Port: 7114, Seq: 0, Ack: 1, Len: 194
Zilla Frame
    Frame Type ID: 0x00000001
    Frame Type: BEGIN
    Protocol Type ID: 0x00000000
    Protocol Type: 
    Worker: 0
    Offset: 0x00001480
    Origin ID: 0x000000090000001e
    Origin Namespace: example
    Origin Binding: north_ws_server
    Routed ID: 0x000000090000001f
    Routed Namespace: example
    Routed Binding: north_echo_server
    Stream ID: 0x0000000000000017
    Initial ID: 0x0000000000000017
    Reply ID: 0x0000000000000016
    Direction: INI
    Sequence: 0
    Acknowledge: 0
    Maximum: 0
    Timestamp: 0x000000000000002f
    Trace ID: 0x0000000000000017
    Authorization: 0x0000000000000000
    Affinity: 0x0000000000000000
    Extension: ws
        Stream Type ID: 0xe9cd9d56
        Stream Type: ws
        Protocol: echo
            Length: 4
            Protocol: echo
        Scheme: http
            Length: 4
            Scheme: http
        Authority: localhost:7114
            Length: 14
            Authority: localhost:7114
        Path: /hello
            Length: 6
            Path: /hello

Frame 48: 268 bytes on wire (2144 bits), 268 bytes captured (2144 bits)
Ethernet II, Src: Send_00 (20:53:45:4e:44:00), Dst: Receive_00 (20:52:45:43:56:00)
Internet Protocol Version 6, Src: fe80::17, Dst: fe80::16
Transmission Control Protocol, Src Port: 7114, Dst Port: 0, Seq: 1, Ack: 194, Len: 194
Zilla Frame
    Frame Type ID: 0x00000001
    Frame Type: BEGIN
    Protocol Type ID: 0x00000000
    Protocol Type: 
    Worker: 0
    Offset: 0x000014f8
    Origin ID: 0x000000090000001e
    Origin Namespace: example
    Origin Binding: north_ws_server
    Routed ID: 0x000000090000001f
    Routed Namespace: example
    Routed Binding: north_echo_server
    Stream ID: 0x0000000000000016
    Initial ID: 0x0000000000000017
    Reply ID: 0x0000000000000016
    Direction: REP
    Sequence: 0
    Acknowledge: 0
    Maximum: 0
    Timestamp: 0x0000000000000030
    Trace ID: 0x0000000000000017
    Authorization: 0x0000000000000000
    Affinity: 0x0000000000000000
    Extension: ws
        Stream Type ID: 0xe9cd9d56
        Stream Type: ws
        Protocol: echo
            Length: 4
            Protocol: echo
        Scheme: http
            Length: 4
            Scheme: http
        Authority: localhost:7114
            Length: 14
            Authority: localhost:7114
        Path: /hello
            Length: 6
            Path: /hello

Frame 49: 246 bytes on wire (1968 bits), 246 bytes captured (1968 bits)
Ethernet II, Src: Send_00 (20:53:45:4e:44:00), Dst: Receive_00 (20:52:45:43:56:00)
Internet Protocol Version 6, Src: fe80::16, Dst: fe80::17
Transmission Control Protocol, Src Port: 0, Dst Port: 7114, Seq: 194, Ack: 195, Len: 172
Zilla Frame
    Frame Type ID: 0x00000002
    Frame Type: DATA
    Protocol Type ID: 0x00000000
    Protocol Type: 
    Worker: 0
    Offset: 0x00001570
    Origin ID: 0x000000090000001e
    Origin Namespace: example
    Origin Binding: north_ws_server
    Routed ID: 0x000000090000001f
    Routed Namespace: example
    Routed Binding: north_echo_server
    Stream ID: 0x0000000000000017
    Initial ID: 0x0000000000000017
    Reply ID: 0x0000000000000016
    Direction: INI
    Sequence: 0
    Acknowledge: 0
    Maximum: 0
    Timestamp: 0x0000000000000031
    Trace ID: 0x0000000000000017
    Authorization: 0x0000000000000000
    Flags: 0x03
        .... ...1 = FIN: Set (1)
        .... ..1. = INIT: Set (1)
        .... .0.. = INCOMPLETE: Not set (0)
        .... 0... = SKIP: Not set (0)
    Budget ID: 0x0000000000000017
    Reserved: 66
    Progress: 66
    Progress/Maximum: 66/0
    Payload
        Length: -1
    Extension: ws
        Stream Type ID: 0xe9cd9d56
        Stream Type: ws
        Flags: 0x42

Frame 50: 268 bytes on wire (2144 bits), 268 bytes captured (2144 bits)
Ethernet II, Src: Send_00 (20:53:45:4e:44:00), Dst: Receive_00 (20:52:45:43:56:00)
Internet Protocol Version 6, Src: fe80::17, Dst: fe80::16
Transmission Control Protocol, Src Port: 7114, Dst Port: 0, Seq: 195, Ack: 366, Len: 194
Zilla Frame
    Frame Type ID: 0x00000002
    Frame Type: DATA
    Protocol Type ID: 0x00000000
    Protocol Type: 
    Worker: 0
    Offset: 0x000015d8
    Origin ID: 0x000000090000001e
    Origin Namespace: example
    Origin Binding: north_ws_server
    Routed ID: 0x000000090000001f
    Routed Namespace: example
    Routed Binding: north_echo_server
    Stream ID: 0x0000000000000016
    Initial ID: 0x0000000000000017
    Reply ID: 0x0000000000000016
    Direction: REP
    Sequence: 0
    Acknowledge: 0
    Maximum: 0
    Timestamp: 0x0000000000000032
    Trace ID: 0x0000000000000017
    Authorization: 0x0000000000000000
    Flags: 0x03
        .... ...1 = FIN: Set (1)
        .... ..1. = INIT: Set (1)
        .... .0.. = INCOMPLETE: Not set (0)
        .... 0... = SKIP: Not set (0)
    Budget ID: 0x0000000000000017
    Reserved: 66
    Progress: 66
    Progress/Maximum: 66/0
    Payload
        Length: 16
        Payload
    Extension: ws
        Stream Type ID: 0xe9cd9d56
        Stream Type: ws
        Flags: 0x33
        Info: 427744332107

Frame 51: 236 bytes on wire (1888 bits), 236 bytes captured (1888 bits)
Ethernet II, Src: Send_00 (20:53:45:4e:44:00), Dst: Receive_00 (20:52:45:43:56:00)
Internet Protocol Version 6, Src: fe80::16, Dst: fe80::17
Transmission Control Protocol, Src Port: 0, Dst Port: 7114, Seq: 366, Ack: 389, Len: 162
Zilla Frame
    Frame Type ID: 0x00000003
    Frame Type: END
    Protocol Type ID: 0x00000000
    Protocol Type: 
    Worker: 0
    Offset: 0x00001650
    Origin ID: 0x000000090000001e
    Origin Namespace: example
    Origin Binding: north_ws_server
    Routed ID: 0x000000090000001f
    Routed Namespace: example
    Routed Binding: north_echo_server
    Stream ID: 0x0000000000000017
    Initial ID: 0x0000000000000017
    Reply ID: 0x0000000000000016
    Direction: INI
    Sequence: 0
    Acknowledge: 0
    Maximum: 0
    Timestamp: 0x0000000000000033
    Trace ID: 0x0000000000000017
    Authorization: 0x0000000000000000
    Extension: ws
        Stream Type ID: 0xe9cd9d56
        Stream Type: ws
        Code: 42
        Reason: hello
            Length: 5
            Reason: hello

